# Test of the JSON data type.
# ----------------------------------------------------------------------
SET NAMES utf8;
CREATE TABLE t1 (i INT, j JSON) ENGINE=InnoDB;
SHOW CREATE TABLE t1;
Table	Create Table
t1	CREATE TABLE `t1` (
  `i` int(11) DEFAULT NULL,
  `j` json DEFAULT NULL
) ENGINE=InnoDB DEFAULT CHARSET=latin1
INSERT INTO t1 VALUES (0, NULL);
INSERT INTO t1 VALUES (1, '{"a": 2}');
INSERT INTO t1 VALUES (2, '[1,2]');
INSERT INTO t1 VALUES (3, '{"a":"b", "c":"d","ab":"abc", "bc": ["x", "y"]}');
INSERT INTO t1 VALUES (4, '["here", ["I", "am"], "!!!"]');
INSERT INTO t1 VALUES (5, '"scalar string"');
INSERT INTO t1 VALUES (6, 'true');
INSERT INTO t1 VALUES (7, 'false');
INSERT INTO t1 VALUES (8, 'null');
INSERT INTO t1 VALUES (9, '-1');
INSERT INTO t1 VALUES (10, CAST(CAST(1 AS UNSIGNED) AS JSON));
INSERT INTO t1 VALUES (11, '32767');
INSERT INTO t1 VALUES (12, '32768');
INSERT INTO t1 VALUES (13, '-32768');
INSERT INTO t1 VALUES (14, '-32769');
INSERT INTO t1 VALUES (15, '2147483647');
INSERT INTO t1 VALUES (16, '2147483648');
INSERT INTO t1 VALUES (17, '-2147483648');
INSERT INTO t1 VALUES (18, '-2147483649');
INSERT INTO t1 VALUES (19, '18446744073709551615');
INSERT INTO t1 VALUES (20, '18446744073709551616');
INSERT INTO t1 VALUES (21, '3.14');
INSERT INTO t1 VALUES (22, '{}');
INSERT INTO t1 VALUES (23, '[]');
INSERT INTO t1 VALUES (24, CAST(CAST('2015-01-15 23:24:25' AS DATETIME) AS JSON));
INSERT INTO t1 VALUES (25, CAST(CAST('23:24:25' AS TIME) AS JSON));
INSERT INTO t1 VALUES (26, CAST(CAST('2015-01-15' AS DATE) AS JSON));
INSERT INTO t1 VALUES (27, CAST(TIMESTAMP'2015-01-15 23:24:25' AS JSON));
INSERT INTO t1 VALUES (28, CAST(ST_GeomFromText('POINT(1 1)') AS JSON));
INSERT INTO t1 VALUES (29, CAST('[]' AS CHAR CHARACTER SET 'ascii'));
INSERT INTO t1 VALUES (100, CONCAT('{"', REPEAT('a', 64 * 1024 - 1), '":123}'));
INSERT INTO t1 VALUES (101, CONCAT('{"', REPEAT('a', 64 * 1024), '":123}'));
ERROR 22032: The JSON object contains a key name that is too long.
INSERT INTO t1 VALUES (102, CAST(CONCAT('{"', REPEAT('a', 64 * 1024), '":123}') AS JSON));
ERROR 22032: The JSON object contains a key name that is too long.
SELECT i, LENGTH(j), j FROM t1 ORDER BY i;
i	LENGTH(j)	j
0	NULL	NULL
1	8	{"a": 2}
2	6	[1, 2]
3	51	{"a": "b", "c": "d", "ab": "abc", "bc": ["x", "y"]}
4	28	["here", ["I", "am"], "!!!"]
5	15	"scalar string"
6	4	true
7	5	false
8	4	null
9	2	-1
10	1	1
11	5	32767
12	5	32768
13	6	-32768
14	6	-32769
15	10	2147483647
16	10	2147483648
17	11	-2147483648
18	11	-2147483649
19	20	18446744073709551615
20	21	1.8446744073709552e19
21	4	3.14
22	2	{}
23	2	[]
24	28	"2015-01-15 23:24:25.000000"
25	17	"23:24:25.000000"
26	12	"2015-01-15"
27	28	"2015-01-15 23:24:25.000000"
28	53	"base64:type255:AAAAAAEBAAAAAAAAAAAA8D8AAAAAAADwPw=="
29	2	[]
100	65544	{"aaaaaaaaaaaaaaaaaaaaaaaaaaaaaaaaaaaaaaaaaaaaaaaaaaaaaaaaaaaaaaaaaaaaaaaaaaaaaaaaaaaaaaaaaaaaaaaaaaaaaaaaaaaaaaaaaaaaaaaaaaaaaaaaaaaaaaaaaaaaaaaaaaaaaaaaaaaaaaaaaaaaaaaaaaaaaaaaaaaaaaaaaaaaaaaaaaaaaaaaaaaaaaaaaaaaaaaaaaaaaaaaaaaaaaaaaaaaaaaaaaaaaaaaaaaaaaaaaaaaaaaaaaaaaaaaaaaaaaaaaaaaaaaaaaaaaaaaaaaaaaaaaaaaaaaaaaaaaaaaaaaaaaaaaaaaaaaaaaaaaaaaaaaaaaaaaaaaaaaaaaaaaaaaaaaaaaaaaaaaaaaaaaaaaaaaaaaaaaaaaaaaaaaaaaaaaaaaaaaaaaaaaaaaaaaaaaaaaaaaaaaaaaaaaaaaaaaaaaaaaaaaaaaaaaaaaaaaaaaaaaaaaaaaaaaaaaaaaaaaaaaaaaaaaaaaaaaaaaaaaaaaaaaaaaaaaaaaaaaaaaaaaaaaaaaaaaaaaaaaaaaaaaaaaaaaaaaaaaaaaaaaaaaaaaaaaaaaaaaaaaaaaaaaaaaaaaaaaaaaaaaaaaaaaaaaaaaaaaaaaaaaaaaaaaaaaaaaaaaaaaaaaaaaaaaaaaaaaaaaaaaaaaaaaaaaaaaaaaaaaaaaaaaaaaaaaaaaaaaaaaaaaaaaaaaaaaaaaaaaaaaaaaaaaaaaaaaaaaaaaaaaaaaaaaaaaaaaaaaaaaaaaaaaaaaaaaaaaaaaaaaaaaaaaaaaaaaaaaaaaaaaaaaaaaaaaaaaaaaaaaaaaaaaaaaaaaaaaaaaaaaaaaaaaaaaaaaaaaaaaaaaaaaaaaaaaaaaaaaaaaaaaaaaaaaaaaaaaaaaaaaaaaaaaaaaaaaaaaaaaaaaaaaaaaaaaaaaaaaaaaaaaaaaaaaaaaaaaaaaaaaaaaaaaaaaaaaaaaaaaaaaaaaaaaaaaaaaaaaaaaaaaaaaaaaaaaaaaaaaaaaaaaaaaaaaaaaaaaaaaaaaaaaaaaaaaaaaaaaaaaaaaaaaaaaaaaaaaaaaaaaaaaaaaaaaaaaaaaaaaaaaaaaaaaaaaaaaaaaaaaaaaaaaaaaaaaaaaaaaaaaaaaaaaaaaaaaaaaaaaaaaaaaaaaaaaaaaaaaaaaaaaaaaaaaaaaaaaaaaaaaaaaaaaaaaaaaaaaaaaaaaaaaaaaaaaaaaaaaaaaaaaaaaaaaaaaaaaaaaaaaaaaaaaaaaaaaaaaaaaaaaaaaaaaaaaaaaaaaaaaaaaaaaaaaaaaaaaaaaaaaaaaaaaaaaaaaaaaaaaaaaaaaaaaaaaaaaaaaaaaaaaaaaaaaaaaaaaaaaaaaaaaaaaaaaaaaaaaaaaaaaaaaaaaaaaaaaaaaaaaaaaaaaaaaaaaaaaaaaaaaaaaaaaaaaaaaaaaaaaaaaaaaaaaaaaaaaaaaaaaaaaaaaaaaaaaaaaaaaaaaaaaaaaaaaaaaaaaaaaaaaaaaaaaaaaaaaaaaaaaaaaaaaaaaaaaaaaaaaaaaaaaaaaaaaaaaaaaaaaaaaaaaaaaaaaaaaaaaaaaaaaaaaaaaaaaaaaaaaaaaaaaaaaaaaaaaaaaaaaaaaaaaaaaaaaaaaaaaaaaaaaaaaaaaaaaaaaaaaaaaaaaaaaaaaaaaaaaaaaaaaaaaaaaaaaaaaaaaaaaaaaaaaaaaaaaaaaaaaaaaaaaaaaaaaaaaaaaaaaaaaaaaaaaaaaaaaaaaaaaaaaaaaaaaaaaaaaaaaaaaaaaaaaaaaaaaaaaaaaaaaaaaaaaaaaaaaaaaaaaaaaaaaaaaaaaaaaaaaaaaaaaaaaaaaaaaaaaaaaaaaaaaaaaaaaaaaaaaaaaaaaaaaaaaaaaaaaaaaaaaaaaaaaaaaaaaaaaaaaaaaaaaaaaaaaaaaaaaaaaaaaaaaaaaaaaaaaaaaaaaaaaaaaaaaaaaaaaaaaaaaaaaaaaaaaaaaaaaaaaaaaaaaaaaaaaaaaaaaaaaaaaaaaaaaaaaaaaaaaaaaaaaaaaaaaaaaaaaaaaaaaaaaaaaaaaaaaaaaaaaaaaaaaaaaaaaaaaaaaaaaaaaaaaaaaaaaaaaaaaaaaaaaaaaaaaaaaaaaaaaaaaaaaaaaaaaaaaaaaaaaaaaaaaaaaaaaaaaaaaaaaaaaaaaaaaaaaaaaaaaaaaaaaaaaaaaaaaaaaaaaaaaaaaaaaaaaaaaaaaaaaaaaaaaaaaaaaaaaaaaaaaaaaaaaaaaaaaaaaaaaaaaaaaaaaaaaaaaaaaaaaaaaaaaaaaaaaaaaaaaaaaaaaaaaaaaaaaaaaaaaaaaaaaaaaaaaaaaaaaaaaaaaaaaaaaaaaaaaaaaaaaaaaaaaaaaaaaaaaaaaaaaaaaaaaaaaaaaaaaaaaaaaaaaaaaaaaaaaaaaaaaaaaaaaaaaaaaaaaaaaaaaaaaaaaaaaaaaaaaaaaaaaaaaaaaaaaaaaaaaaaaaaaaaaaaaaaaaaaaaaaaaaaaaaaaaaaaaaaaaaaaaaaaaaaaaaaaaaaaaaaaaaaaaaaaaaaaaaaaaaaaaaaaaaaaaaaaaaaaaaaaaaaaaaaaaaaaaaaaaaaaaaaaaaaaaaaaaaaaaaaaaaaaaaaaaaaaaaaaaaaaaaaaaaaaaaaaaaaaaaaaaaaaaaaaaaaaaaaaaaaaaaaaaaaaaaaaaaaaaaaaaaaaaaaaaaaaaaaaaaaaaaaaaaaaaaaaaaaaaaaaaaaaaaaaaaaaaaaaaaaaaaaaaaaaaaaaaaaaaaaaaaaaaaaaaaaaaaaaaaaaaaaaaaaaaaaaaaaaaaaaaaaaaaaaaaaaaaaaaaaaaaaaaaaaaaaaaaaaaaaaaaaaaaaaaaaaaaaaaaaaaaaaaaaaaaaaaaaaaaaaaaaaaaaaaaaaaaaaaaaaaaaaaaaaaaaaaaaaaaaaaaaaaaaaaaaaaaaaaaaaaaaaaaaaaaaaaaaaaaaaaaaaaaaaaaaaaaaaaaaaaaaaaaaaaaaaaaaaaaaaaaaaaaaaaaaaaaaaaaaaaaaaaaaaaaaaaaaaaaaaaaaaaaaaaaaaaaaaaaaaaaaaaaaaaaaaaaaaaaaaaaaaaaaaaaaaaaaaaaaaaaaaaaaaaaaaaaaaaaaaaaaaaaaaaaaaaaaaaaaaaaaaaaaaaaaaaaaaaaaaaaaaaaaaaaaaaaaaaaaaaaaaaaaaaaaaaaaaaaaaaaaaaaaaaaaaaaaaaaaaaaaaaaaaaaaaaaaaaaaaaaaaaaaaaaaaaaaaaaaaaaaaaaaaaaaaaaaaaaaaaaaaaaaaaaaaaaaaaaaaaaaaaaaaaaaaaaaaaaaaaaaaaaaaaaaaaaaaaaaaaaaaaaaaaaaaaaaaaaaaaaaaaaaaaaaaaaaaaaaaaaaaaaaaaaaaaaaaaaaaaaaaaaaaaaaaaaaaaaaaaaaaaaaaaaaaaaaaaaaaaaaaaaaaaaaaaaaaaaaaaaaaaaaaaaaaaaaaaaaaaaaaaaaaaaaaaaaaaaaaaaaaaaaaaaaaaaaaaaaaaaaaaaaaaaaaaaaaaaaaaaaaaaaaaaaaaaaaaaaaaaaaaaaaaaaaaaaaaaaaaaaaaaaaaaaaaaaaaaaaaaaaaaaaaaaaaaaaaaaaaaaaaaaaaaaaaaaaaaaaaaaaaaaaaaaaaaaaaaaaaaaaaaaaaaaaaaaaaaaaaaaaaaaaaaaaaaaaaaaaaaaaaaaaaaaaaaaaaaaaaaaaaaaaaaaaaaaaaaaaaaaaaaaaaaaaaaaaaaaaaaaaaaaaaaaaaaaaaaaaaaaaaaaaaaaaaaaaaaaaaaaaaaaaaaaaaaaaaaaaaaaaaaaaaaaaaaaaaaaaaaaaaaaaaaaaaaaaaaaaaaaaaaaaaaaaaaaaaaaaaaaaaaaaaaaaaaaaaaaaaaaaaaaaaaaaaaaaaaaaaaaaaaaaaaaaaaaaaaaaaaaaaaaaaaaaaaaaaaaaaaaaaaaaaaaaaaaaaaaaaaaaaaaaaaaaaaaaaaaaaaaaaaaaaaaaaaaaaaaaaaaaaaaaaaaaaaaaaaaaaaaaaaaaaaaaaaaaaaaaaaaaaaaaaaaaaaaaaaaaaaaaaaaaaaaaaaaaaaaaaaaaaaaaaaaaaaaaaaaaaaaaaaaaaaaaaaaaaaaaaaaaaaaaaaaaaaaaaaaaaaaaaaaaaaaaaaaaaaaaaaaaaaaaaaaaaaaaaaaaaaaaaaaaaaaaaaaaaaaaaaaaaaaaaaaaaaaaaaaaaaaaaaaaaaaaaaaaaaaaaaaaaaaaaaaaaaaaaaaaaaaaaaaaaaaaaaaaaaaaaaaaaaaaaaaaaaaaaaaaaaaaaaaaaaaaaaaaaaaaaaaaaaaaaaaaaaaaaaaaaaaaaaaaaaaaaaaaaaaaaaaaaaaaaaaaaaaaaaaaaaaaaaaaaaaaaaaaaaaaaaaaaaaaaaaaaaaaaaaaaaaaaaaaaaaaaaaaaaaaaaaaaaaaaaaaaaaaaaaaaaaaaaaaaaaaaaaaaaaaaaaaaaaaaaaaaaaaaaaaaaaaaaaaaaaaaaaaaaaaaaaaaaaaaaaaaaaaaaaaaaaaaaaaaaaaaaaaaaaaaaaaaaaaaaaaaaaaaaaaaaaaaaaaaaaaaaaaaaaaaaaaaaaaaaaaaaaaaaaaaaaaaaaaaaaaaaaaaaaaaaaaaaaaaaaaaaaaaaaaaaaaaaaaaaaaaaaaaaaaaaaaaaaaaaaaaaaaaaaaaaaaaaaaaaaaaaaaaaaaaaaaaaaaaaaaaaaaaaaaaaaaaaaaaaaaaaaaaaaaaaaaaaaaaaaaaaaaaaaaaaaaaaaaaaaaaaaaaaaaaaaaaaaaaaaaaaaaaaaaaaaaaaaaaaaaaaaaaaaaaaaaaaaaaaaaaaaaaaaaaaaaaaaaaaaaaaaaaaaaaaaaaaaaaaaaaaaaaaaaaaaaaaaaaaaaaaaaaaaaaaaaaaaaaaaaaaaaaaaaaaaaaaaaaaaaaaaaaaaaaaaaaaaaaaaaaaaaaaaaaaaaaaaaaaaaaaaaaaaaaaaaaaaaaaaaaaaaaaaaaaaaaaaaaaaaaaaaaaaaaaaaaaaaaaaaaaaaaaaaaaaaaaaaaaaaaaaaaaaaaaaaaaaaaaaaaaaaaaaaaaaaaaaaaaaaaaaaaaaaaaaaaaaaaaaaaaaaaaaaaaaaaaaaaaaaaaaaaaaaaaaaaaaaaaaaaaaaaaaaaaaaaaaaaaaaaaaaaaaaaaaaaaaaaaaaaaaaaaaaaaaaaaaaaaaaaaaaaaaaaaaaaaaaaaaaaaaaaaaaaaaaaaaaaaaaaaaaaaaaaaaaaaaaaaaaaaaaaaaaaaaaaaaaaaaaaaaaaaaaaaaaaaaaaaaaaaaaaaaaaaaaaaaaaaaaaaaaaaaaaaaaaaaaaaaaaaaaaaaaaaaaaaaaaaaaaaaaaaaaaaaaaaaaaaaaaaaaaaaaaaaaaaaaaaaaaaaaaaaaaaaaaaaaaaaaaaaaaaaaaaaaaaaaaaaaaaaaaaaaaaaaaaaaaaaaaaaaaaaaaaaaaaaaaaaaaaaaaaaaaaaaaaaaaaaaaaaaaaaaaaaaaaaaaaaaaaaaaaaaaaaaaaaaaaaaaaaaaaaaaaaaaaaaaaaaaaaaaaaaaaaaaaaaaaaaaaaaaaaaaaaaaaaaaaaaaaaaaaaaaaaaaaaaaaaaaaaaaaaaaaaaaaaaaaaaaaaaaaaaaaaaaaaaaaaaaaaaaaaaaaaaaaaaaaaaaaaaaaaaaaaaaaaaaaaaaaaaaaaaaaaaaaaaaaaaaaaaaaaaaaaaaaaaaaaaaaaaaaaaaaaaaaaaaaaaaaaaaaaaaaaaaaaaaaaaaaaaaaaaaaaaaaaaaaaaaaaaaaaaaaaaaaaaaaaaaaaaaaaaaaaaaaaaaaaaaaaaaaaaaaaaaaaaaaaaaaaaaaaaaaaaaaaaaaaaaaaaaaaaaaaaaaaaaaaaaaaaaaaaaaaaaaaaaaaaaaaaaaaaaaaaaaaaaaaaaaaaaaaaaaaaaaaaaaaaaaaaaaaaaaaaaaaaaaaaaaaaaaaaaaaaaaaaaaaaaaaaaaaaaaaaaaaaaaaaaaaaaaaaaaaaaaaaaaaaaaaaaaaaaaaaaaaaaaaaaaaaaaaaaaaaaaaaaaaaaaaaaaaaaaaaaaaaaaaaaaaaaaaaaaaaaaaaaaaaaaaaaaaaaaaaaaaaaaaaaaaaaaaaaaaaaaaaaaaaaaaaaaaaaaaaaaaaaaaaaaaaaaaaaaaaaaaaaaaaaaaaaaaaaaaaaaaaaaaaaaaaaaaaaaaaaaaaaaaaaaaaaaaaaaaaaaaaaaaaaaaaaaaaaaaaaaaaaaaaaaaaaaaaaaaaaaaaaaaaaaaaaaaaaaaaaaaaaaaaaaaaaaaaaaaaaaaaaaaaaaaaaaaaaaaaaaaaaaaaaaaaaaaaaaaaaaaaaaaaaaaaaaaaaaaaaaaaaaaaaaaaaaaaaaaaaaaaaaaaaaaaaaaaaaaaaaaaaaaaaaaaaaaaaaaaaaaaaaaaaaaaaaaaaaaaaaaaaaaaaaaaaaaaaaaaaaaaaaaaaaaaaaaaaaaaaaaaaaaaaaaaaaaaaaaaaaaaaaaaaaaaaaaaaaaaaaaaaaaaaaaaaaaaaaaaaaaaaaaaaaaaaaaaaaaaaaaaaaaaaaaaaaaaaaaaaaaaaaaaaaaaaaaaaaaaaaaaaaaaaaaaaaaaaaaaaaaaaaaaaaaaaaaaaaaaaaaaaaaaaaaaaaaaaaaaaaaaaaaaaaaaaaaaaaaaaaaaaaaaaaaaaaaaaaaaaaaaaaaaaaaaaaaaaaaaaaaaaaaaaaaaaaaaaaaaaaaaaaaaaaaaaaaaaaaaaaaaaaaaaaaaaaaaaaaaaaaaaaaaaaaaaaaaaaaaaaaaaaaaaaaaaaaaaaaaaaaaaaaaaaaaaaaaaaaaaaaaaaaaaaaaaaaaaaaaaaaaaaaaaaaaaaaaaaaaaaaaaaaaaaaaaaaaaaaaaaaaaaaaaaaaaaaaaaaaaaaaaaaaaaaaaaaaaaaaaaaaaaaaaaaaaaaaaaaaaaaaaaaaaaaaaaaaaaaaaaaaaaaaaaaaaaaaaaaaaaaaaaaaaaaaaaaaaaaaaaaaaaaaaaaaaaaaaaaaaaaaaaaaaaaaaaaaaaaaaaaaaaaaaaaaaaaaaaaaaaaaaaaaaaaaaaaaaaaaaaaaaaaaaaaaaaaaaaaaaaaaaaaaaaaaaaaaaaaaaaaaaaaaaaaaaaaaaaaaaaaaaaaaaaaaaaaaaaaaaaaaaaaaaaaaaaaaaaaaaaaaaaaaaaaaaaaaaaaaaaaaaaaaaaaaaaaaaaaaaaaaaaaaaaaaaaaaaaaaaaaaaaaaaaaaaaaaaaaaaaaaaaaaaaaaaaaaaaaaaaaaaaaaaaaaaaaaaaaaaaaaaaaaaaaaaaaaaaaaaaaaaaaaaaaaaaaaaaaaaaaaaaaaaaaaaaaaaaaaaaaaaaaaaaaaaaaaaaaaaaaaaaaaaaaaaaaaaaaaaaaaaaaaaaaaaaaaaaaaaaaaaaaaaaaaaaaaaaaaaaaaaaaaaaaaaaaaaaaaaaaaaaaaaaaaaaaaaaaaaaaaaaaaaaaaaaaaaaaaaaaaaaaaaaaaaaaaaaaaaaaaaaaaaaaaaaaaaaaaaaaaaaaaaaaaaaaaaaaaaaaaaaaaaaaaaaaaaaaaaaaaaaaaaaaaaaaaaaaaaaaaaaaaaaaaaaaaaaaaaaaaaaaaaaaaaaaaaaaaaaaaaaaaaaaaaaaaaaaaaaaaaaaaaaaaaaaaaaaaaaaaaaaaaaaaaaaaaaaaaaaaaaaaaaaaaaaaaaaaaaaaaaaaaaaaaaaaaaaaaaaaaaaaaaaaaaaaaaaaaaaaaaaaaaaaaaaaaaaaaaaaaaaaaaaaaaaaaaaaaaaaaaaaaaaaaaaaaaaaaaaaaaaaaaaaaaaaaaaaaaaaaaaaaaaaaaaaaaaaaaaaaaaaaaaaaaaaaaaaaaaaaaaaaaaaaaaaaaaaaaaaaaaaaaaaaaaaaaaaaaaaaaaaaaaaaaaaaaaaaaaaaaaaaaaaaaaaaaaaaaaaaaaaaaaaaaaaaaaaaaaaaaaaaaaaaaaaaaaaaaaaaaaaaaaaaaaaaaaaaaaaaaaaaaaaaaaaaaaaaaaaaaaaaaaaaaaaaaaaaaaaaaaaaaaaaaaaaaaaaaaaaaaaaaaaaaaaaaaaaaaaaaaaaaaaaaaaaaaaaaaaaaaaaaaaaaaaaaaaaaaaaaaaaaaaaaaaaaaaaaaaaaaaaaaaaaaaaaaaaaaaaaaaaaaaaaaaaaaaaaaaaaaaaaaaaaaaaaaaaaaaaaaaaaaaaaaaaaaaaaaaaaaaaaaaaaaaaaaaaaaaaaaaaaaaaaaaaaaaaaaaaaaaaaaaaaaaaaaaaaaaaaaaaaaaaaaaaaaaaaaaaaaaaaaaaaaaaaaaaaaaaaaaaaaaaaaaaaaaaaaaaaaaaaaaaaaaaaaaaaaaaaaaaaaaaaaaaaaaaaaaaaaaaaaaaaaaaaaaaaaaaaaaaaaaaaaaaaaaaaaaaaaaaaaaaaaaaaaaaaaaaaaaaaaaaaaaaaaaaaaaaaaaaaaaaaaaaaaaaaaaaaaaaaaaaaaaaaaaaaaaaaaaaaaaaaaaaaaaaaaaaaaaaaaaaaaaaaaaaaaaaaaaaaaaaaaaaaaaaaaaaaaaaaaaaaaaaaaaaaaaaaaaaaaaaaaaaaaaaaaaaaaaaaaaaaaaaaaaaaaaaaaaaaaaaaaaaaaaaaaaaaaaaaaaaaaaaaaaaaaaaaaaaaaaaaaaaaaaaaaaaaaaaaaaaaaaaaaaaaaaaaaaaaaaaaaaaaaaaaaaaaaaaaaaaaaaaaaaaaaaaaaaaaaaaaaaaaaaaaaaaaaaaaaaaaaaaaaaaaaaaaaaaaaaaaaaaaaaaaaaaaaaaaaaaaaaaaaaaaaaaaaaaaaaaaaaaaaaaaaaaaaaaaaaaaaaaaaaaaaaaaaaaaaaaaaaaaaaaaaaaaaaaaaaaaaaaaaaaaaaaaaaaaaaaaaaaaaaaaaaaaaaaaaaaaaaaaaaaaaaaaaaaaaaaaaaaaaaaaaaaaaaaaaaaaaaaaaaaaaaaaaaaaaaaaaaaaaaaaaaaaaaaaaaaaaaaaaaaaaaaaaaaaaaaaaaaaaaaaaaaaaaaaaaaaaaaaaaaaaaaaaaaaaaaaaaaaaaaaaaaaaaaaaaaaaaaaaaaaaaaaaaaaaaaaaaaaaaaaaaaaaaaaaaaaaaaaaaaaaaaaaaaaaaaaaaaaaaaaaaaaaaaaaaaaaaaaaaaaaaaaaaaaaaaaaaaaaaaaaaaaaaaaaaaaaaaaaaaaaaaaaaaaaaaaaaaaaaaaaaaaaaaaaaaaaaaaaaaaaaaaaaaaaaaaaaaaaaaaaaaaaaaaaaaaaaaaaaaaaaaaaaaaaaaaaaaaaaaaaaaaaaaaaaaaaaaaaaaaaaaaaaaaaaaaaaaaaaaaaaaaaaaaaaaaaaaaaaaaaaaaaaaaaaaaaaaaaaaaaaaaaaaaaaaaaaaaaaaaaaaaaaaaaaaaaaaaaaaaaaaaaaaaaaaaaaaaaaaaaaaaaaaaaaaaaaaaaaaaaaaaaaaaaaaaaaaaaaaaaaaaaaaaaaaaaaaaaaaaaaaaaaaaaaaaaaaaaaaaaaaaaaaaaaaaaaaaaaaaaaaaaaaaaaaaaaaaaaaaaaaaaaaaaaaaaaaaaaaaaaaaaaaaaaaaaaaaaaaaaaaaaaaaaaaaaaaaaaaaaaaaaaaaaaaaaaaaaaaaaaaaaaaaaaaaaaaaaaaaaaaaaaaaaaaaaaaaaaaaaaaaaaaaaaaaaaaaaaaaaaaaaaaaaaaaaaaaaaaaaaaaaaaaaaaaaaaaaaaaaaaaaaaaaaaaaaaaaaaaaaaaaaaaaaaaaaaaaaaaaaaaaaaaaaaaaaaaaaaaaaaaaaaaaaaaaaaaaaaaaaaaaaaaaaaaaaaaaaaaaaaaaaaaaaaaaaaaaaaaaaaaaaaaaaaaaaaaaaaaaaaaaaaaaaaaaaaaaaaaaaaaaaaaaaaaaaaaaaaaaaaaaaaaaaaaaaaaaaaaaaaaaaaaaaaaaaaaaaaaaaaaaaaaaaaaaaaaaaaaaaaaaaaaaaaaaaaaaaaaaaaaaaaaaaaaaaaaaaaaaaaaaaaaaaaaaaaaaaaaaaaaaaaaaaaaaaaaaaaaaaaaaaaaaaaaaaaaaaaaaaaaaaaaaaaaaaaaaaaaaaaaaaaaaaaaaaaaaaaaaaaaaaaaaaaaaaaaaaaaaaaaaaaaaaaaaaaaaaaaaaaaaaaaaaaaaaaaaaaaaaaaaaaaaaaaaaaaaaaaaaaaaaaaaaaaaaaaaaaaaaaaaaaaaaaaaaaaaaaaaaaaaaaaaaaaaaaaaaaaaaaaaaaaaaaaaaaaaaaaaaaaaaaaaaaaaaaaaaaaaaaaaaaaaaaaaaaaaaaaaaaaaaaaaaaaaaaaaaaaaaaaaaaaaaaaaaaaaaaaaaaaaaaaaaaaaaaaaaaaaaaaaaaaaaaaaaaaaaaaaaaaaaaaaaaaaaaaaaaaaaaaaaaaaaaaaaaaaaaaaaaaaaaaaaaaaaaaaaaaaaaaaaaaaaaaaaaaaaaaaaaaaaaaaaaaaaaaaaaaaaaaaaaaaaaaaaaaaaaaaaaaaaaaaaaaaaaaaaaaaaaaaaaaaaaaaaaaaaaaaaaaaaaaaaaaaaaaaaaaaaaaaaaaaaaaaaaaaaaaaaaaaaaaaaaaaaaaaaaaaaaaaaaaaaaaaaaaaaaaaaaaaaaaaaaaaaaaaaaaaaaaaaaaaaaaaaaaaaaaaaaaaaaaaaaaaaaaaaaaaaaaaaaaaaaaaaaaaaaaaaaaaaaaaaaaaaaaaaaaaaaaaaaaaaaaaaaaaaaaaaaaaaaaaaaaaaaaaaaaaaaaaaaaaaaaaaaaaaaaaaaaaaaaaaaaaaaaaaaaaaaaaaaaaaaaaaaaaaaaaaaaaaaaaaaaaaaaaaaaaaaaaaaaaaaaaaaaaaaaaaaaaaaaaaaaaaaaaaaaaaaaaaaaaaaaaaaaaaaaaaaaaaaaaaaaaaaaaaaaaaaaaaaaaaaaaaaaaaaaaaaaaaaaaaaaaaaaaaaaaaaaaaaaaaaaaaaaaaaaaaaaaaaaaaaaaaaaaaaaaaaaaaaaaaaaaaaaaaaaaaaaaaaaaaaaaaaaaaaaaaaaaaaaaaaaaaaaaaaaaaaaaaaaaaaaaaaaaaaaaaaaaaaaaaaaaaaaaaaaaaaaaaaaaaaaaaaaaaaaaaaaaaaaaaaaaaaaaaaaaaaaaaaaaaaaaaaaaaaaaaaaaaaaaaaaaaaaaaaaaaaaaaaaaaaaaaaaaaaaaaaaaaaaaaaaaaaaaaaaaaaaaaaaaaaaaaaaaaaaaaaaaaaaaaaaaaaaaaaaaaaaaaaaaaaaaaaaaaaaaaaaaaaaaaaaaaaaaaaaaaaaaaaaaaaaaaaaaaaaaaaaaaaaaaaaaaaaaaaaaaaaaaaaaaaaaaaaaaaaaaaaaaaaaaaaaaaaaaaaaaaaaaaaaaaaaaaaaaaaaaaaaaaaaaaaaaaaaaaaaaaaaaaaaaaaaaaaaaaaaaaaaaaaaaaaaaaaaaaaaaaaaaaaaaaaaaaaaaaaaaaaaaaaaaaaaaaaaaaaaaaaaaaaaaaaaaaaaaaaaaaaaaaaaaaaaaaaaaaaaaaaaaaaaaaaaaaaaaaaaaaaaaaaaaaaaaaaaaaaaaaaaaaaaaaaaaaaaaaaaaaaaaaaaaaaaaaaaaaaaaaaaaaaaaaaaaaaaaaaaaaaaaaaaaaaaaaaaaaaaaaaaaaaaaaaaaaaaaaaaaaaaaaaaaaaaaaaaaaaaaaaaaaaaaaaaaaaaaaaaaaaaaaaaaaaaaaaaaaaaaaaaaaaaaaaaaaaaaaaaaaaaaaaaaaaaaaaaaaaaaaaaaaaaaaaaaaaaaaaaaaaaaaaaaaaaaaaaaaaaaaaaaaaaaaaaaaaaaaaaaaaaaaaaaaaaaaaaaaaaaaaaaaaaaaaaaaaaaaaaaaaaaaaaaaaaaaaaaaaaaaaaaaaaaaaaaaaaaaaaaaaaaaaaaaaaaaaaaaaaaaaaaaaaaaaaaaaaaaaaaaaaaaaaaaaaaaaaaaaaaaaaaaaaaaaaaaaaaaaaaaaaaaaaaaaaaaaaaaaaaaaaaaaaaaaaaaaaaaaaaaaaaaaaaaaaaaaaaaaaaaaaaaaaaaaaaaaaaaaaaaaaaaaaaaaaaaaaaaaaaaaaaaaaaaaaaaaaaaaaaaaaaaaaaaaaaaaaaaaaaaaaaaaaaaaaaaaaaaaaaaaaaaaaaaaaaaaaaaaaaaaaaaaaaaaaaaaaaaaaaaaaaaaaaaaaaaaaaaaaaaaaaaaaaaaaaaaaaaaaaaaaaaaaaaaaaaaaaaaaaaaaaaaaaaaaaaaaaaaaaaaaaaaaaaaaaaaaaaaaaaaaaaaaaaaaaaaaaaaaaaaaaaaaaaaaaaaaaaaaaaaaaaaaaaaaaaaaaaaaaaaaaaaaaaaaaaaaaaaaaaaaaaaaaaaaaaaaaaaaaaaaaaaaaaaaaaaaaaaaaaaaaaaaaaaaaaaaaaaaaaaaaaaaaaaaaaaaaaaaaaaaaaaaaaaaaaaaaaaaaaaaaaaaaaaaaaaaaaaaaaaaaaaaaaaaaaaaaaaaaaaaaaaaaaaaaaaaaaaaaaaaaaaaaaaaaaaaaaaaaaaaaaaaaaaaaaaaaaaaaaaaaaaaaaaaaaaaaaaaaaaaaaaaaaaaaaaaaaaaaaaaaaaaaaaaaaaaaaaaaaaaaaaaaaaaaaaaaaaaaaaaaaaaaaaaaaaaaaaaaaaaaaaaaaaaaaaaaaaaaaaaaaaaaaaaaaaaaaaaaaaaaaaaaaaaaaaaaaaaaaaaaaaaaaaaaaaaaaaaaaaaaaaaaaaaaaaaaaaaaaaaaaaaaaaaaaaaaaaaaaaaaaaaaaaaaaaaaaaaaaaaaaaaaaaaaaaaaaaaaaaaaaaaaaaaaaaaaaaaaaaaaaaaaaaaaaaaaaaaaaaaaaaaaaaaaaaaaaaaaaaaaaaaaaaaaaaaaaaaaaaaaaaaaaaaaaaaaaaaaaaaaaaaaaaaaaaaaaaaaaaaaaaaaaaaaaaaaaaaaaaaaaaaaaaaaaaaaaaaaaaaaaaaaaaaaaaaaaaaaaaaaaaaaaaaaaaaaaaaaaaaaaaaaaaaaaaaaaaaaaaaaaaaaaaaaaaaaaaaaaaaaaaaaaaaaaaaaaaaaaaaaaaaaaaaaaaaaaaaaaaaaaaaaaaaaaaaaaaaaaaaaaaaaaaaaaaaaaaaaaaaaaaaaaaaaaaaaaaaaaaaaaaaaaaaaaaaaaaaaaaaaaaaaaaaaaaaaaaaaaaaaaaaaaaaaaaaaaaaaaaaaaaaaaaaaaaaaaaaaaaaaaaaaaaaaaaaaaaaaaaaaaaaaaaaaaaaaaaaaaaaaaaaaaaaaaaaaaaaaaaaaaaaaaaaaaaaaaaaaaaaaaaaaaaaaaaaaaaaaaaaaaaaaaaaaaaaaaaaaaaaaaaaaaaaaaaaaaaaaaaaaaaaaaaaaaaaaaaaaaaaaaaaaaaaaaaaaaaaaaaaaaaaaaaaaaaaaaaaaaaaaaaaaaaaaaaaaaaaaaaaaaaaaaaaaaaaaaaaaaaaaaaaaaaaaaaaaaaaaaaaaaaaaaaaaaaaaaaaaaaaaaaaaaaaaaaaaaaaaaaaaaaaaaaaaaaaaaaaaaaaaaaaaaaaaaaaaaaaaaaaaaaaaaaaaaaaaaaaaaaaaaaaaaaaaaaaaaaaaaaaaaaaaaaaaaaaaaaaaaaaaaaaaaaaaaaaaaaaaaaaaaaaaaaaaaaaaaaaaaaaaaaaaaaaaaaaaaaaaaaaaaaaaaaaaaaaaaaaaaaaaaaaaaaaaaaaaaaaaaaaaaaaaaaaaaaaaaaaaaaaaaaaaaaaaaaaaaaaaaaaaaaaaaaaaaaaaaaaaaaaaaaaaaaaaaaaaaaaaaaaaaaaaaaaaaaaaaaaaaaaaaaaaaaaaaaaaaaaaaaaaaaaaaaaaaaaaaaaaaaaaaaaaaaaaaaaaaaaaaaaaaaaaaaaaaaaaaaaaaaaaaaaaaaaaaaaaaaaaaaaaaaaaaaaaaaaaaaaaaaaaaaaaaaaaaaaaaaaaaaaaaaaaaaaaaaaaaaaaaaaaaaaaaaaaaaaaaaaaaaaaaaaaaaaaaaaaaaaaaaaaaaaaaaaaaaaaaaaaaaaaaaaaaaaaaaaaaaaaaaaaaaaaaaaaaaaaaaaaaaaaaaaaaaaaaaaaaaaaaaaaaaaaaaaaaaaaaaaaaaaaaaaaaaaaaaaaaaaaaaaaaaaaaaaaaaaaaaaaaaaaaaaaaaaaaaaaaaaaaaaaaaaaaaaaaaaaaaaaaaaaaaaaaaaaaaaaaaaaaaaaaaaaaaaaaaaaaaaaaaaaaaaaaaaaaaaaaaaaaaaaaaaaaaaaaaaaaaaaaaaaaaaaaaaaaaaaaaaaaaaaaaaaaaaaaaaaaaaaaaaaaaaaaaaaaaaaaaaaaaaaaaaaaaaaaaaaaaaaaaaaaaaaaaaaaaaaaaaaaaaaaaaaaaaaaaaaaaaaaaaaaaaaaaaaaaaaaaaaaaaaaaaaaaaaaaaaaaaaaaaaaaaaaaaaaaaaaaaaaaaaaaaaaaaaaaaaaaaaaaaaaaaaaaaaaaaaaaaaaaaaaaaaaaaaaaaaaaaaaaaaaaaaaaaaaaaaaaaaaaaaaaaaaaaaaaaaaaaaaaaaaaaaaaaaaaaaaaaaaaaaaaaaaaaaaaaaaaaaaaaaaaaaaaaaaaaaaaaaaaaaaaaaaaaaaaaaaaaaaaaaaaaaaaaaaaaaaaaaaaaaaaaaaaaaaaaaaaaaaaaaaaaaaaaaaaaaaaaaaaaaaaaaaaaaaaaaaaaaaaaaaaaaaaaaaaaaaaaaaaaaaaaaaaaaaaaaaaaaaaaaaaaaaaaaaaaaaaaaaaaaaaaaaaaaaaaaaaaaaaaaaaaaaaaaaaaaaaaaaaaaaaaaaaaaaaaaaaaaaaaaaaaaaaaaaaaaaaaaaaaaaaaaaaaaaaaaaaaaaaaaaaaaaaaaaaaaaaaaaaaaaaaaaaaaaaaaaaaaaaaaaaaaaaaaaaaaaaaaaaaaaaaaaaaaaaaaaaaaaaaaaaaaaaaaaaaaaaaaaaaaaaaaaaaaaaaaaaaaaaaaaaaaaaaaaaaaaaaaaaaaaaaaaaaaaaaaaaaaaaaaaaaaaaaaaaaaaaaaaaaaaaaaaaaaaaaaaaaaaaaaaaaaaaaaaaaaaaaaaaaaaaaaaaaaaaaaaaaaaaaaaaaaaaaaaaaaaaaaaaaaaaaaaaaaaaaaaaaaaaaaaaaaaaaaaaaaaaaaaaaaaaaaaaaaaaaaaaaaaaaaaaaaaaaaaaaaaaaaaaaaaaaaaaaaaaaaaaaaaaaaaaaaaaaaaaaaaaaaaaaaaaaaaaaaaaaaaaaaaaaaaaaaaaaaaaaaaaaaaaaaaaaaaaaaaaaaaaaaaaaaaaaaaaaaaaaaaaaaaaaaaaaaaaaaaaaaaaaaaaaaaaaaaaaaaaaaaaaaaaaaaaaaaaaaaaaaaaaaaaaaaaaaaaaaaaaaaaaaaaaaaaaaaaaaaaaaaaaaaaaaaaaaaaaaaaaaaaaaaaaaaaaaaaaaaaaaaaaaaaaaaaaaaaaaaaaaaaaaaaaaaaaaaaaaaaaaaaaaaaaaaaaaaaaaaaaaaaaaaaaaaaaaaaaaaaaaaaaaaaaaaaaaaaaaaaaaaaaaaaaaaaaaaaaaaaaaaaaaaaaaaaaaaaaaaaaaaaaaaaaaaaaaaaaaaaaaaaaaaaaaaaaaaaaaaaaaaaaaaaaaaaaaaaaaaaaaaaaaaaaaaaaaaaaaaaaaaaaaaaaaaaaaaaaaaaaaaaaaaaaaaaaaaaaaaaaaaaaaaaaaaaaaaaaaaaaaaaaaaaaaaaaaaaaaaaaaaaaaaaaaaaaaaaaaaaaaaaaaaaaaaaaaaaaaaaaaaaaaaaaaaaaaaaaaaaaaaaaaaaaaaaaaaaaaaaaaaaaaaaaaaaaaaaaaaaaaaaaaaaaaaaaaaaaaaaaaaaaaaaaaaaaaaaaaaaaaaaaaaaaaaaaaaaaaaaaaaaaaaaaaaaaaaaaaaaaaaaaaaaaaaaaaaaaaaaaaaaaaaaaaaaaaaaaaaaaaaaaaaaaaaaaaaaaaaaaaaaaaaaaaaaaaaaaaaaaaaaaaaaaaaaaaaaaaaaaaaaaaaaaaaaaaaaaaaaaaaaaaaaaaaaaaaaaaaaaaaaaaaaaaaaaaaaaaaaaaaaaaaaaaaaaaaaaaaaaaaaaaaaaaaaaaaaaaaaaaaaaaaaaaaaaaaaaaaaaaaaaaaaaaaaaaaaaaaaaaaaaaaaaaaaaaaaaaaaaaaaaaaaaaaaaaaaaaaaaaaaaaaaaaaaaaaaaaaaaaaaaaaaaaaaaaaaaaaaaaaaaaaaaaaaaaaaaaaaaaaaaaaaaaaaaaaaaaaaaaaaaaaaaaaaaaaaaaaaaaaaaaaaaaaaaaaaaaaaaaaaaaaaaaaaaaaaaaaaaaaaaaaaaaaaaaaaaaaaaaaaaaaaaaaaaaaaaaaaaaaaaaaaaaaaaaaaaaaaaaaaaaaaaaaaaaaaaaaaaaaaaaaaaaaaaaaaaaaaaaaaaaaaaaaaaaaaaaaaaaaaaaaaaaaaaaaaaaaaaaaaaaaaaaaaaaaaaaaaaaaaaaaaaaaaaaaaaaaaaaaaaaaaaaaaaaaaaaaaaaaaaaaaaaaaaaaaaaaaaaaaaaaaaaaaaaaaaaaaaaaaaaaaaaaaaaaaaaaaaaaaaaaaaaaaaaaaaaaaaaaaaaaaaaaaaaaaaaaaaaaaaaaaaaaaaaaaaaaaaaaaaaaaaaaaaaaaaaaaaaaaaaaaaaaaaaaaaaaaaaaaaaaaaaaaaaaaaaaaaaaaaaaaaaaaaaaaaaaaaaaaaaaaaaaaaaaaaaaaaaaaaaaaaaaaaaaaaaaaaaaaaaaaaaaaaaaaaaaaaaaaaaaaaaaaaaaaaaaaaaaaaaaaaaaaaaaaaaaaaaaaaaaaaaaaaaaaaaaaaaaaaaaaaaaaaaaaaaaaaaaaaaaaaaaaaaaaaaaaaaaaaaaaaaaaaaaaaaaaaaaaaaaaaaaaaaaaaaaaaaaaaaaaaaaaaaaaaaaaaaaaaaaaaaaaaaaaaaaaaaaaaaaaaaaaaaaaaaaaaaaaaaaaaaaaaaaaaaaaaaaaaaaaaaaaaaaaaaaaaaaaaaaaaaaaaaaaaaaaaaaaaaaaaaaaaaaaaaaaaaaaaaaaaaaaaaaaaaaaaaaaaaaaaaaaaaaaaaaaaaaaaaaaaaaaaaaaaaaaaaaaaaaaaaaaaaaaaaaaaaaaaaaaaaaaaaaaaaaaaaaaaaaaaaaaaaaaaaaaaaaaaaaaaaaaaaaaaaaaaaaaaaaaaaaaaaaaaaaaaaaaaaaaaaaaaaaaaaaaaaaaaaaaaaaaaaaaaaaaaaaaaaaaaaaaaaaaaaaaaaaaaaaaaaaaaaaaaaaaaaaaaaaaaaaaaaaaaaaaaaaaaaaaaaaaaaaaaaaaaaaaaaaaaaaaaaaaaaaaaaaaaaaaaaaaaaaaaaaaaaaaaaaaaaaaaaaaaaaaaaaaaaaaaaaaaaaaaaaaaaaaaaaaaaaaaaaaaaaaaaaaaaaaaaaaaaaaaaaaaaaaaaaaaaaaaaaaaaaaaaaaaaaaaaaaaaaaaaaaaaaaaaaaaaaaaaaaaaaaaaaaaaaaaaaaaaaaaaaaaaaaaaaaaaaaaaaaaaaaaaaaaaaaaaaaaaaaaaaaaaaaaaaaaaaaaaaaaaaaaaaaaaaaaaaaaaaaaaaaaaaaaaaaaaaaaaaaaaaaaaaaaaaaaaaaaaaaaaaaaaaaaaaaaaaaaaaaaaaaaaaaaaaaaaaaaaaaaaaaaaaaaaaaaaaaaaaaaaaaaaaaaaaaaaaaaaaaaaaaaaaaaaaaaaaaaaaaaaaaaaaaaaaaaaaaaaaaaaaaaaaaaaaaaaaaaaaaaaaaaaaaaaaaaaaaaaaaaaaaaaaaaaaaaaaaaaaaaaaaaaaaaaaaaaaaaaaaaaaaaaaaaaaaaaaaaaaaaaaaaaaaaaaaaaaaaaaaaaaaaaaaaaaaaaaaaaaaaaaaaaaaaaaaaaaaaaaaaaaaaaaaaaaaaaaaaaaaaaaaaaaaaaaaaaaaaaaaaaaaaaaaaaaaaaaaaaaaaaaaaaaaaaaaaaaaaaaaaaaaaaaaaaaaaaaaaaaaaaaaaaaaaaaaaaaaaaaaaaaaaaaaaaaaaaaaaaaaaaaaaaaaaaaaaaaaaaaaaaaaaaaaaaaaaaaaaaaaaaaaaaaaaaaaaaaaaaaaaaaaaaaaaaaaaaaaaaaaaaaaaaaaaaaaaaaaaaaaaaaaaaaaaaaaaaaaaaaaaaaaaaaaaaaaaaaaaaaaaaaaaaaaaaaaaaaaaaaaaaaaaaaaaaaaaaaaaaaaaaaaaaaaaaaaaaaaaaaaaaaaaaaaaaaaaaaaaaaaaaaaaaaaaaaaaaaaaaaaaaaaaaaaaaaaaaaaaaaaaaaaaaaaaaaaaaaaaaaaaaaaaaaaaaaaaaaaaaaaaaaaaaaaaaaaaaaaaaaaaaaaaaaaaaaaaaaaaaaaaaaaaaaaaaaaaaaaaaaaaaaaaaaaaaaaaaaaaaaaaaaaaaaaaaaaaaaaaaaaaaaaaaaaaaaaaaaaaaaaaaaaaaaaaaaaaaaaaaaaaaaaaaaaaaaaaaaaaaaaaaaaaaaaaaaaaaaaaaaaaaaaaaaaaaaaaaaaaaaaaaaaaaaaaaaaaaaaaaaaaaaaaaaaaaaaaaaaaaaaaaaaaaaaaaaaaaaaaaaaaaaaaaaaaaaaaaaaaaaaaaaaaaaaaaaaaaaaaaaaaaaaaaaaaaaaaaaaaaaaaaaaaaaaaaaaaaaaaaaaaaaaaaaaaaaaaaaaaaaaaaaaaaaaaaaaaaaaaaaaaaaaaaaaaaaaaaaaaaaaaaaaaaaaaaaaaaaaaaaaaaaaaaaaaaaaaaaaaaaaaaaaaaaaaaaaaaaaaaaaaaaaaaaaaaaaaaaaaaaaaaaaaaaaaaaaaaaaaaaaaaaaaaaaaaaaaaaaaaaaaaaaaaaaaaaaaaaaaaaaaaaaaaaaaaaaaaaaaaaaaaaaaaaaaaaaaaaaaaaaaaaaaaaaaaaaaaaaaaaaaaaaaaaaaaaaaaaaaaaaaaaaaaaaaaaaaaaaaaaaaaaaaaaaaaaaaaaaaaaaaaaaaaaaaaaaaaaaaaaaaaaaaaaaaaaaaaaaaaaaaaaaaaaaaaaaaaaaaaaaaaaaaaaaaaaaaaaaaaaaaaaaaaaaaaaaaaaaaaaaaaaaaaaaaaaaaaaaaaaaaaaaaaaaaaaaaaaaaaaaaaaaaaaaaaaaaaaaaaaaaaaaaaaaaaaaaaaaaaaaaaaaaaaaaaaaaaaaaaaaaaaaaaaaaaaaaaaaaaaaaaaaaaaaaaaaaaaaaaaaaaaaaaaaaaaaaaaaaaaaaaaaaaaaaaaaaaaaaaaaaaaaaaaaaaaaaaaaaaaaaaaaaaaaaaaaaaaaaaaaaaaaaaaaaaaaaaaaaaaaaaaaaaaaaaaaaaaaaaaaaaaaaaaaaaaaaaaaaaaaaaaaaaaaaaaaaaaaaaaaaaaaaaaaaaaaaaaaaaaaaaaaaaaaaaaaaaaaaaaaaaaaaaaaaaaaaaaaaaaaaaaaaaaaaaaaaaaaaaaaaaaaaaaaaaaaaaaaaaaaaaaaaaaaaaaaaaaaaaaaaaaaaaaaaaaaaaaaaaaaaaaaaaaaaaaaaaaaaaaaaaaaaaaaaaaaaaaaaaaaaaaaaaaaaaaaaaaaaaaaaaaaaaaaaaaaaaaaaaaaaaaaaaaaaaaaaaaaaaaaaaaaaaaaaaaaaaaaaaaaaaaaaaaaaaaaaaaaaaaaaaaaaaaaaaaaaaaaaaaaaaaaaaaaaaaaaaaaaaaaaaaaaaaaaaaaaaaaaaaaaaaaaaaaaaaaaaaaaaaaaaaaaaaaaaaaaaaaaaaaaaaaaaaaaaaaaaaaaaaaaaaaaaaaaaaaaaaaaaaaaaaaaaaaaaaaaaaaaaaaaaaaaaaaaaaaaaaaaaaaaaaaaaaaaaaaaaaaaaaaaaaaaaaaaaaaaaaaaaaaaaaaaaaaaaaaaaaaaaaaaaaaaaaaaaaaaaaaaaaaaaaaaaaaaaaaaaaaaaaaaaaaaaaaaaaaaaaaaaaaaaaaaaaaaaaaaaaaaaaaaaaaaaaaaaaaaaaaaaaaaaaaaaaaaaaaaaaaaaaaaaaaaaaaaaaaaaaaaaaaaaaaaaaaaaaaaaaaaaaaaaaaaaaaaaaaaaaaaaaaaaaaaaaaaaaaaaaaaaaaaaaaaaaaaaaaaaaaaaaaaaaaaaaaaaaaaaaaaaaaaaaaaaaaaaaaaaaaaaaaaaaaaaaaaaaaaaaaaaaaaaaaaaaaaaaaaaaaaaaaaaaaaaaaaaaaaaaaaaaaaaaaaaaaaaaaaaaaaaaaaaaaaaaaaaaaaaaaaaaaaaaaaaaaaaaaaaaaaaaaaaaaaaaaaaaaaaaaaaaaaaaaaaaaaaaaaaaaaaaaaaaaaaaaaaaaaaaaaaaaaaaaaaaaaaaaaaaaaaaaaaaaaaaaaaaaaaaaaaaaaaaaaaaaaaaaaaaaaaaaaaaaaaaaaaaaaaaaaaaaaaaaaaaaaaaaaaaaaaaaaaaaaaaaaaaaaaaaaaaaaaaaaaaaaaaaaaaaaaaaaaaaaaaaaaaaaaaaaaaaaaaaaaaaaaaaaaaaaaaaaaaaaaaaaaaaaaaaaaaaaaaaaaaaaaaaaaaaaaaaaaaaaaaaaaaaaaaaaaaaaaaaaaaaaaaaaaaaaaaaaaaaaaaaaaaaaaaaaaaaaaaaaaaaaaaaaaaaaaaaaaaaaaaaaaaaaaaaaaaaaaaaaaaaaaaaaaaaaaaaaaaaaaaaaaaaaaaaaaaaaaaaaaaaaaaaaaaaaaaaaaaaaaaaaaaaaaaaaaaaaaaaaaaaaaaaaaaaaaaaaaaaaaaaaaaaaaaaaaaaaaaaaaaaaaaaaaaaaaaaaaaaaaaaaaaaaaaaaaaaaaaaaaaaaaaaaaaaaaaaaaaaaaaaaaaaaaaaaaaaaaaaaaaaaaaaaaaaaaaaaaaaaaaaaaaaaaaaaaaaaaaaaaaaaaaaaaaaaaaaaaaaaaaaaaaaaaaaaaaaaaaaaaaaaaaaaaaaaaaaaaaaaaaaaaaaaaaaaaaaaaaaaaaaaaaaaaaaaaaaaaaaaaaaaaaaaaaaaaaaaaaaaaaaaaaaaaaaaaaaaaaaaaaaaaaaaaaaaaaaaaaaaaaaaaaaaaaaaaaaaaaaaaaaaaaaaaaaaaaaaaaaaaaaaaaaaaaaaaaaaaaaaaaaaaaaaaaaaaaaaaaaaaaaaaaaaaaaaaaaaaaaaaaaaaaaaaaaaaaaaaaaaaaaaaaaaaaaaaaaaaaaaaaaaaaaaaaaaaaaaaaaaaaaaaaaaaaaaaaaaaaaaaaaaaaaaaaaaaaaaaaaaaaaaaaaaaaaaaaaaaaaaaaaaaaaaaaaaaaaaaaaaaaaaaaaaaaaaaaaaaaaaaaaaaaaaaaaaaaaaaaaaaaaaaaaaaaaaaaaaaaaaaaaaaaaaaaaaaaaaaaaaaaaaaaaaaaaaaaaaaaaaaaaaaaaaaaaaaaaaaaaaaaaaaaaaaaaaaaaaaaaaaaaaaaaaaaaaaaaaaaaaaaaaaaaaaaaaaaaaaaaaaaaaaaaaaaaaaaaaaaaaaaaaaaaaaaaaaaaaaaaaaaaaaaaaaaaaaaaaaaaaaaaaaaaaaaaaaaaaaaaaaaaaaaaaaaaaaaaaaaaaaaaaaaaaaaaaaaaaaaaaaaaaaaaaaaaaaaaaaaaaaaaaaaaaaaaaaaaaaaaaaaaaaaaaaaaaaaaaaaaaaaaaaaaaaaaaaaaaaaaaaaaaaaaaaaaaaaaaaaaaaaaaaaaaaaaaaaaaaaaaaaaaaaaaaaaaaaaaaaaaaaaaaaaaaaaaaaaaaaaaaaaaaaaaaaaaaaaaaaaaaaaaaaaaaaaaaaaaaaaaaaaaaaaaaaaaaaaaaaaaaaaaaaaaaaaaaaaaaaaaaaaaaaaaaaaaaaaaaaaaaaaaaaaaaaaaaaaaaaaaaaaaaaaaaaaaaaaaaaaaaaaaaaaaaaaaaaaaaaaaaaaaaaaaaaaaaaaaaaaaaaaaaaaaaaaaaaaaaaaaaaaaaaaaaaaaaaaaaaaaaaaaaaaaaaaaaaaaaaaaaaaaaaaaaaaaaaaaaaaaaaaaaaaaaaaaaaaaaaaaaaaaaaaaaaaaaaaaaaaaaaaaaaaaaaaaaaaaaaaaaaaaaaaaaaaaaaaaaaaaaaaaaaaaaaaaaaaaaaaaaaaaaaaaaaaaaaaaaaaaaaaaaaaaaaaaaaaaaaaaaaaaaaaaaaaaaaaaaaaaaaaaaaaaaaaaaaaaaaaaaaaaaaaaaaaaaaaaaaaaaaaaaaaaaaaaaaaaaaaaaaaaaaaaaaaaaaaaaaaaaaaaaaaaaaaaaaaaaaaaaaaaaaaaaaaaaaaaaaaaaaaaaaaaaaaaaaaaaaaaaaaaaaaaaaaaaaaaaaaaaaaaaaaaaaaaaaaaaaaaaaaaaaaaaaaaaaaaaaaaaaaaaaaaaaaaaaaaaaaaaaaaaaaaaaaaaaaaaaaaaaaaaaaaaaaaaaaaaaaaaaaaaaaaaaaaaaaaaaaaaaaaaaaaaaaaaaaaaaaaaaaaaaaaaaaaaaaaaaaaaaaaaaaaaaaaaaaaaaaaaaaaaaaaaaaaaaaaaaaaaaaaaaaaaaaaaaaaaaaaaaaaaaaaaaaaaaaaaaaaaaaaaaaaaaaaaaaaaaaaaaaaaaaaaaaaaaaaaaaaaaaaaaaaaaaaaaaaaaaaaaaaaaaaaaaaaaaaaaaaaaaaaaaaaaaaaaaaaaaaaaaaaaaaaaaaaaaaaaaaaaaaaaaaaaaaaaaaaaaaaaaaaaaaaaaaaaaaaaaaaaaaaaaaaaaaaaaaaaaaaaaaaaaaaaaaaaaaaaaaaaaaaaaaaaaaaaaaaaaaaaaaaaaaaaaaaaaaaaaaaaaaaaaaaaaaaaaaaaaaaaaaaaaaaaaaaaaaaaaaaaaaaaaaaaaaaaaaaaaaaaaaaaaaaaaaaaaaaaaaaaaaaaaaaaaaaaaaaaaaaaaaaaaaaaaaaaaaaaaaaaaaaaaaaaaaaaaaaaaaaaaaaaaaaaaaaaaaaaaaaaaaaaaaaaaaaaaaaaaaaaaaaaaaaaaaaaaaaaaaaaaaaaaaaaaaaaaaaaaaaaaaaaaaaaaaaaaaaaaaaaaaaaaaaaaaaaaaaaaaaaaaaaaaaaaaaaaaaaaaaaaaaaaaaaaaaaaaaaaaaaaaaaaaaaaaaaaaaaaaaaaaaaaaaaaaaaaaaaaaaaaaaaaaaaaaaaaaaaaaaaaaaaaaaaaaaaaaaaaaaaaaaaaaaaaaaaaaaaaaaaaaaaaaaaaaaaaaaaaaaaaaaaaaaaaaaaaaaaaaaaaaaaaaaaaaaaaaaaaaaaaaaaaaaaaaaaaaaaaaaaaaaaaaaaaaaaaaaaaaaaaaaaaaaaaaaaaaaaaaaaaaaaaaaaaaaaaaaaaaaaaaaaaaaaaaaaaaaaaaaaaaaaaaaaaaaaaaaaaaaaaaaaaaaaaaaaaaaaaaaaaaaaaaaaaaaaaaaaaaaaaaaaaaaaaaaaaaaaaaaaaaaaaaaaaaaaaaaaaaaaaaaaaaaaaaaaaaaaaaaaaaaaaaaaaaaaaaaaaaaaaaaaaaaaaaaaaaaaaaaaaaaaaaaaaaaaaaaaaaaaaaaaaaaaaaaaaaaaaaaaaaaaaaaaaaaaaaaaaaaaaaaaaaaaaaaaaaaaaaaaaaaaaaaaaaaaaaaaaaaaaaaaaaaaaaaaaaaaaaaaaaaaaaaaaaaaaaaaaaaaaaaaaaaaaaaaaaaaaaaaaaaaaaaaaaaaaaaaaaaaaaaaaaaaaaaaaaaaaaaaaaaaaaaaaaaaaaaaaaaaaaaaaaaaaaaaaaaaaaaaaaaaaaaaaaaaaaaaaaaaaaaaaaaaaaaaaaaaaaaaaaaaaaaaaaaaaaaaaaaaaaaaaaaaaaaaaaaaaaaaaaaaaaaaaaaaaaaaaaaaaaaaaaaaaaaaaaaaaaaaaaaaaaaaaaaaaaaaaaaaaaaaaaaaaaaaaaaaaaaaaaaaaaaaaaaaaaaaaaaaaaaaaaaaaaaaaaaaaaaaaaaaaaaaaaaaaaaaaaaaaaaaaaaaaaaaaaaaaaaaaaaaaaaaaaaaaaaaaaaaaaaaaaaaaaaaaaaaaaaaaaaaaaaaaaaaaaaaaaaaaaaaaaaaaaaaaaaaaaaaaaaaaaaaaaaaaaaaaaaaaaaaaaaaaaaaaaaaaaaaaaaaaaaaaaaaaaaaaaaaaaaaaaaaaaaaaaaaaaaaaaaaaaaaaaaaaaaaaaaaaaaaaaaaaaaaaaaaaaaaaaaaaaaaaaaaaaaaaaaaaaaaaaaaaaaaaaaaaaaaaaaaaaaaaaaaaaaaaaaaaaaaaaaaaaaaaaaaaaaaaaaaaaaaaaaaaaaaaaaaaaaaaaaaaaaaaaaaaaaaaaaaaaaaaaaaaaaaaaaaaaaaaaaaaaaaaaaaaaaaaaaaaaaaaaaaaaaaaaaaaaaaaaaaaaaaaaaaaaaaaaaaaaaaaaaaaaaaaaaaaaaaaaaaaaaaaaaaaaaaaaaaaaaaaaaaaaaaaaaaaaaaaaaaaaaaaaaaaaaaaaaaaaaaaaaaaaaaaaaaaaaaaaaaaaaaaaaaaaaaaaaaaaaaaaaaaaaaaaaaaaaaaaaaaaaaaaaaaaaaaaaaaaaaaaaaaaaaaaaaaaaaaaaaaaaaaaaaaaaaaaaaaaaaaaaaaaaaaaaaaaaaaaaaaaaaaaaaaaaaaaaaaaaaaaaaaaaaaaaaaaaaaaaaaaaaaaaaaaaaaaaaaaaaaaaaaaaaaaaaaaaaaaaaaaaaaaaaaaaaaaaaaaaaaaaaaaaaaaaaaaaaaaaaaaaaaaaaaaaaaaaaaaaaaaaaaaaaaaaaaaaaaaaaaaaaaaaaaaaaaaaaaaaaaaaaaaaaaaaaaaaaaaaaaaaaaaaaaaaaaaaaaaaaaaaaaaaaaaaaaaaaaaaaaaaaaaaaaaaaaaaaaaaaaaaaaaaaaaaaaaaaaaaaaaaaaaaaaaaaaaaaaaaaaaaaaaaaaaaaaaaaaaaaaaaaaaaaaaaaaaaaaaaaaaaaaaaaaaaaaaaaaaaaaaaaaaaaaaaaaaaaaaaaaaaaaaaaaaaaaaaaaaaaaaaaaaaaaaaaaaaaaaaaaaaaaaaaaaaaaaaaaaaaaaaaaaaaaaaaaaaaaaaaaaaaaaaaaaaaaaaaaaaaaaaaaaaaaaaaaaaaaaaaaaaaaaaaaaaaaaaaaaaaaaaaaaaaaaaaaaaaaaaaaaaaaaaaaaaaaaaaaaaaaaaaaaaaaaaaaaaaaaaaaaaaaaaaaaaaaaaaaaaaaaaaaaaaaaaaaaaaaaaaaaaaaaaaaaaaaaaaaaaaaaaaaaaaaaaaaaaaaaaaaaaaaaaaaaaaaaaaaaaaaaaaaaaaaaaaaaaaaaaaaaaaaaaaaaaaaaaaaaaaaaaaaaaaaaaaaaaaaaaaaaaaaaaaaaaaaaaaaaaaaaaaaaaaaaaaaaaaaaaaaaaaaaaaaaaaaaaaaaaaaaaaaaaaaaaaaaaaaaaaaaaaaaaaaaaaaaaaaaaaaaaaaaaaaaaaaaaaaaaaaaaaaaaaaaaaaaaaaaaaaaaaaaaaaaaaaaaaaaaaaaaaaaaaaaaaaaaaaaaaaaaaaaaaaaaaaaaaaaaaaaaaaaaaaaaaaaaaaaaaaaaaaaaaaaaaaaaaaaaaaaaaaaaaaaaaaaaaaaaaaaaaaaaaaaaaaaaaaaaaaaaaaaaaaaaaaaaaaaaaaaaaaaaaaaaaaaaaaaaaaaaaaaaaaaaaaaaaaaaaaaaaaaaaaaaaaaaaaaaaaaaaaaaaaaaaaaaaaaaaaaaaaaaaaaaaaaaaaaaaaaaaaaaaaaaaaaaaaaaaaaaaaaaaaaaaaaaaaaaaaaaaaaaaaaaaaaaaaaaaaaaaaaaaaaaaaaaaaaaaaaaaaaaaaaaaaaaaaaaaaaaaaaaaaaaaaaaaaaaaaaaaaaaaaaaaaaaaaaaaaaaaaaaaaaaaaaaaaaaaaaaaaaaaaaaaaaaaaaaaaaaaaaaaaaaaaaaaaaaaaaaaaaaaaaaaaaaaaaaaaaaaaaaaaaaaaaaaaaaaaaaaaaaaaaaaaaaaaaaaaaaaaaaaaaaaaaaaaaaaaaaaaaaaaaaaaaaaaaaaaaaaaaaaaaaaaaaaaaaaaaaaaaaaaaaaaaaaaaaaaaaaaaaaaaaaaaaaaaaaaaaaaaaaaaaaaaaaaaaaaaaaaaaaaaaaaaaaaaaaaaaaaaaaaaaaaaaaaaaaaaaaaaaaaaaaaaaaaaaaaaaaaaaaaaaaaaaaaaaaaaaaaaaaaaaaaaaaaaaaaaaaaaaaaaaaaaaaaaaaaaaaaaaaaaaaaaaaaaaaaaaaaaaaaaaaaaaaaaaaaaaaaaaaaaaaaaaaaaaaaaaaaaaaaaaaaaaaaaaaaaaaaaaaaaaaaaaaaaaaaaaaaaaaaaaaaaaaaaaaaaaaaaaaaaaaaaaaaaaaaaaaaaaaaaaaaaaaaaaaaaaaaaaaaaaaaaaaaaaaaaaaaaaaaaaaaaaaaaaaaaaaaaaaaaaaaaaaaaaaaaaaaaaaaaaaaaaaaaaaaaaaaaaaaaaaaaaaaaaaaaaaaaaaaaaaaaaaaaaaaaaaaaaaaaaaaaaaaaaaaaaaaaaaaaaaaaaaaaaaaaaaaaaaaaaaaaaaaaaaaaaaaaaaaaaaaaaaaaaaaaaaaaaaaaaaaaaaaaaaaaaaaaaaaaaaaaaaaaaaaaaaaaaaaaaaaaaaaaaaaaaaaaaaaaaaaaaaaaaaaaaaaaaaaaaaaaaaaaaaaaaaaaaaaaaaaaaaaaaaaaaaaaaaaaaaaaaaaaaaaaaaaaaaaaaaaaaaaaaaaaaaaaaaaaaaaaaaaaaaaaaaaaaaaaaaaaaaaaaaaaaaaaaaaaaaaaaaaaaaaaaaaaaaaaaaaaaaaaaaaaaaaaaaaaaaaaaaaaaaaaaaaaaaaaaaaaaaaaaaaaaaaaaaaaaaaaaaaaaaaaaaaaaaaaaaaaaaaaaaaaaaaaaaaaaaaaaaaaaaaaaaaaaaaaaaaaaaaaaaaaaaaaaaaaaaaaaaaaaaaaaaaaaaaaaaaaaaaaaaaaaaaaaaaaaaaaaaaaaaaaaaaaaaaaaaaaaaaaaaaaaaaaaaaaaaaaaaaaaaaaaaaaaaaaaaaaaaaaaaaaaaaaaaaaaaaaaaaaaaaaaaaaaaaaaaaaaaaaaaaaaaaaaaaaaaaaaaaaaaaaaaaaaaaaaaaaaaaaaaaaaaaaaaaaaaaaaaaaaaaaaaaaaaaaaaaaaaaaaaaaaaaaaaaaaaaaaaaaaaaaaaaaaaaaaaaaaaaaaaaaaaaaaaaaaaaaaaaaaaaaaaaaaaaaaaaaaaaaaaaaaaaaaaaaaaaaaaaaaaaaaaaaaaaaaaaaaaaaaaaaaaaaaaaaaaaaaaaaaaaaaaaaaaaaaaaaaaaaaaaaaaaaaaaaaaaaaaaaaaaaaaaaaaaaaaaaaaaaaaaaaaaaaaaaaaaaaaaaaaaaaaaaaaaaaaaaaaaaaaaaaaaaaaaaaaaaaaaaaaaaaaaaaaaaaaaaaaaaaaaaaaaaaaaaaaaaaaaaaaaaaaaaaaaaaaaaaaaaaaaaaaaaaaaaaaaaaaaaaaaaaaaaaaaaaaaaaaaaaaaaaaaaaaaaaaaaaaaaaaaaaaaaaaaaaaaaaaaaaaaaaaaaaaaaaaaaaaaaaaaaaaaaaaaaaaaaaaaaaaaaaaaaaaaaaaaaaaaaaaaaaaaaaaaaaaaaaaaaaaaaaaaaaaaaaaaaaaaaaaaaaaaaaaaaaaaaaaaaaaaaaaaaaaaaaaaaaaaaaaaaaaaaaaaaaaaaaaaaaaaaaaaaaaaaaaaaaaaaaaaaaaaaaaaaaaaaaaaaaaaaaaaaaaaaaaaaaaaaaaaaaaaaaaaaaaaaaaaaaaaaaaaaaaaaaaaaaaaaaaaaaaaaaaaaaaaaaaaaaaaaaaaaaaaaaaaaaaaaaaaaaaaaaaaaaaaaaaaaaaaaaaaaaaaaaaaaaaaaaaaaaaaaaaaaaaaaaaaaaaaaaaaaaaaaaaaaaaaaaaaaaaaaaaaaaaaaaaaaaaaaaaaaaaaaaaaaaaaaaaaaaaaaaaaaaaaaaaaaaaaaaaaaaaaaaaaaaaaaaaaaaaaaaaaaaaaaaaaaaaaaaaaaaaaaaaaaaaaaaaaaaaaaaaaaaaaaaaaaaaaaaaaaaaaaaaaaaaaaaaaaaaaaaaaaaaaaaaaaaaaaaaaaaaaaaaaaaaaaaaaaaaaaaaaaaaaaaaaaaaaaaaaaaaaaaaaaaaaaaaaaaaaaaaaaaaaaaaaaaaaaaaaaaaaaaaaaaaaaaaaaaaaaaaaaaaaaaaaaaaaaaaaaaaaaaaaaaaaaaaaaaaaaaaaaaaaaaaaaaaaaaaaaaaaaaaaaaaaaaaaaaaaaaaaaaaaaaaaaaaaaaaaaaaaaaaaaaaaaaaaaaaaaaaaaaaaaaaaaaaaaaaaaaaaaaaaaaaaaaaaaaaaaaaaaaaaaaaaaaaaaaaaaaaaaaaaaaaaaaaaaaaaaaaaaaaaaaaaaaaaaaaaaaaaaaaaaaaaaaaaaaaaaaaaaaaaaaaaaaaaaaaaaaaaaaaaaaaaaaaaaaaaaaaaaaaaaaaaaaaaaaaaaaaaaaaaaaaaaaaaaaaaaaaaaaaaaaaaaaaaaaaaaaaaaaaaaaaaaaaaaaaaaaaaaaaaaaaaaaaaaaaaaaaaaaaaaaaaaaaaaaaaaaaaaaaaaaaaaaaaaaaaaaaaaaaaaaaaaaaaaaaaaaaaaaaaaaaaaaaaaaaaaaaaaaaaaaaaaaaaaaaaaaaaaaaaaaaaaaaaaaaaaaaaaaaaaaaaaaaaaaaaaaaaaaaaaaaaaaaaaaaaaaaaaaaaaaaaaaaaaaaaaaaaaaaaaaaaaaaaaaaaaaaaaaaaaaaaaaaaaaaaaaaaaaaaaaaaaaaaaaaaaaaaaaaaaaaaaaaaaaaaaaaaaaaaaaaaaaaaaaaaaaaaaaaaaaaaaaaaaaaaaaaaaaaaaaaaaaaaaaaaaaaaaaaaaaaaaaaaaaaaaaaaaaaaaaaaaaaaaaaaaaaaaaaaaaaaaaaaaaaaaaaaaaaaaaaaaaaaaaaaaaaaaaaaaaaaaaaaaaaaaaaaaaaaaaaaaaaaaaaaaaaaaaaaaaaaaaaaaaaaaaaaaaaaaaaaaaaaaaaaaaaaaaaaaaaaaaaaaaaaaaaaaaaaaaaaaaaaaaaaaaaaaaaaaaaaaaaaaaaaaaaaaaaaaaaaaaaaaaaaaaaaaaaaaaaaaaaaaaaaaaaaaaaaaaaaaaaaaaaaaaaaaaaaaaaaaaaaaaaaaaaaaaaaaaaaaaaaaaaaaaaaaaaaaaaaaaaaaaaaaaaaaaaaaaaaaaaaaaaaaaaaaaaaaaaaaaaaaaaaaaaaaaaaaaaaaaaaaaaaaaaaaaaaaaaaaaaaaaaaaaaaaaaaaaaaaaaaaaaaaaaaaaaaaaaaaaaaaaaaaaaaaaaaaaaaaaaaaaaaaaaaaaaaaaaaaaaaaaaaaaaaaaaaaaaaaaaaaaaaaaaaaaaaaaaaaaaaaaaaaaaaaaaaaaaaaaaaaaaaaaaaaaaaaaaaaaaaaaaaaaaaaaaaaaaaaaaaaaaaaaaaaaaaaaaaaaaaaaaaaaaaaaaaaaaaaaaaaaaaaaaaaaaaaaaaaaaaaaaaaaaaaaaaaaaaaaaaaaaaaaaaaaaaaaaaaaaaaaaaaaaaaaaaaaaaaaaaaaaaaaaaaaaaaaaaaaaaaaaaaaaaaaaaaaaaaaaaaaaaaaaaaaaaaaaaaaaaaaaaaaaaaaaaaaaaaaaaaaaaaaaaaaaaaaaaaaaaaaaaaaaaaaaaaaaaaaaaaaaaaaaaaaaaaaaaaaaaaaaaaaaaaaaaaaaaaaaaaaaaaaaaaaaaaaaaaaaaaaaaaaaaaaaaaaaaaaaaaaaaaaaaaaaaaaaaaaaaaaaaaaaaaaaaaaaaaaaaaaaaaaaaaaaaaaaaaaaaaaaaaaaaaaaaaaaaaaaaaaaaaaaaaaaaaaaaaaaaaaaaaaaaaaaaaaaaaaaaaaaaaaaaaaaaaaaaaaaaaaaaaaaaaaaaaaaaaaaaaaaaaaaaaaaaaaaaaaaaaaaaaaaaaaaaaaaaaaaaaaaaaaaaaaaaaaaaaaaaaaaaaaaaaaaaaaaaaaaaaaaaaaaaaaaaaaaaaaaaaaaaaaaaaaaaaaaaaaaaaaaaaaaaaaaaaaaaaaaaaaaaaaaaaaaaaaaaaaaaaaaaaaaaaaaaaaaaaaaaaaaaaaaaaaaaaaaaaaaaaaaaaaaaaaaaaaaaaaaaaaaaaaaaaaaaaaaaaaaaaaaaaaaaaaaaaaaaaaaaaaaaaaaaaaaaaaaaaaaaaaaaaaaaaaaaaaaaaaaaaaaaaaaaaaaaaaaaaaaaaaaaaaaaaaaaaaaaaaaaaaaaaaaaaaaaaaaaaaaaaaaaaaaaaaaaaaaaaaaaaaaaaaaaaaaaaaaaaaaaaaaaaaaaaaaaaaaaaaaaaaaaaaaaaaaaaaaaaaaaaaaaaaaaaaaaaaaaaaaaaaaaaaaaaaaaaaaaaaaaaaaaaaaaaaaaaaaaaaaaaaaaaaaaaaaaaaaaaaaaaaaaaaaaaaaaaaaaaaaaaaaaaaaaaaaaaaaaaaaaaaaaaaaaaaaaaaaaaaaaaaaaaaaaaaaaaaaaaaaaaaaaaaaaaaaaaaaaaaaaaaaaaaaaaaaaaaaaaaaaaaaaaaaaaaaaaaaaaaaaaaaaaaaaaaaaaaaaaaaaaaaaaaaaaaaaaaaaaaaaaaaaaaaaaaaaaaaaaaaaaaaaaaaaaaaaaaaaaaaaaaaaaaaaaaaaaaaaaaaaaaaaaaaaaaaaaaaaaaaaaaaaaaaaaaaaaaaaaaaaaaaaaaaaaaaaaaaaaaaaaaaaaaaaaaaaaaaaaaaaaaaaaaaaaaaaaaaaaaaaaaaaaaaaaaaaaaaaaaaaaaaaaaaaaaaaaaaaaaaaaaaaaaaaaaaaaaaaaaaaaaaaaaaaaaaaaaaaaaaaaaaaaaaaaaaaaaaaaaaaaaaaaaaaaaaaaaaaaaaaaaaaaaaaaaaaaaaaaaaaaaaaaaaaaaaaaaaaaaaaaaaaaaaaaaaaaaaaaaaaaaaaaaaaaaaaaaaaaaaaaaaaaaaaaaaaaaaaaaaaaaaaaaaaaaaaaaaaaaaaaaaaaaaaaaaaaaaaaaaaaaaaaaaaaaaaaaaaaaaaaaaaaaaaaaaaaaaaaaaaaaaaaaaaaaaaaaaaaaaaaaaaaaaaaaaaaaaaaaaaaaaaaaaaaaaaaaaaaaaaaaaaaaaaaaaaaaaaaaaaaaaaaaaaaaaaaaaaaaaaaaaaaaaaaaaaaaaaaaaaaaaaaaaaaaaaaaaaaaaaaaaaaaaaaaaaaaaaaaaaaaaaaaaaaaaaaaaaaaaaaaaaaaaaaaaaaaaaaaaaaaaaaaaaaaaaaaaaaaaaaaaaaaaaaaaaaaaaaaaaaaaaaaaaaaaaaaaaaaaaaaaaaaaaaaaaaaaaaaaaaaaaaaaaaaaaaaaaaaaaaaaaaaaaaaaaaaaaaaaaaaaaaaaaaaaaaaaaaaaaaaaaaaaaaaaaaaaaaaaaaaaaaaaaaaaaaaaaaaaaaaaaaaaaaaaaaaaaaaaaaaaaaaaaaaaaaaaaaaaaaaaaaaaaaaaaaaaaaaaaaaaaaaaaaaaaaaaaaaaaaaaaaaaaaaaaaaaaaaaaaaaaaaaaaaaaaaaaaaaaaaaaaaaaaaaaaaaaaaaaaaaaaaaaaaaaaaaaaaaaaaaaaaaaaaaaaaaaaaaaaaaaaaaaaaaaaaaaaaaaaaaaaaaaaaaaaaaaaaaaaaaaaaaaaaaaaaaaaaaaaaaaaaaaaaaaaaaaaaaaaaaaaaaaaaaaaaaaaaaaaaaaaaaaaaaaaaaaaaaaaaaaaaaaaaaaaaaaaaaaaaaaaaaaaaaaaaaaaaaaaaaaaaaaaaaaaaaaaaaaaaaaaaaaaaaaaaaaaaaaaaaaaaaaaaaaaaaaaaaaaaaaaaaaaaaaaaaaaaaaaaaaaaaaaaaaaaaaaaaaaaaaaaaaaaaaaaaaaaaaaaaaaaaaaaaaaaaaaaaaaaaaaaaaaaaaaaaaaaaaaaaaaaaaaaaaaaaaaaaaaaaaaaaaaaaaaaaaaaaaaaaaaaaaaaaaaaaaaaaaaaaaaaaaaaaaaaaaaaaaaaaaaaaaaaaaaaaaaaaaaaaaaaaaaaaaaaaaaaaaaaaaaaaaaaaaaaaaaaaaaaaaaaaaaaaaaaaaaaaaaaaaaaaaaaaaaaaaaaaaaaaaaaaaaaaaaaaaaaaaaaaaaaaaaaaaaaaaaaaaaaaaaaaaaaaaaaaaaaaaaaaaaaaaaaaaaaaaaaaaaaaaaaaaaaaaaaaaaaaaaaaaaaaaaaaaaaaaaaaaaaaaaaaaaaaaaaaaaaaaaaaaaaaaaaaaaaaaaaaaaaaaaaaaaaaaaaaaaaaaaaaaaaaaaaaaaaaaaaaaaaaaaaaaaaaaaaaaaaaaaaaaaaaaaaaaaaaaaaaaaaaaaaaaaaaaaaaaaaaaaaaaaaaaaaaaaaaaaaaaaaaaaaaaaaaaaaaaaaaaaaaaaaaaaaaaaaaaaaaaaaaaaaaaaaaaaaaaaaaaaaaaaaaaaaaaaaaaaaaaaaaaaaaaaaaaaaaaaaaaaaaaaaaaaaaaaaaaaaaaaaaaaaaaaaaaaaaaaaaaaaaaaaaaaaaaaaaaaaaaaaaaaaaaaaaaaaaaaaaaaaaaaaaaaaaaaaaaaaaaaaaaaaaaaaaaaaaaaaaaaaaaaaaaaaaaaaaaaaaaaaaaaaaaaaaaaaaaaaaaaaaaaaaaaaaaaaaaaaaaaaaaaaaaaaaaaaaaaaaaaaaaaaaaaaaaaaaaaaaaaaaaaaaaaaaaaaaaaaaaaaaaaaaaaaaaaaaaaaaaaaaaaaaaaaaaaaaaaaaaaaaaaaaaaaaaaaaaaaaaaaaaaaaaaaaaaaaaaaaaaaaaaaaaaaaaaaaaaaaaaaaaaaaaaaaaaaaaaaaaaaaaaaaaaaaaaaaaaaaaaaaaaaaaaaaaaaaaaaaaaaaaaaaaaaaaaaaaaaaaaaaaaaaaaaaaaaaaaaaaaaaaaaaaaaaaaaaaaaaaaaaaaaaaaaaaaaaaaaaaaaaaaaaaaaaaaaaaaaaaaaaaaaaaaaaaaaaaaaaaaaaaaaaaaaaaaaaaaaaaaaaaaaaaaaaaaaaaaaaaaaaaaaaaaaaaaaaaaaaaaaaaaaaaaaaaaaaaaaaaaaaaaaaaaaaaaaaaaaaaaaaaaaaaaaaaaaaaaaaaaaaaaaaaaaaaaaaaaaaaaaaaaaaaaaaaaaaaaaaaaaaaaaaaaaaaaaaaaaaaaaaaaaaaaaaaaaaaaaaaaaaaaaaaaaaaaaaaaaaaaaaaaaaaaaaaaaaaaaaaaaaaaaaaaaaaaaaaaaaaaaaaaaaaaaaaaaaaaaaaaaaaaaaaaaaaaaaaaaaaaaaaaaaaaaaaaaaaaaaaaaaaaaaaaaaaaaaaaaaaaaaaaaaaaaaaaaaaaaaaaaaaaaaaaaaaaaaaaaaaaaaaaaaaaaaaaaaaaaaaaaaaaaaaaaaaaaaaaaaaaaaaaaaaaaaaaaaaaaaaaaaaaaaaaaaaaaaaaaaaaaaaaaaaaaaaaaaaaaaaaaaaaaaaaaaaaaaaaaaaaaaaaaaaaaaaaaaaaaaaaaaaaaaaaaaaaaaaaaaaaaaaaaaaaaaaaaaaaaaaaaaaaaaaaaaaaaaaaaaaaaaaaaaaaaaaaaaaaaaaaaaaaaaaaaaaaaaaaaaaaaaaaaaaaaaaaaaaaaaaaaaaaaaaaaaaaaaaaaaaaaaaaaaaaaaaaaaaaaaaaaaaaaaaaaaaaaaaaaaaaaaaaaaaaaaaaaaaaaaaaaaaaaaaaaaaaaaaaaaaaaaaaaaaaaaaaaaaaaaaaaaaaaaaaaaaaaaaaaaaaaaaaaaaaaaaaaaaaaaaaaaaaaaaaaaaaaaaaaaaaaaaaaaaaaaaaaaaaaaaaaaaaaaaaaaaaaaaaaaaaaaaaaaaaaaaaaaaaaaaaaaaaaaaaaaaaaaaaaaaaaaaaaaaaaaaaaaaaaaaaaaaaaaaaaaaaaaaaaaaaaaaaaaaaaaaaaaaaaaaaaaaaaaaaaaaaaaaaaaaaaaaaaaaaaaaaaaaaaaaaaaaaaaaaaaaaaaaaaaaaaaaaaaaaaaaaaaaaaaaaaaaaaaaaaaaaaaaaaaaaaaaaaaaaaaaaaaaaaaaaaaaaaaaaaaaaaaaaaaaaaaaaaaaaaaaaaaaaaaaaaaaaaaaaaaaaaaaaaaaaaaaaaaaaaaaaaaaaaaaaaaaaaaaaaaaaaaaaaaaaaaaaaaaaaaaaaaaaaaaaaaaaaaaaaaaaaaaaaaaaaaaaaaaaaaaaaaaaaaaaaaaaaaaaaaaaaaaaaaaaaaaaaaaaaaaaaaaaaaaaaaaaaaaaaaaaaaaaaaaaaaaaaaaaaaaaaaaaaaaaaaaaaaaaaaaaaaaaaaaaaaaaaaaaaaaaaaaaaaaaaaaaaaaaaaaaaaaaaaaaaaaaaaaaaaaaaaaaaaaaaaaaaaaaaaaaaaaaaaaaaaaaaaaaaaaaaaaaaaaaaaaaaaaaaaaaaaaaaaaaaaaaaaaaaaaaaaaaaaaaaaaaaaaaaaaaaaaaaaaaaaaaaaaaaaaaaaaaaaaaaaaaaaaaaaaaaaaaaaaaaaaaaaaaaaaaaaaaaaaaaaaaaaaaaaaaaaaaaaaaaaaaaaaaaaaaaaaaaaaaaaaaaaaaaaaaaaaaaaaaaaaaaaaaaaaaaaaaaaaaaaaaaaaaaaaaaaaaaaaaaaaaaaaaaaaaaaaaaaaaaaaaaaaaaaaaaaaaaaaaaaaaaaaaaaaaaaaaaaaaaaaaaaaaaaaaaaaaaaaaaaaaaaaaaaaaaaaaaaaaaaaaaaaaaaaaaaaaaaaaaaaaaaaaaaaaaaaaaaaaaaaaaaaaaaaaaaaaaaaaaaaaaaaaaaaaaaaaaaaaaaaaaaaaaaaaaaaaaaaaaaaaaaaaaaaaaaaaaaaaaaaaaaaaaaaaaaaaaaaaaaaaaaaaaaaaaaaaaaaaaaaaaaaaaaaaaaaaaaaaaaaaaaaaaaaaaaaaaaaaaaaaaaaaaaaaaaaaaaaaaaaaaaaaaaaaaaaaaaaaaaaaaaaaaaaaaaaaaaaaaaaaaaaaaaaaaaaaaaaaaaaaaaaaaaaaaaaaaaaaaaaaaaaaaaaaaaaaaaaaaaaaaaaaaaaaaaaaaaaaaaaaaaaaaaaaaaaaaaaaaaaaaaaaaaaaaaaaaaaaaaaaaaaaaaaaaaaaaaaaaaaaaaaaaaaaaaaaaaaaaaaaaaaaaaaaaaaaaaaaaaaaaaaaaaaaaaaaaaaaaaaaaaaaaaaaaaaaaaaaaaaaaaaaaaaaaaaaaaaaaaaaaaaaaaaaaaaaaaaaaaaaaaaaaaaaaaaaaaaaaaaaaaaaaaaaaaaaaaaaaaaaaaaaaaaaaaaaaaaaaaaaaaaaaaaaaaaaaaaaaaaaaaaaaaaaaaaaaaaaaaaaaaaaaaaaaaaaaaaaaaaaaaaaaaaaaaaaaaaaaaaaaaaaaaaaaaaaaaaaaaaaaaaaaaaaaaaaaaaaaaaaaaaaaaaaaaaaaaaaaaaaaaaaaaaaaaaaaaaaaaaaaaaaaaaaaaaaaaaaaaaaaaaaaaaaaaaaaaaaaaaaaaaaaaaaaaaaaaaaaaaaaaaaaaaaaaaaaaaaaaaaaaaaaaaaaaaaaaaaaaaaaaaaaaaaaaaaaaaaaaaaaaaaaaaaaaaaaaaaaaaaaaaaaaaaaaaaaaaaaaaaaaaaaaaaaaaaaaaaaaaaaaaaaaaaaaaaaaaaaaaaaaaaaaaaaaaaaaaaaaaaaaaaaaaaaaaaaaaaaaaaaaaaaaaaaaaaaaaaaaaaaaaaaaaaaaaaaaaaaaaaaaaaaaaaaaaaaaaaaaaaaaaaaaaaaaaaaaaaaaaaaaaaaaaaaaaaaaaaaaaaaaaaaaaaaaaaaaaaaaaaaaaaaaaaaaaaaaaaaaaaaaaaaaaaaaaaaaaaaaaaaaaaaaaaaaaaaaaaaaaaaaaaaaaaaaaaaaaaaaaaaaaaaaaaaaaaaaaaaaaaaaaaaaaaaaaaaaaaaaaaaaaaaaaaaaaaaaaaaaaaaaaaaaaaaaaaaaaaaaaaaaaaaaaaaaaaaaaaaaaaaaaaaaaaaaaaaaaaaaaaaaaaaaaaaaaaaaaaaaaaaaaaaaaaaaaaaaaaaaaaaaaaaaaaaaaaaaaaaaaaaaaaaaaaaaaaaaaaaaaaaaaaaaaaaaaaaaaaaaaaaaaaaaaaaaaaaaaaaaaaaaaaaaaaaaaaaaaaaaaaaaaaaaaaaaaaaaaaaaaaaaaaaaaaaaaaaaaaaaaaaaaaaaaaaaaaaaaaaaaaaaaaaaaaaaaaaaaaaaaaaaaaaaaaaaaaaaaaaaaaaaaaaaaaaaaaaaaaaaaaaaaaaaaaaaaaaaaaaaaaaaaaaaaaaaaaaaaaaaaaaaaaaaaaaaaaaaaaaaaaaaaaaaaaaaaaaaaaaaaaaaaaaaaaaaaaaaaaaaaaaaaaaaaaaaaaaaaaaaaaaaaaaaaaaaaaaaaaaaaaaaaaaaaaaaaaaaaaaaaaaaaaaaaaaaaaaaaaaaaaaaaaaaaaaaaaaaaaaaaaaaaaaaaaaaaaaaaaaaaaaaaaaaaaaaaaaaaaaaaaaaaaaaaaaaaaaaaaaaaaaaaaaaaaaaaaaaaaaaaaaaaaaaaaaaaaaaaaaaaaaaaaaaaaaaaaaaaaaaaaaaaaaaaaaaaaaaaaaaaaaaaaaaaaaaaaaaaaaaaaaaaaaaaaaaaaaaaaaaaaaaaaaaaaaaaaaaaaaaaaaaaaaaaaaaaaaaaaaaaaaaaaaaaaaaaaaaaaaaaaaaaaaaaaaaaaaaaaaaaaaaaaaaaaaaaaaaaaaaaaaaaaaaaaaaaaaaaaaaaaaaaaaaaaaaaaaaaaaaaaaaaaaaaaaaaaaaaaaaaaaaaaaaaaaaaaaaaaaaaaaaaaaaaaaaaaaaaaaaaaaaaaaaaaaaaaaaaaaaaaaaaaaaaaaaaaaaaaaaaaaaaaaaaaaaaaaaaaaaaaaaaaaaaaaaaaaaaaaaaaaaaaaaaaaaaaaaaaaaaaaaaaaaaaaaaaaaaaaaaaaaaaaaaaaaaaaaaaaaaaaaaaaaaaaaaaaaaaaaaaaaaaaaaaaaaaaaaaaaaaaaaaaaaaaaaaaaaaaaaaaaaaaaaaaaaaaaaaaaaaaaaaaaaaaaaaaaaaaaaaaaaaaaaaaaaaaaaaaaaaaaaaaaaaaaaaaaaaaaaaaaaaaaaaaaaaaaaaaaaaaaaaaaaaaaaaaaaaaaaaaaaaaaaaaaaaaaaaaaaaaaaaaaaaaaaaaaaaaaaaaaaaaaaaaaaaaaaaaaaaaaaaaaaaaaaaaaaaaaaaaaaaaaaaaaaaaaaaaaaaaaaaaaaaaaaaaaaaaaaaaaaaaaaaaaaaaaaaaaaaaaaaaaaaaaaaaaaaaaaaaaaaaaaaaaaaaaaaaaaaaaaaaaaaaaaaaaaaaaaaaaaaaaaaaaaaaaaaaaaaaaaaaaaaaaaaaaaaaaaaaaaaaaaaaaaaaaaaaaaaaaaaaaaaaaaaaaaaaaaaaaaaaaaaaaaaaaaaaaaaaaaaaaaaaaaaaaaaaaaaaaaaaaaaaaaaaaaaaaaaaaaaaaaaaaaaaaaaaaaaaaaaaaaaaaaaaaaaaaaaaaaaaaaaaaaaaaaaaaaaaaaaaaaaaaaaaaaaaaaaaaaaaaaaaaaaaaaaaaaaaaaaaaaaaaaaaaaaaaaaaaaaaaaaaaaaaaaaaaaaaaaaaaaaaaaaaaaaaaaaaaaaaaaaaaaaaaaaaaaaaaaaaaaaaaaaaaaaaaaaaaaaaaaaaaaaaaaaaaaaaaaaaaaaaaaaaaaaaaaaaaaaaaaaaaaaaaaaaaaaaaaaaaaaaaaaaaaaaaaaaaaaaaaaaaaaaaaaaaaaaaaaaaaaaaaaaaaaaaaaaaaaaaaaaaaaaaaaaaaaaaaaaaaaaaaaaaaaaaaaaaaaaaaaaaaaaaaaaaaaaaaaaaaaaaaaaaaaaaaaaaaaaaaaaaaaaaaaaaaaaaaaaaaaaaaaaaaaaaaaaaaaaaaaaaaaaaaaaaaaaaaaaaaaaaaaaaaaaaaaaaaaaaaaaaaaaaaaaaaaaaaaaaaaaaaaaaaaaaaaaaaaaaaaaaaaaaaaaaaaaaaaaaaaaaaaaaaaaaaaaaaaaaaaaaaaaaaaaaaaaaaaaaaaaaaaaaaaaaaaaaaaaaaaaaaaaaaaaaaaaaaaaaaaaaaaaaaaaaaaaaaaaaaaaaaaaaaaaaaaaaaaaaaaaaaaaaaaaaaaaaaaaaaaaaaaaaaaaaaaaaaaaaaaaaaaaaaaaaaaaaaaaaaaaaaaaaaaaaaaaaaaaaaaaaaaaaaaaaaaaaaaaaaaaaaaaaaaaaaaaaaaaaaaaaaaaaaaaaaaaaaaaaaaaaaaaaaaaaaaaaaaaaaaaaaaaaaaaaaaaaaaaaaaaaaaaaaaaaaaaaaaaaaaaaaaaaaaaaaaaaaaaaaaaaaaaaaaaaaaaaaaaaaaaaaaaaaaaaaaaaaaaaaaaaaaaaaaaaaaaaaaaaaaaaaaaaaaaaaaaaaaaaaaaaaaaaaaaaaaaaaaaaaaaaaaaaaaaaaaaaaaaaaaaaaaaaaaaaaaaaaaaaaaaaaaaaaaaaaaaaaaaaaaaaaaaaaaaaaaaaaaaaaaaaaaaaaaaaaaaaaaaaaaaaaaaaaaaaaaaaaaaaaaaaaaaaaaaaaaaaaaaaaaaaaaaaaaaaaaaaaaaaaaaaaaaaaaaaaaaaaaaaaaaaaaaaaaaaaaaaaaaaaaaaaaaaaaaaaaaaaaaaaaaaaaaaaaaaaaaaaaaaaaaaaaaaaaaaaaaaaaaaaaaaaaaaaaaaaaaaaaaaaaaaaaaaaaaaaaaaaaaaaaaaaaaaaaaaaaaaaaaaaaaaaaaaaaaaaaaaaaaaaaaaaaaaaaaaaaaaaaaaaaaaaaaaaaaaaaaaaaaaaaaaaaaaaaaaaaaaaaaaaaaaaaaaaaaaaaaaaaaaaaaaaaaaaaaaaaaaaaaaaaaaaaaaaaaaaaaaaaaaaaaaaaaaaaaaaaaaaaaaaaaaaaaaaaaaaaaaaaaaaaaaaaaaaaaaaaaaaaaaaaaaaaaaaaaaaaaaaaaaaaaaaaaaaaaaaaaaaaaaaaaaaaaaaaaaaaaaaaaaaaaaaaaaaaaaaaaaaaaaaaaaaaaaaaaaaaaaaaaaaaaaaaaaaaaaaaaaaaaaaaaaaaaaaaaaaaaaaaaaaaaaaaaaaaaaaaaaaaaaaaaaaaaaaaaaaaaaaaaaaaaaaaaaaaaaaaaaaaaaaaaaaaaaaaaaaaaaaaaaaaaaaaaaaaaaaaaaaaaaaaaaaaaaaaaaaaaaaaaaaaaaaaaaaaaaaaaaaaaaaaaaaaaaaaaaaaaaaaaaaaaaaaaaaaaaaaaaaaaaaaaaaaaaaaaaaaaaaaaaaaaaaaaaaaaaaaaaaaaaaaaaaaaaaaaaaaaaaaaaaaaaaaaaaaaaaaaaaaaaaaaaaaaaaaaaaaaaaaaaaaaaaaaaaaaaaaaaaaaaaaaaaaaaaaaaaaaaaaaaaaaaaaaaaaaaaaaaaaaaaaaaaaaaaaaaaaaaaaaaaaaaaaaaaaaaaaaaaaaaaaaaaaaaaaaaaaaaaaaaaaaaaaaaaaaaaaaaaaaaaaaaaaaaaaaaaaaaaaaaaaaaaaaaaaaaaaaaaaaaaaaaaaaaaaaaaaaaaaaaaaaaaaaaaaaaaaaaaaaaaaaaaaaaaaaaaaaaaaaaaaaaaaaaaaaaaaaaaaaaaaaaaaaaaaaaaaaaaaaaaaaaaaaaaaaaaaaaaaaaaaaaaaaaaaaaaaaaaaaaaaaaaaaaaaaaaaaaaaaaaaaaaaaaaaaaaaaaaaaaaaaaaaaaaaaaaaaaaaaaaaaaaaaaaaaaaaaaaaaaaaaaaaaaaaaaaaaaaaaaaaaaaaaaaaaaaaaaaaaaaaaaaaaaaaaaaaaaaaaaaaaaaaaaaaaaaaaaaaaaaaaaaaaaaaaaaaaaaaaaaaaaaaaaaaaaaaaaaaaaaaaaaaaaaaaaaaaaaaaaaaaaaaaaaaaaaaaaaaaaaaaaaaaaaaaaaaaaaaaaaaaaaaaaaaaaaaaaaaaaaaaaaaaaaaaaaaaaaaaaaaaaaaaaaaaaaaaaaaaaaaaaaaaaaaaaaaaaaaaaaaaaaaaaaaaaaaaaaaaaaaaaaaaaaaaaaaaaaaaaaaaaaaaaaaaaaaaaaaaaaaaaaaaaaaaaaaaaaaaaaaaaaaaaaaaaaaaaaaaaaaaaaaaaaaaaaaaaaaaaaaaaaaaaaaaaaaaaaaaaaaaaaaaaaaaaaaaaaaaaaaaaaaaaaaaaaaaaaaaaaaaaaaaaaaaaaaaaaaaaaaaaaaaaaaaaaaaaaaaaaaaaaaaaaaaaaaaaaaaaaaaaaaaaaaaaaaaaaaaaaaaaaaaaaaaaaaaaaaaaaaaaaaaaaaaaaaaaaaaaaaaaaaaaaaaaaaaaaaaaaaaaaaaaaaaaaaaaaaaaaaaaaaaaaaaaaaaaaaaaaaaaaaaaaaaaaaaaaaaaaaaaaaaaaaaaaaaaaaaaaaaaaaaaaaaaaaaaaaaaaaaaaaaaaaaaaaaaaaaaaaaaaaaaaaaaaaaaaaaaaaaaaaaaaaaaaaaaaaaaaaaaaaaaaaaaaaaaaaaaaaaaaaaaaaaaaaaaaaaaaaaaaaaaaaaaaaaaaaaaaaaaaaaaaaaaaaaaaaaaaaaaaaaaaaaaaaaaaaaaaaaaaaaaaaaaaaaaaaaaaaaaaaaaaaaaaaaaaaaaaaaaaaaaaaaaaaaaaaaaaaaaaaaaaaaaaaaaaaaaaaaaaaaaaaaaaaaaaaaaaaaaaaaaaaaaaaaaaaaaaaaaaaaaaaaaaaaaaaaaaaaaaaaaaaaaaaaaaaaaaaaaaaaaaaaaaaaaaaaaaaaaaaaaaaaaaaaaaaaaaaaaaaaaaaaaaaaaaaaaaaaaaaaaaaaaaaaaaaaaaaaaaaaaaaaaaaaaaaaaaaaaaaaaaaaaaaaaaaaaaaaaaaaaaaaaaaaaaaaaaaaaaaaaaaaaaaaaaaaaaaaaaaaaaaaaaaaaaaaaaaaaaaaaaaaaaaaaaaaaaaaaaaaaaaaaaaaaaaaaaaaaaaaaaaaaaaaaaaaaaaaaaaaaaaaaaaaaaaaaaaaaaaaaaaaaaaaaaaaaaaaaaaaaaaaaaaaaaaaaaaaaaaaaaaaaaaaaaaaaaaaaaaaaaaaaaaaaaaaaaaaaaaaaaaaaaaaaaaaaaaaaaaaaaaaaaaaaaaaaaaaaaaaaaaaaaaaaaaaaaaaaaaaaaaaaaaaaaaaaaaaaaaaaaaaaaaaaaaaaaaaaaaaaaaaaaaaaaaaaaaaaaaaaaaaaaaaaaaaaaaaaaaaaaaaaaaaaaaaaaaaaaaaaaaaaaaaaaaaaaaaaaaaaaaaaaaaaaaaaaaaaaaaaaaaaaaaaaaaaaaaaaaaaaaaaaaaaaaaaaaaaaaaaaaaaaaaaaaaaaaaaaaaaaaaaaaaaaaaaaaaaaaaaaaaaaaaaaaaaaaaaaaaaaaaaaaaaaaaaaaaaaaaaaaaaaaaaaaaaaaaaaaaaaaaaaaaaaaaaaaaaaaaaaaaaaaaaaaaaaaaaaaaaaaaaaaaaaaaaaaaaaaaaaaaaaaaaaaaaaaaaaaaaaaaaaaaaaaaaaaaaaaaaaaaaaaaaaaaaaaaaaaaaaaaaaaaaaaaaaaaaaaaaaaaaaaaaaaaaaaaaaaaaaaaaaaaaaaaaaaaaaaaaaaaaaaaaaaaaaaaaaaaaaaaaaaaaaaaaaaaaaaaaaaaaaaaaaaaaaaaaaaaaaaaaaaaaaaaaaaaaaaaaaaaaaaaaaaaaaaaaaaaaaaaaaaaaaaaaaaaaaaaaaaaaaaaaaaaaaaaaaaaaaaaaaaaaaaaaaaaaaaaaaaaaaaaaaaaaaaaaaaaaaaaaaaaaaaaaaaaaaaaaaaaaaaaaaaaaaaaaaaaaaaaaaaaaaaaaaaaaaaaaaaaaaaaaaaaaaaaaaaaaaaaaaaaaaaaaaaaaaaaaaaaaaaaaaaaaaaaaaaaaaaaaaaaaaaaaaaaaaaaaaaaaaaaaaaaaaaaaaaaaaaaaaaaaaaaaaaaaaaaaaaaaaaaaaaaaaaaaaaaaaaaaaaaaaaaaaaaaaaaaaaaaaaaaaaaaaaaaaaaaaaaaaaaaaaaaaaaaaaaaaaaaaaaaaaaaaaaaaaaaaaaaaaaaaaaaaaaaaaaaaaaaaaaaaaaaaaaaaaaaaaaaaaaaaaaaaaaaaaaaaaaaaaaaaaaaaaaaaaaaaaaaaaaaaaaaaaaaaaaaaaaaaaaaaaaaaaaaaaaaaaaaaaaaaaaaaaaaaaaaaaaaaaaaaaaaaaaaaaaaaaaaaaaaaaaaaaaaaaaaaaaaaaaaaaaaaaaaaaaaaaaaaaaaaaaaaaaaaaaaaaaaaaaaaaaaaaaaaaaaaaaaaaaaaaaaaaaaaaaaaaaaaaaaaaaaaaaaaaaaaaaaaaaaaaaaaaaaaaaaaaaaaaaaaaaaaaaaaaaaaaaaaaaaaaaaaaaaaaaaaaaaaaaaaaaaaaaaaaaaaaaaaaaaaaaaaaaaaaaaaaaaaaaaaaaaaaaaaaaaaaaaaaaaaaaaaaaaaaaaaaaaaaaaaaaaaaaaaaaaaaaaaaaaaaaaaaaaaaaaaaaaaaaaaaaaaaaaaaaaaaaaaaaaaaaaaaaaaaaaaaaaaaaaaaaaaaaaaaaaaaaaaaaaaaaaaaaaaaaaaaaaaaaaaaaaaaaaaaaaaaaaaaaaaaaaaaaaaaaaaaaaaaaaaaaaaaaaaaaaaaaaaaaaaaaaaaaaaaaaaaaaaaaaaaaaaaaaaaaaaaaaaaaaaaaaaaaaaaaaaaaaaaaaaaaaaaaaaaaaaaaaaaaaaaaaaaaaaaaaaaaaaaaaaaaaaaaaaaaaaaaaaaaaaaaaaaaaaaaaaaaaaaaaaaaaaaaaaaaaaaaaaaaaaaaaaaaaaaaaaaaaaaaaaaaaaaaaaaaaaaaaaaaaaaaaaaaaaaaaaaaaaaaaaaaaaaaaaaaaaaaaaaaaaaaaaaaaaaaaaaaaaaaaaaaaaaaaaaaaaaaaaaaaaaaaaaaaaaaaaaaaaaaaaaaaaaaaaaaaaaaaaaaaaaaaaaaaaaaaaaaaaaaaaaaaaaaaaaaaaaaaaaaaaaaaaaaaaaaaaaaaaaaaaaaaaaaaaaaaaaaaaaaaaaaaaaaaaaaaaaaaaaaaaaaaaaaaaaaaaaaaaaaaaaaaaaaaaaaaaaaaaaaaaaaaaaaaaaaaaaaaaaaaaaaaaaaaaaaaaaaaaaaaaaaaaaaaaaaaaaaaaaaaaaaaaaaaaaaaaaaaaaaaaaaaaaaaaaaaaaaaaaaaaaaaaaaaaaaaaaaaaaaaaaaaaaaaaaaaaaaaaaaaaaaaaaaaaaaaaaaaaaaaaaaaaaaaaaaaaaaaaaaaaaaaaaaaaaaaaaaaaaaaaaaaaaaaaaaaaaaaaaaaaaaaaaaaaaaaaaaaaaaaaaaaaaaaaaaaaaaaaaaaaaaaaaaaaaaaaaaaaaaaaaaaaaaaaaaaaaaaaaaaaaaaaaaaaaaaaaaaaaaaaaaaaaaaaaaaaaaaaaaaaaaaaaaaaaaaaaaaaaaaaaaaaaaaaaaaaaaaaaaaaaaaaaaaaaaaaaaaaaaaaaaaaaaaaaaaaaaaaaaaaaaaaaaaaaaaaaaaaaaaaaaaaaaaaaaaaaaaaaaaaaaaaaaaaaaaaaaaaaaaaaaaaaaaaaaaaaaaaaaaaaaaaaaaaaaaaaaaaaaaaaaaaaaaaaaaaaaaaaaaaaaaaaaaaaaaaaaaaaaaaaaaaaaaaaaaaaaaaaaaaaaaaaaaaaaaaaaaaaaaaaaaaaaaaaaaaaaaaaaaaaaaaaaaaaaaaaaaaaaaaaaaaaaaaaaaaaaaaaaaaaaaaaaaaaaaaaaaaaaaaaaaaaaaaaaaaaaaaaaaaaaaaaaaaaaaaaaaaaaaaaaaaaaaaaaaaaaaaaaaaaaaaaaaaaaaaaaaaaaaaaaaaaaaaaaaaaaaaaaaaaaaaaaaaaaaaaaaaaaaaaaaaaaaaaaaaaaaaaaaaaaaaaaaaaaaaaaaaaaaaaaaaaaaaaaaaaaaaaaaaaaaaaaaaaaaaaaaaaaaaaaaaaaaaaaaaaaaaaaaaaaaaaaaaaaaaaaaaaaaaaaaaaaaaaaaaaaaaaaaaaaaaaaaaaaaaaaaaaaaaaaaaaaaaaaaaaaaaaaaaaaaaaaaaaaaaaaaaaaaaaaaaaaaaaaaaaaaaaaaaaaaaaaaaaaaaaaaaaaaaaaaaaaaaaaaaaaaaaaaaaaaaaaaaaaaaaaaaaaaaaaaaaaaaaaaaaaaaaaaaaaaaaaaaaaaaaaaaaaaaaaaaaaaaaaaaaaaaaaaaaaaaaaaaaaaaaaaaaaaaaaaaaaaaaaaaaaaaaaaaaaaaaaaaaaaaaaaaaaaaaaaaaaaaaaaaaaaaaaaaaaaaaaaaaaaaaaaaaaaaaaaaaaaaaaaaaaaaaaaaaaaaaaaaaaaaaaaaaaaaaaaaaaaaaaaaaaaaaaaaaaaaaaaaaaaaaaaaaaaaaaaaaaaaaaaaaaaaaaaaaaaaaaaaaaaaaaaaaaaaaaaaaaaaaaaaaaaaaaaaaaaaaaaaaaaaaaaaaaaaaaaaaaaaaaaaaaaaaaaaaaaaaaaaaaaaaaaaaaaaaaaaaaaaaaaaaaaaaaaaaaaaaaaaaaaaaaaaaaaaaaaaaaaaaaaaaaaaaaaaaaaaaaaaaaaaaaaaaaaaaaaaaaaaaaaaaaaaaaaaaaaaaaaaaaaaaaaaaaaaaaaaaaaaaaaaaaaaaaaaaaaaaaaaaaaaaaaaaaaaaaaaaaaaaaaaaaaaaaaaaaaaaaaaaaaaaaaaaaaaaaaaaaaaaaaaaaaaaaaaaaaaaaaaaaaaaaaaaaaaaaaaaaaaaaaaaaaaaaaaaaaaaaaaaaaaaaaaaaaaaaaaaaaaaaaaaaaaaaaaaaaaaaaaaaaaaaaaaaaaaaaaaaaaaaaaaaaaaaaaaaaaaaaaaaaaaaaaaaaaaaaaaaaaaaaaaaaaaaaaaaaaaaaaaaaaaaaaaaaaaaaaaaaaaaaaaaaaaaaaaaaaaaaaaaaaaaaaaaaaaaaaaaaaaaaaaaaaaaaaaaaaaaaaaaaaaaaaaaaaaaaaaaaaaaaaaaaaaaaaaaaaaaaaaaaaaaaaaaaaaaaaaaaaaaaaaaaaaaaaaaaaaaaaaaaaaaaaaaaaaaaaaaaaaaaaaaaaaaaaaaaaaaaaaaaaaaaaaaaaaaaaaaaaaaaaaaaaaaaaaaaaaaaaaaaaaaaaaaaaaaaaaaaaaaaaaaaaaaaaaaaaaaaaaaaaaaaaaaaaaaaaaaaaaaaaaaaaaaaaaaaaaaaaaaaaaaaaaaaaaaaaaaaaaaaaaaaaaaaaaaaaaaaaaaaaaaaaaaaaaaaaaaaaaaaaaaaaaaaaaaaaaaaaaaaaaaaaaaaaaaaaaaaaaaaaaaaaaaaaaaaaaaaaaaaaaaaaaaaaaaaaaaaaaaaaaaaaaaaaaaaaaaaaaaaaaaaaaaaaaaaaaaaaaaaaaaaaaaaaaaaaaaaaaaaaaaaaaaaaaaaaaaaaaaaaaaaaaaaaaaaaaaaaaaaaaaaaaaaaaaaaaaaaaaaaaaaaaaaaaaaaaaaaaaaaaaaaaaaaaaaaaaaaaaaaaaaaaaaaaaaaaaaaaaaaaaaaaaaaaaaaaaaaaaaaaaaaaaaaaaaaaaaaaaaaaaaaaaaaaaaaaaaaaaaaaaaaaaaaaaaaaaaaaaaaaaaaaaaaaaaaaaaaaaaaaaaaaaaaaaaaaaaaaaaaaaaaaaaaaaaaaaaaaaaaaaaaaaaaaaaaaaaaaaaaaaaaaaaaaaaaaaaaaaaaaaaaaaaaaaaaaaaaaaaaaaaaaaaaaaaaaaaaaaaaaaaaaaaaaaaaaaaaaaaaaaaaaaaaaaaaaaaaaaaaaaaaaaaaaaaaaaaaaaaaaaaaaaaaaaaaaaaaaaaaaaaaaaaaaaaaaaaaaaaaaaaaaaaaaaaaaaaaaaaaaaaaaaaaaaaaaaaaaaaaaaaaaaaaaaaaaaaaaaaaaaaaaaaaaaaaaaaaaaaaaaaaaaaaaaaaaaaaaaaaaaaaaaaaaaaaaaaaaaaaaaaaaaaaaaaaaaaaaaaaaaaaaaaaaaaaaaaaaaaaaaaaaaaaaaaaaaaaaaaaaaaaaaaaaaaaaaaaaaaaaaaaaaaaaaaaaaaaaaaaaaaaaaaaaaaaaaaaaaaaaaaaaaaaaaaaaaaaaaaaaaaaaaaaaaaaaaaaaaaaaaaaaaaaaaaaaaaaaaaaaaaaaaaaaaaaaaaaaaaaaaaaaaaaaaaaaaaaaaaaaaaaaaaaaaaaaaaaaaaaaaaaaaaaaaaaaaaaaaaaaaaaaaaaaaaaaaaaaaaaaaaaaaaaaaaaaaaaaaaaaaaaaaaaaaaaaaaaaaaaaaaaaaaaaaaaaaaaaaaaaaaaaaaaaaaaaaaaaaaaaaaaaaaaaaaaaaaaaaaaaaaaaaaaaaaaaaaaaaaaaaaaaaaaaaaaaaaaaaaaaaaaaaaaaaaaaaaaaaaaaaaaaaaaaaaaaaaaaaaaaaaaaaaaaaaaaaaaaaaaaaaaaaaaaaaaaaaaaaaaaaaaaaaaaaaaaaaaaaaaaaaaaaaaaaaaaaaaaaaaaaaaaaaaaaaaaaaaaaaaaaaaaaaaaaaaaaaaaaaaaaaaaaaaaaaaaaaaaaaaaaaaaaaaaaaaaaaaaaaaaaaaaaaaaaaaaaaaaaaaaaaaaaaaaaaaaaaaaaaaaaaaaaaaaaaaaaaaaaaaaaaaaaaaaaaaaaaaaaaaaaaaaaaaaaaaaaaaaaaaaaaaaaaaaaaaaaaaaaaaaaaaaaaaaaaaaaaaaaaaaaaaaaaaaaaaaaaaaaaaaaaaaaaaaaaaaaaaaaaaaaaaaaaaaaaaaaaaaaaaaaaaaaaaaaaaaaaaaaaaaaaaaaaaaaaaaaaaaaaaaaaaaaaaaaaaaaaaaaaaaaaaaaaaaaaaaaaaaaaaaaaaaaaaaaaaaaaaaaaaaaaaaaaaaaaaaaaaaaaaaaaaaaaaaaaaaaaaaaaaaaaaaaaaaaaaaaaaaaaaaaaaaaaaaaaaaaaaaaaaaaaaaaaaaaaaaaaaaaaaaaaaaaaaaaaaaaaaaaaaaaaaaaaaaaaaaaaaaaaaaaaaaaaaaaaaaaaaaaaaaaaaaaaaaaaaaaaaaaaaaaaaaaaaaaaaaaaaaaaaaaaaaaaaaaaaaaaaaaaaaaaaaaaaaaaaaaaaaaaaaaaaaaaaaaaaaaaaaaaaaaaaaaaaaaaaaaaaaaaaaaaaaaaaaaaaaaaaaaaaaaaaaaaaaaaaaaaaaaaaaaaaaaaaaaaaaaaaaaaaaaaaaaaaaaaaaaaaaaaaaaaaaaaaaaaaaaaaaaaaaaaaaaaaaaaaaaaaaaaaaaaaaaaaaaaaaaaaaaaaaaaaaaaaaaaaaaaaaaaaaaaaaaaaaaaaaaaaaaaaaaaaaaaaaaaaaaaaaaaaaaaaaaaaaaaaaaaaaaaaaaaaaaaaaaaaaaaaaaaaaaaaaaaaaaaaaaaaaaaaaaaaaaaaaaaaaaaaaaaaaaaaaaaaaaaaaaaaaaaaaaaaaaaaaaaaaaaaaaaaaaaaaaaaaaaaaaaaaaaaaaaaaaaaaaaaaaaaaaaaaaaaaaaaaaaaaaaaaaaaaaaaaaaaaaaaaaaaaaaaaaaaaaaaaaaaaaaaaaaaaaaaaaaaaaaaaaaaaaaaaaaaaaaaaaaaaaaaaaaaaaaaaaaaaaaaaaaaaaaaaaaaaaaaaaaaaaaaaaaaaaaaaaaaaaaaaaaaaaaaaaaaaaaaaaaaaaaaaaaaaaaaaaaaaaaaaaaaaaaaaaaaaaaaaaaaaaaaaaaaaaaaaaaaaaaaaaaaaaaaaaaaaaaaaaaaaaaaaaaaaaaaaaaaaaaaaaaaaaaaaaaaaaaaaaaaaaaaaaaaaaaaaaaaaaaaaaaaaaaaaaaaaaaaaaaaaaaaaaaaaaaaaaaaaaaaaaaaaaaaaaaaaaaaaaaaaaaaaaaaaaaaaaaaaaaaaaaaaaaaaaaaaaaaaaaaaaaaaaaaaaaaaaaaaaaaaaaaaaaaaaaaaaaaaaaaaaaaaaaaaaaaaaaaaaaaaaaaaaaaaaaaaaaaaaaaaaaaaaaaaaaaaaaaaaaaaaaaaaaaaaaaaaaaaaaaaaaaaaaaaaaaaaaaaaaaaaaaaaaaaaaaaaaaaaaaaaaaaaaaaaaaaaaaaaaaaaaaaaaaaaaaaaaaaaaaaaaaaaaaaaaaaaaaaaaaaaaaaaaaaaaaaaaaaaaaaaaaaaaaaaaaaaaaaaaaaaaaaaaaaaaaaaaaaaaaaaaaaaaaaaaaaaaaaaaaaaaaaaaaaaaaaaaaaaaaaaaaaaaaaaaaaaaaaaaaaaaaaaaaaaaaaaaaaaaaaaaaaaaaaaaaaaaaaaaaaaaaaaaaaaaaaaaaaaaaaaaaaaaaaaaaaaaaaaaaaaaaaaaaaaaaaaaaaaaaaaaaaaaaaaaaaaaaaaaaaaaaaaaaaaaaaaaaaaaaaaaaaaaaaaaaaaaaaaaaaaaaaaaaaaaaaaaaaaaaaaaaaaaaaaaaaaaaaaaaaaaaaaaaaaaaaaaaaaaaaaaaaaaaaaaaaaaaaaaaaaaaaaaaaaaaaaaaaaaaaaaaaaaaaaaaaaaaaaaaaaaaaaaaaaaaaaaaaaaaaaaaaaaaaaaaaaaaaaaaaaaaaaaaaaaaaaaaaaaaaaaaaaaaaaaaaaaaaaaaaaaaaaaaaaaaaaaaaaaaaaaaaaaaaaaaaaaaaaaaaaaaaaaaaaaaaaaaaaaaaaaaaaaaaaaaaaaaaaaaaaaaaaaaaaaaaaaaaaaaaaaaaaaaaaaaaaaaaaaaaaaaaaaaaaaaaaaaaaaaaaaaaaaaaaaaaaaaaaaaaaaaaaaaaaaaaaaaaaaaaaaaaaaaaaaaaaaaaaaaaaaaaaaaaaaaaaaaaaaaaaaaaaaaaaaaaaaaaaaaaaaaaaaaaaaaaaaaaaaaaaaaaaaaaaaaaaaaaaaaaaaaaaaaaaaaaaaaaaaaaaaaaaaaaaaaaaaaaaaaaaaaaaaaaaaaaaaaaaaaaaaaaaaaaaaaaaaaaaaaaaaaaaaaaaaaaaaaaaaaaaaaaaaaaaaaaaaaaaaaaaaaaaaaaaaaaaaaaaaaaaaaaaaaaaaaaaaaaaaaaaaaaaaaaaaaaaaaaaaaaaaaaaaaaaaaaaaaaaaaaaaaaaaaaaaaaaaaaaaaaaaaaaaaaaaaaaaaaaaaaaaaaaaaaaaaaaaaaaaaaaaaaaaaaaaaaaaaaaaaaaaaaaaaaaaaaaaaaaaaaaaaaaaaaaaaaaaaaaaaaaaaaaaaaaaaaaaaaaaaaaaaaaaaaaaaaaaaaaaaaaaaaaaaaaaaaaaaaaaaaaaaaaaaaaaaaaaaaaaaaaaaaaaaaaaaaaaaaaaaaaaaaaaaaaaaaaaaaaaaaaaaaaaaaaaaaaaaaaaaaaaaaaaaaaaaaaaaaaaaaaaaaaaaaaaaaaaaaaaaaaaaaaaaaaaaaaaaaaaaaaaaaaaaaaaaaaaaaaaaaaaaaaaaaaaaaaaaaaaaaaaaaaaaaaaaaaaaaaaaaaaaaaaaaaaaaaaaaaaaaaaaaaaaaaaaaaaaaaaaaaaaaaaaaaaaaaaaaaaaaaaaaaaaaaaaaaaaaaaaaaaaaaaaaaaaaaaaaaaaaaaaaaaaaaaaaaaaaaaaaaaaaaaaaaaaaaaaaaaaaaaaaaaaaaaaaaaaaaaaaaaaaaaaaaaaaaaaaaaaaaaaaaaaaaaaaaaaaaaaaaaaaaaaaaaaaaaaaaaaaaaaaaaaaaaaaaaaaaaaaaaaaaaaaaaaaaaaaaaaaaaaaaaaaaaaaaaaaaaaaaaaaaaaaaaaaaaaaaaaaaaaaaaaaaaaaaaaaaaaaaaaaaaaaaaaaaaaaaaaaaaaaaaaaaaaaaaaaaaaaaaaaaaaaaaaaaaaaaaaaaaaaaaaaaaaaaaaaaaaaaaaaaaaaaaaaaaaaaaaaaaaaaaaaaaaaaaaaaaaaaaaaaaaaaaaaaaaaaaaaaaaaaaaaaaaaaaaaaaaaaaaaaaaaaaaaaaaaaaaaaaaaaaaaaaaaaaaaaaaaaaaaaaaaaaaaaaaaaaaaaaaaaaaaaaaaaaaaaaaaaaaaaaaaaaaaaaaaaaaaaaaaaaaaaaaaaaaaaaaaaaaaaaaaaaaaaaaaaaaaaaaaaaaaaaaaaaaaaaaaaaaaaaaaaaaaaaaaaaaaaaaaaaaaaaaaaaaaaaaaaaaaaaaaaaaaaaaaaaaaaaaaaaaaaaaaaaaaaaaaaaaaaaaaaaaaaaaaaaaaaaaaaaaaaaaaaaaaaaaaaaaaaaaaaaaaaaaaaaaaaaaaaaaaaaaaaaaaaaaaaaaaaaaaaaaaaaaaaaaaaaaaaaaaaaaaaaaaaaaaaaaaaaaaaaaaaaaaaaaaaaaaaaaaaaaaaaaaaaaaaaaaaaaaaaaaaaaaaaaaaaaaaaaaaaaaaaaaaaaaaaaaaaaaaaaaaaaaaaaaaaaaaaaaaaaaaaaaaaaaaaaaaaaaaaaaaaaaaaaaaaaaaaaaaaaaaaaaaaaaaaaaaaaaaaaaaaaaaaaaaaaaaaaaaaaaaaaaaaaaaaaaaaaaaaaaaaaaaaaaaaaaaaaaaaaaaaaaaaaaaaaaaaaaaaaaaaaaaaaaaaaaaaaaaaaaaaaaaaaaaaaaaaaaaaaaaaaaaaaaaaaaaaaaaaaaaaaaaaaaaaaaaaaaaaaaaaaaaaaaaaaaaaaaaaaaaaaaaaaaaaaaaaaaaaaaaaaaaaaaaaaaaaaaaaaaaaaaaaaaaaaaaaaaaaaaaaaaaaaaaaaaaaaaaaaaaaaaaaaaaaaaaaaaaaaaaaaaaaaaaaaaaaaaaaaaaaaaaaaaaaaaaaaaaaaaaaaaaaaaaaaaaaaaaaaaaaaaaaaaaaaaaaaaaaaaaaaaaaaaaaaaaaaaaaaaaaaaaaaaaaaaaaaaaaaaaaaaaaaaaaaaaaaaaaaaaaaaaaaaaaaaaaaaaaaaaaaaaaaaaaaaaaaaaaaaaaaaaaaaaaaaaaaaaaaaaaaaaaaaaaaaaaaaaaaaaaaaaaaaaaaaaaaaaaaaaaaaaaaaaaaaaaaaaaaaaaaaaaaaaaaaaaaaaaaaaaaaaaaaaaaaaaaaaaaaaaaaaaaaaaaaaaaaaaaaaaaaaaaaaaaaaaaaaaaaaaaaaaaaaaaaaaaaaaaaaaaaaaaaaaaaaaaaaaaaaaaaaaaaaaaaaaaaaaaaaaaaaaaaaaaaaaaaaaaaaaaaaaaaaaaaaaaaaaaaaaaaaaaaaaaaaaaaaaaaaaaaaaaaaaaaaaaaaaaaaaaaaaaaaaaaaaaaaaaaaaaaaaaaaaaaaaaaaaaaaaaaaaaaaaaaaaaaaaaaaaaaaaaaaaaaaaaaaaaaaaaaaaaaaaaaaaaaaaaaaaaaaaaaaaaaaaaaaaaaaaaaaaaaaaaaaaaaaaaaaaaaaaaaaaaaaaaaaaaaaaaaaaaaaaaaaaaaaaaaaaaaaaaaaaaaaaaaaaaaaaaaaaaaaaaaaaaaaaaaaaaaaaaaaaaaaaaaaaaaaaaaaaaaaaaaaaaaaaaaaaaaaaaaaaaaaaaaaaaaaaaaaaaaaaaaaaaaaaaaaaaaaaaaaaaaaaaaaaaaaaaaaaaaaaaaaaaaaaaaaaaaaaaaaaaaaaaaaaaaaaaaaaaaaaaaaaaaaaaaaaaaaaaaaaaaaaaaaaaaaaaaaaaaaaaaaaaaaaaaaaaaaaaaaaaaaaaaaaaaaaaaaaaaaaaaaaaaaaaaaaaaaaaaaaaaaaaaaaaaaaaaaaaaaaaaaaaaaaaaaaaaaaaaaaaaaaaaaaaaaaaaaaaaaaaaaaaaaaaaaaaaaaaaaaaaaaaaaaaaaaaaaaaaaaaaaaaaaaaaaaaaaaaaaaaaaaaaaaaaaaaaaaaaaaaaaaaaaaaaaaaaaaaaaaaaaaaaaaaaaaaaaaaaaaaaaaaaaaaaaaaaaaaaaaaaaaaaaaaaaaaaaaaaaaaaaaaaaaaaaaaaaaaaaaaaaaaaaaaaaaaaaaaaaaaaaaaaaaaaaaaaaaaaaaaaaaaaaaaaaaaaaaaaaaaaaaaaaaaaaaaaaaaaaaaaaaaaaaaaaaaaaaaaaaaaaaaaaaaaaaaaaaaaaaaaaaaaaaaaaaaaaaaaaaaaaaaaaaaaaaaaaaaaaaaaaaaaaaaaaaaaaaaaaaaaaaaaaaaaaaaaaaaaaaaaaaaaaaaaaaaaaaaaaaaaaaaaaaaaaaaaaaaaaaaaaaaaaaaaaaaaaaaaaaaaaaaaaaaaaaaaaaaaaaaaaaaaaaaaaaaaaaaaaaaaaaaaaaaaaaaaaaaaaaaaaaaaaaaaaaaaaaaaaaaaaaaaaaaaaaaaaaaaaaaaaaaaaaaaaaaaaaaaaaaaaaaaaaaaaaaaaaaaaaaaaaaaaaaaaaaaaaaaaaaaaaaaaaaaaaaaaaaaaaaaaaaaaaaaaaaaaaaaaaaaaaaaaaaaaaaaaaaaaaaaaaaaaaaaaaaaaaaaaaaaaaaaaaaaaaaaaaaaaaaaaaaaaaaaaaaaaaaaaaaaaaaaaaaaaaaaaaaaaaaaaaaaaaaaaaaaaaaaaaaaaaaaaaaaaaaaaaaaaaaaaaaaaaaaaaaaaaaaaaaaaaaaaaaaaaaaaaaaaaaaaaaaaaaaaaaaaaaaaaaaaaaaaaaaaaaaaaaaaaaaaaaaaaaaaaaaaaaaaaaaaaaaaaaaaaaaaaaaaaaaaaaaaaaaaaaaaaaaaaaaaaaaaaaaaaaaaaaaaaaaaaaaaaaaaaaaaaaaaaaaaaaaaaaaaaaaaaaaaaaaaaaaaaaaaaaaaaaaaaaaaaaaaaaaaaaaaaaaaaaaaaaaaaaaaaaaaaaaaaaaaaaaaaaaaaaaaaaaaaaaaaaaaaaaaaaaaaaaaaaaaaaaaaaaaaaaaaaaaaaaaaaaaaaaaaaaaaaaaaaaaaaaaaaaaaaaaaaaaaaaaaaaaaaaaaaaaaaaaaaaaaaaaaaaaaaaaaaaaaaaaaaaaaaaaaaaaaaaaaaaaaaaaaaaaaaaaaaaaaaaaaaaaaaaaaaaaaaaaaaaaaaaaaaaaaaaaaaaaaaaaaaaaaaaaaaaaaaaaaaaaaaaaaaaaaaaaaaaaaaaaaaaaaaaaaaaaaaaaaaaaaaaaaaaaaaaaaaaaaaaaaaaaaaaaaaaaaaaaaaaaaaaaaaaaaaaaaaaaaaaaaaaaaaaaaaaaaaaaaaaaaaaaaaaaaaaaaaaaaaaaaaaaaaaaaaaaaaaaaaaaaaaaaaaaaaaaaaaaaaaaaaaaaaaaaaaaaaaaaaaaaaaaaaaaaaaaaaaaaaaaaaaaaaaaaaaaaaaaaaaaaaaaaaaaaaaaaaaaaaaaaaaaaaaaaaaaaaaaaaaaaaaaaaaaaaaaaaaaaaaaaaaaaaaaaaaaaaaaaaaaaaaaaaaaaaaaaaaaaaaaaaaaaaaaaaaaaaaaaaaaaaaaaaaaaaaaaaaaaaaaaaaaaaaaaaaaaaaaaaaaaaaaaaaaaaaaaaaaaaaaaaaaaaaaaaaaaaaaaaaaaaaaaaaaaaaaaaaaaaaaaaaaaaaaaaaaaaaaaaaaaaaaaaaaaaaaaaaaaaaaaaaaaaaaaaaaaaaaaaaaaaaaaaaaaaaaaaaaaaaaaaaaaaaaaaaaaaaaaaaaaaaaaaaaaaaaaaaaaaaaaaaaaaaaaaaaaaaaaaaaaaaaaaaaaaaaaaaaaaaaaaaaaaaaaaaaaaaaaaaaaaaaaaaaaaaaaaaaaaaaaaaaaaaaaaaaaaaaaaaaaaaaaaaaaaaaaaaaaaaaaaaaaaaaaaaaaaaaaaaaaaaaaaaaaaaaaaaaaaaaaaaaaaaaaaaaaaaaaaaaaaaaaaaaaaaaaaaaaaaaaaaaaaaaaaaaaaaaaaaaaaaaaaaaaaaaaaaaaaaaaaaaaaaaaaaaaaaaaaaaaaaaaaaaaaaaaaaaaaaaaaaaaaaaaaaaaaaaaaaaaaaaaaaaaaaaaaaaaaaaaaaaaaaaaaaaaaaaaaaaaaaaaaaaaaaaaaaaaaaaaaaaaaaaaaaaaaaaaaaaaaaaaaaaaaaaaaaaaaaaaaaaaaaaaaaaaaaaaaaaaaaaaaaaaaaaaaaaaaaaaaaaaaaaaaaaaaaaaaaaaaaaaaaaaaaaaaaaaaaaaaaaaaaaaaaaaaaaaaaaaaaaaaaaaaaaaaaaaaaaaaaaaaaaaaaaaaaaaaaaaaaaaaaaaaaaaaaaaaaaaaaaaaaaaaaaaaaaaaaaaaaaaaaaaaaaaaaaaaaaaaaaaaaaaaaaaaaaaaaaaaaaaaaaaaaaaaaaaaaaaaaaaaaaaaaaaaaaaaaaaaaaaaaaaaaaaaaaaaaaaaaaaaaaaaaaaaaaaaaaaaaaaaaaaaaaaaaaaaaaaaaaaaaaaaaaaaaaaaaaaaaaaaaaaaaaaaaaaaaaaaaaaaaaaaaaaaaaaaaaaaaaaaaaaaaaaaaaaaaaaaaaaaaaaaaaaaaaaaaaaaaaaaaaaaaaaaaaaaaaaaaaaaaaaaaaaaaaaaaaaaaaaaaaaaaaaaaaaaaaaaaaaaaaaaaaaaaaaaaaaaaaaaaaaaaaaaaaaaaaaaaaaaaaaaaaaaaaaaaaaaaaaaaaaaaaaaaaaaaaaaaaaaaaaaaaaaaaaaaaaaaaaaaaaaaaaaaaaaaaaaaaaaaaaaaaaaaaaaaaaaaaaaaaaaaaaaaaaaaaaaaaaaaaaaaaaaaaaaaaaaaaaaaaaaaaaaaaaaaaaaaaaaaaaaaaaaaaaaaaaaaaaaaaaaaaaaaaaaaaaaaaaaaaaaaaaaaaaaaaaaaaaaaaaaaaaaaaaaaaaaaaaaaaaaaaaaaaaaaaaaaaaaaaaaaaaaaaaaaaaaaaaaaaaaaaaaaaaaaaaaaaaaaaaaaaaaaaaaaaaaaaaaaaaaaaaaaaaaaaaaaaaaaaaaaaaaaaaaaaaaaaaaaaaaaaaaaaaaaaaaaaaaaaaaaaaaaaaaaaaaaaaaaaaaaaaaaaaaaaaaaaaaaaaaaaaaaaaaaaaaaaaaaaaaaaaaaaaaaaaaaaaaaaaaaaaaaaaaaaaaaaaaaaaaaaaaaaaaaaaaaaaaaaaaaaaaaaaaaaaaaaaaaaaaaaaaaaaaaaaaaaaaaaaaaaaaaaaaaaaaaaaaaaaaaaaaaaaaaaaaaaaaaaaaaaaaaaaaaaaaaaaaaaaaaaaaaaaaaaaaaaaaaaaaaaaaaaaaaaaaaaaaaaaaaaaaaaaaaaaaaaaaaaaaaaaaaaaaaaaaaaaaaaaaaaaaaaaaaaaaaaaaaaaaaaaaaaaaaaaaaaaaaaaaaaaaaaaaaaaaaaaaaaaaaaaaaaaaaaaaaaaaaaaaaaaaaaaaaaaaaaaaaaaaaaaaaaaaaaaaaaaaaaaaaaaaaaaaaaaaaaaaaaaaaaaaaaaaaaaaaaaaaaaaaaaaaaaaaaaaaaaaaaaaaaaaaaaaaaaaaaaaaaaaaaaaaaaaaaaaaaaaaaaaaaaaaaaaaaaaaaaaaaaaaaaaaaaaaaaaaaaaaaaaaaaaaaaaaaaaaaaaaaaaaaaaaaaaaaaaaaaaaaaaaaaaaaaaaaaaaaaaaaaaaaaaaaaaaaaaaaaaaaaaaaaaaaaaaaaaaaaaaaaaaaaaaaaaaaaaaaaaaaaaaaaaaaaaaaaaaaaaaaaaaaaaaaaaaaaaaaaaaaaaaaaaaaaaaaaaaaaaaaaaaaaaaaaaaaaaaaaaaaaaaaaaaaaaaaaaaaaaaaaaaaaaaaaaaaaaaaaaaaaaaaaaaaaaaaaaaaaaaaaaaaaaaaaaaaaaaaaaaaaaaaaaaaaaaaaaaaaaaaaaaaaaaaaaaaaaaaaaaaaaaaaaaaaaaaaaaaaaaaaaaaaaaaaaaaaaaaaaaaaaaaaaaaaaaaaaaaaaaaaaaaaaaaaaaaaaaaaaaaaaaaaaaaaaaaaaaaaaaaaaaaaaaaaaaaaaaaaaaaaaaaaaaaaaaaaaaaaaaaaaaaaaaaaaaaaaaaaaaaaaaaaaaaaaaaaaaaaaaaaaaaaaaaaaaaaaaaaaaaaaaaaaaaaaaaaaaaaaaaaaaaaaaaaaaaaaaaaaaaaaaaaaaaaaaaaaaaaaaaaaaaaaaaaaaaaaaaaaaaaaaaaaaaaaaaaaaaaaaaaaaaaaaaaaaaaaaaaaaaaaaaaaaaaaaaaaaaaaaaaaaaaaaaaaaaaaaaaaaaaaaaaaaaaaaaaaaaaaaaaaaaaaaaaaaaaaaaaaaaaaaaaaaaaaaaaaaaaaaaaaaaaaaaaaaaaaaaaaaaaaaaaaaaaaaaaaaaaaaaaaaaaaaaaaaaaaaaaaaaaaaaaaaaaaaaaaaaaaaaaaaaaaaaaaaaaaaaaaaaaaaaaaaaaaaaaaaaaaaaaaaaaaaaaaaaaaaaaaaaaaaaaaaaaaaaaaaaaaaaaaaaaaaaaaaaaaaaaaaaaaaaaaaaaaaaaaaaaaaaaaaaaaaaaaaaaaaaaaaaaaaaaaaaaaaaaaaaaaaaaaaaaaaaaaaaaaaaaaaaaaaaaaaaaaaaaaaaaaaaaaaaaaaaaaaaaaaaaaaaaaaaaaaaaaaaaaaaaaaaaaaaaaaaaaaaaaaaaaaaaaaaaaaaaaaaaaaaaaaaaaaaaaaaaaaaaaaaaaaaaaaaaaaaaaaaaaaaaaaaaaaaaaaaaaaaaaaaaaaaaaaaaaaaaaaaaaaaaaaaaaaaaaaaaaaaaaaaaaaaaaaaaaaaaaaaaaaaaaaaaaaaaaaaaaaaaaaaaaaaaaaaaaaaaaaaaaaaaaaaaaaaaaaaaaaaaaaaaaaaaaaaaaaaaaaaaaaaaaaaaaaaaaaaaaaaaaaaaaaaaaaaaaaaaaaaaaaaaaaaaaaaaaaaaaaaaaaaaaaaaaaaaaaaaaaaaaaaaaaaaaaaaaaaaaaaaaaaaaaaaaaaaaaaaaaaaaaaaaaaaaaaaaaaaaaaaaaaaaaaaaaaaaaaaaaaaaaaaaaaaaaaaaaaaaaaaaaaaaaaaaaaaaaaaaaaaaaaaaaaaaaaaaaaaaaaaaaaaaaaaaaaaaaaaaaaaaaaaaaaaaaaaaaaaaaaaaaaaaaaaaaaaaaaaaaaaaaaaaaaaaaaaaaaaaaaaaaaaaaaaaaaaaaaaaaaaaaaaaaaaaaaaaaaaaaaaaaaaaaaaaaaaaaaaaaaaaaaaaaaaaaaaaaaaaaaaaaaaaaaaaaaaaaaaaaaaaaaaaaaaaaaaaaaaaaaaaaaaaaaaaaaaaaaaaaaaaaaaaaaaaaaaaaaaaaaaaaaaaaaaaaaaaaaaaaaaaaaaaaaaaaaaaaaaaaaaaaaaaaaaaaaaaaaaaaaaaaaaaaaaaaaaaaaaaaaaaaaaaaaaaaaaaaaaaaaaaaaaaaaaaaaaaaaaaaaaaaaaaaaaaaaaaaaaaaaaaaaaaaaaaaaaaaaaaaaaaaaaaaaaaaaaaaaaaaaaaaaaaaaaaaaaaaaaaaaaaaaaaaaaaaaaaaaaaaaaaaaaaaaaaaaaaaaaaaaaaaaaaaaaaaaaaaaaaaaaaaaaaaaaaaaaaaaaaaaaaaaaaaaaaaaaaaaaaaaaaaaaaaaaaaaaaaaaaaaaaaaaaaaaaaaaaaaaaaaaaaaaaaaaaaaaaaaaaaaaaaaaaaaaaaaaaaaaaaaaaaaaaaaaaaaaaaaaaaaaaaaaaaaaaaaaaaaaaaaaaaaaaaaaaaaaaaaaaaaaaaaaaaaaaaaaaaaaaaaaaaaaaaaaaaaaaaaaaaaaaaaaaaaaaaaaaaaaaaaaaaaaaaaaaaaaaaaaaaaaaaaaaaaaaaaaaaaaaaaaaaaaaaaaaaaaaaaaaaaaaaaaaaaaaaaaaaaaaaaaaaaaaaaaaaaaaaaaaaaaaaaaaaaaaaaaaaaaaaaaaaaaaaaaaaaaaaaaaaaaaaaaaaaaaaaaaaaaaaaaaaaaaaaaaaaaaaaaaaaaaaaaaaaaaaaaaaaaaaaaaaaaaaaaaaaaaaaaaaaaaaaaaaaaaaaaaaaaaaaaaaaaaaaaaaaaaaaaaaaaaaaaaaaaaaaaaaaaaaaaaaaaaaaaaaaaaaaaaaaaaaaaaaaaaaaaaaaaaaaaaaaaaaaaaaaaaaaaaaaaaaaaaaaaaaaaaaaaaaaaaaaaaaaaaaaaaaaaaaaaaaaaaaaaaaaaaaaaaaaaaaaaaaaaaaaaaaaaaaaaaaaaaaaaaaaaaaaaaaaaaaaaaaaaaaaaaaaaaaaaaaaaaaaaaaaaaaaaaaaaaaaaaaaaaaaaaaaaaaaaaaaaaaaaaaaaaaaaaaaaaaaaaaaaaaaaaaaaaaaaaaaaaaaaaaaaaaaaaaaaaaaaaaaaaaaaaaaaaaaaaaaaaaaaaaaaaaaaaaaaaaaaaaaaaaaaaaaaaaaaaaaaaaaaaaaaaaaaaaaaaaaaaaaaaaaaaaaaaaaaaaaaaaaaaaaaaaaaaaaaaaaaaaaaaaaaaaaaaaaaaaaaaaaaaaaaaaaaaaaaaaaaaaaaaaaaaaaaaaaaaaaaaaaaaaaaaaaaaaaaaaaaaaaaaaaaaaaaaaaaaaaaaaaaaaaaaaaaaaaaaaaaaaaaaaaaaaaaaaaaaaaaaaaaaaaaaaaaaaaaaaaaaaaaaaaaaaaaaaaaaaaaaaaaaaaaaaaaaaaaaaaaaaaaaaaaaaaaaaaaaaaaaaaaaaaaaaaaaaaaaaaaaaaaaaaaaaaaaaaaaaaaaaaaaaaaaaaaaaaaaaaaaaaaaaaaaaaaaaaaaaaaaaaaaaaaaaaaaaaaaaaaaaaaaaaaaaaaaaaaaaaaaaaaaaaaaaaaaaaaaaaaaaaaaaaaaaaaaaaaaaaaaaaaaaaaaaaaaaaaaaaaaaaaaaaaaaaaaaaaaaaaaaaaaaaaaaaaaaaaaaaaaaaaaaaaaaaaaaaaaaaaaaaaaaaaaaaaaaaaaaaaaaaaaaaaaaaaaaaaaaaaaaaaaaaaaaaaaaaaaaaaaaaaaaaaaaaaaaaaaaaaaaaaaaaaaaaaaaaaaaaaaaaaaaaaaaaaaaaaaaaaaaaaaaaaaaaaaaaaaaaaaaaaaaaaaaaaaaaaaaaaaaaaaaaaaaaaaaaaaaaaaaaaaaaaaaaaaaaaaaaaaaaaaaaaaaaaaaaaaaaaaaaaaaaaaaaaaaaaaaaaaaaaaaaaaaaaaaaaaaaaaaaaaaaaaaaaaaaaaaaaaaaaaaaaaaaaaaaaaaaaaaaaaaaaaaaaaaaaaaaaaaaaaaaaaaaaaaaaaaaaaaaaaaaaaaaaaaaaaaaaaaaaaaaaaaaaaaaaaaaaaaaaaaaaaaaaaaaaaaaaaaaaaaaaaaaaaaaaaaaaaaaaaaaaaaaaaaaaaaaaaaaaaaaaaaaaaaaaaaaaaaaaaaaaaaaaaaaaaaaaaaaaaaaaaaaaaaaaaaaaaaaaaaaaaaaaaaaaaaaaaaaaaaaaaaaaaaaaaaaaaaaaaaaaaaaaaaaaaaaaaaaaaaaaaaaaaaaaaaaaaaaaaaaaaaaaaaaaaaaaaaaaaaaaaaaaaaaaaaaaaaaaaaaaaaaaaaaaaaaaaaaaaaaaaaaaaaaaaaaaaaaaaaaaaaaaaaaaaaaaaaaaaaaaaaaaaaaaaaaaaaaaaaaaaaaaaaaaaaaaaaaaaaaaaaaaaaaaaaaaaaaaaaaaaaaaaaaaaaaaaaaaaaaaaaaaaaaaaaaaaaaaaaaaaaaaaaaaaaaaaaaaaaaaaaaaaaaaaaaaaaaaaaaaaaaaaaaaaaaaaaaaaaaaaaaaaaaaaaaaaaaaaaaaaaaaaaaaaaaaaaaaaaaaaaaaaaaaaaaaaaaaaaaaaaaaaaaaaaaaaaaaaaaaaaaaaaaaaaaaaaaaaaaaaaaaaaaaaaaaaaaaaaaaaaaaaaaaaaaaaaaaaaaaaaaaaaaaaaaaaaaaaaaaaaaaaaaaaaaaaaaaaaaaaaaaaaaaaaaaaaaaaaaaaaaaaaaaaaaaaaaaaaaaaaaaaaaaaaaaaaaaaaaaaaaaaaaaaaaaaaaaaaaaaaaaaaaaaaaaaaaaaaaaaaaaaaaaaaaaaaaaaaaaaaaaaaaaaaaaaaaaaaaaaaaaaaaaaaaaaaaaaaaaaaaaaaaaaaaaaaaaaaaaaaaaaaaaaaaaaaaaaaaaaaaaaaaaaaaaaaaaaaaaaaaaaaaaaaaaaaaaaaaaaaaaaaaaaaaaaaaaaaaaaaaaaaaaaaaaaaaaaaaaaaaaaaaaaaaaaaaaaaaaaaaaaaaaaaaaaaaaaaaaaaaaaaaaaaaaaaaaaaaaaaaaaaaaaaaaaaaaaaaaaaaaaaaaaaaaaaaaaaaaaaaaaaaaaaaaaaaaaaaaaaaaaaaaaaaaaaaaaaaaaaaaaaaaaaaaaaaaaaaaaaaaaaaaaaaaaaaaaaaaaaaaaaaaaaaaaaaaaaaaaaaaaaaaaaaaaaaaaaaaaaaaaaaaaaaaaaaaaaaaaaaaaaaaaaaaaaaaaaaaaaaaaaaaaaaaaaaaaaaaaaaaaaaaaaaaaaaaaaaaaaaaaaaaaaaaaaaaaaaaaaaaaaaaaaaaaaaaaaaaaaaaaaaaaaaaaaaaaaaaaaaaaaaaaaaaaaaaaaaaaaaaaaaaaaaaaaaaaaaaaaaaaaaaaaaaaaaaaaaaaaaaaaaaaaaaaaaaaaaaaaaaaaaaaaaaaaaaaaaaaaaaaaaaaaaaaaaaaaaaaaaaaaaaaaaaaaaaaaaaaaaaaaaaaaaaaaaaaaaaaaaaaaaaaaaaaaaaaaaaaaaaaaaaaaaaaaaaaaaaaaaaaaaaaaaaaaaaaaaaaaaaaaaaaaaaaaaaaaaaaaaaaaaaaaaaaaaaaaaaaaaaaaaaaaaaaaaaaaaaaaaaaaaaaaaaaaaaaaaaaaaaaaaaaaaaaaaaaaaaaaaaaaaaaaaaaaaaaaaaaaaaaaaaaaaaaaaaaaaaaaaaaaaaaaaaaaaaaaaaaaaaaaaaaaaaaaaaaaaaaaaaaaaaaaaaaaaaaaaaaaaaaaaaaaaaaaaaaaaaaaaaaaaaaaaaaaaaaaaaaaaaaaaaaaaaaaaaaaaaaaaaaaaaaaaaaaaaaaaaaaaaaaaaaaaaaaaaaaaaaaaaaaaaaaaaaaaaaaaaaaaaaaaaaaaaaaaaaaaaaaaaaaaaaaaaaaaaaaaaaaaaaaaaaaaaaaaaaaaaaaaaaaaaaaaaaaaaaaaaaaaaaaaaaaaaaaaaaaaaaaaaaaaaaaaaaaaaaaaaaaaaaaaaaaaaaaaaaaaaaaaaaaaaaaaaaaaaaaaaaaaaaaaaaaaaaaaaaaaaaaaaaaaaaaaaaaaaaaaaaaaaaaaaaaaaaaaaaaaaaaaaaaaaaaaaaaaaaaaaaaaaaaaaaaaaaaaaaaaaaaaaaaaaaaaaaaaaaaaaaaaaaaaaaaaaaaaaaaaaaaaaaaaaaaaaaaaaaaaaaaaaaaaaaaaaaaaaaaaaaaaaaaaaaaaaaaaaaaaaaaaaaaaaaaaaaaaaaaaaaaaaaaaaaaaaaaaaaaaaaaaaaaaaaaaaaaaaaaaaaaaaaaaaaaaaaaaaaaaaaaaaaaaaaaaaaaaaaaaaaaaaaaaaaaaaaaaaaaaaaaaaaaaaaaaaaaaaaaaaaaaaaaaaaaaaaaaaaaaaaaaaaaaaaaaaaaaaaaaaaaaaaaaaaaaaaaaaaaaaaaaaaaaaaaaaaaaaaaaaaaaaaaaaaaaaaaaaaaaaaaaaaaaaaaaaaaaaaaaaaaaaaaaaaaaaaaaaaaaaaaaaaaaaaaaaaaaaaaaaaaaaaaaaaaaaaaaaaaaaaaaaaaaaaaaaaaaaaaaaaaaaaaaaaaaaaaaaaaaaaaaaaaaaaaaaaaaaaaaaaaaaaaaaaaaaaaaaaaaaaaaaaaaaaaaaaaaaaaaaaaaaaaaaaaaaaaaaaaaaaaaaaaaaaaaaaaaaaaaaaaaaaaaaaaaaaaaaaaaaaaaaaaaaaaaaaaaaaaaaaaaaaaaaaaaaaaaaaaaaaaaaaaaaaaaaaaaaaaaaaaaaaaaaaaaaaaaaaaaaaaaaaaaaaaaaaaaaaaaaaaaaaaaaaaaaaaaaaaaaaaaaaaaaaaaaaaaaaaaaaaaaaaaaaaaaaaaaaaaaaaaaaaaaaaaaaaaaaaaaaaaaaaaaaaaaaaaaaaaaaaaaaaaaaaaaaaaaaaaaaaaaaaaaaaaaaaaaaaaaaaaaaaaaaaaaaaaaaaaaaaaaaaaaaaaaaaaaaaaaaaaaaaaaaaaaaaaaaaaaaaaaaaaaaaaaaaaaaaaaaaaaaaaaaaaaaaaaaaaaaaaaaaaaaaaaaaaaaaaaaaaaaaaaaaaaaaaaaaaaaaaaaaaaaaaaaaaaaaaaaaaaaaaaaaaaaaaaaaaaaaaaaaaaaaaaaaaaaaaaaaaaaaaaaaaaaaaaaaaaaaaaaaaaaaaaaaaaaaaaaaaaaaaaaaaaaaaaaaaaaaaaaaaaaaaaaaaaaaaaaaaaaaaaaaaaaaaaaaaaaaaaaaaaaaaaaaaaaaaaaaaaaaaaaaaaaaaaaaaaaaaaaaaaaaaaaaaaaaaaaaaaaaaaaaaaaaaaaaaaaaaaaaaaaaaaaaaaaaaaaaaaaaaaaaaaaaaaaaaaaaaaaaaaaaaaaaaaaaaaaaaaaaaaaaaaaaaaaaaaaaaaaaaaaaaaaaaaaaaaaaaaaaaaaaaaaaaaaaaaaaaaaaaaaaaaaaaaaaaaaaaaaaaaaaaaaaaaaaaaaaaaaaaaaaaaaaaaaaaaaaaaaaaaaaaaaaaaaaaaaaaaaaaaaaaaaaaaaaaaaaaaaaaaaaaaaaaaaaaaaaaaaaaaaaaaaaaaaaaaaaaaaaaaaaaaaaaaaaaaaaaaaaaaaaaaaaaaaaaaaaaaaaaaaaaaaaaaaaaaaaaaaaaaaaaaaaaaaaaaaaaaaaaaaaaaaaaaaaaaaaaaaaaaaaaaaaaaaaaaaaaaaaaaaaaaaaaaaaaaaaaaaaaaaaaaaaaaaaaaaaaaaaaaaaaaaaaaaaaaaaaaaaaaaaaaaaaaaaaaaaaaaaaaaaaaaaaaaaaaaaaaaaaaaaaaaaaaaaaaaaaaaaaaaaaaaaaaaaaaaaaaaaaaaaaaaaaaaaaaaaaaaaaaaaaaaaaaaaaaaaaaaaaaaaaaaaaaaaaaaaaaaaaaaaaaaaaaaaaaaaaaaaaaaaaaaaaaaaaaaaaaaaaaaaaaaaaaaaaaaaaaaaaaaaaaaaaaaaaaaaaaaaaaaaaaaaaaaaaaaaaaaaaaaaaaaaaaaaaaaaaaaaaaaaaaaaaaaaaaaaaaaaaaaaaaaaaaaaaaaaaaaaaaaaaaaaaaaaaaaaaaaaaaaaaaaaaaaaaaaaaaaaaaaaaaaaaaaaaaaaaaaaaaaaaaaaaaaaaaaaaaaaaaaaaaaaaaaaaaaaaaaaaaaaaaaaaaaaaaaaaaaaaaaaaaaaaaaaaaaaaaaaaaaaaaaaaaaaaaaaaaaaaaaaaaaaaaaaaaaaaaaaaaaaaaaaaaaaaaaaaaaaaaaaaaaaaaaaaaaaaaaaaaaaaaaaaaaaaaaaaaaaaaaaaaaaaaaaaaaaaaaaaaaaaaaaaaaaaaaaaaaaaaaaaaaaaaaaaaaaaaaaaaaaaaaaaaaaaaaaaaaaaaaaaaaaaaaaaaaaaaaaaaaaaaaaaaaaaaaaaaaaaaaaaaaaaaaaaaaaaaaaaaaaaaaaaaaaaaaaaaaaaaaaaaaaaaaaaaaaaaaaaaaaaaaaaaaaaaaaaaaaaaaaaaaaaaaaaaaaaaaaaaaaaaaaaaaaaaaaaaaaaaaaaaaaaaaaaaaaaaaaaaaaaaaaaaaaaaaaaaaaaaaaaaaaaaaaaaaaaaaaaaaaaaaaaaaaaaaaaaaaaaaaaaaaaaaaaaaaaaaaaaaaaaaaaaaaaaaaaaaaaaaaaaaaaaaaaaaaaaaaaaaaaaaaaaaaaaaaaaaaaaaaaaaaaaaaaaaaaaaaaaaaaaaaaaaaaaaaaaaaaaaaaaaaaaaaaaaaaaaaaaaaaaaaaaaaaaaaaaaaaaaaaaaaaaaaaaaaaaaaaaaaaaaaaaaaaaaaaaaaaaaaaaaaaaaaaaaaaaaaaaaaaaaaaaaaaaaaaaaaaaaaaaaaaaaaaaaaaaaaaaaaaaaaaaaaaaaaaaaaaaaaaaaaaaaaaaaaaaaaaaaaaaaaaaaaaaaaaaaaaaaaaaaaaaaaaaaaaaaaaaaaaaaaaaaaaaaaaaaaaaaaaaaaaaaaaaaaaaaaaaaaaaaaaaaaaaaaaaaaaaaaaaaaaaaaaaaaaaaaaaaaaaaaaaaaaaaaaaaaaaaaaaaaaaaaaaaaaaaaaaaaaaaaaaaaaaaaaaaaaaaaaaaaaaaaaaaaaaaaaaaaaaaaaaaaaaaaaaaaaaaaaaaaaaaaaaaaaaaaaaaaaaaaaaaaaaaaaaaaaaaaaaaaaaaaaaaaaaaaaaaaaaaaaaaaaaaaaaaaaaaaaaaaaaaaaaaaaaaaaaaaaaaaaaaaaaaaaaaaaaaaaaaaaaaaaaaaaaaaaaaaaaaaaaaaaaaaaaaaaaaaaaaaaaaaaaaaaaaaaaaaaaaaaaaaaaaaaaaaaaaaaaaaaaaaaaaaaaaaaaaaaaaaaaaaaaaaaaaaaaaaaaaaaaaaaaaaaa": 123}
CREATE TABLE auxtbl(ts TIMESTAMP);
INSERT INTO auxtbl VALUES ('2015-02-24 18:52:00');
INSERT INTO t1(j) VALUES ('');
ERROR 22032: Invalid JSON text: "Text only contains white space(s)" at position 0 in value (or column) ''.
INSERT INTO t1(j) VALUES ('[');
ERROR 22032: Invalid JSON text: "Expect a value here." at position 1 in value (or column) '['.
INSERT INTO t1(j) VALUES (x'cafebabe');
ERROR 22032: Cannot create a JSON value from a string with CHARACTER SET 'binary'.
INSERT INTO t1(j) VALUES (ST_GeomFromText('POINT(1 1)'));
ERROR 22032: Cannot create a JSON value from a string with CHARACTER SET 'binary'.
INSERT INTO t1(j) VALUES (-1);
ERROR 22032: Invalid JSON text: "not a JSON text, may need CAST" at position 0 in value (or column) 'column t1.j'.
INSERT INTO t1(j) VALUES (CAST(1 AS UNSIGNED));
ERROR 22032: Invalid JSON text: "not a JSON text, may need CAST" at position 0 in value (or column) 'column t1.j'.
INSERT INTO t1(j) VALUES (3.14);
ERROR 22032: Invalid JSON text: "not a JSON text, may need CAST" at position 0 in value (or column) 'column t1.j'.
INSERT INTO t1(j) VALUES (3.14E30);
ERROR 22032: Invalid JSON text: "not a JSON text, may need CAST" at position 0 in value (or column) 'column t1.j'.
INSERT INTO t1(j) VALUES (PI());
ERROR 22032: Invalid JSON text: "not a JSON text, may need CAST" at position 0 in value (or column) 'column t1.j'.
INSERT INTO t1(j) select ts from auxtbl;
ERROR 22032: Invalid JSON text: "Nothing should follow the root object or array." at position 4 in value (or column) '2015-02-24 18:52:00'.
DROP TABLE auxtbl;
INSERT INTO t1(j) VALUES (CAST('15:52:00' as TIME));
ERROR 22032: Invalid JSON text: "not a JSON text, may need CAST" at position 0 in value (or column) 'column t1.j'.
INSERT INTO t1(j) VALUES (CAST('2015-02-24' as DATE));
ERROR 22032: Invalid JSON text: "not a JSON text, may need CAST" at position 0 in value (or column) 'column t1.j'.
INSERT INTO t1(j) VALUES (TIMESTAMP '2015-02-24 15:52:00');
ERROR 22032: Invalid JSON text: "not a JSON text, may need CAST" at position 0 in value (or column) 'column t1.j'.
CREATE INDEX t1_idx_j ON t1(j);
ERROR 42000: JSON column 'j' cannot be used in key specification.
CREATE INDEX t1_idx_i_j ON t1(i, j);
ERROR 42000: JSON column 'j' cannot be used in key specification.
CREATE INDEX t1_idx_j_i ON t1(j, i);
ERROR 42000: JSON column 'j' cannot be used in key specification.
CREATE INDEX t1_idx_i ON t1(i);
DROP INDEX t1_idx_i ON t1;
CREATE TABLE t2(i INT, j JSON);
INSERT INTO t2 SELECT i, j FROM t1;
SELECT i, LENGTH(j) FROM t2 ORDER BY i;
i	LENGTH(j)
0	NULL
1	8
2	6
3	51
4	28
5	15
6	4
7	5
8	4
9	2
10	1
11	5
12	5
13	6
14	6
15	10
16	10
17	11
18	11
19	20
20	21
21	4
22	2
23	2
24	28
25	17
26	12
27	28
28	53
29	2
100	65544
DROP TABLE t2;
CREATE TABLE json(json int);
INSERT INTO json(json) VALUES (1);
SELECT json FROM json;
json
1
DROP TABLE json;
#
# Test of JSON comparator.
#
SELECT i,
(j = '"scalar string"') AS c1,
(j = 'scalar string') AS c2,
(j = CAST('"scalar string"' AS JSON)) AS c3,
(j = CAST(CAST(j AS CHAR CHARACTER SET 'utf8mb4') AS JSON)) AS c4,
(j = CAST(NULL AS JSON)) AS c5,
(j = NULL) AS c6,
(j <=> NULL) AS c7,
(j <=> CAST(NULL AS JSON)) AS c8,
(j IN (-1, 2, 32768, 3.14)) AS c9,
(j IN (CAST('[1, 2]' AS JSON), CAST('{}' AS JSON), CAST(3.14 AS JSON)))
AS c10,
(j = (SELECT j FROM t1 WHERE j = CAST('null' AS JSON))) AS c11,
(j = (SELECT j FROM t1 WHERE j IS NULL)) AS c12,
(j = (SELECT j FROM t1 WHERE 1<>1)) AS c13,
(j = DATE'2015-01-15') AS c14,
(j = TIME'23:24:25') AS c15,
(j = TIMESTAMP'2015-01-15 23:24:25') AS c16,
(j = CURRENT_TIMESTAMP) AS c17,
(j = ST_GeomFromText('POINT(1 1)')) AS c18,
(JSN_EXTRACT(j, '$.a') = 2) AS c19
FROM t1
ORDER BY i;
i	c1	c2	c3	c4	c5	c6	c7	c8	c9	c10	c11	c12	c13	c14	c15	c16	c17	c18	c19
0	NULL	NULL	NULL	NULL	NULL	NULL	1	1	NULL	NULL	NULL	NULL	NULL	NULL	NULL	NULL	NULL	NULL	NULL
1	0	0	0	1	NULL	NULL	0	0	0	0	0	NULL	NULL	0	0	0	0	0	1
2	0	0	0	1	NULL	NULL	0	0	0	1	0	NULL	NULL	0	0	0	0	0	NULL
3	0	0	0	1	NULL	NULL	0	0	0	0	0	NULL	NULL	0	0	0	0	0	0
4	0	0	0	1	NULL	NULL	0	0	0	0	0	NULL	NULL	0	0	0	0	0	NULL
5	0	1	1	1	NULL	NULL	0	0	0	0	0	NULL	NULL	0	0	0	0	0	NULL
6	0	0	0	1	NULL	NULL	0	0	0	0	0	NULL	NULL	0	0	0	0	0	NULL
7	0	0	0	1	NULL	NULL	0	0	0	0	0	NULL	NULL	0	0	0	0	0	NULL
8	0	0	0	1	NULL	NULL	0	0	0	0	1	NULL	NULL	0	0	0	0	0	NULL
9	0	0	0	1	NULL	NULL	0	0	1	0	0	NULL	NULL	0	0	0	0	0	NULL
10	0	0	0	1	NULL	NULL	0	0	0	0	0	NULL	NULL	0	0	0	0	0	NULL
11	0	0	0	1	NULL	NULL	0	0	0	0	0	NULL	NULL	0	0	0	0	0	NULL
12	0	0	0	1	NULL	NULL	0	0	1	0	0	NULL	NULL	0	0	0	0	0	NULL
13	0	0	0	1	NULL	NULL	0	0	0	0	0	NULL	NULL	0	0	0	0	0	NULL
14	0	0	0	1	NULL	NULL	0	0	0	0	0	NULL	NULL	0	0	0	0	0	NULL
15	0	0	0	1	NULL	NULL	0	0	0	0	0	NULL	NULL	0	0	0	0	0	NULL
16	0	0	0	1	NULL	NULL	0	0	0	0	0	NULL	NULL	0	0	0	0	0	NULL
17	0	0	0	1	NULL	NULL	0	0	0	0	0	NULL	NULL	0	0	0	0	0	NULL
18	0	0	0	1	NULL	NULL	0	0	0	0	0	NULL	NULL	0	0	0	0	0	NULL
19	0	0	0	1	NULL	NULL	0	0	0	0	0	NULL	NULL	0	0	0	0	0	NULL
20	0	0	0	1	NULL	NULL	0	0	0	0	0	NULL	NULL	0	0	0	0	0	NULL
21	0	0	0	1	NULL	NULL	0	0	1	1	0	NULL	NULL	0	0	0	0	0	NULL
22	0	0	0	1	NULL	NULL	0	0	0	1	0	NULL	NULL	0	0	0	0	0	NULL
23	0	0	0	1	NULL	NULL	0	0	0	0	0	NULL	NULL	0	0	0	0	0	NULL
24	0	0	0	0	NULL	NULL	0	0	0	0	0	NULL	NULL	0	0	1	0	0	NULL
25	0	0	0	0	NULL	NULL	0	0	0	0	0	NULL	NULL	0	1	0	0	0	NULL
26	0	0	0	0	NULL	NULL	0	0	0	0	0	NULL	NULL	1	0	0	0	0	NULL
27	0	0	0	0	NULL	NULL	0	0	0	0	0	NULL	NULL	0	0	1	0	0	NULL
28	0	0	0	0	NULL	NULL	0	0	0	0	0	NULL	NULL	0	0	0	0	1	NULL
29	0	0	0	1	NULL	NULL	0	0	0	0	0	NULL	NULL	0	0	0	0	0	NULL
100	0	0	0	1	NULL	NULL	0	0	0	0	0	NULL	NULL	0	0	0	0	0	NULL
Warnings:
Warning	1292	Truncated incorrect DOUBLE value: '{"a": 2}'
Warning	1292	Truncated incorrect DOUBLE value: '[1, 2]'
Warning	1292	Truncated incorrect DOUBLE value: '{"a": "b", "c": "d", "ab": "abc", "bc": ["x", "y"]}'
Warning	1292	Truncated incorrect DOUBLE value: '["here", ["I", "am"], "!!!"]'
Warning	1292	Truncated incorrect DOUBLE value: 'null'
Warning	1292	Truncated incorrect DOUBLE value: '{}'
Warning	1292	Truncated incorrect DOUBLE value: '[]'
Warning	1292	Truncated incorrect DOUBLE value: '"2015-01-15 23:24:25.000000"'
Warning	1292	Truncated incorrect DOUBLE value: '"23:24:25.000000"'
Warning	1292	Truncated incorrect DOUBLE value: '"2015-01-15"'
Warning	1292	Truncated incorrect DOUBLE value: '"2015-01-15 23:24:25.000000"'
Warning	1292	Truncated incorrect DOUBLE value: '"base64:type255:AAAAAAEBAAAAAAAAAAAA8D8AAAAAAADwPw=="'
Warning	1292	Truncated incorrect DOUBLE value: '[]'
Warning	1292	Truncated incorrect DOUBLE value: '{"aaaaaaaaaaaaaaaaaaaaaaaaaaaaaaaaaaaaaaaaaaaaaaaaaaaaaaaaaaaaaaaaaaaaaaaaaaaaaaaaaaaaaaaaaaaaaaaaaaaaaaaaaaaaaaaaaaaaaaaaaaaaaa'
SELECT i FROM t1
WHERE j = CAST(CAST(j AS CHAR CHARACTER SET 'utf8') AS JSON)
ORDER BY i;
i
1
2
3
4
5
6
7
8
9
10
11
12
13
14
15
16
17
18
19
20
21
22
23
29
100
SELECT CAST(NULL AS UNSIGNED) = CAST(NULL AS JSON);
CAST(NULL AS UNSIGNED) = CAST(NULL AS JSON)
NULL
SELECT CAST(NULL AS JSON) = CAST(NULL AS JSON);
CAST(NULL AS JSON) = CAST(NULL AS JSON)
NULL
SELECT CAST(NULL AS JSON) = NULL;
CAST(NULL AS JSON) = NULL
NULL
SELECT CAST(1 AS JSON) = NULL;
CAST(1 AS JSON) = NULL
NULL
SELECT CAST('true' AS JSON) = 1;
CAST('true' AS JSON) = 1
0
SELECT CAST('true' AS JSON) = true;
CAST('true' AS JSON) = true
1
SELECT a.i, b.i, a.j < b.j, a.j = b.j, a.j > b.j, a.j <> b.j, a.j <=> b.j
FROM t1 a, t1 b
ORDER BY a.i, b.i;
i	i	a.j < b.j	a.j = b.j	a.j > b.j	a.j <> b.j	a.j <=> b.j
0	0	NULL	NULL	NULL	NULL	1
0	1	NULL	NULL	NULL	NULL	0
0	2	NULL	NULL	NULL	NULL	0
0	3	NULL	NULL	NULL	NULL	0
0	4	NULL	NULL	NULL	NULL	0
0	5	NULL	NULL	NULL	NULL	0
0	6	NULL	NULL	NULL	NULL	0
0	7	NULL	NULL	NULL	NULL	0
0	8	NULL	NULL	NULL	NULL	0
0	9	NULL	NULL	NULL	NULL	0
0	10	NULL	NULL	NULL	NULL	0
0	11	NULL	NULL	NULL	NULL	0
0	12	NULL	NULL	NULL	NULL	0
0	13	NULL	NULL	NULL	NULL	0
0	14	NULL	NULL	NULL	NULL	0
0	15	NULL	NULL	NULL	NULL	0
0	16	NULL	NULL	NULL	NULL	0
0	17	NULL	NULL	NULL	NULL	0
0	18	NULL	NULL	NULL	NULL	0
0	19	NULL	NULL	NULL	NULL	0
0	20	NULL	NULL	NULL	NULL	0
0	21	NULL	NULL	NULL	NULL	0
0	22	NULL	NULL	NULL	NULL	0
0	23	NULL	NULL	NULL	NULL	0
0	24	NULL	NULL	NULL	NULL	0
0	25	NULL	NULL	NULL	NULL	0
0	26	NULL	NULL	NULL	NULL	0
0	27	NULL	NULL	NULL	NULL	0
0	28	NULL	NULL	NULL	NULL	0
0	29	NULL	NULL	NULL	NULL	0
0	100	NULL	NULL	NULL	NULL	0
1	0	NULL	NULL	NULL	NULL	0
1	1	0	1	0	0	1
1	2	1	0	0	1	0
1	3	1	0	0	1	0
1	4	1	0	0	1	0
1	5	0	0	1	1	0
1	6	1	0	0	1	0
1	7	1	0	0	1	0
1	8	0	0	1	1	0
1	9	0	0	1	1	0
1	10	0	0	1	1	0
1	11	0	0	1	1	0
1	12	0	0	1	1	0
1	13	0	0	1	1	0
1	14	0	0	1	1	0
1	15	0	0	1	1	0
1	16	0	0	1	1	0
1	17	0	0	1	1	0
1	18	0	0	1	1	0
1	19	0	0	1	1	0
1	20	0	0	1	1	0
1	21	0	0	1	1	0
1	22	0	0	1	1	0
1	23	1	0	0	1	0
1	24	1	0	0	1	0
1	25	1	0	0	1	0
1	26	1	0	0	1	0
1	27	1	0	0	1	0
1	28	1	0	0	1	0
1	29	1	0	0	1	0
1	100	1	0	0	1	0
2	0	NULL	NULL	NULL	NULL	0
2	1	0	0	1	1	0
2	2	0	1	0	0	1
2	3	0	0	1	1	0
2	4	1	0	0	1	0
2	5	0	0	1	1	0
2	6	1	0	0	1	0
2	7	1	0	0	1	0
2	8	0	0	1	1	0
2	9	0	0	1	1	0
2	10	0	0	1	1	0
2	11	0	0	1	1	0
2	12	0	0	1	1	0
2	13	0	0	1	1	0
2	14	0	0	1	1	0
2	15	0	0	1	1	0
2	16	0	0	1	1	0
2	17	0	0	1	1	0
2	18	0	0	1	1	0
2	19	0	0	1	1	0
2	20	0	0	1	1	0
2	21	0	0	1	1	0
2	22	0	0	1	1	0
2	23	0	0	1	1	0
2	24	1	0	0	1	0
2	25	1	0	0	1	0
2	26	1	0	0	1	0
2	27	1	0	0	1	0
2	28	1	0	0	1	0
2	29	0	0	1	1	0
2	100	0	0	1	1	0
3	0	NULL	NULL	NULL	NULL	0
3	1	0	0	1	1	0
3	2	1	0	0	1	0
3	3	0	1	0	0	1
3	4	1	0	0	1	0
3	5	0	0	1	1	0
3	6	1	0	0	1	0
3	7	1	0	0	1	0
3	8	0	0	1	1	0
3	9	0	0	1	1	0
3	10	0	0	1	1	0
3	11	0	0	1	1	0
3	12	0	0	1	1	0
3	13	0	0	1	1	0
3	14	0	0	1	1	0
3	15	0	0	1	1	0
3	16	0	0	1	1	0
3	17	0	0	1	1	0
3	18	0	0	1	1	0
3	19	0	0	1	1	0
3	20	0	0	1	1	0
3	21	0	0	1	1	0
3	22	0	0	1	1	0
3	23	1	0	0	1	0
3	24	1	0	0	1	0
3	25	1	0	0	1	0
3	26	1	0	0	1	0
3	27	1	0	0	1	0
3	28	1	0	0	1	0
3	29	1	0	0	1	0
3	100	0	0	1	1	0
4	0	NULL	NULL	NULL	NULL	0
4	1	0	0	1	1	0
4	2	0	0	1	1	0
4	3	0	0	1	1	0
4	4	0	1	0	0	1
4	5	0	0	1	1	0
4	6	1	0	0	1	0
4	7	1	0	0	1	0
4	8	0	0	1	1	0
4	9	0	0	1	1	0
4	10	0	0	1	1	0
4	11	0	0	1	1	0
4	12	0	0	1	1	0
4	13	0	0	1	1	0
4	14	0	0	1	1	0
4	15	0	0	1	1	0
4	16	0	0	1	1	0
4	17	0	0	1	1	0
4	18	0	0	1	1	0
4	19	0	0	1	1	0
4	20	0	0	1	1	0
4	21	0	0	1	1	0
4	22	0	0	1	1	0
4	23	0	0	1	1	0
4	24	1	0	0	1	0
4	25	1	0	0	1	0
4	26	1	0	0	1	0
4	27	1	0	0	1	0
4	28	1	0	0	1	0
4	29	0	0	1	1	0
4	100	0	0	1	1	0
5	0	NULL	NULL	NULL	NULL	0
5	1	1	0	0	1	0
5	2	1	0	0	1	0
5	3	1	0	0	1	0
5	4	1	0	0	1	0
5	5	0	1	0	0	1
5	6	1	0	0	1	0
5	7	1	0	0	1	0
5	8	0	0	1	1	0
5	9	0	0	1	1	0
5	10	0	0	1	1	0
5	11	0	0	1	1	0
5	12	0	0	1	1	0
5	13	0	0	1	1	0
5	14	0	0	1	1	0
5	15	0	0	1	1	0
5	16	0	0	1	1	0
5	17	0	0	1	1	0
5	18	0	0	1	1	0
5	19	0	0	1	1	0
5	20	0	0	1	1	0
5	21	0	0	1	1	0
5	22	1	0	0	1	0
5	23	1	0	0	1	0
5	24	1	0	0	1	0
5	25	1	0	0	1	0
5	26	1	0	0	1	0
5	27	1	0	0	1	0
5	28	1	0	0	1	0
5	29	1	0	0	1	0
5	100	1	0	0	1	0
6	0	NULL	NULL	NULL	NULL	0
6	1	0	0	1	1	0
6	2	0	0	1	1	0
6	3	0	0	1	1	0
6	4	0	0	1	1	0
6	5	0	0	1	1	0
6	6	0	1	0	0	1
6	7	0	0	1	1	0
6	8	0	0	1	1	0
6	9	0	0	1	1	0
6	10	0	0	1	1	0
6	11	0	0	1	1	0
6	12	0	0	1	1	0
6	13	0	0	1	1	0
6	14	0	0	1	1	0
6	15	0	0	1	1	0
6	16	0	0	1	1	0
6	17	0	0	1	1	0
6	18	0	0	1	1	0
6	19	0	0	1	1	0
6	20	0	0	1	1	0
6	21	0	0	1	1	0
6	22	0	0	1	1	0
6	23	0	0	1	1	0
6	24	1	0	0	1	0
6	25	1	0	0	1	0
6	26	1	0	0	1	0
6	27	1	0	0	1	0
6	28	1	0	0	1	0
6	29	0	0	1	1	0
6	100	0	0	1	1	0
7	0	NULL	NULL	NULL	NULL	0
7	1	0	0	1	1	0
7	2	0	0	1	1	0
7	3	0	0	1	1	0
7	4	0	0	1	1	0
7	5	0	0	1	1	0
7	6	1	0	0	1	0
7	7	0	1	0	0	1
7	8	0	0	1	1	0
7	9	0	0	1	1	0
7	10	0	0	1	1	0
7	11	0	0	1	1	0
7	12	0	0	1	1	0
7	13	0	0	1	1	0
7	14	0	0	1	1	0
7	15	0	0	1	1	0
7	16	0	0	1	1	0
7	17	0	0	1	1	0
7	18	0	0	1	1	0
7	19	0	0	1	1	0
7	20	0	0	1	1	0
7	21	0	0	1	1	0
7	22	0	0	1	1	0
7	23	0	0	1	1	0
7	24	1	0	0	1	0
7	25	1	0	0	1	0
7	26	1	0	0	1	0
7	27	1	0	0	1	0
7	28	1	0	0	1	0
7	29	0	0	1	1	0
7	100	0	0	1	1	0
8	0	NULL	NULL	NULL	NULL	0
8	1	1	0	0	1	0
8	2	1	0	0	1	0
8	3	1	0	0	1	0
8	4	1	0	0	1	0
8	5	1	0	0	1	0
8	6	1	0	0	1	0
8	7	1	0	0	1	0
8	8	0	1	0	0	1
8	9	1	0	0	1	0
8	10	1	0	0	1	0
8	11	1	0	0	1	0
8	12	1	0	0	1	0
8	13	1	0	0	1	0
8	14	1	0	0	1	0
8	15	1	0	0	1	0
8	16	1	0	0	1	0
8	17	1	0	0	1	0
8	18	1	0	0	1	0
8	19	1	0	0	1	0
8	20	1	0	0	1	0
8	21	1	0	0	1	0
8	22	1	0	0	1	0
8	23	1	0	0	1	0
8	24	1	0	0	1	0
8	25	1	0	0	1	0
8	26	1	0	0	1	0
8	27	1	0	0	1	0
8	28	1	0	0	1	0
8	29	1	0	0	1	0
8	100	1	0	0	1	0
9	0	NULL	NULL	NULL	NULL	0
9	1	1	0	0	1	0
9	2	1	0	0	1	0
9	3	1	0	0	1	0
9	4	1	0	0	1	0
9	5	1	0	0	1	0
9	6	1	0	0	1	0
9	7	1	0	0	1	0
9	8	0	0	1	1	0
9	9	0	1	0	0	1
9	10	1	0	0	1	0
9	11	1	0	0	1	0
9	12	1	0	0	1	0
9	13	0	0	1	1	0
9	14	0	0	1	1	0
9	15	1	0	0	1	0
9	16	1	0	0	1	0
9	17	0	0	1	1	0
9	18	0	0	1	1	0
9	19	1	0	0	1	0
9	20	1	0	0	1	0
9	21	1	0	0	1	0
9	22	1	0	0	1	0
9	23	1	0	0	1	0
9	24	1	0	0	1	0
9	25	1	0	0	1	0
9	26	1	0	0	1	0
9	27	1	0	0	1	0
9	28	1	0	0	1	0
9	29	1	0	0	1	0
9	100	1	0	0	1	0
10	0	NULL	NULL	NULL	NULL	0
10	1	1	0	0	1	0
10	2	1	0	0	1	0
10	3	1	0	0	1	0
10	4	1	0	0	1	0
10	5	1	0	0	1	0
10	6	1	0	0	1	0
10	7	1	0	0	1	0
10	8	0	0	1	1	0
10	9	0	0	1	1	0
10	10	0	1	0	0	1
10	11	1	0	0	1	0
10	12	1	0	0	1	0
10	13	0	0	1	1	0
10	14	0	0	1	1	0
10	15	1	0	0	1	0
10	16	1	0	0	1	0
10	17	0	0	1	1	0
10	18	0	0	1	1	0
10	19	1	0	0	1	0
10	20	1	0	0	1	0
10	21	1	0	0	1	0
10	22	1	0	0	1	0
10	23	1	0	0	1	0
10	24	1	0	0	1	0
10	25	1	0	0	1	0
10	26	1	0	0	1	0
10	27	1	0	0	1	0
10	28	1	0	0	1	0
10	29	1	0	0	1	0
10	100	1	0	0	1	0
11	0	NULL	NULL	NULL	NULL	0
11	1	1	0	0	1	0
11	2	1	0	0	1	0
11	3	1	0	0	1	0
11	4	1	0	0	1	0
11	5	1	0	0	1	0
11	6	1	0	0	1	0
11	7	1	0	0	1	0
11	8	0	0	1	1	0
11	9	0	0	1	1	0
11	10	0	0	1	1	0
11	11	0	1	0	0	1
11	12	1	0	0	1	0
11	13	0	0	1	1	0
11	14	0	0	1	1	0
11	15	1	0	0	1	0
11	16	1	0	0	1	0
11	17	0	0	1	1	0
11	18	0	0	1	1	0
11	19	1	0	0	1	0
11	20	1	0	0	1	0
11	21	0	0	1	1	0
11	22	1	0	0	1	0
11	23	1	0	0	1	0
11	24	1	0	0	1	0
11	25	1	0	0	1	0
11	26	1	0	0	1	0
11	27	1	0	0	1	0
11	28	1	0	0	1	0
11	29	1	0	0	1	0
11	100	1	0	0	1	0
12	0	NULL	NULL	NULL	NULL	0
12	1	1	0	0	1	0
12	2	1	0	0	1	0
12	3	1	0	0	1	0
12	4	1	0	0	1	0
12	5	1	0	0	1	0
12	6	1	0	0	1	0
12	7	1	0	0	1	0
12	8	0	0	1	1	0
12	9	0	0	1	1	0
12	10	0	0	1	1	0
12	11	0	0	1	1	0
12	12	0	1	0	0	1
12	13	0	0	1	1	0
12	14	0	0	1	1	0
12	15	1	0	0	1	0
12	16	1	0	0	1	0
12	17	0	0	1	1	0
12	18	0	0	1	1	0
12	19	1	0	0	1	0
12	20	1	0	0	1	0
12	21	0	0	1	1	0
12	22	1	0	0	1	0
12	23	1	0	0	1	0
12	24	1	0	0	1	0
12	25	1	0	0	1	0
12	26	1	0	0	1	0
12	27	1	0	0	1	0
12	28	1	0	0	1	0
12	29	1	0	0	1	0
12	100	1	0	0	1	0
13	0	NULL	NULL	NULL	NULL	0
13	1	1	0	0	1	0
13	2	1	0	0	1	0
13	3	1	0	0	1	0
13	4	1	0	0	1	0
13	5	1	0	0	1	0
13	6	1	0	0	1	0
13	7	1	0	0	1	0
13	8	0	0	1	1	0
13	9	1	0	0	1	0
13	10	1	0	0	1	0
13	11	1	0	0	1	0
13	12	1	0	0	1	0
13	13	0	1	0	0	1
13	14	0	0	1	1	0
13	15	1	0	0	1	0
13	16	1	0	0	1	0
13	17	0	0	1	1	0
13	18	0	0	1	1	0
13	19	1	0	0	1	0
13	20	1	0	0	1	0
13	21	1	0	0	1	0
13	22	1	0	0	1	0
13	23	1	0	0	1	0
13	24	1	0	0	1	0
13	25	1	0	0	1	0
13	26	1	0	0	1	0
13	27	1	0	0	1	0
13	28	1	0	0	1	0
13	29	1	0	0	1	0
13	100	1	0	0	1	0
14	0	NULL	NULL	NULL	NULL	0
14	1	1	0	0	1	0
14	2	1	0	0	1	0
14	3	1	0	0	1	0
14	4	1	0	0	1	0
14	5	1	0	0	1	0
14	6	1	0	0	1	0
14	7	1	0	0	1	0
14	8	0	0	1	1	0
14	9	1	0	0	1	0
14	10	1	0	0	1	0
14	11	1	0	0	1	0
14	12	1	0	0	1	0
14	13	1	0	0	1	0
14	14	0	1	0	0	1
14	15	1	0	0	1	0
14	16	1	0	0	1	0
14	17	0	0	1	1	0
14	18	0	0	1	1	0
14	19	1	0	0	1	0
14	20	1	0	0	1	0
14	21	1	0	0	1	0
14	22	1	0	0	1	0
14	23	1	0	0	1	0
14	24	1	0	0	1	0
14	25	1	0	0	1	0
14	26	1	0	0	1	0
14	27	1	0	0	1	0
14	28	1	0	0	1	0
14	29	1	0	0	1	0
14	100	1	0	0	1	0
15	0	NULL	NULL	NULL	NULL	0
15	1	1	0	0	1	0
15	2	1	0	0	1	0
15	3	1	0	0	1	0
15	4	1	0	0	1	0
15	5	1	0	0	1	0
15	6	1	0	0	1	0
15	7	1	0	0	1	0
15	8	0	0	1	1	0
15	9	0	0	1	1	0
15	10	0	0	1	1	0
15	11	0	0	1	1	0
15	12	0	0	1	1	0
15	13	0	0	1	1	0
15	14	0	0	1	1	0
15	15	0	1	0	0	1
15	16	1	0	0	1	0
15	17	0	0	1	1	0
15	18	0	0	1	1	0
15	19	1	0	0	1	0
15	20	1	0	0	1	0
15	21	0	0	1	1	0
15	22	1	0	0	1	0
15	23	1	0	0	1	0
15	24	1	0	0	1	0
15	25	1	0	0	1	0
15	26	1	0	0	1	0
15	27	1	0	0	1	0
15	28	1	0	0	1	0
15	29	1	0	0	1	0
15	100	1	0	0	1	0
16	0	NULL	NULL	NULL	NULL	0
16	1	1	0	0	1	0
16	2	1	0	0	1	0
16	3	1	0	0	1	0
16	4	1	0	0	1	0
16	5	1	0	0	1	0
16	6	1	0	0	1	0
16	7	1	0	0	1	0
16	8	0	0	1	1	0
16	9	0	0	1	1	0
16	10	0	0	1	1	0
16	11	0	0	1	1	0
16	12	0	0	1	1	0
16	13	0	0	1	1	0
16	14	0	0	1	1	0
16	15	0	0	1	1	0
16	16	0	1	0	0	1
16	17	0	0	1	1	0
16	18	0	0	1	1	0
16	19	1	0	0	1	0
16	20	1	0	0	1	0
16	21	0	0	1	1	0
16	22	1	0	0	1	0
16	23	1	0	0	1	0
16	24	1	0	0	1	0
16	25	1	0	0	1	0
16	26	1	0	0	1	0
16	27	1	0	0	1	0
16	28	1	0	0	1	0
16	29	1	0	0	1	0
16	100	1	0	0	1	0
17	0	NULL	NULL	NULL	NULL	0
17	1	1	0	0	1	0
17	2	1	0	0	1	0
17	3	1	0	0	1	0
17	4	1	0	0	1	0
17	5	1	0	0	1	0
17	6	1	0	0	1	0
17	7	1	0	0	1	0
17	8	0	0	1	1	0
17	9	1	0	0	1	0
17	10	1	0	0	1	0
17	11	1	0	0	1	0
17	12	1	0	0	1	0
17	13	1	0	0	1	0
17	14	1	0	0	1	0
17	15	1	0	0	1	0
17	16	1	0	0	1	0
17	17	0	1	0	0	1
17	18	0	0	1	1	0
17	19	1	0	0	1	0
17	20	1	0	0	1	0
17	21	1	0	0	1	0
17	22	1	0	0	1	0
17	23	1	0	0	1	0
17	24	1	0	0	1	0
17	25	1	0	0	1	0
17	26	1	0	0	1	0
17	27	1	0	0	1	0
17	28	1	0	0	1	0
17	29	1	0	0	1	0
17	100	1	0	0	1	0
18	0	NULL	NULL	NULL	NULL	0
18	1	1	0	0	1	0
18	2	1	0	0	1	0
18	3	1	0	0	1	0
18	4	1	0	0	1	0
18	5	1	0	0	1	0
18	6	1	0	0	1	0
18	7	1	0	0	1	0
18	8	0	0	1	1	0
18	9	1	0	0	1	0
18	10	1	0	0	1	0
18	11	1	0	0	1	0
18	12	1	0	0	1	0
18	13	1	0	0	1	0
18	14	1	0	0	1	0
18	15	1	0	0	1	0
18	16	1	0	0	1	0
18	17	1	0	0	1	0
18	18	0	1	0	0	1
18	19	1	0	0	1	0
18	20	1	0	0	1	0
18	21	1	0	0	1	0
18	22	1	0	0	1	0
18	23	1	0	0	1	0
18	24	1	0	0	1	0
18	25	1	0	0	1	0
18	26	1	0	0	1	0
18	27	1	0	0	1	0
18	28	1	0	0	1	0
18	29	1	0	0	1	0
18	100	1	0	0	1	0
19	0	NULL	NULL	NULL	NULL	0
19	1	1	0	0	1	0
19	2	1	0	0	1	0
19	3	1	0	0	1	0
19	4	1	0	0	1	0
19	5	1	0	0	1	0
19	6	1	0	0	1	0
19	7	1	0	0	1	0
19	8	0	0	1	1	0
19	9	0	0	1	1	0
19	10	0	0	1	1	0
19	11	0	0	1	1	0
19	12	0	0	1	1	0
19	13	0	0	1	1	0
19	14	0	0	1	1	0
19	15	0	0	1	1	0
19	16	0	0	1	1	0
19	17	0	0	1	1	0
19	18	0	0	1	1	0
19	19	0	1	0	0	1
19	20	1	0	0	1	0
19	21	0	0	1	1	0
19	22	1	0	0	1	0
19	23	1	0	0	1	0
19	24	1	0	0	1	0
19	25	1	0	0	1	0
19	26	1	0	0	1	0
19	27	1	0	0	1	0
19	28	1	0	0	1	0
19	29	1	0	0	1	0
19	100	1	0	0	1	0
20	0	NULL	NULL	NULL	NULL	0
20	1	1	0	0	1	0
20	2	1	0	0	1	0
20	3	1	0	0	1	0
20	4	1	0	0	1	0
20	5	1	0	0	1	0
20	6	1	0	0	1	0
20	7	1	0	0	1	0
20	8	0	0	1	1	0
20	9	0	0	1	1	0
20	10	0	0	1	1	0
20	11	0	0	1	1	0
20	12	0	0	1	1	0
20	13	0	0	1	1	0
20	14	0	0	1	1	0
20	15	0	0	1	1	0
20	16	0	0	1	1	0
20	17	0	0	1	1	0
20	18	0	0	1	1	0
20	19	0	0	1	1	0
20	20	0	1	0	0	1
20	21	0	0	1	1	0
20	22	1	0	0	1	0
20	23	1	0	0	1	0
20	24	1	0	0	1	0
20	25	1	0	0	1	0
20	26	1	0	0	1	0
20	27	1	0	0	1	0
20	28	1	0	0	1	0
20	29	1	0	0	1	0
20	100	1	0	0	1	0
21	0	NULL	NULL	NULL	NULL	0
21	1	1	0	0	1	0
21	2	1	0	0	1	0
21	3	1	0	0	1	0
21	4	1	0	0	1	0
21	5	1	0	0	1	0
21	6	1	0	0	1	0
21	7	1	0	0	1	0
21	8	0	0	1	1	0
21	9	0	0	1	1	0
21	10	0	0	1	1	0
21	11	1	0	0	1	0
21	12	1	0	0	1	0
21	13	0	0	1	1	0
21	14	0	0	1	1	0
21	15	1	0	0	1	0
21	16	1	0	0	1	0
21	17	0	0	1	1	0
21	18	0	0	1	1	0
21	19	1	0	0	1	0
21	20	1	0	0	1	0
21	21	0	1	0	0	1
21	22	1	0	0	1	0
21	23	1	0	0	1	0
21	24	1	0	0	1	0
21	25	1	0	0	1	0
21	26	1	0	0	1	0
21	27	1	0	0	1	0
21	28	1	0	0	1	0
21	29	1	0	0	1	0
21	100	1	0	0	1	0
22	0	NULL	NULL	NULL	NULL	0
22	1	1	0	0	1	0
22	2	1	0	0	1	0
22	3	1	0	0	1	0
22	4	1	0	0	1	0
22	5	0	0	1	1	0
22	6	1	0	0	1	0
22	7	1	0	0	1	0
22	8	0	0	1	1	0
22	9	0	0	1	1	0
22	10	0	0	1	1	0
22	11	0	0	1	1	0
22	12	0	0	1	1	0
22	13	0	0	1	1	0
22	14	0	0	1	1	0
22	15	0	0	1	1	0
22	16	0	0	1	1	0
22	17	0	0	1	1	0
22	18	0	0	1	1	0
22	19	0	0	1	1	0
22	20	0	0	1	1	0
22	21	0	0	1	1	0
22	22	0	1	0	0	1
22	23	1	0	0	1	0
22	24	1	0	0	1	0
22	25	1	0	0	1	0
22	26	1	0	0	1	0
22	27	1	0	0	1	0
22	28	1	0	0	1	0
22	29	1	0	0	1	0
22	100	1	0	0	1	0
23	0	NULL	NULL	NULL	NULL	0
23	1	0	0	1	1	0
23	2	1	0	0	1	0
23	3	0	0	1	1	0
23	4	1	0	0	1	0
23	5	0	0	1	1	0
23	6	1	0	0	1	0
23	7	1	0	0	1	0
23	8	0	0	1	1	0
23	9	0	0	1	1	0
23	10	0	0	1	1	0
23	11	0	0	1	1	0
23	12	0	0	1	1	0
23	13	0	0	1	1	0
23	14	0	0	1	1	0
23	15	0	0	1	1	0
23	16	0	0	1	1	0
23	17	0	0	1	1	0
23	18	0	0	1	1	0
23	19	0	0	1	1	0
23	20	0	0	1	1	0
23	21	0	0	1	1	0
23	22	0	0	1	1	0
23	23	0	1	0	0	1
23	24	1	0	0	1	0
23	25	1	0	0	1	0
23	26	1	0	0	1	0
23	27	1	0	0	1	0
23	28	1	0	0	1	0
23	29	0	1	0	0	1
23	100	0	0	1	1	0
24	0	NULL	NULL	NULL	NULL	0
24	1	0	0	1	1	0
24	2	0	0	1	1	0
24	3	0	0	1	1	0
24	4	0	0	1	1	0
24	5	0	0	1	1	0
24	6	0	0	1	1	0
24	7	0	0	1	1	0
24	8	0	0	1	1	0
24	9	0	0	1	1	0
24	10	0	0	1	1	0
24	11	0	0	1	1	0
24	12	0	0	1	1	0
24	13	0	0	1	1	0
24	14	0	0	1	1	0
24	15	0	0	1	1	0
24	16	0	0	1	1	0
24	17	0	0	1	1	0
24	18	0	0	1	1	0
24	19	0	0	1	1	0
24	20	0	0	1	1	0
24	21	0	0	1	1	0
24	22	0	0	1	1	0
24	23	0	0	1	1	0
24	24	0	1	0	0	1
24	25	0	0	1	1	0
24	26	0	0	1	1	0
24	27	0	1	0	0	1
24	28	1	0	0	1	0
24	29	0	0	1	1	0
24	100	0	0	1	1	0
25	0	NULL	NULL	NULL	NULL	0
25	1	0	0	1	1	0
25	2	0	0	1	1	0
25	3	0	0	1	1	0
25	4	0	0	1	1	0
25	5	0	0	1	1	0
25	6	0	0	1	1	0
25	7	0	0	1	1	0
25	8	0	0	1	1	0
25	9	0	0	1	1	0
25	10	0	0	1	1	0
25	11	0	0	1	1	0
25	12	0	0	1	1	0
25	13	0	0	1	1	0
25	14	0	0	1	1	0
25	15	0	0	1	1	0
25	16	0	0	1	1	0
25	17	0	0	1	1	0
25	18	0	0	1	1	0
25	19	0	0	1	1	0
25	20	0	0	1	1	0
25	21	0	0	1	1	0
25	22	0	0	1	1	0
25	23	0	0	1	1	0
25	24	1	0	0	1	0
25	25	0	1	0	0	1
25	26	0	0	1	1	0
25	27	1	0	0	1	0
25	28	1	0	0	1	0
25	29	0	0	1	1	0
25	100	0	0	1	1	0
26	0	NULL	NULL	NULL	NULL	0
26	1	0	0	1	1	0
26	2	0	0	1	1	0
26	3	0	0	1	1	0
26	4	0	0	1	1	0
26	5	0	0	1	1	0
26	6	0	0	1	1	0
26	7	0	0	1	1	0
26	8	0	0	1	1	0
26	9	0	0	1	1	0
26	10	0	0	1	1	0
26	11	0	0	1	1	0
26	12	0	0	1	1	0
26	13	0	0	1	1	0
26	14	0	0	1	1	0
26	15	0	0	1	1	0
26	16	0	0	1	1	0
26	17	0	0	1	1	0
26	18	0	0	1	1	0
26	19	0	0	1	1	0
26	20	0	0	1	1	0
26	21	0	0	1	1	0
26	22	0	0	1	1	0
26	23	0	0	1	1	0
26	24	1	0	0	1	0
26	25	1	0	0	1	0
26	26	0	1	0	0	1
26	27	1	0	0	1	0
26	28	1	0	0	1	0
26	29	0	0	1	1	0
26	100	0	0	1	1	0
27	0	NULL	NULL	NULL	NULL	0
27	1	0	0	1	1	0
27	2	0	0	1	1	0
27	3	0	0	1	1	0
27	4	0	0	1	1	0
27	5	0	0	1	1	0
27	6	0	0	1	1	0
27	7	0	0	1	1	0
27	8	0	0	1	1	0
27	9	0	0	1	1	0
27	10	0	0	1	1	0
27	11	0	0	1	1	0
27	12	0	0	1	1	0
27	13	0	0	1	1	0
27	14	0	0	1	1	0
27	15	0	0	1	1	0
27	16	0	0	1	1	0
27	17	0	0	1	1	0
27	18	0	0	1	1	0
27	19	0	0	1	1	0
27	20	0	0	1	1	0
27	21	0	0	1	1	0
27	22	0	0	1	1	0
27	23	0	0	1	1	0
27	24	0	1	0	0	1
27	25	0	0	1	1	0
27	26	0	0	1	1	0
27	27	0	1	0	0	1
27	28	1	0	0	1	0
27	29	0	0	1	1	0
27	100	0	0	1	1	0
28	0	NULL	NULL	NULL	NULL	0
28	1	0	0	1	1	0
28	2	0	0	1	1	0
28	3	0	0	1	1	0
28	4	0	0	1	1	0
28	5	0	0	1	1	0
28	6	0	0	1	1	0
28	7	0	0	1	1	0
28	8	0	0	1	1	0
28	9	0	0	1	1	0
28	10	0	0	1	1	0
28	11	0	0	1	1	0
28	12	0	0	1	1	0
28	13	0	0	1	1	0
28	14	0	0	1	1	0
28	15	0	0	1	1	0
28	16	0	0	1	1	0
28	17	0	0	1	1	0
28	18	0	0	1	1	0
28	19	0	0	1	1	0
28	20	0	0	1	1	0
28	21	0	0	1	1	0
28	22	0	0	1	1	0
28	23	0	0	1	1	0
28	24	0	0	1	1	0
28	25	0	0	1	1	0
28	26	0	0	1	1	0
28	27	0	0	1	1	0
28	28	0	1	0	0	1
28	29	0	0	1	1	0
28	100	0	0	1	1	0
29	0	NULL	NULL	NULL	NULL	0
29	1	0	0	1	1	0
29	2	1	0	0	1	0
29	3	0	0	1	1	0
29	4	1	0	0	1	0
29	5	0	0	1	1	0
29	6	1	0	0	1	0
29	7	1	0	0	1	0
29	8	0	0	1	1	0
29	9	0	0	1	1	0
29	10	0	0	1	1	0
29	11	0	0	1	1	0
29	12	0	0	1	1	0
29	13	0	0	1	1	0
29	14	0	0	1	1	0
29	15	0	0	1	1	0
29	16	0	0	1	1	0
29	17	0	0	1	1	0
29	18	0	0	1	1	0
29	19	0	0	1	1	0
29	20	0	0	1	1	0
29	21	0	0	1	1	0
29	22	0	0	1	1	0
29	23	0	1	0	0	1
29	24	1	0	0	1	0
29	25	1	0	0	1	0
29	26	1	0	0	1	0
29	27	1	0	0	1	0
29	28	1	0	0	1	0
29	29	0	1	0	0	1
29	100	0	0	1	1	0
100	0	NULL	NULL	NULL	NULL	0
100	1	0	0	1	1	0
100	2	1	0	0	1	0
100	3	1	0	0	1	0
100	4	1	0	0	1	0
100	5	0	0	1	1	0
100	6	1	0	0	1	0
100	7	1	0	0	1	0
100	8	0	0	1	1	0
100	9	0	0	1	1	0
100	10	0	0	1	1	0
100	11	0	0	1	1	0
100	12	0	0	1	1	0
100	13	0	0	1	1	0
100	14	0	0	1	1	0
100	15	0	0	1	1	0
100	16	0	0	1	1	0
100	17	0	0	1	1	0
100	18	0	0	1	1	0
100	19	0	0	1	1	0
100	20	0	0	1	1	0
100	21	0	0	1	1	0
100	22	0	0	1	1	0
100	23	1	0	0	1	0
100	24	1	0	0	1	0
100	25	1	0	0	1	0
100	26	1	0	0	1	0
100	27	1	0	0	1	0
100	28	1	0	0	1	0
100	29	1	0	0	1	0
100	100	0	1	0	0	1
# Verify that the index on the int column is not used when
# comparing the int column to a JSON column. The two columns
# should be compared using the JSON comparator.
CREATE TABLE t2(i int, j json);
CREATE INDEX t2_i ON t2(i);
INSERT INTO t2 values (1, CAST(1 AS JSON));
INSERT INTO t2 values (1, CAST('"1"' AS JSON));
ANALYZE TABLE t2;
Table	Op	Msg_type	Msg_text
test.t2	analyze	status	OK
EXPLAIN SELECT * FROM t2 where i = j;
id	select_type	table	partitions	type	possible_keys	key	key_len	ref	rows	filtered	Extra
1	SIMPLE	t2	NULL	ALL	NULL	NULL	NULL	NULL	2	50.00	Using where
Warnings:
Note	1003	/* select#1 */ select `test`.`t2`.`i` AS `i`,`test`.`t2`.`j` AS `j` from `test`.`t2` where (`test`.`t2`.`i` = `test`.`t2`.`j`)
SELECT * FROM t2 where i = j;
i	j
1	1
DROP TABLE t2;
CREATE TABLE numbers(id INT NOT NULL AUTO_INCREMENT,
rank INT,
j JSON,
PRIMARY KEY(id));
INSERT INTO numbers(rank, j) VALUES
(1, '-1e100'),
(2, '-1e65'),
# smallest DECIMAL (negative with 65 digits)
(3, CAST(-99999999999999999999999999999999999999999999999999999999999999999 AS JSON)),
(4, CAST(-9223372036854776001 AS JSON)),
(5, CAST(-9223372036854776000 AS JSON)),
# closest DOUBLE approximation of the smallest SIGNED BIGINT
(5 /* same rank as previous */, '-9.223372036854776e18'),
(6, CAST(-9223372036854775999 AS JSON)),
(7, CAST(-9223372036854775809 AS JSON)),   # smallest SIGNED BIGINT - 1
(8, CAST(-9223372036854775808 AS JSON)),   # smallest SIGNED BIGINT
(9, CAST(-9223372036854775807 AS JSON)),   # smallest SIGNED BIGINT + 1
(10, '-1e-50'),                  # close to zero, fits in a DECIMAL
(11, '-1.2345678901234e-71'),    # has to be truncated to fit in a DECIMAL
(12, CAST(-0.000000000000000000000000000000000000000000000000000000000000000000000012 AS JSON)),
(12 /* same rank as previous */, '-1.2e-71'),
(13, '-1.0345678901234e-71'),    # has to be truncated to fit in a DECIMAL
(14, '-1e-100'),                 # too close to zero to fit in a DECIMAL
(15, '0'),
(16, '1e-100'),                  # too close to zero to fit in a DECIMAL
(17, '1.0345678901234e-71'),     # has to be truncated to fit in a DECIMAL
(18, CAST(0.000000000000000000000000000000000000000000000000000000000000000000000012 AS JSON)),
(18 /* same rank as previous */, '1.2e-71'),
(19, '1.2345678901234e-71'),     # has to be truncated to fit in a DECIMAL
(20, '1e-50'),                   # close to zero, fits in a DECIMAL
(21, CAST(9223372036854775806 AS JSON)),    # largest SIGNED BIGINT - 1
(22, CAST(9223372036854775807 AS JSON)),    # largest SIGNED BIGINT
(23, CAST(9223372036854775808 AS JSON)),    # largest SIGNED BIGINT + 1
(24, CAST(9223372036854775999 AS JSON)),
# closest DOUBLE approximation of the largest SIGNED BIGINT
(25, '9.223372036854776e18'),
(25 /* same rank as previous */, CAST(9223372036854776000 AS JSON)),
(26, CAST(9223372036854776001 AS JSON)),
(27, CAST(18446744073709551614 AS JSON)),   # largest UNSIGNED BIGINT - 1
(28, CAST(18446744073709551615 AS JSON)),   # largest UNSIGNED BIGINT
(29, CAST(18446744073709551616 AS JSON)),   # largest UNSIGNED BIGINT + 1
# Gets converted to the closest DOUBLE approximation of UNSIGNED BIGINT + 1
# by the JSON parser
(30, '18446744073709551616'),
# biggest DECIMAL (65 digits)
(31, CAST(99999999999999999999999999999999999999999999999999999999999999999 AS JSON)),
(32, CAST('1e65' AS JSON)),
(33, CAST('1e100' AS JSON));
SELECT *, JSN_TYPE(j) FROM numbers ORDER BY id;
id	rank	j	JSN_TYPE(j)
1	1	-1e100	DOUBLE
2	2	-1e65	DOUBLE
3	3	-99999999999999999999999999999999999999999999999999999999999999999	DECIMAL
4	4	-9223372036854776001	DECIMAL
5	5	-9223372036854776000	DECIMAL
6	5	-9.223372036854776e18	DOUBLE
7	6	-9223372036854775999	DECIMAL
8	7	-9223372036854775809	DECIMAL
9	8	-9223372036854775808	INTEGER
10	9	-9223372036854775807	INTEGER
11	10	-9.999999999999999e-51	DOUBLE
12	11	-1.2345678901233999e-71	DOUBLE
13	12	-0.000000000000000000000000000000000000000000000000000000000000000000000012	DECIMAL
14	12	-1.2e-71	DOUBLE
15	13	-1.0345678901234e-71	DOUBLE
16	14	-1e-100	DOUBLE
17	15	0	INTEGER
18	16	1e-100	DOUBLE
19	17	1.0345678901234e-71	DOUBLE
20	18	0.000000000000000000000000000000000000000000000000000000000000000000000012	DECIMAL
21	18	1.2e-71	DOUBLE
22	19	1.2345678901233999e-71	DOUBLE
23	20	9.999999999999999e-51	DOUBLE
24	21	9223372036854775806	INTEGER
25	22	9223372036854775807	INTEGER
26	23	9223372036854775808	UNSIGNED INTEGER
27	24	9223372036854775999	UNSIGNED INTEGER
28	25	9.223372036854776e18	DOUBLE
29	25	9223372036854776000	UNSIGNED INTEGER
30	26	9223372036854776001	UNSIGNED INTEGER
31	27	18446744073709551614	UNSIGNED INTEGER
32	28	18446744073709551615	UNSIGNED INTEGER
33	29	18446744073709551616	DECIMAL
34	30	1.8446744073709552e19	DOUBLE
35	31	99999999999999999999999999999999999999999999999999999999999999999	DECIMAL
36	32	1e65	DOUBLE
37	33	1e100	DOUBLE
SELECT a.j, b.j, a.j < b.j, a.j = b.j, a.j > b.j, a.j <=> b.j
FROM numbers a, numbers b
WHERE ((a.j < b.j) <> (a.rank < b.rank)) OR
((a.j = b.j) <> (a.rank = b.rank)) OR
((a.j > b.j) <> (a.rank > b.rank)) OR
((a.j <=> b.j) <> (a.rank <=> b.rank));
j	j	a.j < b.j	a.j = b.j	a.j > b.j	a.j <=> b.j
DROP TABLE numbers;
# ----------------------------------------------------------------------
# Test of JSN_VALID function.
# ----------------------------------------------------------------------

# Table - Json string column - non-utf8 character set
create table latin_t (c varchar(20)) CHARACTER SET 'latin1';
insert into latin_t values ('123');
select JSN_VALID(c) from latin_t;
JSN_VALID(c)
1
drop table latin_t;

# Table - Json string column - utf-8, NULL
Note: 'utf8' is a subset of internal 'utf8mb4'

create table utf8_t (c varchar(20)) CHARACTER SET 'utf8';
insert into utf8_t values (NULL);
# Expect NULL:
select JSN_VALID(c) from utf8_t;
JSN_VALID(c)
NULL
delete from utf8_t;

# Table - Json string column - utf-8, valid
insert into utf8_t values ('[123]');
select JSN_VALID(c) from utf8_t;
JSN_VALID(c)
1
delete from utf8_t;

# Table - Json string column - utf-8, non-utf8
insert into utf8_t values ('[123');
expect 0 (false)
select JSN_VALID(c) from utf8_t;
JSN_VALID(c)
0
delete from utf8_t;

# Table - Try to extract JSON from TIMESTAMP column
ALTER TABLE utf8_t ADD d TIMESTAMP;
# Should give false; not string or JSON type
# and we do not convert automatically from TIMESTAMP to JSON
insert into utf8_t values (NULL, '2014-11-25 18:00');
select JSN_VALID(d) from utf8_t;
JSN_VALID(d)
0
# Explicit cast to a character data type
# allows MySQL to parse this is a JSON text
# The string isn't a legal JSON document, tho, so not valid.
select JSN_VALID(CAST(d as CHAR)) from utf8_t;
JSN_VALID(CAST(d as CHAR))
0
# Should give true
select JSN_VALID(CONCAT( CONCAT('"', CAST(d as CHAR)), '"')) from utf8_t;
JSN_VALID(CONCAT( CONCAT('"', CAST(d as CHAR)), '"'))
1
delete from utf8_t;
drop table utf8_t;

# Table - JSON type; should give true by definition
create table json_t(t json);
insert into json_t values ('[123]');
select jsn_VALID(t) from json_t;
jsn_VALID(t)
1

# String literal - valid JSON
select JSN_VALID('123');
JSN_VALID('123')
1
select JSN_VALID('"123"');
JSN_VALID('"123"')
1
select JSN_VALID('true');
JSN_VALID('true')
1
select JSN_VALID('false');
JSN_VALID('false')
1
select JSN_VALID('null');
JSN_VALID('null')
1
select JSN_VALID('{"address": "Trondheim"}');
JSN_VALID('{"address": "Trondheim"}')
1

# String literal - not valid JSON
select JSN_VALID('12 3');
JSN_VALID('12 3')
0

# String literal not in UTF-8
set names 'ascii';
select JSN_VALID('123');
JSN_VALID('123')
1
set names 'utf8';

# Json expression
select JSN_VALID(cast('[123]' as JSON ));
JSN_VALID(cast('[123]' as JSON ))
1

# Json expression NULL
select JSN_VALID(cast(NULL as JSON ));
JSN_VALID(cast(NULL as JSON ))
NULL

# Bare NULL
select JSN_VALID( NULL );
JSN_VALID( NULL )
NULL

# Function result - string
select JSN_VALID( UPPER('"abc"') );
JSN_VALID( UPPER('"abc"') )
1
set names 'latin1';

# Function result - string
select JSN_VALID( UPPER('"abc"') );
JSN_VALID( UPPER('"abc"') )
1
set names 'utf8';

# Function result - date, not valid as JSON without CAST
select JSN_VALID( CAST('2015-01-15' AS DATE) );
JSN_VALID( CAST('2015-01-15' AS DATE) )
0

# The date string doesn't parse as JSON text, so wrong:
select JSN_VALID( CAST(CAST('2015-01-15' AS DATE) as CHAR CHARACTER SET 'utf8') );
JSN_VALID( CAST(CAST('2015-01-15' AS DATE) as CHAR CHARACTER SET 'utf8') )
0
# OK, though:
select JSN_VALID( CAST(CURDATE() as JSON) );
JSN_VALID( CAST(CURDATE() as JSON) )
1

# Function result - NULL
select JSN_VALID( UPPER(NULL) );
JSN_VALID( UPPER(NULL) )
NULL
select JSN_VALID( UPPER(CAST(NULL as CHAR)) );
JSN_VALID( UPPER(CAST(NULL as CHAR)) )
NULL

# Function result - JSON
select JSN_VALID( JSN_ARRAY(t, t) ) from json_t;
JSN_VALID( JSN_ARRAY(t, t) )
1
drop table json_t;
SELECT JSN_VALID( '{ "firstName" : "Fred", "lastName" : "Flintstone" }' );
JSN_VALID( '{ "firstName" : "Fred", "lastName" : "Flintstone" }' )
1
SELECT JSN_VALID( '3' );
JSN_VALID( '3' )
1
SELECT JSN_VALID( null );
JSN_VALID( null )
NULL
# ----------------------------------------------------------------------
# Test of JSN_CONTAINS_PATH function.
# ----------------------------------------------------------------------
select jsn_contains_path();
ERROR 42000: Incorrect parameter count in the call to native function 'jsn_contains_path'
select jsn_contains_path('{ "a": true }' );
ERROR 42000: Incorrect parameter count in the call to native function 'jsn_contains_path'
select jsn_contains_path('{ "a": true }', 'all' );
ERROR 42000: Incorrect parameter count in the call to native function 'jsn_contains_path'
select jsn_contains_path('{ "a": tru }', 'all', '$' );
ERROR 22032: Invalid JSON text in argument 1 to function jsn_contains_path: "Invalid value" at position 11 in '{ "a": tru }'.
select jsn_contains_path('{ "a": true }', 'all', '$[' );
ERROR 42000: Invalid JSON path expression. The error is around character position 2 in '$['.
select jsn_contains_path('{ "a": true }', 'all', '$a.***[3]' );
ERROR 42000: Invalid JSON path expression. The error is around character position 1 in '$a.***[3]'.
select jsn_contains_path('{ "a": true }', 'foo', '$.a' );
ERROR 42000: The oneOrAll argument to JSN_CONTAINS_PATH may take these values: 'one' or 'all'.
select jsn_contains_path(null, 'all', '$.a' );
jsn_contains_path(null, 'all', '$.a' )
NULL
select jsn_contains_path('{ "a": true }', null, '$.a' );
jsn_contains_path('{ "a": true }', null, '$.a' )
NULL
select jsn_contains_path('{ "a": true }', 'all', null );
jsn_contains_path('{ "a": true }', 'all', null )
NULL
select jsn_contains_path('{ "a": true }', 'all', '$' );
jsn_contains_path('{ "a": true }', 'all', '$' )
1
select jsn_contains_path('{ "a": true }', 'all', '$.a' );
jsn_contains_path('{ "a": true }', 'all', '$.a' )
1
select jsn_contains_path('{ "a": true }', 'one', '$.a' );
jsn_contains_path('{ "a": true }', 'one', '$.a' )
1
select jsn_contains_path('{ "a": true }', 'all', '$.b' );
jsn_contains_path('{ "a": true }', 'all', '$.b' )
0
select jsn_contains_path('{ "a": true }', 'one', '$.b' );
jsn_contains_path('{ "a": true }', 'one', '$.b' )
0
select jsn_contains_path('{ "a": true }', 'all', '$.a', '$.b' );
jsn_contains_path('{ "a": true }', 'all', '$.a', '$.b' )
0
select jsn_contains_path('{ "a": true }', 'all', '$.b', '$.a' );
jsn_contains_path('{ "a": true }', 'all', '$.b', '$.a' )
0
select jsn_contains_path('{ "a": true }', 'ALL', '$.a', '$.b' );
jsn_contains_path('{ "a": true }', 'ALL', '$.a', '$.b' )
0
select jsn_contains_path('{ "a": true }', 'aLl', '$.a', '$.b' );
jsn_contains_path('{ "a": true }', 'aLl', '$.a', '$.b' )
0
select jsn_contains_path('{ "a": true }', 'one', '$.a', '$.b' );
jsn_contains_path('{ "a": true }', 'one', '$.a', '$.b' )
1
select jsn_contains_path('{ "a": true }', 'one', '$.b', '$.a' );
jsn_contains_path('{ "a": true }', 'one', '$.b', '$.a' )
1
select jsn_contains_path('{ "a": true }', 'ONE', '$.a', '$.b' );
jsn_contains_path('{ "a": true }', 'ONE', '$.a', '$.b' )
1
select jsn_contains_path('{ "a": true }', 'oNe', '$.a', '$.b' );
jsn_contains_path('{ "a": true }', 'oNe', '$.a', '$.b' )
1
select jsn_contains_path('{ "a": true, "b": [ 1, 2, { "c": [ 4, 5, { "d": [ 6, 7, 8, 9, 10 ]} ] } ] }', 'all', '$**[4]' );
jsn_contains_path('{ "a": true, "b": [ 1, 2, { "c": [ 4, 5, { "d": [ 6, 7, 8, 9, 10 ]} ] } ] }', 'all', '$**[4]' )
1
select jsn_contains_path('{ "a": true, "b": [ 1, 2, { "c": [ 4, 5, { "d": [ 6, 7, 8, 9, 10 ]} ] } ] }', 'all', '$**[4]', '$**[5]' );
jsn_contains_path('{ "a": true, "b": [ 1, 2, { "c": [ 4, 5, { "d": [ 6, 7, 8, 9, 10 ]} ] } ] }', 'all', '$**[4]', '$**[5]' )
0
select jsn_contains_path('{ "a": true, "b": [ 1, 2, { "c": [ 4, 5, { "d": [ 6, 7, 8, 9, 10 ]} ] } ] }', 'all', '$**.c[2]' );
jsn_contains_path('{ "a": true, "b": [ 1, 2, { "c": [ 4, 5, { "d": [ 6, 7, 8, 9, 10 ]} ] } ] }', 'all', '$**.c[2]' )
1
select jsn_contains_path('{ "a": true, "b": [ 1, 2, { "c": [ 4, 5, { "d": [ 6, 7, 8, 9, 10 ]} ] } ] }', 'all', '$**.c[3]' );
jsn_contains_path('{ "a": true, "b": [ 1, 2, { "c": [ 4, 5, { "d": [ 6, 7, 8, 9, 10 ]} ] } ] }', 'all', '$**.c[3]' )
0
select jsn_contains_path('{ "a": true, "b": [ 1, 2 ] }', 'all', '$**[1]', '$.b[0]', '$.c' );
jsn_contains_path('{ "a": true, "b": [ 1, 2 ] }', 'all', '$**[1]', '$.b[0]', '$.c' )
0
select jsn_contains_path('{ "a": true, "b": [ 1, 2 ] }', 'all', '$.c', '$**[1]', '$.b[0]' );
jsn_contains_path('{ "a": true, "b": [ 1, 2 ] }', 'all', '$.c', '$**[1]', '$.b[0]' )
0
select jsn_contains_path('{ "a": true, "b": [ 1, 2 ] }', 'all', '$.b[0]', '$.c', '$**[1]' );
jsn_contains_path('{ "a": true, "b": [ 1, 2 ] }', 'all', '$.b[0]', '$.c', '$**[1]' )
0
select jsn_contains_path('{ "a": true, "b": [ 1, 2 ] }', 'one', '$**[1]', '$.b[0]', '$.c' );
jsn_contains_path('{ "a": true, "b": [ 1, 2 ] }', 'one', '$**[1]', '$.b[0]', '$.c' )
1
select jsn_contains_path('{ "a": true, "b": [ 1, 2 ] }', 'one', '$.c', '$**[1]', '$.b[0]' );
jsn_contains_path('{ "a": true, "b": [ 1, 2 ] }', 'one', '$.c', '$**[1]', '$.b[0]' )
1
select jsn_contains_path('{ "a": true, "b": [ 1, 2 ] }', 'one', '$.b[0]', '$.c', '$**[1]' );
jsn_contains_path('{ "a": true, "b": [ 1, 2 ] }', 'one', '$.b[0]', '$.c', '$**[1]' )
1
SELECT JSN_CONTAINS_PATH
(
'{ "a" : 123, "b" : [ 123, 456 ] }',
'all',
'$.a.c',
'$.b[1]'
);
JSN_CONTAINS_PATH
(
'{ "a" : 123, "b" : [ 123, 456 ] }',
'all',
'$.a.c',
'$.b[1]'
)
0
SELECT JSN_CONTAINS_PATH
(
'{ "a" : 123, "b" : [ 123, 456 ] }',
'one',
'$.a.c',
'$.b[1]'
);
JSN_CONTAINS_PATH
(
'{ "a" : 123, "b" : [ 123, 456 ] }',
'one',
'$.a.c',
'$.b[1]'
)
1
SELECT JSN_CONTAINS_PATH
(
'{ "a" : 123, "b" : [ 123, 456 ] }',
'all',
'$.c'
);
JSN_CONTAINS_PATH
(
'{ "a" : 123, "b" : [ 123, 456 ] }',
'all',
'$.c'
)
0
SELECT JSN_CONTAINS_PATH
(
'{ "a" : 123, "b" : [ 123, { "c" : { "d" : true } } ] }',
'all',
'$.b[1].c.d'
);
JSN_CONTAINS_PATH
(
'{ "a" : 123, "b" : [ 123, { "c" : { "d" : true } } ] }',
'all',
'$.b[1].c.d'
)
1
# ----------------------------------------------------------------------
# Test of JSN_LENGTH function.
# ----------------------------------------------------------------------
create table utf8_mj_length (a int, c varchar(20)) CHARACTER SET 'utf8';
insert into utf8_mj_length values( 1, null );
insert into utf8_mj_length values( 2, '1' );
insert into utf8_mj_length values( 3, 'abc' );
insert into utf8_mj_length values( 4, '"abc"' );
insert into utf8_mj_length values ( 5, 'true' );
insert into utf8_mj_length values ( 6, 'false' );
insert into utf8_mj_length values ( 7, 'null' );
select a, c, jsn_length( c ) from utf8_mj_length where a = 1;
a	c	jsn_length( c )
1	NULL	NULL
select a, c, jsn_length( c ) from utf8_mj_length where a = 2;
a	c	jsn_length( c )
2	1	1

# invalid json text
select a, c, jsn_length( c ) from utf8_mj_length where a = 3;
ERROR 22032: Invalid JSON text in argument 1 to function jsn_length: "Expect a value here." at position 0 in 'abc'.
select a, c, jsn_length( c ) from utf8_mj_length where a = 4;
a	c	jsn_length( c )
4	"abc"	1
select a, c, jsn_length( c ) from utf8_mj_length where a = 5;
a	c	jsn_length( c )
5	true	1
select a, c, jsn_length( c ) from utf8_mj_length where a = 6;
a	c	jsn_length( c )
6	false	1
select a, c, jsn_length( c ) from utf8_mj_length where a = 7;
a	c	jsn_length( c )
7	null	1
create table json_mj_length( a int, b json );
insert into json_mj_length values( 1, NULL );
select a, b, jsn_length( b ) from json_mj_length where a = 1;
a	b	jsn_length( b )
1	NULL	NULL
set names 'ascii';

# path auto-converted to a utf8 string from ascii

select a, c, jsn_length( c, '$' ) from utf8_mj_length where a = 2;
a	c	jsn_length( c, '$' )
2	1	1
set names 'utf8';
select a, c, jsn_length( c, '$' ) from utf8_mj_length where a = 1;
a	c	jsn_length( c, '$' )
1	NULL	NULL
select a, c, jsn_length( c, '$' ) from utf8_mj_length where a = 2;
a	c	jsn_length( c, '$' )
2	1	1

# invalid json text
select a, c, jsn_length( c, '$' ) from utf8_mj_length where a = 3;
ERROR 22032: Invalid JSON text in argument 1 to function jsn_length: "Expect a value here." at position 0 in 'abc'.
select a, c, jsn_length( c, '$' ) from utf8_mj_length where a = 4;
a	c	jsn_length( c, '$' )
4	"abc"	1
select a, c, jsn_length( c, '$' ) from utf8_mj_length where a = 5;
a	c	jsn_length( c, '$' )
5	true	1
select a, c, jsn_length( c, '$' ) from utf8_mj_length where a = 6;
a	c	jsn_length( c, '$' )
6	false	1
select a, c, jsn_length( c, '$' ) from utf8_mj_length where a = 7;
a	c	jsn_length( c, '$' )
7	null	1
select a, b, jsn_length( b, '$' ) from json_mj_length where a = 1;
a	b	jsn_length( b, '$' )
1	NULL	NULL
drop table utf8_mj_length;
drop table json_mj_length;
select jsn_length( null );
jsn_length( null )
NULL
select jsn_length( '1' );
jsn_length( '1' )
1

# invalid json text
select jsn_length( 'abc' );
ERROR 22032: Invalid JSON text in argument 1 to function jsn_length: "Expect a value here." at position 0 in 'abc'.
select jsn_length( '"abc"' );
jsn_length( '"abc"' )
1
select jsn_length( 'true' );
jsn_length( 'true' )
1
select jsn_length( 'false' );
jsn_length( 'false' )
1
select jsn_length( 'null' );
jsn_length( 'null' )
1
select jsn_length( '{}' );
jsn_length( '{}' )
0
select jsn_length( '{ "a" : 100, "b" : 200 }' );
jsn_length( '{ "a" : 100, "b" : 200 }' )
2
select jsn_length( '{ "a" : 100, "b" : [ 300, 400, 500 ] }' );
jsn_length( '{ "a" : 100, "b" : [ 300, 400, 500 ] }' )
2
select jsn_length( '[]' );
jsn_length( '[]' )
0
select jsn_length( '[ null, "foo", true, 1.1 ]' );
jsn_length( '[ null, "foo", true, 1.1 ]' )
4
select jsn_length( '[ null, "foo", true, { "a" : "b", "c" : "d" } ]' );
jsn_length( '[ null, "foo", true, { "a" : "b", "c" : "d" } ]' )
4
select jsn_length( '"foo"' );
jsn_length( '"foo"' )
1
select jsn_length( '1.2' );
jsn_length( '1.2' )
1

# invalid json path
select jsn_length( 'true', 'c$' );
ERROR 42000: Invalid JSON path expression. The error is around character position 1 in 'c$'.

# invalid json path
select jsn_length( '{ "foo" : [ true, false ] }', '$.foo[bar]' );
ERROR 42000: Invalid JSON path expression. The error is around character position 6 in '$.foo[bar]'.

# wildcards not allowed in path expressions for this function
select jsn_length( 'true', '$.*' );
ERROR 42000: In this situation, path expressions may not contain the * and ** tokens.

# wildcards not allowed in path expressions for this function
select jsn_length( 'true', '$.foo**.bar' );
ERROR 42000: In this situation, path expressions may not contain the * and ** tokens.
select jsn_length( '[ 1, [ 2, 3, 4 ], 5 ]', '$[0]' );
jsn_length( '[ 1, [ 2, 3, 4 ], 5 ]', '$[0]' )
1
select jsn_length( '[ 1, [ 2, 3, 4 ], 5 ]', '$[1]' );
jsn_length( '[ 1, [ 2, 3, 4 ], 5 ]', '$[1]' )
3
select jsn_length( '[ 1, [ 2, 3, 4 ], 5 ]', '$[2]' );
jsn_length( '[ 1, [ 2, 3, 4 ], 5 ]', '$[2]' )
1
select jsn_length( '[ 1, [ 2, 3, 4 ], 5 ]', '$[2][0]' );
jsn_length( '[ 1, [ 2, 3, 4 ], 5 ]', '$[2][0]' )
1
select jsn_length( '[ 1, [ 2, 3, 4 ], {"a": 1} ]', '$[2][0]' );
jsn_length( '[ 1, [ 2, 3, 4 ], {"a": 1} ]', '$[2][0]' )
1
select jsn_length( '[ 1, [ 2, 3, 4 ], 5 ]', '$[2][1]' );
jsn_length( '[ 1, [ 2, 3, 4 ], 5 ]', '$[2][1]' )
NULL
select jsn_length( '[ 1, { "a": true, "b": false, "c": null }, 5 ]', '$[1]' );
jsn_length( '[ 1, { "a": true, "b": false, "c": null }, 5 ]', '$[1]' )
3
SELECT JSN_LENGTH
(
'{}'
);
JSN_LENGTH
(
'{}'
)
0
SELECT JSN_LENGTH
(
'3'
);
JSN_LENGTH
(
'3'
)
1
SELECT JSN_LENGTH
(
'{ "a" : 123, "b" : [ 123, 456, 789 ] }'
);
JSN_LENGTH
(
'{ "a" : 123, "b" : [ 123, 456, 789 ] }'
)
2
SELECT JSN_LENGTH
(
'{ "a" : 123, "b" : [ 123, 456, 789 ] }',
'$.b'
);
JSN_LENGTH
(
'{ "a" : 123, "b" : [ 123, 456, 789 ] }',
'$.b'
)
3
SELECT JSN_LENGTH
(
'{ "a" : 123, "b" : [ 123, 456, 789 ] }',
'$.c'
);
JSN_LENGTH
(
'{ "a" : 123, "b" : [ 123, 456, 789 ] }',
'$.c'
)
NULL
# ----------------------------------------------------------------------
# Test of JSN_DEPTH function.
# ----------------------------------------------------------------------
select jsn_depth(null);
jsn_depth(null)
NULL
select jsn_depth(cast(null as json));
jsn_depth(cast(null as json))
NULL
select i, jsn_depth(j) from t1;
i	jsn_depth(j)
0	NULL
1	2
2	2
3	3
4	3
5	1
6	1
7	1
8	1
9	1
10	1
11	1
12	1
13	1
14	1
15	1
16	1
17	1
18	1
19	1
20	1
21	1
22	1
23	1
24	1
25	1
26	1
27	1
28	1
29	1
100	2
select jsn_depth(cast('[]' as json)),
jsn_depth(cast('{}' as json)),
jsn_depth(cast('null' as json)),
jsn_depth(jsn_quote('foo'));
jsn_depth(cast('[]' as json))	jsn_depth(cast('{}' as json))	jsn_depth(cast('null' as json))	jsn_depth(jsn_quote('foo'))
1	1	1	1
select jsn_depth(cast('[[2], 3, [[[4]]]]' as json));
jsn_depth(cast('[[2], 3, [[[4]]]]' as json))
5
select jsn_depth(cast('{"a": {"a1": [3]}, "b": {"b1": {"c": {"d": [5]}}}}' as json));
jsn_depth(cast('{"a": {"a1": [3]}, "b": {"b1": {"c": {"d": [5]}}}}' as json))
6
SELECT JSN_DEPTH
(
'{}'
);
JSN_DEPTH
(
'{}'
)
1
SELECT JSN_DEPTH
(
'[]'
);
JSN_DEPTH
(
'[]'
)
1
SELECT JSN_DEPTH( '"abc"' );
JSN_DEPTH( '"abc"' )
1
SELECT JSN_DEPTH( CAST( '"abc"' AS JSON ) );
JSN_DEPTH( CAST( '"abc"' AS JSON ) )
1
SELECT JSN_DEPTH( 1 );
ERROR 22032: Invalid data type for JSON data in argument 1 to function jsn_depth; a JSON string or JSON type is required.
SELECT JSN_DEPTH( 'abc' );
ERROR 22032: Invalid JSON text in argument 1 to function jsn_depth: "Expect a value here." at position 0 in 'abc'.
SELECT JSN_DEPTH( CAST( 1 AS JSON ) );
JSN_DEPTH( CAST( 1 AS JSON ) )
1
SELECT JSN_DEPTH
(
'{ "a" : true, "b" : false, "c" : null }'
);
JSN_DEPTH
(
'{ "a" : true, "b" : false, "c" : null }'
)
2
SELECT JSN_DEPTH
(
'[ "a", true, "b" , false, "c" , null ]'
);
JSN_DEPTH
(
'[ "a", true, "b" , false, "c" , null ]'
)
2
SELECT JSN_DEPTH
(
'{ "a" : true, "b" : {}, "c" : null }'
);
JSN_DEPTH
(
'{ "a" : true, "b" : {}, "c" : null }'
)
2
SELECT JSN_DEPTH
(
'[ "a", true, "b" , {}, "c" , null ]'
);
JSN_DEPTH
(
'[ "a", true, "b" , {}, "c" , null ]'
)
2
SELECT JSN_DEPTH
(
'{ "a" : true, "b" : { "e" : false }, "c" : null }'
);
JSN_DEPTH
(
'{ "a" : true, "b" : { "e" : false }, "c" : null }'
)
3
SELECT JSN_DEPTH
(
'[ "a", true, "b" , { "e" : false }, "c" , null ]'
);
JSN_DEPTH
(
'[ "a", true, "b" , { "e" : false }, "c" , null ]'
)
3
SELECT JSN_DEPTH
(
'[ "a", true, "b" , { "e" : false }, "c" , null'
);
ERROR 22032: Invalid JSON text in argument 1 to function jsn_depth: "Must be a comma or ']' after an array element." at position 46 in '[ "a", true, "b" , { "e" : false }, "c" , null'.
# ----------------------------------------------------------------------
# Test of JSN_REMOVE function.
# ----------------------------------------------------------------------
select jsn_remove( null, '$[1]' );
jsn_remove( null, '$[1]' )
NULL
select jsn_remove( null, '$[1]' ) is null;
jsn_remove( null, '$[1]' ) is null
1
select jsn_remove( '[ 1, { "a": true, "b": false, "c": null }, 5 ]', null );
jsn_remove( '[ 1, { "a": true, "b": false, "c": null }, 5 ]', null )
NULL
select jsn_remove( '[ 1, { "a": true, "b": false, "c": null }, 5 ]', null ) is null;
jsn_remove( '[ 1, { "a": true, "b": false, "c": null }, 5 ]', null ) is null
1
select jsn_remove( '[ 1, { "a": true, "b": false, "c": null }, 5 ]', '$[1]', null );
jsn_remove( '[ 1, { "a": true, "b": false, "c": null }, 5 ]', '$[1]', null )
NULL
select jsn_remove( '[ 1, { "a": true, "b": false, "c": null }, 5 ]', '$[1]', null ) is null;
jsn_remove( '[ 1, { "a": true, "b": false, "c": null }, 5 ]', '$[1]', null ) is null
1

# not enough args
select jsn_remove();
ERROR 42000: Incorrect parameter count in the call to native function 'jsn_remove'

# not enough args
select jsn_remove( '[ 1, { "a": true, "b": false, "c": null }, 5 ]' );
ERROR 42000: Incorrect parameter count in the call to native function 'jsn_remove'

# not enough args
select jsn_remove( '$[1]' );
ERROR 42000: Incorrect parameter count in the call to native function 'jsn_remove'

# invalid json text
select jsn_remove( '[ 1, { "a": true, "b": false, "c": null }, 5 ', '$[1]', '$[2]' );
ERROR 22032: Invalid JSON text in argument 1 to function jsn_remove: "Must be a comma or ']' after an array element." at position 45 in '[ 1, { "a": true, "b": false, "c": null }, 5 '.

# invalid json path
select jsn_remove( '[ 1, { "a": true, "b": false, "c": null }, 5 ]', '$[1', '$[2]' );
ERROR 42000: Invalid JSON path expression. The error is around character position 3 in '$[1'.

# invalid json path
select jsn_remove( '[ 1, { "a": true, "b": false, "c": null }, 5 ]', '$[1]', '$[2' );
ERROR 42000: Invalid JSON path expression. The error is around character position 3 in '$[2'.

# Vacuous path expression
select jsn_remove( '[ 1, 2, 3 ]', '$' );
ERROR 42000: The path expression '$' is not allowed in this context.

# Vacuous path expression
select jsn_remove( '[ 1, 2, 3 ]', '$', '$[2]' );
ERROR 42000: The path expression '$' is not allowed in this context.

# Vacuous path expression
select jsn_remove( '[ 1, 2, 3 ]', '$[1]', '$' );
ERROR 42000: The path expression '$' is not allowed in this context.
select jsn_remove( '[ 1, 2, 3 ]', '$[*]' );
ERROR 42000: In this situation, path expressions may not contain the * and ** tokens.
select jsn_remove( '[ 1, 2, 3 ]', '$**[2]' );
ERROR 42000: In this situation, path expressions may not contain the * and ** tokens.
select jsn_remove( '[ 1, 2, 3 ]', '$[2]', '$[*]' );
ERROR 42000: In this situation, path expressions may not contain the * and ** tokens.
select jsn_remove( '[ 1, 2, 3 ]', '$[2]', '$**[2]' );
ERROR 42000: In this situation, path expressions may not contain the * and ** tokens.
select jsn_remove( '[ 1, 2, 3 ]', '$[0]' );
jsn_remove( '[ 1, 2, 3 ]', '$[0]' )
[2, 3]
select jsn_remove( '[ 1, 2, 3 ]', '$[1]' );
jsn_remove( '[ 1, 2, 3 ]', '$[1]' )
[1, 3]
select jsn_remove( '[ 1, 2, 3 ]', '$[2]' );
jsn_remove( '[ 1, 2, 3 ]', '$[2]' )
[1, 2]
select jsn_remove( '[ 1, 2, 3 ]', '$[3]' );
jsn_remove( '[ 1, 2, 3 ]', '$[3]' )
[1, 2, 3]
select jsn_remove( '[ 1, { "a": true, "b": false, "c": null }, 5 ]', '$[1]' );
jsn_remove( '[ 1, { "a": true, "b": false, "c": null }, 5 ]', '$[1]' )
[1, 5]
select jsn_remove( '[ { "a": { "a": true } } ]', '$**.a' );
ERROR 42000: In this situation, path expressions may not contain the * and ** tokens.
select jsn_remove( '[ { "a": true }, { "b": false }, { "c": null }, { "a": null } ]', '$[0].a', '$[2].c' );
jsn_remove( '[ { "a": true }, { "b": false }, { "c": null }, { "a": null } ]', '$[0].a', '$[2].c' )
[{}, {"b": false}, {}, {"a": null}]
select jsn_remove( '[ { "a": true }, { "b": [ { "c": { "a": true } }  ] }, { "c": null }, { "a": null } ]', '$**.a' );
ERROR 42000: In this situation, path expressions may not contain the * and ** tokens.
select jsn_remove( '{"id": 123, "name": "systemQA", "array": [1, 2, 3]}', '$[0]' );
jsn_remove( '{"id": 123, "name": "systemQA", "array": [1, 2, 3]}', '$[0]' )
{"id": 123, "name": "systemQA", "array": [1, 2, 3]}
CREATE TABLE jsn_remove_t(j JSON, p TEXT);
INSERT INTO jsn_remove_t(p) VALUES ('$.a'), ('$.b'), ('$.c');
UPDATE jsn_remove_t SET j = '{"a":1,"b":2,"c":3}';
SELECT j, p, jsn_remove(j, p) FROM jsn_remove_t ORDER BY p;
j	p	jsn_remove(j, p)
{"a": 1, "b": 2, "c": 3}	$.a	{"b": 2, "c": 3}
{"a": 1, "b": 2, "c": 3}	$.b	{"a": 1, "c": 3}
{"a": 1, "b": 2, "c": 3}	$.c	{"a": 1, "b": 2}
DROP TABLE jsn_remove_t;
SELECT JSN_REMOVE
(
'{"a" : "foo", "b" : [true, {"c" : 123}]}',
'$.b[ 1 ]'
);
JSN_REMOVE
(
'{"a" : "foo", "b" : [true, {"c" : 123}]}',
'$.b[ 1 ]'
)
{"a": "foo", "b": [true]}
SELECT JSN_REMOVE
(
'{ "a" : "foo", "b" : [ true, { "c" : 123, "c" : 456 } ] }',
'$.b[ 1 ].c'
);
JSN_REMOVE
(
'{ "a" : "foo", "b" : [ true, { "c" : 123, "c" : 456 } ] }',
'$.b[ 1 ].c'
)
{"a": "foo", "b": [true, {}]}
SELECT JSN_REMOVE
(
'{ "a" : "foo", "b" : [ true, { "c" : 123 } ] }',
'$.b[ 1 ].c'
);
JSN_REMOVE
(
'{ "a" : "foo", "b" : [ true, { "c" : 123 } ] }',
'$.b[ 1 ].c'
)
{"a": "foo", "b": [true, {}]}
SELECT JSN_REMOVE
(
'{ "a" : "foo", "b" : [ true, { "c" : 123, "d" : 456 } ] }',
'$.b[ 1 ].e'
);
JSN_REMOVE
(
'{ "a" : "foo", "b" : [ true, { "c" : 123, "d" : 456 } ] }',
'$.b[ 1 ].e'
)
{"a": "foo", "b": [true, {"c": 123, "d": 456}]}
# ----------------------------------------------------------------------
# Test of JSN_MERGE function.
# ----------------------------------------------------------------------

# not enough args
select jsn_merge();
ERROR 42000: Incorrect parameter count in the call to native function 'jsn_merge'

# not enough args
select jsn_merge( '[ 1, 2, 3 ]' );
ERROR 42000: Incorrect parameter count in the call to native function 'jsn_merge'
select jsn_merge( null, null );
jsn_merge( null, null )
NULL
select jsn_merge( null, '[ 1, 2, 3 ]' );
jsn_merge( null, '[ 1, 2, 3 ]' )
NULL
select jsn_merge( '[ 1, 2, 3 ]', null );
jsn_merge( '[ 1, 2, 3 ]', null )
NULL
select jsn_merge( null, '[ 1, 2, 3 ]', '[ 4, 5, 6 ]' );
jsn_merge( null, '[ 1, 2, 3 ]', '[ 4, 5, 6 ]' )
NULL
select jsn_merge( '[ 1, 2, 3 ]', null, '[ 4, 5, 6 ]' );
jsn_merge( '[ 1, 2, 3 ]', null, '[ 4, 5, 6 ]' )
NULL
select jsn_merge( '[ 1, 2, 3 ]', '[ 4, 5, 6 ]', null );
jsn_merge( '[ 1, 2, 3 ]', '[ 4, 5, 6 ]', null )
NULL
select jsn_merge( '[1, 2]', '[3, 4' );
ERROR 22032: Invalid JSON text in argument 2 to function jsn_merge: "Must be a comma or ']' after an array element." at position 5 in '[3, 4'.
select jsn_merge( '[1, 2', '[3, 4]' );
ERROR 22032: Invalid JSON text in argument 1 to function jsn_merge: "Must be a comma or ']' after an array element." at position 5 in '[1, 2'.
select jsn_merge( '1', '2' );
jsn_merge( '1', '2' )
[1, 2]
select jsn_merge( '1', '[2, 3]' );
jsn_merge( '1', '[2, 3]' )
[1, 2, 3]
select jsn_merge( '[1, 2]', '3' );
jsn_merge( '[1, 2]', '3' )
[1, 2, 3]
select jsn_merge( '1', '{ "a": 2 }' );
jsn_merge( '1', '{ "a": 2 }' )
[1, {"a": 2}]
select jsn_merge( '{ "a": 2 }', '1' );
jsn_merge( '{ "a": 2 }', '1' )
[{"a": 2}, 1]
select jsn_merge( '[1, 2]', '[3, 4]' );
jsn_merge( '[1, 2]', '[3, 4]' )
[1, 2, 3, 4]
select jsn_merge( '{ "a": 2 }', '{ "b": 3}' );
jsn_merge( '{ "a": 2 }', '{ "b": 3}' )
{"a": 2, "b": 3}
select jsn_merge( '[1, 2]', '{ "a": 2 }' );
jsn_merge( '[1, 2]', '{ "a": 2 }' )
[1, 2, {"a": 2}]
select jsn_merge( '{ "a": 2 }', '[1, 2]' );
jsn_merge( '{ "a": 2 }', '[1, 2]' )
[{"a": 2}, 1, 2]
select jsn_merge( '{"a": 1, "b": 2 }', '{"b": 3, "d": 4 }' );
jsn_merge( '{"a": 1, "b": 2 }', '{"b": 3, "d": 4 }' )
{"a": 1, "b": [2, 3], "d": 4}
select jsn_merge( '{"a": 1, "b": 2 }', '{"b": [3, 4], "d": 4 }' );
jsn_merge( '{"a": 1, "b": 2 }', '{"b": [3, 4], "d": 4 }' )
{"a": 1, "b": [2, 3, 4], "d": 4}
select jsn_merge( '{"a": 1, "b": [2, 3] }', '{"b": 4, "d": 4 }' );
jsn_merge( '{"a": 1, "b": [2, 3] }', '{"b": 4, "d": 4 }' )
{"a": 1, "b": [2, 3, 4], "d": 4}
select jsn_merge( '{"a": 1, "b": 2 }', '{"b": {"e": 7, "f": 8}, "d": 4 }' );
jsn_merge( '{"a": 1, "b": 2 }', '{"b": {"e": 7, "f": 8}, "d": 4 }' )
{"a": 1, "b": [2, {"e": 7, "f": 8}], "d": 4}
select jsn_merge( '{"b": {"e": 7, "f": 8}, "d": 4 }', '{"a": 1, "b": 2 }' );
jsn_merge( '{"b": {"e": 7, "f": 8}, "d": 4 }', '{"a": 1, "b": 2 }' )
{"a": 1, "b": [{"e": 7, "f": 8}, 2], "d": 4}
select jsn_merge( '{"a": 1, "b": [2, 9] }', '{"b": [10, 11], "d": 4 }' );
jsn_merge( '{"a": 1, "b": [2, 9] }', '{"b": [10, 11], "d": 4 }' )
{"a": 1, "b": [2, 9, 10, 11], "d": 4}
select jsn_merge( '{"a": 1, "b": [2, 9] }', '{"b": {"e": 7, "f": 8}, "d": 4 }' );
jsn_merge( '{"a": 1, "b": [2, 9] }', '{"b": {"e": 7, "f": 8}, "d": 4 }' )
{"a": 1, "b": [2, 9, {"e": 7, "f": 8}], "d": 4}
select jsn_merge( '{"b": {"e": 7, "f": 8}, "d": 4 }', '{"a": 1, "b": [2, 9] }' );
jsn_merge( '{"b": {"e": 7, "f": 8}, "d": 4 }', '{"a": 1, "b": [2, 9] }' )
{"a": 1, "b": [{"e": 7, "f": 8}, 2, 9], "d": 4}
select jsn_merge( '{"b": {"e": 7, "f": 8}, "d": 4 }', '{ "a": 1, "b": {"e": 20, "g": 21 } }' );
jsn_merge( '{"b": {"e": 7, "f": 8}, "d": 4 }', '{ "a": 1, "b": {"e": 20, "g": 21 } }' )
{"a": 1, "b": {"e": [7, 20], "f": 8, "g": 21}, "d": 4}
select jsn_merge( '1', '2', '3' );
jsn_merge( '1', '2', '3' )
[1, 2, 3]
select jsn_merge( '[1, 2 ]', '3', '[4, 5]' );
jsn_merge( '[1, 2 ]', '3', '[4, 5]' )
[1, 2, 3, 4, 5]
select jsn_merge
(
'{ "a": true, "b": { "c": 3, "d": 4 }, "e": [ 1, 2 ] }',
'{ "d": false, "b": { "g": 3, "d": 5 }, "f": [ 1, 2 ] }',
'{ "m": true, "b": { "h": 8, "d": 4 }, "e": [ 3, 4 ] }'
);
jsn_merge
(
'{ "a": true, "b": { "c": 3, "d": 4 }, "e": [ 1, 2 ] }',
'{ "d": false, "b": { "g": 3, "d": 5 }, "f": [ 1, 2 ] }',
'{ "m": true, "b": { "h": 8, "d": 4 }, "e": [ 3, 4 ] }'
)
{"a": true, "b": {"c": 3, "d": [4, 5, 4], "g": 3, "h": 8}, "d": false, "e": [1, 2, 3, 4], "f": [1, 2], "m": true}
CREATE TABLE jsn_merge_t(i INT, j JSON);
INSERT INTO jsn_merge_t VALUES
(0, NULL),
(1, 'true'),
(2, '5'),
(3, '[1,2]'),
(4, '{"a":["x", "y"]}'),
(5, '{"a":"b","c":"d"}');
SELECT t1.j, t2.j, jsn_merge(t1.j, t2.j), jsn_merge(t2.j, t1.j)
FROM jsn_merge_t t1, jsn_merge_t t2 ORDER BY t1.i, t2.i;
j	j	jsn_merge(t1.j, t2.j)	jsn_merge(t2.j, t1.j)
NULL	NULL	NULL	NULL
NULL	true	NULL	NULL
NULL	5	NULL	NULL
NULL	[1, 2]	NULL	NULL
NULL	{"a": ["x", "y"]}	NULL	NULL
NULL	{"a": "b", "c": "d"}	NULL	NULL
true	NULL	NULL	NULL
true	true	[true, true]	[true, true]
true	5	[true, 5]	[5, true]
true	[1, 2]	[true, 1, 2]	[1, 2, true]
true	{"a": ["x", "y"]}	[true, {"a": ["x", "y"]}]	[{"a": ["x", "y"]}, true]
true	{"a": "b", "c": "d"}	[true, {"a": "b", "c": "d"}]	[{"a": "b", "c": "d"}, true]
5	NULL	NULL	NULL
5	true	[5, true]	[true, 5]
5	5	[5, 5]	[5, 5]
5	[1, 2]	[5, 1, 2]	[1, 2, 5]
5	{"a": ["x", "y"]}	[5, {"a": ["x", "y"]}]	[{"a": ["x", "y"]}, 5]
5	{"a": "b", "c": "d"}	[5, {"a": "b", "c": "d"}]	[{"a": "b", "c": "d"}, 5]
[1, 2]	NULL	NULL	NULL
[1, 2]	true	[1, 2, true]	[true, 1, 2]
[1, 2]	5	[1, 2, 5]	[5, 1, 2]
[1, 2]	[1, 2]	[1, 2, 1, 2]	[1, 2, 1, 2]
[1, 2]	{"a": ["x", "y"]}	[1, 2, {"a": ["x", "y"]}]	[{"a": ["x", "y"]}, 1, 2]
[1, 2]	{"a": "b", "c": "d"}	[1, 2, {"a": "b", "c": "d"}]	[{"a": "b", "c": "d"}, 1, 2]
{"a": ["x", "y"]}	NULL	NULL	NULL
{"a": ["x", "y"]}	true	[{"a": ["x", "y"]}, true]	[true, {"a": ["x", "y"]}]
{"a": ["x", "y"]}	5	[{"a": ["x", "y"]}, 5]	[5, {"a": ["x", "y"]}]
{"a": ["x", "y"]}	[1, 2]	[{"a": ["x", "y"]}, 1, 2]	[1, 2, {"a": ["x", "y"]}]
{"a": ["x", "y"]}	{"a": ["x", "y"]}	{"a": ["x", "y", "x", "y"]}	{"a": ["x", "y", "x", "y"]}
{"a": ["x", "y"]}	{"a": "b", "c": "d"}	{"a": ["x", "y", "b"], "c": "d"}	{"a": ["b", "x", "y"], "c": "d"}
{"a": "b", "c": "d"}	NULL	NULL	NULL
{"a": "b", "c": "d"}	true	[{"a": "b", "c": "d"}, true]	[true, {"a": "b", "c": "d"}]
{"a": "b", "c": "d"}	5	[{"a": "b", "c": "d"}, 5]	[5, {"a": "b", "c": "d"}]
{"a": "b", "c": "d"}	[1, 2]	[{"a": "b", "c": "d"}, 1, 2]	[1, 2, {"a": "b", "c": "d"}]
{"a": "b", "c": "d"}	{"a": ["x", "y"]}	{"a": ["b", "x", "y"], "c": "d"}	{"a": ["x", "y", "b"], "c": "d"}
{"a": "b", "c": "d"}	{"a": "b", "c": "d"}	{"a": ["b", "b"], "c": ["d", "d"]}	{"a": ["b", "b"], "c": ["d", "d"]}
DROP TABLE jsn_merge_t;
SELECT JSN_MERGE
(
'{ "a" : "foo", "b" : [ true, { "c" : 123 } ] }',
'[ 5, 6]'
);
JSN_MERGE
(
'{ "a" : "foo", "b" : [ true, { "c" : 123 } ] }',
'[ 5, 6]'
)
[{"a": "foo", "b": [true, {"c": 123}]}, 5, 6]
SELECT JSN_MERGE
(
'{ "a" : "foo", "b" : [ true, { "c" : 123 } ] }',
'{ "b": [ false, 34 ] }'
);
JSN_MERGE
(
'{ "a" : "foo", "b" : [ true, { "c" : 123 } ] }',
'{ "b": [ false, 34 ] }'
)
{"a": "foo", "b": [true, {"c": 123}, false, 34]}
SELECT JSN_MERGE
(
'{ "a" : "foo", "b" : [ true, { "c" : 123 } ] }',
'{ "b": "bar" }'
);
JSN_MERGE
(
'{ "a" : "foo", "b" : [ true, { "c" : 123 } ] }',
'{ "b": "bar" }'
)
{"a": "foo", "b": [true, {"c": 123}, "bar"]}
SELECT JSN_MERGE
(
'{ "a" : { "b" : 1 } }',
'{ "a" : { "c" : 1 } }'
);
JSN_MERGE
(
'{ "a" : { "b" : 1 } }',
'{ "a" : { "c" : 1 } }'
)
{"a": {"b": 1, "c": 1}}
# ----------------------------------------------------------------------
# Test of JSN_TYPE function.
# ----------------------------------------------------------------------
select jsn_type('abc');
ERROR 22032: Invalid JSON text in argument 1 to function jsn_type: "Expect a value here." at position 0 in 'abc'.
select i, jsn_type(j) from t1;
i	jsn_type(j)
0	NULL
1	OBJECT
2	ARRAY
3	OBJECT
4	ARRAY
5	STRING
6	BOOLEAN
7	BOOLEAN
8	NULL
9	INTEGER
10	UNSIGNED INTEGER
11	INTEGER
12	INTEGER
13	INTEGER
14	INTEGER
15	INTEGER
16	INTEGER
17	INTEGER
18	INTEGER
19	UNSIGNED INTEGER
20	DOUBLE
21	DOUBLE
22	OBJECT
23	ARRAY
24	DATETIME
25	TIME
26	DATE
27	DATETIME
28	GEOMETRY
29	ARRAY
100	OBJECT
select jsn_type('{"a": 2}');
jsn_type('{"a": 2}')
OBJECT
select jsn_type('[1,2]');
jsn_type('[1,2]')
ARRAY
select jsn_type('"scalar string"');
jsn_type('"scalar string"')
STRING
select jsn_type('true');
jsn_type('true')
BOOLEAN
select jsn_type('false');
jsn_type('false')
BOOLEAN
select jsn_type('null');
jsn_type('null')
NULL
select jsn_type('1');
jsn_type('1')
INTEGER
select jsn_type('-0');
jsn_type('-0')
INTEGER
select jsn_type('-0.0');
jsn_type('-0.0')
DOUBLE
select jsn_type(-1);
ERROR 22032: Invalid data type for JSON data in argument 1 to function jsn_type; a JSON string or JSON type is required.
select jsn_type(CAST(1 AS UNSIGNED));
ERROR 22032: Invalid data type for JSON data in argument 1 to function jsn_type; a JSON string or JSON type is required.
select jsn_type('32767');
jsn_type('32767')
INTEGER
select jsn_type(PI());
ERROR 22032: Invalid data type for JSON data in argument 1 to function jsn_type; a JSON string or JSON type is required.
select jsn_type('3.14');
jsn_type('3.14')
DOUBLE
select jsn_type(CAST(CAST('2015-01-15' AS DATE) as CHAR CHARACTER SET 'utf8'));
ERROR 22032: Invalid JSON text in argument 1 to function jsn_type: "Nothing should follow the root object or array." at position 4 in '2015-01-15'.
create table keys1(i int, j json);
insert into keys1 select * from t1;
DROP TABLE t1;
create table rawOrders( orderID int, doc json );
insert into rawOrders values ( 1, '100' ), ( 2, '{ "id": 2, "quantity": 200 }' );
create table orders( orderID int, quantity int unsigned );
INSERT INTO orders( orderID, quantity )
SELECT
r.orderID,
CASE( JSN_TYPE( r.doc ) )
WHEN "INTEGER" THEN CAST( r.doc AS UNSIGNED INT )
WHEN "OBJECT" THEN CAST( JSN_EXTRACT( r.doc, '$.quantity' ) AS UNSIGNED INT )
ELSE NULL
END
FROM rawOrders r;
select * from rawOrders;
orderID	doc
1	100
2	{"id": 2, "quantity": 200}
select * from orders;
orderID	quantity
1	100
2	200
drop table rawOrders;
drop table orders;
# ----------------------------------------------------------------------
# Test of CAST(<column> AS JSON)
# ----------------------------------------------------------------------
create table t1(dati datetime, da date,
tim time, ts timestamp,
y year,
--
ti tinyint,   tiu tinyint unsigned,
si smallint,  siu smallint unsigned,
mi mediumint, miu mediumint unsigned,
i  int,       iu  int unsigned,
bi bigint,    biu bigint unsigned,
boo boolean,
--
dc decimal(5,2),
n numeric(5,2),
--
f float, d double,
bitt bit(10),
blb blob,
bin binary(10),
en enum('a','b','c'),
se set('a','b','c'),
--
ge geometry,
po point,
ls linestring,
py polygon,
js json
);
insert into t1 values('2014-11-25 18:00', '2014-11-25',
'18:00:59', '2014-11-25 18:00',
'1999',
--
127, 255,
32767, 65535,
8388607, 16777215, -- 3 bytes
2147483647, 4294967295, -- 4 bytes
9223372036854775807, 18446744073709551615,
true,
--
3.14,
3.14,
--
3.14, 3.14,
b'10101',
'10101abcde',
'10101abcde',
'b',
'a,c',
--
ST_GeomFromText('POINT(1 1)'),
ST_GeomFromText('POINT(1 1)'),
ST_GeomFromText('LINESTRING(0 0,1 1,2 2)'),
ST_GeomFromText('POLYGON((0 0,10 0,10 10,0 10,0 0),
                                            (5 5,7 5,7 7,5 7, 5 5))'),
'[123]'
                      );
select jsn_type(cast(dati as json)) from t1;
jsn_type(cast(dati as json))
DATETIME
select jsn_type(cast(da as json)) from t1;
jsn_type(cast(da as json))
DATE
select jsn_type(cast(tim as json)) from t1;
jsn_type(cast(tim as json))
TIME
select jsn_type(cast(ts as json)) from t1;
jsn_type(cast(ts as json))
TIMESTAMP
select jsn_type(cast(y as json)) from t1;
jsn_type(cast(y as json))
OPAQUE
select jsn_type(cast(ti as json)) from t1;
jsn_type(cast(ti as json))
INTEGER
select jsn_type(cast(tiu as json)) from t1;
jsn_type(cast(tiu as json))
UNSIGNED INTEGER
select jsn_type(cast(si as json)) from t1;
jsn_type(cast(si as json))
INTEGER
select jsn_type(cast(siu as json)) from t1;
jsn_type(cast(siu as json))
UNSIGNED INTEGER
select jsn_type(cast(mi as json)) from t1;
jsn_type(cast(mi as json))
INTEGER
select jsn_type(cast(miu as json)) from t1;
jsn_type(cast(miu as json))
UNSIGNED INTEGER
select jsn_type(cast(i as json)) from t1;
jsn_type(cast(i as json))
INTEGER
select jsn_type(cast(iu as json)) from t1;
jsn_type(cast(iu as json))
UNSIGNED INTEGER
select jsn_type(cast(bi as json)) from t1;
jsn_type(cast(bi as json))
INTEGER
select jsn_type(cast(biu as json)) from t1;
jsn_type(cast(biu as json))
UNSIGNED INTEGER
select jsn_type(cast(boo as json)) from t1;
jsn_type(cast(boo as json))
INTEGER
select jsn_type(cast(dc as json)) from t1;
jsn_type(cast(dc as json))
DECIMAL
select jsn_type(cast(f as json)) from t1;
jsn_type(cast(f as json))
DOUBLE
select jsn_type(cast(d as json)) from t1;
jsn_type(cast(d as json))
DOUBLE
select jsn_type(cast(bitt as json)) from t1;
jsn_type(cast(bitt as json))
BIT
select jsn_type(cast(blb as json)) from t1;
jsn_type(cast(blb as json))
BLOB
select jsn_type(cast(bin as json)) from t1;
jsn_type(cast(bin as json))
BLOB
select jsn_type(cast(en as json)) from t1;
jsn_type(cast(en as json))
STRING
select jsn_type(cast(se as json)) from t1;
jsn_type(cast(se as json))
STRING
select jsn_type(cast(ge as json)) from t1;
jsn_type(cast(ge as json))
GEOMETRY
select jsn_type(cast(po as json)) from t1;
jsn_type(cast(po as json))
GEOMETRY
select jsn_type(cast(ls as json)) from t1;
jsn_type(cast(ls as json))
GEOMETRY
select jsn_type(cast(py as json)) from t1;
jsn_type(cast(py as json))
GEOMETRY
select jsn_type(cast(js as json)) from t1;
jsn_type(cast(js as json))
ARRAY
select cast(dati as json) from t1;
cast(dati as json)
"2014-11-25 18:00:00.000000"
select cast(da as json) from t1;
cast(da as json)
"2014-11-25"
select cast(tim as json) from t1;
cast(tim as json)
"18:00:59.000000"
select cast(ts as json) from t1;
cast(ts as json)
"2014-11-25 18:00:00.000000"
select cast(y as json) from t1;
cast(y as json)
"base64:type13:MTk5OQ=="
select cast(ti as json) from t1;
cast(ti as json)
127
select cast(tiu as json) from t1;
cast(tiu as json)
255
select cast(si as json) from t1;
cast(si as json)
32767
select cast(siu as json) from t1;
cast(siu as json)
65535
select cast(mi as json) from t1;
cast(mi as json)
8388607
select cast(miu as json) from t1;
cast(miu as json)
16777215
select cast(i as json) from t1;
cast(i as json)
2147483647
select cast(iu as json) from t1;
cast(iu as json)
4294967295
select cast(bi as json) from t1;
cast(bi as json)
9223372036854775807
select cast(biu as json) from t1;
cast(biu as json)
18446744073709551615
select cast(boo as json) from t1;
cast(boo as json)
1
select cast(dc as json) from t1;
cast(dc as json)
3.14
select cast(f as json) from t1;
cast(f as json)
3.140000104904175
select cast(d as json) from t1;
cast(d as json)
3.14
select cast(bitt as json) from t1;
cast(bitt as json)
"base64:type16:ABU="
select cast(blb as json) from t1;
cast(blb as json)
"base64:type252:MTAxMDFhYmNkZQ=="
select cast(bin as json) from t1;
cast(bin as json)
"base64:type254:MTAxMDFhYmNkZQ=="
select cast(en as json) from t1;
cast(en as json)
"b"
select cast(se as json) from t1;
cast(se as json)
"a,c"
select cast(ge as json) from t1;
cast(ge as json)
"base64:type255:AAAAAAEBAAAAAAAAAAAA8D8AAAAAAADwPw=="
select cast(po as json) from t1;
cast(po as json)
"base64:type255:AAAAAAEBAAAAAAAAAAAA8D8AAAAAAADwPw=="
select cast(ls as json) from t1;
cast(ls as json)
"base64:type255:AAAAAAECAAAAAwAAAAAAAAAAAAAAAAAAAAAAAAAAAAAAAADwPwAAAAAAAPA/AAAAAAAAAEAAAAAA
AAAAQA=="
select cast(py as json) from t1;
cast(py as json)
"base64:type255:AAAAAAEDAAAAAgAAAAUAAAAAAAAAAAAAAAAAAAAAAAAAAAAAAAAAJEAAAAAAAAAAAAAAAAAAACRA
AAAAAAAAJEAAAAAAAAAAAAAAAAAAACRAAAAAAAAAAAAAAAAAAAAAAAUAAAAAAAAAAAAUQAAAAAAA
ABRAAAAAAAAAHEAAAAAAAAAUQAAAAAAAABxAAAAAAAAAHEAAAAAAAAAUQAAAAAAAABxAAAAAAAAA
FEAAAAAAAAAUQA=="
select cast(js as json) from t1;
cast(js as json)
[123]
drop table t1;
create table t1 ( c1 varchar(200) character set 'latin1',
c2 varchar(200) character set 'utf8' );
insert into t1 values ('[1,2]',  # legal json, but not utf-8
'[1,2 ');
select cast(c1 as json) from t1;
cast(c1 as json)
[1, 2]
select cast(c2 as json) from t1;
ERROR 22032: Invalid JSON text in argument 1 to function cast_as_json: "Must be a comma or ']' after an array element." at position 5 in '[1,2 '.
select cast(c2 as json) is null from t1;
ERROR 22032: Invalid JSON text in argument 1 to function cast_as_json: "Must be a comma or ']' after an array element." at position 5 in '[1,2 '.
drop table t1;
# ----------------------------------------------------------------------
# Test of CAST(literal AS JSON)
# ----------------------------------------------------------------------
select jsn_type(cast(cast('2014-11-25 18:00' as datetime) as json));
jsn_type(cast(cast('2014-11-25 18:00' as datetime) as json))
DATETIME
select jsn_type(cast(cast('2014-11-25' as date) as json));
jsn_type(cast(cast('2014-11-25' as date) as json))
DATE
select jsn_type(cast(cast('18:00:59' as time) as json));
jsn_type(cast(cast('18:00:59' as time) as json))
TIME
select jsn_type(cast(127 as json));
jsn_type(cast(127 as json))
INTEGER
select jsn_type(cast(255 as json));
jsn_type(cast(255 as json))
INTEGER
select jsn_type(cast(32767 as json));
jsn_type(cast(32767 as json))
INTEGER
select jsn_type(cast(65535 as json));
jsn_type(cast(65535 as json))
INTEGER
select jsn_type(cast(8388607 as json));
jsn_type(cast(8388607 as json))
INTEGER
select jsn_type(cast(16777215 as json));
jsn_type(cast(16777215 as json))
INTEGER
select jsn_type(cast(2147483647 as json));
jsn_type(cast(2147483647 as json))
INTEGER
select jsn_type(cast(4294967295 as json));
jsn_type(cast(4294967295 as json))
INTEGER
select jsn_type(cast(9223372036854775807 as json));
jsn_type(cast(9223372036854775807 as json))
INTEGER
select jsn_type(cast(18446744073709551615 as json));
jsn_type(cast(18446744073709551615 as json))
UNSIGNED INTEGER
select jsn_type(cast(true as json));
jsn_type(cast(true as json))
BOOLEAN
select jsn_type(cast(b'10101' as json));
jsn_type(cast(b'10101' as json))
BIT
select jsn_type(cast(cast(3.14 as decimal(5,2)) as json));
jsn_type(cast(cast(3.14 as decimal(5,2)) as json))
DECIMAL
select jsn_type(cast(3.14 as json));
jsn_type(cast(3.14 as json))
DECIMAL
select jsn_type(cast(3.14E30 as json));
jsn_type(cast(3.14E30 as json))
DOUBLE
select jsn_type(cast(cast('10101abcde' as binary) as json));
jsn_type(cast(cast('10101abcde' as binary) as json))
OPAQUE
select jsn_type(cast(ST_GeomFromText('POINT(1 1)') as json));
jsn_type(cast(ST_GeomFromText('POINT(1 1)') as json))
GEOMETRY
select jsn_type(cast(ST_GeomFromText('LINESTRING(0 0,1 1,2 2)') as json));
jsn_type(cast(ST_GeomFromText('LINESTRING(0 0,1 1,2 2)') as json))
GEOMETRY
select jsn_type(cast(ST_GeomFromText('POLYGON((0 0,10 0,10 10,0 10,0 0),
                                     (5 5,7 5,7 7,5 7, 5 5))') as json));
jsn_type(cast(ST_GeomFromText('POLYGON((0 0,10 0,10 10,0 10,0 0),
                                     (5 5,7 5,7 7,5 7, 5 5))') as json))
GEOMETRY
select jsn_type(cast(null as json));
jsn_type(cast(null as json))
NULL
select jsn_type(cast(null as json)) is null;
jsn_type(cast(null as json)) is null
1
select jsn_type(null) is null;
jsn_type(null) is null
1
select cast(cast('2014-11-25 18:00' as datetime) as json);
cast(cast('2014-11-25 18:00' as datetime) as json)
"2014-11-25 18:00:00.000000"
select cast(cast('2014-11-25' as date) as json);
cast(cast('2014-11-25' as date) as json)
"2014-11-25"
select cast(cast('18:00:59' as time) as json);
cast(cast('18:00:59' as time) as json)
"18:00:59.000000"
select cast(127 as json);
cast(127 as json)
127
select cast(255 as json);
cast(255 as json)
255
select cast(32767 as json);
cast(32767 as json)
32767
select cast(65535 as json);
cast(65535 as json)
65535
select cast(8388607 as json);
cast(8388607 as json)
8388607
select cast(16777215 as json);
cast(16777215 as json)
16777215
select cast(2147483647 as json);
cast(2147483647 as json)
2147483647
select cast(4294967295 as json);
cast(4294967295 as json)
4294967295
select cast(9223372036854775807 as json);
cast(9223372036854775807 as json)
9223372036854775807
select cast(18446744073709551615 as json);
cast(18446744073709551615 as json)
18446744073709551615
select cast(true as json);
cast(true as json)
true
select cast(b'10101' as json);
cast(b'10101' as json)
"base64:type16:FQ=="
select cast(cast(3.14 as decimal(5,2)) as json);
cast(cast(3.14 as decimal(5,2)) as json)
3.14
select cast(3.14 as json);
cast(3.14 as json)
3.14
select cast(3.14e0 as json);
cast(3.14e0 as json)
3.14
select cast(cast('10101abcde' as binary) as json);
cast(cast('10101abcde' as binary) as json)
"base64:type253:MTAxMDFhYmNkZQ=="
select cast(ST_GeomFromText('POINT(1 1)') as json);
cast(ST_GeomFromText('POINT(1 1)') as json)
"base64:type255:AAAAAAEBAAAAAAAAAAAA8D8AAAAAAADwPw=="
select cast(ST_GeomFromText('LINESTRING(0 0,1 1,2 2)') as json);
cast(ST_GeomFromText('LINESTRING(0 0,1 1,2 2)') as json)
"base64:type255:AAAAAAECAAAAAwAAAAAAAAAAAAAAAAAAAAAAAAAAAAAAAADwPwAAAAAAAPA/AAAAAAAAAEAAAAAA
AAAAQA=="
select cast(ST_GeomFromText('POLYGON((0 0,10 0,10 10,0 10,0 0),
                                     (5 5,7 5,7 7,5 7, 5 5))') as json);
cast(ST_GeomFromText('POLYGON((0 0,10 0,10 10,0 10,0 0),
                                     (5 5,7 5,7 7,5 7, 5 5))') as json)
"base64:type255:AAAAAAEDAAAAAgAAAAUAAAAAAAAAAAAAAAAAAAAAAAAAAAAAAAAAJEAAAAAAAAAAAAAAAAAAACRA
AAAAAAAAJEAAAAAAAAAAAAAAAAAAACRAAAAAAAAAAAAAAAAAAAAAAAUAAAAAAAAAAAAUQAAAAAAA
ABRAAAAAAAAAHEAAAAAAAAAUQAAAAAAAABxAAAAAAAAAHEAAAAAAAAAUQAAAAAAAABxAAAAAAAAA
FEAAAAAAAAAUQA=="
select cast(null as json);
cast(null as json)
NULL
select cast(null as json) is null;
cast(null as json) is null
1
create table t2(x int);
insert into t2 values (1), (2);
select x, cast(y as json) from (select x, cast(x as json) as y from t2) s;
x	cast(y as json)
1	1
2	2
select x, cast(y as json) from (select x, cast(cast(x as json) as char charset utf8) as y from t2) s;
x	cast(y as json)
1	1
2	2
select cast('"abc"' as json);
cast('"abc"' as json)
"abc"
select cast('abc' as json);
ERROR 22032: Invalid JSON text in argument 1 to function cast_as_json: "Expect a value here." at position 0 in 'abc'.
drop table t2;
# ----------------------------------------------------------------------
# Test of CAST(<select> AS JSON)
# ----------------------------------------------------------------------
select cast((select 1) as json);
cast((select 1) as json)
1
create table t(i int, j json, c char(10) character set 'utf8');
insert into t values (5, '6', '{}');
select cast((select i from t) as json);
cast((select i from t) as json)
5
select cast((select j from t) as json);
cast((select j from t) as json)
6
select cast((select c from t) as json);
cast((select c from t) as json)
{}
select cast((select cast(i as json) from t) as json);
cast((select cast(i as json) from t) as json)
5
select cast((select cast(j as json) from t) as json);
cast((select cast(j as json) from t) as json)
6
select cast((select cast(c as json) from t) as json);
cast((select cast(c as json) from t) as json)
{}
select cast((select i,i from t) as json);
ERROR 21000: Operand should contain 1 column(s)
select cast((select * from t) as json);
ERROR 21000: Operand should contain 1 column(s)
insert into t values (7, '8', '[]');
select cast((select i from t) as json);
ERROR 21000: Subquery returns more than 1 row
delete from t;
insert into t values (null, null, null);
select cast((select i from t) as json);
cast((select i from t) as json)
NULL
select cast((select j from t) as json);
cast((select j from t) as json)
NULL
select cast((select cast(i as json) from t) as json);
cast((select cast(i as json) from t) as json)
NULL
select cast((select cast(j as json) from t) as json);
cast((select cast(j as json) from t) as json)
NULL
select cast((select cast(c as json) from t) as json);
cast((select cast(c as json) from t) as json)
NULL
drop table t;
# ----------------------------------------------------------------------
# Test of generated columns that call JSON functions
# ----------------------------------------------------------------------
CREATE TABLE t(id INT, j JSON,
gc INT GENERATED ALWAYS AS (JSN_EXTRACT(j, '$[0]')));
INSERT INTO t(id, j) VALUES (0, '"5"'), (1, '[]'), (2, '[1,2]'), (3, '5');
INSERT INTO t(j) VALUES ('{}');
ERROR 22007: Truncated incorrect INT value: '{}'
INSERT INTO t(j) VALUES ('{"a":1}');
ERROR 22007: Truncated incorrect INT value: '{"a": 1}'
INSERT INTO t(j) VALUES ('"abc"');
ERROR 22007: Truncated incorrect INTEGER value: 'abc'
INSERT INTO t(j) VALUES ('');
ERROR 22032: Invalid JSON text: "Text only contains white space(s)" at position 0 in value (or column) ''.
INSERT INTO t(j) VALUES ('[');
ERROR 22032: Invalid JSON text: "Expect a value here." at position 1 in value (or column) '['.
SELECT * FROM t ORDER BY id;
id	j	gc
0	"5"	5
1	[]	NULL
2	[1, 2]	1
3	5	5
UPDATE t SET j = '[123]';
SELECT * FROM t ORDER BY id;
id	j	gc
0	[123]	123
1	[123]	123
2	[123]	123
3	[123]	123
UPDATE t SET j = '[';
ERROR 22032: Invalid JSON text: "Expect a value here." at position 1 in value (or column) '['.
DROP TABLE t;
CREATE TABLE t(id INT, j JSON,
gc JSON GENERATED ALWAYS AS (JSN_ARRAY(j)));
INSERT INTO t(id, j)
VALUES (1, '1'), (2, '[true, false]'), (3, '{"a":1,"b":2}');
INSERT INTO t(j) VALUES ('');
ERROR 22032: Invalid JSON text: "Text only contains white space(s)" at position 0 in value (or column) ''.
INSERT INTO t(j) VALUES ('[');
ERROR 22032: Invalid JSON text: "Expect a value here." at position 1 in value (or column) '['.
SELECT * FROM t ORDER BY id;
id	j	gc
1	1	[1]
2	[true, false]	[[true, false]]
3	{"a": 1, "b": 2}	[{"a": 1, "b": 2}]
UPDATE t SET j = '"abc"';
SELECT * FROM t ORDER BY id;
id	j	gc
1	"abc"	["abc"]
2	"abc"	["abc"]
3	"abc"	["abc"]
UPDATE t SET j = '[';
ERROR 22032: Invalid JSON text: "Expect a value here." at position 1 in value (or column) '['.
DROP TABLE t;
# ----------------------------------------------------------------------
# Test of JSN_KEYS function.
# ----------------------------------------------------------------------
select i, jsn_keys(j) from keys1;
i	jsn_keys(j)
0	NULL
1	["a"]
2	NULL
3	["a", "c", "ab", "bc"]
4	NULL
5	NULL
6	NULL
7	NULL
8	NULL
9	NULL
10	NULL
11	NULL
12	NULL
13	NULL
14	NULL
15	NULL
16	NULL
17	NULL
18	NULL
19	NULL
20	NULL
21	NULL
22	[]
23	NULL
24	NULL
25	NULL
26	NULL
27	NULL
28	NULL
29	NULL
100	["aaaaaaaaaaaaaaaaaaaaaaaaaaaaaaaaaaaaaaaaaaaaaaaaaaaaaaaaaaaaaaaaaaaaaaaaaaaaaaaaaaaaaaaaaaaaaaaaaaaaaaaaaaaaaaaaaaaaaaaaaaaaaaaaaaaaaaaaaaaaaaaaaaaaaaaaaaaaaaaaaaaaaaaaaaaaaaaaaaaaaaaaaaaaaaaaaaaaaaaaaaaaaaaaaaaaaaaaaaaaaaaaaaaaaaaaaaaaaaaaaaaaaaaaaaaaaaaaaaaaaaaaaaaaaaaaaaaaaaaaaaaaaaaaaaaaaaaaaaaaaaaaaaaaaaaaaaaaaaaaaaaaaaaaaaaaaaaaaaaaaaaaaaaaaaaaaaaaaaaaaaaaaaaaaaaaaaaaaaaaaaaaaaaaaaaaaaaaaaaaaaaaaaaaaaaaaaaaaaaaaaaaaaaaaaaaaaaaaaaaaaaaaaaaaaaaaaaaaaaaaaaaaaaaaaaaaaaaaaaaaaaaaaaaaaaaaaaaaaaaaaaaaaaaaaaaaaaaaaaaaaaaaaaaaaaaaaaaaaaaaaaaaaaaaaaaaaaaaaaaaaaaaaaaaaaaaaaaaaaaaaaaaaaaaaaaaaaaaaaaaaaaaaaaaaaaaaaaaaaaaaaaaaaaaaaaaaaaaaaaaaaaaaaaaaaaaaaaaaaaaaaaaaaaaaaaaaaaaaaaaaaaaaaaaaaaaaaaaaaaaaaaaaaaaaaaaaaaaaaaaaaaaaaaaaaaaaaaaaaaaaaaaaaaaaaaaaaaaaaaaaaaaaaaaaaaaaaaaaaaaaaaaaaaaaaaaaaaaaaaaaaaaaaaaaaaaaaaaaaaaaaaaaaaaaaaaaaaaaaaaaaaaaaaaaaaaaaaaaaaaaaaaaaaaaaaaaaaaaaaaaaaaaaaaaaaaaaaaaaaaaaaaaaaaaaaaaaaaaaaaaaaaaaaaaaaaaaaaaaaaaaaaaaaaaaaaaaaaaaaaaaaaaaaaaaaaaaaaaaaaaaaaaaaaaaaaaaaaaaaaaaaaaaaaaaaaaaaaaaaaaaaaaaaaaaaaaaaaaaaaaaaaaaaaaaaaaaaaaaaaaaaaaaaaaaaaaaaaaaaaaaaaaaaaaaaaaaaaaaaaaaaaaaaaaaaaaaaaaaaaaaaaaaaaaaaaaaaaaaaaaaaaaaaaaaaaaaaaaaaaaaaaaaaaaaaaaaaaaaaaaaaaaaaaaaaaaaaaaaaaaaaaaaaaaaaaaaaaaaaaaaaaaaaaaaaaaaaaaaaaaaaaaaaaaaaaaaaaaaaaaaaaaaaaaaaaaaaaaaaaaaaaaaaaaaaaaaaaaaaaaaaaaaaaaaaaaaaaaaaaaaaaaaaaaaaaaaaaaaaaaaaaaaaaaaaaaaaaaaaaaaaaaaaaaaaaaaaaaaaaaaaaaaaaaaaaaaaaaaaaaaaaaaaaaaaaaaaaaaaaaaaaaaaaaaaaaaaaaaaaaaaaaaaaaaaaaaaaaaaaaaaaaaaaaaaaaaaaaaaaaaaaaaaaaaaaaaaaaaaaaaaaaaaaaaaaaaaaaaaaaaaaaaaaaaaaaaaaaaaaaaaaaaaaaaaaaaaaaaaaaaaaaaaaaaaaaaaaaaaaaaaaaaaaaaaaaaaaaaaaaaaaaaaaaaaaaaaaaaaaaaaaaaaaaaaaaaaaaaaaaaaaaaaaaaaaaaaaaaaaaaaaaaaaaaaaaaaaaaaaaaaaaaaaaaaaaaaaaaaaaaaaaaaaaaaaaaaaaaaaaaaaaaaaaaaaaaaaaaaaaaaaaaaaaaaaaaaaaaaaaaaaaaaaaaaaaaaaaaaaaaaaaaaaaaaaaaaaaaaaaaaaaaaaaaaaaaaaaaaaaaaaaaaaaaaaaaaaaaaaaaaaaaaaaaaaaaaaaaaaaaaaaaaaaaaaaaaaaaaaaaaaaaaaaaaaaaaaaaaaaaaaaaaaaaaaaaaaaaaaaaaaaaaaaaaaaaaaaaaaaaaaaaaaaaaaaaaaaaaaaaaaaaaaaaaaaaaaaaaaaaaaaaaaaaaaaaaaaaaaaaaaaaaaaaaaaaaaaaaaaaaaaaaaaaaaaaaaaaaaaaaaaaaaaaaaaaaaaaaaaaaaaaaaaaaaaaaaaaaaaaaaaaaaaaaaaaaaaaaaaaaaaaaaaaaaaaaaaaaaaaaaaaaaaaaaaaaaaaaaaaaaaaaaaaaaaaaaaaaaaaaaaaaaaaaaaaaaaaaaaaaaaaaaaaaaaaaaaaaaaaaaaaaaaaaaaaaaaaaaaaaaaaaaaaaaaaaaaaaaaaaaaaaaaaaaaaaaaaaaaaaaaaaaaaaaaaaaaaaaaaaaaaaaaaaaaaaaaaaaaaaaaaaaaaaaaaaaaaaaaaaaaaaaaaaaaaaaaaaaaaaaaaaaaaaaaaaaaaaaaaaaaaaaaaaaaaaaaaaaaaaaaaaaaaaaaaaaaaaaaaaaaaaaaaaaaaaaaaaaaaaaaaaaaaaaaaaaaaaaaaaaaaaaaaaaaaaaaaaaaaaaaaaaaaaaaaaaaaaaaaaaaaaaaaaaaaaaaaaaaaaaaaaaaaaaaaaaaaaaaaaaaaaaaaaaaaaaaaaaaaaaaaaaaaaaaaaaaaaaaaaaaaaaaaaaaaaaaaaaaaaaaaaaaaaaaaaaaaaaaaaaaaaaaaaaaaaaaaaaaaaaaaaaaaaaaaaaaaaaaaaaaaaaaaaaaaaaaaaaaaaaaaaaaaaaaaaaaaaaaaaaaaaaaaaaaaaaaaaaaaaaaaaaaaaaaaaaaaaaaaaaaaaaaaaaaaaaaaaaaaaaaaaaaaaaaaaaaaaaaaaaaaaaaaaaaaaaaaaaaaaaaaaaaaaaaaaaaaaaaaaaaaaaaaaaaaaaaaaaaaaaaaaaaaaaaaaaaaaaaaaaaaaaaaaaaaaaaaaaaaaaaaaaaaaaaaaaaaaaaaaaaaaaaaaaaaaaaaaaaaaaaaaaaaaaaaaaaaaaaaaaaaaaaaaaaaaaaaaaaaaaaaaaaaaaaaaaaaaaaaaaaaaaaaaaaaaaaaaaaaaaaaaaaaaaaaaaaaaaaaaaaaaaaaaaaaaaaaaaaaaaaaaaaaaaaaaaaaaaaaaaaaaaaaaaaaaaaaaaaaaaaaaaaaaaaaaaaaaaaaaaaaaaaaaaaaaaaaaaaaaaaaaaaaaaaaaaaaaaaaaaaaaaaaaaaaaaaaaaaaaaaaaaaaaaaaaaaaaaaaaaaaaaaaaaaaaaaaaaaaaaaaaaaaaaaaaaaaaaaaaaaaaaaaaaaaaaaaaaaaaaaaaaaaaaaaaaaaaaaaaaaaaaaaaaaaaaaaaaaaaaaaaaaaaaaaaaaaaaaaaaaaaaaaaaaaaaaaaaaaaaaaaaaaaaaaaaaaaaaaaaaaaaaaaaaaaaaaaaaaaaaaaaaaaaaaaaaaaaaaaaaaaaaaaaaaaaaaaaaaaaaaaaaaaaaaaaaaaaaaaaaaaaaaaaaaaaaaaaaaaaaaaaaaaaaaaaaaaaaaaaaaaaaaaaaaaaaaaaaaaaaaaaaaaaaaaaaaaaaaaaaaaaaaaaaaaaaaaaaaaaaaaaaaaaaaaaaaaaaaaaaaaaaaaaaaaaaaaaaaaaaaaaaaaaaaaaaaaaaaaaaaaaaaaaaaaaaaaaaaaaaaaaaaaaaaaaaaaaaaaaaaaaaaaaaaaaaaaaaaaaaaaaaaaaaaaaaaaaaaaaaaaaaaaaaaaaaaaaaaaaaaaaaaaaaaaaaaaaaaaaaaaaaaaaaaaaaaaaaaaaaaaaaaaaaaaaaaaaaaaaaaaaaaaaaaaaaaaaaaaaaaaaaaaaaaaaaaaaaaaaaaaaaaaaaaaaaaaaaaaaaaaaaaaaaaaaaaaaaaaaaaaaaaaaaaaaaaaaaaaaaaaaaaaaaaaaaaaaaaaaaaaaaaaaaaaaaaaaaaaaaaaaaaaaaaaaaaaaaaaaaaaaaaaaaaaaaaaaaaaaaaaaaaaaaaaaaaaaaaaaaaaaaaaaaaaaaaaaaaaaaaaaaaaaaaaaaaaaaaaaaaaaaaaaaaaaaaaaaaaaaaaaaaaaaaaaaaaaaaaaaaaaaaaaaaaaaaaaaaaaaaaaaaaaaaaaaaaaaaaaaaaaaaaaaaaaaaaaaaaaaaaaaaaaaaaaaaaaaaaaaaaaaaaaaaaaaaaaaaaaaaaaaaaaaaaaaaaaaaaaaaaaaaaaaaaaaaaaaaaaaaaaaaaaaaaaaaaaaaaaaaaaaaaaaaaaaaaaaaaaaaaaaaaaaaaaaaaaaaaaaaaaaaaaaaaaaaaaaaaaaaaaaaaaaaaaaaaaaaaaaaaaaaaaaaaaaaaaaaaaaaaaaaaaaaaaaaaaaaaaaaaaaaaaaaaaaaaaaaaaaaaaaaaaaaaaaaaaaaaaaaaaaaaaaaaaaaaaaaaaaaaaaaaaaaaaaaaaaaaaaaaaaaaaaaaaaaaaaaaaaaaaaaaaaaaaaaaaaaaaaaaaaaaaaaaaaaaaaaaaaaaaaaaaaaaaaaaaaaaaaaaaaaaaaaaaaaaaaaaaaaaaaaaaaaaaaaaaaaaaaaaaaaaaaaaaaaaaaaaaaaaaaaaaaaaaaaaaaaaaaaaaaaaaaaaaaaaaaaaaaaaaaaaaaaaaaaaaaaaaaaaaaaaaaaaaaaaaaaaaaaaaaaaaaaaaaaaaaaaaaaaaaaaaaaaaaaaaaaaaaaaaaaaaaaaaaaaaaaaaaaaaaaaaaaaaaaaaaaaaaaaaaaaaaaaaaaaaaaaaaaaaaaaaaaaaaaaaaaaaaaaaaaaaaaaaaaaaaaaaaaaaaaaaaaaaaaaaaaaaaaaaaaaaaaaaaaaaaaaaaaaaaaaaaaaaaaaaaaaaaaaaaaaaaaaaaaaaaaaaaaaaaaaaaaaaaaaaaaaaaaaaaaaaaaaaaaaaaaaaaaaaaaaaaaaaaaaaaaaaaaaaaaaaaaaaaaaaaaaaaaaaaaaaaaaaaaaaaaaaaaaaaaaaaaaaaaaaaaaaaaaaaaaaaaaaaaaaaaaaaaaaaaaaaaaaaaaaaaaaaaaaaaaaaaaaaaaaaaaaaaaaaaaaaaaaaaaaaaaaaaaaaaaaaaaaaaaaaaaaaaaaaaaaaaaaaaaaaaaaaaaaaaaaaaaaaaaaaaaaaaaaaaaaaaaaaaaaaaaaaaaaaaaaaaaaaaaaaaaaaaaaaaaaaaaaaaaaaaaaaaaaaaaaaaaaaaaaaaaaaaaaaaaaaaaaaaaaaaaaaaaaaaaaaaaaaaaaaaaaaaaaaaaaaaaaaaaaaaaaaaaaaaaaaaaaaaaaaaaaaaaaaaaaaaaaaaaaaaaaaaaaaaaaaaaaaaaaaaaaaaaaaaaaaaaaaaaaaaaaaaaaaaaaaaaaaaaaaaaaaaaaaaaaaaaaaaaaaaaaaaaaaaaaaaaaaaaaaaaaaaaaaaaaaaaaaaaaaaaaaaaaaaaaaaaaaaaaaaaaaaaaaaaaaaaaaaaaaaaaaaaaaaaaaaaaaaaaaaaaaaaaaaaaaaaaaaaaaaaaaaaaaaaaaaaaaaaaaaaaaaaaaaaaaaaaaaaaaaaaaaaaaaaaaaaaaaaaaaaaaaaaaaaaaaaaaaaaaaaaaaaaaaaaaaaaaaaaaaaaaaaaaaaaaaaaaaaaaaaaaaaaaaaaaaaaaaaaaaaaaaaaaaaaaaaaaaaaaaaaaaaaaaaaaaaaaaaaaaaaaaaaaaaaaaaaaaaaaaaaaaaaaaaaaaaaaaaaaaaaaaaaaaaaaaaaaaaaaaaaaaaaaaaaaaaaaaaaaaaaaaaaaaaaaaaaaaaaaaaaaaaaaaaaaaaaaaaaaaaaaaaaaaaaaaaaaaaaaaaaaaaaaaaaaaaaaaaaaaaaaaaaaaaaaaaaaaaaaaaaaaaaaaaaaaaaaaaaaaaaaaaaaaaaaaaaaaaaaaaaaaaaaaaaaaaaaaaaaaaaaaaaaaaaaaaaaaaaaaaaaaaaaaaaaaaaaaaaaaaaaaaaaaaaaaaaaaaaaaaaaaaaaaaaaaaaaaaaaaaaaaaaaaaaaaaaaaaaaaaaaaaaaaaaaaaaaaaaaaaaaaaaaaaaaaaaaaaaaaaaaaaaaaaaaaaaaaaaaaaaaaaaaaaaaaaaaaaaaaaaaaaaaaaaaaaaaaaaaaaaaaaaaaaaaaaaaaaaaaaaaaaaaaaaaaaaaaaaaaaaaaaaaaaaaaaaaaaaaaaaaaaaaaaaaaaaaaaaaaaaaaaaaaaaaaaaaaaaaaaaaaaaaaaaaaaaaaaaaaaaaaaaaaaaaaaaaaaaaaaaaaaaaaaaaaaaaaaaaaaaaaaaaaaaaaaaaaaaaaaaaaaaaaaaaaaaaaaaaaaaaaaaaaaaaaaaaaaaaaaaaaaaaaaaaaaaaaaaaaaaaaaaaaaaaaaaaaaaaaaaaaaaaaaaaaaaaaaaaaaaaaaaaaaaaaaaaaaaaaaaaaaaaaaaaaaaaaaaaaaaaaaaaaaaaaaaaaaaaaaaaaaaaaaaaaaaaaaaaaaaaaaaaaaaaaaaaaaaaaaaaaaaaaaaaaaaaaaaaaaaaaaaaaaaaaaaaaaaaaaaaaaaaaaaaaaaaaaaaaaaaaaaaaaaaaaaaaaaaaaaaaaaaaaaaaaaaaaaaaaaaaaaaaaaaaaaaaaaaaaaaaaaaaaaaaaaaaaaaaaaaaaaaaaaaaaaaaaaaaaaaaaaaaaaaaaaaaaaaaaaaaaaaaaaaaaaaaaaaaaaaaaaaaaaaaaaaaaaaaaaaaaaaaaaaaaaaaaaaaaaaaaaaaaaaaaaaaaaaaaaaaaaaaaaaaaaaaaaaaaaaaaaaaaaaaaaaaaaaaaaaaaaaaaaaaaaaaaaaaaaaaaaaaaaaaaaaaaaaaaaaaaaaaaaaaaaaaaaaaaaaaaaaaaaaaaaaaaaaaaaaaaaaaaaaaaaaaaaaaaaaaaaaaaaaaaaaaaaaaaaaaaaaaaaaaaaaaaaaaaaaaaaaaaaaaaaaaaaaaaaaaaaaaaaaaaaaaaaaaaaaaaaaaaaaaaaaaaaaaaaaaaaaaaaaaaaaaaaaaaaaaaaaaaaaaaaaaaaaaaaaaaaaaaaaaaaaaaaaaaaaaaaaaaaaaaaaaaaaaaaaaaaaaaaaaaaaaaaaaaaaaaaaaaaaaaaaaaaaaaaaaaaaaaaaaaaaaaaaaaaaaaaaaaaaaaaaaaaaaaaaaaaaaaaaaaaaaaaaaaaaaaaaaaaaaaaaaaaaaaaaaaaaaaaaaaaaaaaaaaaaaaaaaaaaaaaaaaaaaaaaaaaaaaaaaaaaaaaaaaaaaaaaaaaaaaaaaaaaaaaaaaaaaaaaaaaaaaaaaaaaaaaaaaaaaaaaaaaaaaaaaaaaaaaaaaaaaaaaaaaaaaaaaaaaaaaaaaaaaaaaaaaaaaaaaaaaaaaaaaaaaaaaaaaaaaaaaaaaaaaaaaaaaaaaaaaaaaaaaaaaaaaaaaaaaaaaaaaaaaaaaaaaaaaaaaaaaaaaaaaaaaaaaaaaaaaaaaaaaaaaaaaaaaaaaaaaaaaaaaaaaaaaaaaaaaaaaaaaaaaaaaaaaaaaaaaaaaaaaaaaaaaaaaaaaaaaaaaaaaaaaaaaaaaaaaaaaaaaaaaaaaaaaaaaaaaaaaaaaaaaaaaaaaaaaaaaaaaaaaaaaaaaaaaaaaaaaaaaaaaaaaaaaaaaaaaaaaaaaaaaaaaaaaaaaaaaaaaaaaaaaaaaaaaaaaaaaaaaaaaaaaaaaaaaaaaaaaaaaaaaaaaaaaaaaaaaaaaaaaaaaaaaaaaaaaaaaaaaaaaaaaaaaaaaaaaaaaaaaaaaaaaaaaaaaaaaaaaaaaaaaaaaaaaaaaaaaaaaaaaaaaaaaaaaaaaaaaaaaaaaaaaaaaaaaaaaaaaaaaaaaaaaaaaaaaaaaaaaaaaaaaaaaaaaaaaaaaaaaaaaaaaaaaaaaaaaaaaaaaaaaaaaaaaaaaaaaaaaaaaaaaaaaaaaaaaaaaaaaaaaaaaaaaaaaaaaaaaaaaaaaaaaaaaaaaaaaaaaaaaaaaaaaaaaaaaaaaaaaaaaaaaaaaaaaaaaaaaaaaaaaaaaaaaaaaaaaaaaaaaaaaaaaaaaaaaaaaaaaaaaaaaaaaaaaaaaaaaaaaaaaaaaaaaaaaaaaaaaaaaaaaaaaaaaaaaaaaaaaaaaaaaaaaaaaaaaaaaaaaaaaaaaaaaaaaaaaaaaaaaaaaaaaaaaaaaaaaaaaaaaaaaaaaaaaaaaaaaaaaaaaaaaaaaaaaaaaaaaaaaaaaaaaaaaaaaaaaaaaaaaaaaaaaaaaaaaaaaaaaaaaaaaaaaaaaaaaaaaaaaaaaaaaaaaaaaaaaaaaaaaaaaaaaaaaaaaaaaaaaaaaaaaaaaaaaaaaaaaaaaaaaaaaaaaaaaaaaaaaaaaaaaaaaaaaaaaaaaaaaaaaaaaaaaaaaaaaaaaaaaaaaaaaaaaaaaaaaaaaaaaaaaaaaaaaaaaaaaaaaaaaaaaaaaaaaaaaaaaaaaaaaaaaaaaaaaaaaaaaaaaaaaaaaaaaaaaaaaaaaaaaaaaaaaaaaaaaaaaaaaaaaaaaaaaaaaaaaaaaaaaaaaaaaaaaaaaaaaaaaaaaaaaaaaaaaaaaaaaaaaaaaaaaaaaaaaaaaaaaaaaaaaaaaaaaaaaaaaaaaaaaaaaaaaaaaaaaaaaaaaaaaaaaaaaaaaaaaaaaaaaaaaaaaaaaaaaaaaaaaaaaaaaaaaaaaaaaaaaaaaaaaaaaaaaaaaaaaaaaaaaaaaaaaaaaaaaaaaaaaaaaaaaaaaaaaaaaaaaaaaaaaaaaaaaaaaaaaaaaaaaaaaaaaaaaaaaaaaaaaaaaaaaaaaaaaaaaaaaaaaaaaaaaaaaaaaaaaaaaaaaaaaaaaaaaaaaaaaaaaaaaaaaaaaaaaaaaaaaaaaaaaaaaaaaaaaaaaaaaaaaaaaaaaaaaaaaaaaaaaaaaaaaaaaaaaaaaaaaaaaaaaaaaaaaaaaaaaaaaaaaaaaaaaaaaaaaaaaaaaaaaaaaaaaaaaaaaaaaaaaaaaaaaaaaaaaaaaaaaaaaaaaaaaaaaaaaaaaaaaaaaaaaaaaaaaaaaaaaaaaaaaaaaaaaaaaaaaaaaaaaaaaaaaaaaaaaaaaaaaaaaaaaaaaaaaaaaaaaaaaaaaaaaaaaaaaaaaaaaaaaaaaaaaaaaaaaaaaaaaaaaaaaaaaaaaaaaaaaaaaaaaaaaaaaaaaaaaaaaaaaaaaaaaaaaaaaaaaaaaaaaaaaaaaaaaaaaaaaaaaaaaaaaaaaaaaaaaaaaaaaaaaaaaaaaaaaaaaaaaaaaaaaaaaaaaaaaaaaaaaaaaaaaaaaaaaaaaaaaaaaaaaaaaaaaaaaaaaaaaaaaaaaaaaaaaaaaaaaaaaaaaaaaaaaaaaaaaaaaaaaaaaaaaaaaaaaaaaaaaaaaaaaaaaaaaaaaaaaaaaaaaaaaaaaaaaaaaaaaaaaaaaaaaaaaaaaaaaaaaaaaaaaaaaaaaaaaaaaaaaaaaaaaaaaaaaaaaaaaaaaaaaaaaaaaaaaaaaaaaaaaaaaaaaaaaaaaaaaaaaaaaaaaaaaaaaaaaaaaaaaaaaaaaaaaaaaaaaaaaaaaaaaaaaaaaaaaaaaaaaaaaaaaaaaaaaaaaaaaaaaaaaaaaaaaaaaaaaaaaaaaaaaaaaaaaaaaaaaaaaaaaaaaaaaaaaaaaaaaaaaaaaaaaaaaaaaaaaaaaaaaaaaaaaaaaaaaaaaaaaaaaaaaaaaaaaaaaaaaaaaaaaaaaaaaaaaaaaaaaaaaaaaaaaaaaaaaaaaaaaaaaaaaaaaaaaaaaaaaaaaaaaaaaaaaaaaaaaaaaaaaaaaaaaaaaaaaaaaaaaaaaaaaaaaaaaaaaaaaaaaaaaaaaaaaaaaaaaaaaaaaaaaaaaaaaaaaaaaaaaaaaaaaaaaaaaaaaaaaaaaaaaaaaaaaaaaaaaaaaaaaaaaaaaaaaaaaaaaaaaaaaaaaaaaaaaaaaaaaaaaaaaaaaaaaaaaaaaaaaaaaaaaaaaaaaaaaaaaaaaaaaaaaaaaaaaaaaaaaaaaaaaaaaaaaaaaaaaaaaaaaaaaaaaaaaaaaaaaaaaaaaaaaaaaaaaaaaaaaaaaaaaaaaaaaaaaaaaaaaaaaaaaaaaaaaaaaaaaaaaaaaaaaaaaaaaaaaaaaaaaaaaaaaaaaaaaaaaaaaaaaaaaaaaaaaaaaaaaaaaaaaaaaaaaaaaaaaaaaaaaaaaaaaaaaaaaaaaaaaaaaaaaaaaaaaaaaaaaaaaaaaaaaaaaaaaaaaaaaaaaaaaaaaaaaaaaaaaaaaaaaaaaaaaaaaaaaaaaaaaaaaaaaaaaaaaaaaaaaaaaaaaaaaaaaaaaaaaaaaaaaaaaaaaaaaaaaaaaaaaaaaaaaaaaaaaaaaaaaaaaaaaaaaaaaaaaaaaaaaaaaaaaaaaaaaaaaaaaaaaaaaaaaaaaaaaaaaaaaaaaaaaaaaaaaaaaaaaaaaaaaaaaaaaaaaaaaaaaaaaaaaaaaaaaaaaaaaaaaaaaaaaaaaaaaaaaaaaaaaaaaaaaaaaaaaaaaaaaaaaaaaaaaaaaaaaaaaaaaaaaaaaaaaaaaaaaaaaaaaaaaaaaaaaaaaaaaaaaaaaaaaaaaaaaaaaaaaaaaaaaaaaaaaaaaaaaaaaaaaaaaaaaaaaaaaaaaaaaaaaaaaaaaaaaaaaaaaaaaaaaaaaaaaaaaaaaaaaaaaaaaaaaaaaaaaaaaaaaaaaaaaaaaaaaaaaaaaaaaaaaaaaaaaaaaaaaaaaaaaaaaaaaaaaaaaaaaaaaaaaaaaaaaaaaaaaaaaaaaaaaaaaaaaaaaaaaaaaaaaaaaaaaaaaaaaaaaaaaaaaaaaaaaaaaaaaaaaaaaaaaaaaaaaaaaaaaaaaaaaaaaaaaaaaaaaaaaaaaaaaaaaaaaaaaaaaaaaaaaaaaaaaaaaaaaaaaaaaaaaaaaaaaaaaaaaaaaaaaaaaaaaaaaaaaaaaaaaaaaaaaaaaaaaaaaaaaaaaaaaaaaaaaaaaaaaaaaaaaaaaaaaaaaaaaaaaaaaaaaaaaaaaaaaaaaaaaaaaaaaaaaaaaaaaaaaaaaaaaaaaaaaaaaaaaaaaaaaaaaaaaaaaaaaaaaaaaaaaaaaaaaaaaaaaaaaaaaaaaaaaaaaaaaaaaaaaaaaaaaaaaaaaaaaaaaaaaaaaaaaaaaaaaaaaaaaaaaaaaaaaaaaaaaaaaaaaaaaaaaaaaaaaaaaaaaaaaaaaaaaaaaaaaaaaaaaaaaaaaaaaaaaaaaaaaaaaaaaaaaaaaaaaaaaaaaaaaaaaaaaaaaaaaaaaaaaaaaaaaaaaaaaaaaaaaaaaaaaaaaaaaaaaaaaaaaaaaaaaaaaaaaaaaaaaaaaaaaaaaaaaaaaaaaaaaaaaaaaaaaaaaaaaaaaaaaaaaaaaaaaaaaaaaaaaaaaaaaaaaaaaaaaaaaaaaaaaaaaaaaaaaaaaaaaaaaaaaaaaaaaaaaaaaaaaaaaaaaaaaaaaaaaaaaaaaaaaaaaaaaaaaaaaaaaaaaaaaaaaaaaaaaaaaaaaaaaaaaaaaaaaaaaaaaaaaaaaaaaaaaaaaaaaaaaaaaaaaaaaaaaaaaaaaaaaaaaaaaaaaaaaaaaaaaaaaaaaaaaaaaaaaaaaaaaaaaaaaaaaaaaaaaaaaaaaaaaaaaaaaaaaaaaaaaaaaaaaaaaaaaaaaaaaaaaaaaaaaaaaaaaaaaaaaaaaaaaaaaaaaaaaaaaaaaaaaaaaaaaaaaaaaaaaaaaaaaaaaaaaaaaaaaaaaaaaaaaaaaaaaaaaaaaaaaaaaaaaaaaaaaaaaaaaaaaaaaaaaaaaaaaaaaaaaaaaaaaaaaaaaaaaaaaaaaaaaaaaaaaaaaaaaaaaaaaaaaaaaaaaaaaaaaaaaaaaaaaaaaaaaaaaaaaaaaaaaaaaaaaaaaaaaaaaaaaaaaaaaaaaaaaaaaaaaaaaaaaaaaaaaaaaaaaaaaaaaaaaaaaaaaaaaaaaaaaaaaaaaaaaaaaaaaaaaaaaaaaaaaaaaaaaaaaaaaaaaaaaaaaaaaaaaaaaaaaaaaaaaaaaaaaaaaaaaaaaaaaaaaaaaaaaaaaaaaaaaaaaaaaaaaaaaaaaaaaaaaaaaaaaaaaaaaaaaaaaaaaaaaaaaaaaaaaaaaaaaaaaaaaaaaaaaaaaaaaaaaaaaaaaaaaaaaaaaaaaaaaaaaaaaaaaaaaaaaaaaaaaaaaaaaaaaaaaaaaaaaaaaaaaaaaaaaaaaaaaaaaaaaaaaaaaaaaaaaaaaaaaaaaaaaaaaaaaaaaaaaaaaaaaaaaaaaaaaaaaaaaaaaaaaaaaaaaaaaaaaaaaaaaaaaaaaaaaaaaaaaaaaaaaaaaaaaaaaaaaaaaaaaaaaaaaaaaaaaaaaaaaaaaaaaaaaaaaaaaaaaaaaaaaaaaaaaaaaaaaaaaaaaaaaaaaaaaaaaaaaaaaaaaaaaaaaaaaaaaaaaaaaaaaaaaaaaaaaaaaaaaaaaaaaaaaaaaaaaaaaaaaaaaaaaaaaaaaaaaaaaaaaaaaaaaaaaaaaaaaaaaaaaaaaaaaaaaaaaaaaaaaaaaaaaaaaaaaaaaaaaaaaaaaaaaaaaaaaaaaaaaaaaaaaaaaaaaaaaaaaaaaaaaaaaaaaaaaaaaaaaaaaaaaaaaaaaaaaaaaaaaaaaaaaaaaaaaaaaaaaaaaaaaaaaaaaaaaaaaaaaaaaaaaaaaaaaaaaaaaaaaaaaaaaaaaaaaaaaaaaaaaaaaaaaaaaaaaaaaaaaaaaaaaaaaaaaaaaaaaaaaaaaaaaaaaaaaaaaaaaaaaaaaaaaaaaaaaaaaaaaaaaaaaaaaaaaaaaaaaaaaaaaaaaaaaaaaaaaaaaaaaaaaaaaaaaaaaaaaaaaaaaaaaaaaaaaaaaaaaaaaaaaaaaaaaaaaaaaaaaaaaaaaaaaaaaaaaaaaaaaaaaaaaaaaaaaaaaaaaaaaaaaaaaaaaaaaaaaaaaaaaaaaaaaaaaaaaaaaaaaaaaaaaaaaaaaaaaaaaaaaaaaaaaaaaaaaaaaaaaaaaaaaaaaaaaaaaaaaaaaaaaaaaaaaaaaaaaaaaaaaaaaaaaaaaaaaaaaaaaaaaaaaaaaaaaaaaaaaaaaaaaaaaaaaaaaaaaaaaaaaaaaaaaaaaaaaaaaaaaaaaaaaaaaaaaaaaaaaaaaaaaaaaaaaaaaaaaaaaaaaaaaaaaaaaaaaaaaaaaaaaaaaaaaaaaaaaaaaaaaaaaaaaaaaaaaaaaaaaaaaaaaaaaaaaaaaaaaaaaaaaaaaaaaaaaaaaaaaaaaaaaaaaaaaaaaaaaaaaaaaaaaaaaaaaaaaaaaaaaaaaaaaaaaaaaaaaaaaaaaaaaaaaaaaaaaaaaaaaaaaaaaaaaaaaaaaaaaaaaaaaaaaaaaaaaaaaaaaaaaaaaaaaaaaaaaaaaaaaaaaaaaaaaaaaaaaaaaaaaaaaaaaaaaaaaaaaaaaaaaaaaaaaaaaaaaaaaaaaaaaaaaaaaaaaaaaaaaaaaaaaaaaaaaaaaaaaaaaaaaaaaaaaaaaaaaaaaaaaaaaaaaaaaaaaaaaaaaaaaaaaaaaaaaaaaaaaaaaaaaaaaaaaaaaaaaaaaaaaaaaaaaaaaaaaaaaaaaaaaaaaaaaaaaaaaaaaaaaaaaaaaaaaaaaaaaaaaaaaaaaaaaaaaaaaaaaaaaaaaaaaaaaaaaaaaaaaaaaaaaaaaaaaaaaaaaaaaaaaaaaaaaaaaaaaaaaaaaaaaaaaaaaaaaaaaaaaaaaaaaaaaaaaaaaaaaaaaaaaaaaaaaaaaaaaaaaaaaaaaaaaaaaaaaaaaaaaaaaaaaaaaaaaaaaaaaaaaaaaaaaaaaaaaaaaaaaaaaaaaaaaaaaaaaaaaaaaaaaaaaaaaaaaaaaaaaaaaaaaaaaaaaaaaaaaaaaaaaaaaaaaaaaaaaaaaaaaaaaaaaaaaaaaaaaaaaaaaaaaaaaaaaaaaaaaaaaaaaaaaaaaaaaaaaaaaaaaaaaaaaaaaaaaaaaaaaaaaaaaaaaaaaaaaaaaaaaaaaaaaaaaaaaaaaaaaaaaaaaaaaaaaaaaaaaaaaaaaaaaaaaaaaaaaaaaaaaaaaaaaaaaaaaaaaaaaaaaaaaaaaaaaaaaaaaaaaaaaaaaaaaaaaaaaaaaaaaaaaaaaaaaaaaaaaaaaaaaaaaaaaaaaaaaaaaaaaaaaaaaaaaaaaaaaaaaaaaaaaaaaaaaaaaaaaaaaaaaaaaaaaaaaaaaaaaaaaaaaaaaaaaaaaaaaaaaaaaaaaaaaaaaaaaaaaaaaaaaaaaaaaaaaaaaaaaaaaaaaaaaaaaaaaaaaaaaaaaaaaaaaaaaaaaaaaaaaaaaaaaaaaaaaaaaaaaaaaaaaaaaaaaaaaaaaaaaaaaaaaaaaaaaaaaaaaaaaaaaaaaaaaaaaaaaaaaaaaaaaaaaaaaaaaaaaaaaaaaaaaaaaaaaaaaaaaaaaaaaaaaaaaaaaaaaaaaaaaaaaaaaaaaaaaaaaaaaaaaaaaaaaaaaaaaaaaaaaaaaaaaaaaaaaaaaaaaaaaaaaaaaaaaaaaaaaaaaaaaaaaaaaaaaaaaaaaaaaaaaaaaaaaaaaaaaaaaaaaaaaaaaaaaaaaaaaaaaaaaaaaaaaaaaaaaaaaaaaaaaaaaaaaaaaaaaaaaaaaaaaaaaaaaaaaaaaaaaaaaaaaaaaaaaaaaaaaaaaaaaaaaaaaaaaaaaaaaaaaaaaaaaaaaaaaaaaaaaaaaaaaaaaaaaaaaaaaaaaaaaaaaaaaaaaaaaaaaaaaaaaaaaaaaaaaaaaaaaaaaaaaaaaaaaaaaaaaaaaaaaaaaaaaaaaaaaaaaaaaaaaaaaaaaaaaaaaaaaaaaaaaaaaaaaaaaaaaaaaaaaaaaaaaaaaaaaaaaaaaaaaaaaaaaaaaaaaaaaaaaaaaaaaaaaaaaaaaaaaaaaaaaaaaaaaaaaaaaaaaaaaaaaaaaaaaaaaaaaaaaaaaaaaaaaaaaaaaaaaaaaaaaaaaaaaaaaaaaaaaaaaaaaaaaaaaaaaaaaaaaaaaaaaaaaaaaaaaaaaaaaaaaaaaaaaaaaaaaaaaaaaaaaaaaaaaaaaaaaaaaaaaaaaaaaaaaaaaaaaaaaaaaaaaaaaaaaaaaaaaaaaaaaaaaaaaaaaaaaaaaaaaaaaaaaaaaaaaaaaaaaaaaaaaaaaaaaaaaaaaaaaaaaaaaaaaaaaaaaaaaaaaaaaaaaaaaaaaaaaaaaaaaaaaaaaaaaaaaaaaaaaaaaaaaaaaaaaaaaaaaaaaaaaaaaaaaaaaaaaaaaaaaaaaaaaaaaaaaaaaaaaaaaaaaaaaaaaaaaaaaaaaaaaaaaaaaaaaaaaaaaaaaaaaaaaaaaaaaaaaaaaaaaaaaaaaaaaaaaaaaaaaaaaaaaaaaaaaaaaaaaaaaaaaaaaaaaaaaaaaaaaaaaaaaaaaaaaaaaaaaaaaaaaaaaaaaaaaaaaaaaaaaaaaaaaaaaaaaaaaaaaaaaaaaaaaaaaaaaaaaaaaaaaaaaaaaaaaaaaaaaaaaaaaaaaaaaaaaaaaaaaaaaaaaaaaaaaaaaaaaaaaaaaaaaaaaaaaaaaaaaaaaaaaaaaaaaaaaaaaaaaaaaaaaaaaaaaaaaaaaaaaaaaaaaaaaaaaaaaaaaaaaaaaaaaaaaaaaaaaaaaaaaaaaaaaaaaaaaaaaaaaaaaaaaaaaaaaaaaaaaaaaaaaaaaaaaaaaaaaaaaaaaaaaaaaaaaaaaaaaaaaaaaaaaaaaaaaaaaaaaaaaaaaaaaaaaaaaaaaaaaaaaaaaaaaaaaaaaaaaaaaaaaaaaaaaaaaaaaaaaaaaaaaaaaaaaaaaaaaaaaaaaaaaaaaaaaaaaaaaaaaaaaaaaaaaaaaaaaaaaaaaaaaaaaaaaaaaaaaaaaaaaaaaaaaaaaaaaaaaaaaaaaaaaaaaaaaaaaaaaaaaaaaaaaaaaaaaaaaaaaaaaaaaaaaaaaaaaaaaaaaaaaaaaaaaaaaaaaaaaaaaaaaaaaaaaaaaaaaaaaaaaaaaaaaaaaaaaaaaaaaaaaaaaaaaaaaaaaaaaaaaaaaaaaaaaaaaaaaaaaaaaaaaaaaaaaaaaaaaaaaaaaaaaaaaaaaaaaaaaaaaaaaaaaaaaaaaaaaaaaaaaaaaaaaaaaaaaaaaaaaaaaaaaaaaaaaaaaaaaaaaaaaaaaaaaaaaaaaaaaaaaaaaaaaaaaaaaaaaaaaaaaaaaaaaaaaaaaaaaaaaaaaaaaaaaaaaaaaaaaaaaaaaaaaaaaaaaaaaaaaaaaaaaaaaaaaaaaaaaaaaaaaaaaaaaaaaaaaaaaaaaaaaaaaaaaaaaaaaaaaaaaaaaaaaaaaaaaaaaaaaaaaaaaaaaaaaaaaaaaaaaaaaaaaaaaaaaaaaaaaaaaaaaaaaaaaaaaaaaaaaaaaaaaaaaaaaaaaaaaaaaaaaaaaaaaaaaaaaaaaaaaaaaaaaaaaaaaaaaaaaaaaaaaaaaaaaaaaaaaaaaaaaaaaaaaaaaaaaaaaaaaaaaaaaaaaaaaaaaaaaaaaaaaaaaaaaaaaaaaaaaaaaaaaaaaaaaaaaaaaaaaaaaaaaaaaaaaaaaaaaaaaaaaaaaaaaaaaaaaaaaaaaaaaaaaaaaaaaaaaaaaaaaaaaaaaaaaaaaaaaaaaaaaaaaaaaaaaaaaaaaaaaaaaaaaaaaaaaaaaaaaaaaaaaaaaaaaaaaaaaaaaaaaaaaaaaaaaaaaaaaaaaaaaaaaaaaaaaaaaaaaaaaaaaaaaaaaaaaaaaaaaaaaaaaaaaaaaaaaaaaaaaaaaaaaaaaaaaaaaaaaaaaaaaaaaaaaaaaaaaaaaaaaaaaaaaaaaaaaaaaaaaaaaaaaaaaaaaaaaaaaaaaaaaaaaaaaaaaaaaaaaaaaaaaaaaaaaaaaaaaaaaaaaaaaaaaaaaaaaaaaaaaaaaaaaaaaaaaaaaaaaaaaaaaaaaaaaaaaaaaaaaaaaaaaaaaaaaaaaaaaaaaaaaaaaaaaaaaaaaaaaaaaaaaaaaaaaaaaaaaaaaaaaaaaaaaaaaaaaaaaaaaaaaaaaaaaaaaaaaaaaaaaaaaaaaaaaaaaaaaaaaaaaaaaaaaaaaaaaaaaaaaaaaaaaaaaaaaaaaaaaaaaaaaaaaaaaaaaaaaaaaaaaaaaaaaaaaaaaaaaaaaaaaaaaaaaaaaaaaaaaaaaaaaaaaaaaaaaaaaaaaaaaaaaaaaaaaaaaaaaaaaaaaaaaaaaaaaaaaaaaaaaaaaaaaaaaaaaaaaaaaaaaaaaaaaaaaaaaaaaaaaaaaaaaaaaaaaaaaaaaaaaaaaaaaaaaaaaaaaaaaaaaaaaaaaaaaaaaaaaaaaaaaaaaaaaaaaaaaaaaaaaaaaaaaaaaaaaaaaaaaaaaaaaaaaaaaaaaaaaaaaaaaaaaaaaaaaaaaaaaaaaaaaaaaaaaaaaaaaaaaaaaaaaaaaaaaaaaaaaaaaaaaaaaaaaaaaaaaaaaaaaaaaaaaaaaaaaaaaaaaaaaaaaaaaaaaaaaaaaaaaaaaaaaaaaaaaaaaaaaaaaaaaaaaaaaaaaaaaaaaaaaaaaaaaaaaaaaaaaaaaaaaaaaaaaaaaaaaaaaaaaaaaaaaaaaaaaaaaaaaaaaaaaaaaaaaaaaaaaaaaaaaaaaaaaaaaaaaaaaaaaaaaaaaaaaaaaaaaaaaaaaaaaaaaaaaaaaaaaaaaaaaaaaaaaaaaaaaaaaaaaaaaaaaaaaaaaaaaaaaaaaaaaaaaaaaaaaaaaaaaaaaaaaaaaaaaaaaaaaaaaaaaaaaaaaaaaaaaaaaaaaaaaaaaaaaaaaaaaaaaaaaaaaaaaaaaaaaaaaaaaaaaaaaaaaaaaaaaaaaaaaaaaaaaaaaaaaaaaaaaaaaaaaaaaaaaaaaaaaaaaaaaaaaaaaaaaaaaaaaaaaaaaaaaaaaaaaaaaaaaaaaaaaaaaaaaaaaaaaaaaaaaaaaaaaaaaaaaaaaaaaaaaaaaaaaaaaaaaaaaaaaaaaaaaaaaaaaaaaaaaaaaaaaaaaaaaaaaaaaaaaaaaaaaaaaaaaaaaaaaaaaaaaaaaaaaaaaaaaaaaaaaaaaaaaaaaaaaaaaaaaaaaaaaaaaaaaaaaaaaaaaaaaaaaaaaaaaaaaaaaaaaaaaaaaaaaaaaaaaaaaaaaaaaaaaaaaaaaaaaaaaaaaaaaaaaaaaaaaaaaaaaaaaaaaaaaaaaaaaaaaaaaaaaaaaaaaaaaaaaaaaaaaaaaaaaaaaaaaaaaaaaaaaaaaaaaaaaaaaaaaaaaaaaaaaaaaaaaaaaaaaaaaaaaaaaaaaaaaaaaaaaaaaaaaaaaaaaaaaaaaaaaaaaaaaaaaaaaaaaaaaaaaaaaaaaaaaaaaaaaaaaaaaaaaaaaaaaaaaaaaaaaaaaaaaaaaaaaaaaaaaaaaaaaaaaaaaaaaaaaaaaaaaaaaaaaaaaaaaaaaaaaaaaaaaaaaaaaaaaaaaaaaaaaaaaaaaaaaaaaaaaaaaaaaaaaaaaaaaaaaaaaaaaaaaaaaaaaaaaaaaaaaaaaaaaaaaaaaaaaaaaaaaaaaaaaaaaaaaaaaaaaaaaaaaaaaaaaaaaaaaaaaaaaaaaaaaaaaaaaaaaaaaaaaaaaaaaaaaaaaaaaaaaaaaaaaaaaaaaaaaaaaaaaaaaaaaaaaaaaaaaaaaaaaaaaaaaaaaaaaaaaaaaaaaaaaaaaaaaaaaaaaaaaaaaaaaaaaaaaaaaaaaaaaaaaaaaaaaaaaaaaaaaaaaaaaaaaaaaaaaaaaaaaaaaaaaaaaaaaaaaaaaaaaaaaaaaaaaaaaaaaaaaaaaaaaaaaaaaaaaaaaaaaaaaaaaaaaaaaaaaaaaaaaaaaaaaaaaaaaaaaaaaaaaaaaaaaaaaaaaaaaaaaaaaaaaaaaaaaaaaaaaaaaaaaaaaaaaaaaaaaaaaaaaaaaaaaaaaaaaaaaaaaaaaaaaaaaaaaaaaaaaaaaaaaaaaaaaaaaaaaaaaaaaaaaaaaaaaaaaaaaaaaaaaaaaaaaaaaaaaaaaaaaaaaaaaaaaaaaaaaaaaaaaaaaaaaaaaaaaaaaaaaaaaaaaaaaaaaaaaaaaaaaaaaaaaaaaaaaaaaaaaaaaaaaaaaaaaaaaaaaaaaaaaaaaaaaaaaaaaaaaaaaaaaaaaaaaaaaaaaaaaaaaaaaaaaaaaaaaaaaaaaaaaaaaaaaaaaaaaaaaaaaaaaaaaaaaaaaaaaaaaaaaaaaaaaaaaaaaaaaaaaaaaaaaaaaaaaaaaaaaaaaaaaaaaaaaaaaaaaaaaaaaaaaaaaaaaaaaaaaaaaaaaaaaaaaaaaaaaaaaaaaaaaaaaaaaaaaaaaaaaaaaaaaaaaaaaaaaaaaaaaaaaaaaaaaaaaaaaaaaaaaaaaaaaaaaaaaaaaaaaaaaaaaaaaaaaaaaaaaaaaaaaaaaaaaaaaaaaaaaaaaaaaaaaaaaaaaaaaaaaaaaaaaaaaaaaaaaaaaaaaaaaaaaaaaaaaaaaaaaaaaaaaaaaaaaaaaaaaaaaaaaaaaaaaaaaaaaaaaaaaaaaaaaaaaaaaaaaaaaaaaaaaaaaaaaaaaaaaaaaaaaaaaaaaaaaaaaaaaaaaaaaaaaaaaaaaaaaaaaaaaaaaaaaaaaaaaaaaaaaaaaaaaaaaaaaaaaaaaaaaaaaaaaaaaaaaaaaaaaaaaaaaaaaaaaaaaaaaaaaaaaaaaaaaaaaaaaaaaaaaaaaaaaaaaaaaaaaaaaaaaaaaaaaaaaaaaaaaaaaaaaaaaaaaaaaaaaaaaaaaaaaaaaaaaaaaaaaaaaaaaaaaaaaaaaaaaaaaaaaaaaaaaaaaaaaaaaaaaaaaaaaaaaaaaaaaaaaaaaaaaaaaaaaaaaaaaaaaaaaaaaaaaaaaaaaaaaaaaaaaaaaaaaaaaaaaaaaaaaaaaaaaaaaaaaaaaaaaaaaaaaaaaaaaaaaaaaaaaaaaaaaaaaaaaaaaaaaaaaaaaaaaaaaaaaaaaaaaaaaaaaaaaaaaaaaaaaaaaaaaaaaaaaaaaaaaaaaaaaaaaaaaaaaaaaaaaaaaaaaaaaaaaaaaaaaaaaaaaaaaaaaaaaaaaaaaaaaaaaaaaaaaaaaaaaaaaaaaaaaaaaaaaaaaaaaaaaaaaaaaaaaaaaaaaaaaaaaaaaaaaaaaaaaaaaaaaaaaaaaaaaaaaaaaaaaaaaaaaaaaaaaaaaaaaaaaaaaaaaaaaaaaaaaaaaaaaaaaaaaaaaaaaaaaaaaaaaaaaaaaaaaaaaaaaaaaaaaaaaaaaaaaaaaaaaaaaaaaaaaaaaaaaaaaaaaaaaaaaaaaaaaaaaaaaaaaaaaaaaaaaaaaaaaaaaaaaaaaaaaaaaaaaaaaaaaaaaaaaaaaaaaaaaaaaaaaaaaaaaaaaaaaaaaaaaaaaaaaaaaaaaaaaaaaaaaaaaaaaaaaaaaaaaaaaaaaaaaaaaaaaaaaaaaaaaaaaaaaaaaaaaaaaaaaaaaaaaaaaaaaaaaaaaaaaaaaaaaaaaaaaaaaaaaaaaaaaaaaaaaaaaaaaaaaaaaaaaaaaaaaaaaaaaaaaaaaaaaaaaaaaaaaaaaaaaaaaaaaaaaaaaaaaaaaaaaaaaaaaaaaaaaaaaaaaaaaaaaaaaaaaaaaaaaaaaaaaaaaaaaaaaaaaaaaaaaaaaaaaaaaaaaaaaaaaaaaaaaaaaaaaaaaaaaaaaaaaaaaaaaaaaaaaaaaaaaaaaaaaaaaaaaaaaaaaaaaaaaaaaaaaaaaaaaaaaaaaaaaaaaaaaaaaaaaaaaaaaaaaaaaaaaaaaaaaaaaaaaaaaaaaaaaaaaaaaaaaaaaaaaaaaaaaaaaaaaaaaaaaaaaaaaaaaaaaaaaaaaaaaaaaaaaaaaaaaaaaaaaaaaaaaaaaaaaaaaaaaaaaaaaaaaaaaaaaaaaaaaaaaaaaaaaaaaaaaaaaaaaaaaaaaaaaaaaaaaaaaaaaaaaaaaaaaaaaaaaaaaaaaaaaaaaaaaaaaaaaaaaaaaaaaaaaaaaaaaaaaaaaaaaaaaaaaaaaaaaaaaaaaaaaaaaaaaaaaaaaaaaaaaaaaaaaaaaaaaaaaaaaaaaaaaaaaaaaaaaaaaaaaaaaaaaaaaaaaaaaaaaaaaaaaaaaaaaaaaaaaaaaaaaaaaaaaaaaaaaaaaaaaaaaaaaaaaaaaaaaaaaaaaaaaaaaaaaaaaaaaaaaaaaaaaaaaaaaaaaaaaaaaaaaaaaaaaaaaaaaaaaaaaaaaaaaaaaaaaaaaaaaaaaaaaaaaaaaaaaaaaaaaaaaaaaaaaaaaaaaaaaaaaaaaaaaaaaaaaaaaaaaaaaaaaaaaaaaaaaaaaaaaaaaaaaaaaaaaaaaaaaaaaaaaaaaaaaaaaaaaaaaaaaaaaaaaaaaaaaaaaaaaaaaaaaaaaaaaaaaaaaaaaaaaaaaaaaaaaaaaaaaaaaaaaaaaaaaaaaaaaaaaaaaaaaaaaaaaaaaaaaaaaaaaaaaaaaaaaaaaaaaaaaaaaaaaaaaaaaaaaaaaaaaaaaaaaaaaaaaaaaaaaaaaaaaaaaaaaaaaaaaaaaaaaaaaaaaaaaaaaaaaaaaaaaaaaaaaaaaaaaaaaaaaaaaaaaaaaaaaaaaaaaaaaaaaaaaaaaaaaaaaaaaaaaaaaaaaaaaaaaaaaaaaaaaaaaaaaaaaaaaaaaaaaaaaaaaaaaaaaaaaaaaaaaaaaaaaaaaaaaaaaaaaaaaaaaaaaaaaaaaaaaaaaaaaaaaaaaaaaaaaaaaaaaaaaaaaaaaaaaaaaaaaaaaaaaaaaaaaaaaaaaaaaaaaaaaaaaaaaaaaaaaaaaaaaaaaaaaaaaaaaaaaaaaaaaaaaaaaaaaaaaaaaaaaaaaaaaaaaaaaaaaaaaaaaaaaaaaaaaaaaaaaaaaaaaaaaaaaaaaaaaaaaaaaaaaaaaaaaaaaaaaaaaaaaaaaaaaaaaaaaaaaaaaaaaaaaaaaaaaaaaaaaaaaaaaaaaaaaaaaaaaaaaaaaaaaaaaaaaaaaaaaaaaaaaaaaaaaaaaaaaaaaaaaaaaaaaaaaaaaaaaaaaaaaaaaaaaaaaaaaaaaaaaaaaaaaaaaaaaaaaaaaaaaaaaaaaaaaaaaaaaaaaaaaaaaaaaaaaaaaaaaaaaaaaaaaaaaaaaaaaaaaaaaaaaaaaaaaaaaaaaaaaaaaaaaaaaaaaaaaaaaaaaaaaaaaaaaaaaaaaaaaaaaaaaaaaaaaaaaaaaaaaaaaaaaaaaaaaaaaaaaaaaaaaaaaaaaaaaaaaaaaaaaaaaaaaaaaaaaaaaaaaaaaaaaaaaaaaaaaaaaaaaaaaaaaaaaaaaaaaaaaaaaaaaaaaaaaaaaaaaaaaaaaaaaaaaaaaaaaaaaaaaaaaaaaaaaaaaaaaaaaaaaaaaaaaaaaaaaaaaaaaaaaaaaaaaaaaaaaaaaaaaaaaaaaaaaaaaaaaaaaaaaaaaaaaaaaaaaaaaaaaaaaaaaaaaaaaaaaaaaaaaaaaaaaaaaaaaaaaaaaaaaaaaaaaaaaaaaaaaaaaaaaaaaaaaaaaaaaaaaaaaaaaaaaaaaaaaaaaaaaaaaaaaaaaaaaaaaaaaaaaaaaaaaaaaaaaaaaaaaaaaaaaaaaaaaaaaaaaaaaaaaaaaaaaaaaaaaaaaaaaaaaaaaaaaaaaaaaaaaaaaaaaaaaaaaaaaaaaaaaaaaaaaaaaaaaaaaaaaaaaaaaaaaaaaaaaaaaaaaaaaaaaaaaaaaaaaaaaaaaaaaaaaaaaaaaaaaaaaaaaaaaaaaaaaaaaaaaaaaaaaaaaaaaaaaaaaaaaaaaaaaaaaaaaaaaaaaaaaaaaaaaaaaaaaaaaaaaaaaaaaaaaaaaaaaaaaaaaaaaaaaaaaaaaaaaaaaaaaaaaaaaaaaaaaaaaaaaaaaaaaaaaaaaaaaaaaaaaaaaaaaaaaaaaaaaaaaaaaaaaaaaaaaaaaaaaaaaaaaaaaaaaaaaaaaaaaaaaaaaaaaaaaaaaaaaaaaaaaaaaaaaaaaaaaaaaaaaaaaaaaaaaaaaaaaaaaaaaaaaaaaaaaaaaaaaaaaaaaaaaaaaaaaaaaaaaaaaaaaaaaaaaaaaaaaaaaaaaaaaaaaaaaaaaaaaaaaaaaaaaaaaaaaaaaaaaaaaaaaaaaaaaaaaaaaaaaaaaaaaaaaaaaaaaaaaaaaaaaaaaaaaaaaaaaaaaaaaaaaaaaaaaaaaaaaaaaaaaaaaaaaaaaaaaaaaaaaaaaaaaaaaaaaaaaaaaaaaaaaaaaaaaaaaaaaaaaaaaaaaaaaaaaaaaaaaaaaaaaaaaaaaaaaaaaaaaaaaaaaaaaaaaaaaaaaaaaaaaaaaaaaaaaaaaaaaaaaaaaaaaaaaaaaaaaaaaaaaaaaaaaaaaaaaaaaaaaaaaaaaaaaaaaaaaaaaaaaaaaaaaaaaaaaaaaaaaaaaaaaaaaaaaaaaaaaaaaaaaaaaaaaaaaaaaaaaaaaaaaaaaaaaaaaaaaaaaaaaaaaaaaaaaaaaaaaaaaaaaaaaaaaaaaaaaaaaaaaaaaaaaaaaaaaaaaaaaaaaaaaaaaaaaaaaaaaaaaaaaaaaaaaaaaaaaaaaaaaaaaaaaaaaaaaaaaaaaaaaaaaaaaaaaaaaaaaaaaaaaaaaaaaaaaaaaaaaaaaaaaaaaaaaaaaaaaaaaaaaaaaaaaaaaaaaaaaaaaaaaaaaaaaaaaaaaaaaaaaaaaaaaaaaaaaaaaaaaaaaaaaaaaaaaaaaaaaaaaaaaaaaaaaaaaaaaaaaaaaaaaaaaaaaaaaaaaaaaaaaaaaaaaaaaaaaaaaaaaaaaaaaaaaaaaaaaaaaaaaaaaaaaaaaaaaaaaaaaaaaaaaaaaaaaaaaaaaaaaaaaaaaaaaaaaaaaaaaaaaaaaaaaaaaaaaaaaaaaaaaaaaaaaaaaaaaaaaaaaaaaaaaaaaaaaaaaaaaaaaaaaaaaaaaaaaaaaaaaaaaaaaaaaaaaaaaaaaaaaaaaaaaaaaaaaaaaaaaaaaaaaaaaaaaaaaaaaaaaaaaaaaaaaaaaaaaaaaaaaaaaaaaaaaaaaaaaaaaaaaaaaaaaaaaaaaaaaaaaaaaaaaaaaaaaaaaaaaaaaaaaaaaaaaaaaaaaaaaaaaaaaaaaaaaaaaaaaaaaaaaaaaaaaaaaaaaaaaaaaaaaaaaaaaaaaaaaaaaaaaaaaaaaaaaaaaaaaaaaaaaaaaaaaaaaaaaaaaaaaaaaaaaaaaaaaaaaaaaaaaaaaaaaaaaaaaaaaaaaaaaaaaaaaaaaaaaaaaaaaaaaaaaaaaaaaaaaaaaaaaaaaaaaaaaaaaaaaaaaaaaaaaaaaaaaaaaaaaaaaaaaaaaaaaaaaaaaaaaaaaaaaaaaaaaaaaaaaaaaaaaaaaaaaaaaaaaaaaaaaaaaaaaaaaaaaaaaaaaaaaaaaaaaaaaaaaaaaaaaaaaaaaaaaaaaaaaaaaaaaaaaaaaaaaaaaaaaaaaaaaaaaaaaaaaaaaaaaaaaaaaaaaaaaaaaaaaaaaaaaaaaaaaaaaaaaaaaaaaaaaaaaaaaaaaaaaaaaaaaaaaaaaaaaaaaaaaaaaaaaaaaaaaaaaaaaaaaaaaaaaaaaaaaaaaaaaaaaaaaaaaaaaaaaaaaaaaaaaaaaaaaaaaaaaaaaaaaaaaaaaaaaaaaaaaaaaaaaaaaaaaaaaaaaaaaaaaaaaaaaaaaaaaaaaaaaaaaaaaaaaaaaaaaaaaaaaaaaaaaaaaaaaaaaaaaaaaaaaaaaaaaaaaaaaaaaaaaaaaaaaaaaaaaaaaaaaaaaaaaaaaaaaaaaaaaaaaaaaaaaaaaaaaaaaaaaaaaaaaaaaaaaaaaaaaaaaaaaaaaaaaaaaaaaaaaaaaaaaaaaaaaaaaaaaaaaaaaaaaaaaaaaaaaaaaaaaaaaaaaaaaaaaaaaaaaaaaaaaaaaaaaaaaaaaaaaaaaaaaaaaaaaaaaaaaaaaaaaaaaaaaaaaaaaaaaaaaaaaaaaaaaaaaaaaaaaaaaaaaaaaaaaaaaaaaaaaaaaaaaaaaaaaaaaaaaaaaaaaaaaaaaaaaaaaaaaaaaaaaaaaaaaaaaaaaaaaaaaaaaaaaaaaaaaaaaaaaaaaaaaaaaaaaaaaaaaaaaaaaaaaaaaaaaaaaaaaaaaaaaaaaaaaaaaaaaaaaaaaaaaaaaaaaaaaaaaaaaaaaaaaaaaaaaaaaaaaaaaaaaaaaaaaaaaaaaaaaaaaaaaaaaaaaaaaaaaaaaaaaaaaaaaaaaaaaaaaaaaaaaaaaaaaaaaaaaaaaaaaaaaaaaaaaaaaaaaaaaaaaaaaaaaaaaaaaaaaaaaaaaaaaaaaaaaaaaaaaaaaaaaaaaaaaaaaaaaaaaaaaaaaaaaaaaaaaaaaaaaaaaaaaaaaaaaaaaaaaaaaaaaaaaaaaaaaaaaaaaaaaaaaaaaaaaaaaaaaaaaaaaaaaaaaaaaaaaaaaaaaaaaaaaaaaaaaaaaaaaaaaaaaaaaaaaaaaaaaaaaaaaaaaaaaaaaaaaaaaaaaaaaaaaaaaaaaaaaaaaaaaaaaaaaaaaaaaaaaaaaaaaaaaaaaaaaaaaaaaaaaaaaaaaaaaaaaaaaaaaaaaaaaaaaaaaaaaaaaaaaaaaaaaaaaaaaaaaaaaaaaaaaaaaaaaaaaaaaaaaaaaaaaaaaaaaaaaaaaaaaaaaaaaaaaaaaaaaaaaaaaaaaaaaaaaaaaaaaaaaaaaaaaaaaaaaaaaaaaaaaaaaaaaaaaaaaaaaaaaaaaaaaaaaaaaaaaaaaaaaaaaaaaaaaaaaaaaaaaaaaaaaaaaaaaaaaaaaaaaaaaaaaaaaaaaaaaaaaaaaaaaaaaaaaaaaaaaaaaaaaaaaaaaaaaaaaaaaaaaaaaaaaaaaaaaaaaaaaaaaaaaaaaaaaaaaaaaaaaaaaaaaaaaaaaaaaaaaaaaaaaaaaaaaaaaaaaaaaaaaaaaaaaaaaaaaaaaaaaaaaaaaaaaaaaaaaaaaaaaaaaaaaaaaaaaaaaaaaaaaaaaaaaaaaaaaaaaaaaaaaaaaaaaaaaaaaaaaaaaaaaaaaaaaaaaaaaaaaaaaaaaaaaaaaaaaaaaaaaaaaaaaaaaaaaaaaaaaaaaaaaaaaaaaaaaaaaaaaaaaaaaaaaaaaaaaaaaaaaaaaaaaaaaaaaaaaaaaaaaaaaaaaaaaaaaaaaaaaaaaaaaaaaaaaaaaaaaaaaaaaaaaaaaaaaaaaaaaaaaaaaaaaaaaaaaaaaaaaaaaaaaaaaaaaaaaaaaaaaaaaaaaaaaaaaaaaaaaaaaaaaaaaaaaaaaaaaaaaaaaaaaaaaaaaaaaaaaaaaaaaaaaaaaaaaaaaaaaaaaaaaaaaaaaaaaaaaaaaaaaaaaaaaaaaaaaaaaaaaaaaaaaaaaaaaaaaaaaaaaaaaaaaaaaaaaaaaaaaaaaaaaaaaaaaaaaaaaaaaaaaaaaaaaaaaaaaaaaaaaaaaaaaaaaaaaaaaaaaaaaaaaaaaaaaaaaaaaaaaaaaaaaaaaaaaaaaaaaaaaaaaaaaaaaaaaaaaaaaaaaaaaaaaaaaaaaaaaaaaaaaaaaaaaaaaaaaaaaaaaaaaaaaaaaaaaaaaaaaaaaaaaaaaaaaaaaaaaaaaaaaaaaaaaaaaaaaaaaaaaaaaaaaaaaaaaaaaaaaaaaaaaaaaaaaaaaaaaaaaaaaaaaaaaaaaaaaaaaaaaaaaaaaaaaaaaaaaaaaaaaaaaaaaaaaaaaaaaaaaaaaaaaaaaaaaaaaaaaaaaaaaaaaaaaaaaaaaaaaaaaaaaaaaaaaaaaaaaaaaaaaaaaaaaaaaaaaaaaaaaaaaaaaaaaaaaaaaaaaaaaaaaaaaaaaaaaaaaaaaaaaaaaaaaaaaaaaaaaaaaaaaaaaaaaaaaaaaaaaaaaaaaaaaaaaaaaaaaaaaaaaaaaaaaaaaaaaaaaaaaaaaaaaaaaaaaaaaaaaaaaaaaaaaaaaaaaaaaaaaaaaaaaaaaaaaaaaaaaaaaaaaaaaaaaaaaaaaaaaaaaaaaaaaaaaaaaaaaaaaaaaaaaaaaaaaaaaaaaaaaaaaaaaaaaaaaaaaaaaaaaaaaaaaaaaaaaaaaaaaaaaaaaaaaaaaaaaaaaaaaaaaaaaaaaaaaaaaaaaaaaaaaaaaaaaaaaaaaaaaaaaaaaaaaaaaaaaaaaaaaaaaaaaaaaaaaaaaaaaaaaaaaaaaaaaaaaaaaaaaaaaaaaaaaaaaaaaaaaaaaaaaaaaaaaaaaaaaaaaaaaaaaaaaaaaaaaaaaaaaaaaaaaaaaaaaaaaaaaaaaaaaaaaaaaaaaaaaaaaaaaaaaaaaaaaaaaaaaaaaaaaaaaaaaaaaaaaaaaaaaaaaaaaaaaaaaaaaaaaaaaaaaaaaaaaaaaaaaaaaaaaaaaaaaaaaaaaaaaaaaaaaaaaaaaaaaaaaaaaaaaaaaaaaaaaaaaaaaaaaaaaaaaaaaaaaaaaaaaaaaaaaaaaaaaaaaaaaaaaaaaaaaaaaaaaaaaaaaaaaaaaaaaaaaaaaaaaaaaaaaaaaaaaaaaaaaaaaaaaaaaaaaaaaaaaaaaaaaaaaaaaaaaaaaaaaaaaaaaaaaaaaaaaaaaaaaaaaaaaaaaaaaaaaaaaaaaaaaaaaaaaaaaaaaaaaaaaaaaaaaaaaaaaaaaaaaaaaaaaaaaaaaaaaaaaaaaaaaaaaaaaaaaaaaaaaaaaaaaaaaaaaaaaaaaaaaaaaaaaaaaaaaaaaaaaaaaaaaaaaaaaaaaaaaaaaaaaaaaaaaaaaaaaaaaaaaaaaaaaaaaaaaaaaaaaaaaaaaaaaaaaaaaaaaaaaaaaaaaaaaaaaaaaaaaaaaaaaaaaaaaaaaaaaaaaaaaaaaaaaaaaaaaaaaaaaaaaaaaaaaaaaaaaaaaaaaaaaaaaaaaaaaaaaaaaaaaaaaaaaaaaaaaaaaaaaaaaaaaaaaaaaaaaaaaaaaaaaaaaaaaaaaaaaaaaaaaaaaaaaaaaaaaaaaaaaaaaaaaaaaaaaaaaaaaaaaaaaaaaaaaaaaaaaaaaaaaaaaaaaaaaaaaaaaaaaaaaaaaaaaaaaaaaaaaaaaaaaaaaaaaaaaaaaaaaaaaaaaaaaaaaaaaaaaaaaaaaaaaaaaaaaaaaaaaaaaaaaaaaaaaaaaaaaaaaaaaaaaaaaaaaaaaaaaaaaaaaaaaaaaaaaaaaaaaaaaaaaaaaaaaaaaaaaaaaaaaaaaaaaaaaaaaaaaaaaaaaaaaaaaaaaaaaaaaaaaaaaaaaaaaaaaaaaaaaaaaaaaaaaaaaaaaaaaaaaaaaaaaaaaaaaaaaaaaaaaaaaaaaaaaaaaaaaaaaaaaaaaaaaaaaaaaaaaaaaaaaaaaaaaaaaaaaaaaaaaaaaaaaaaaaaaaaaaaaaaaaaaaaaaaaaaaaaaaaaaaaaaaaaaaaaaaaaaaaaaaaaaaaaaaaaaaaaaaaaaaaaaaaaaaaaaaaaaaaaaaaaaaaaaaaaaaaaaaaaaaaaaaaaaaaaaaaaaaaaaaaaaaaaaaaaaaaaaaaaaaaaaaaaaaaaaaaaaaaaaaaaaaaaaaaaaaaaaaaaaaaaaaaaaaaaaaaaaaaaaaaaaaaaaaaaaaaaaaaaaaaaaaaaaaaaaaaaaaaaaaaaaaaaaaaaaaaaaaaaaaaaaaaaaaaaaaaaaaaaaaaaaaaaaaaaaaaaaaaaaaaaaaaaaaaaaaaaaaaaaaaaaaaaaaaaaaaaaaaaaaaaaaaaaaaaaaaaaaaaaaaaaaaaaaaaaaaaaaaaaaaaaaaaaaaaaaaaaaaaaaaaaaaaaaaaaaaaaaaaaaaaaaaaaaaaaaaaaaaaaaaaaaaaaaaaaaaaaaaaaaaaaaaaaaaaaaaaaaaaaaaaaaaaaaaaaaaaaaaaaaaaaaaaaaaaaaaaaaaaaaaaaaaaaaaaaaaaaaaaaaaaaaaaaaaaaaaaaaaaaaaaaaaaaaaaaaaaaaaaaaaaaaaaaaaaaaaaaaaaaaaaaaaaaaaaaaaaaaaaaaaaaaaaaaaaaaaaaaaaaaaaaaaaaaaaaaaaaaaaaaaaaaaaaaaaaaaaaaaaaaaaaaaaaaaaaaaaaaaaaaaaaaaaaaaaaaaaaaaaaaaaaaaaaaaaaaaaaaaaaaaaaaaaaaaaaaaaaaaaaaaaaaaaaaaaaaaaaaaaaaaaaaaaaaaaaaaaaaaaaaaaaaaaaaaaaaaaaaaaaaaaaaaaaaaaaaaaaaaaaaaaaaaaaaaaaaaaaaaaaaaaaaaaaaaaaaaaaaaaaaaaaaaaaaaaaaaaaaaaaaaaaaaaaaaaaaaaaaaaaaaaaaaaaaaaaaaaaaaaaaaaaaaaaaaaaaaaaaaaaaaaaaaaaaaaaaaaaaaaaaaaaaaaaaaaaaaaaaaaaaaaaaaaaaaaaaaaaaaaaaaaaaaaaaaaaaaaaaaaaaaaaaaaaaaaaaaaaaaaaaaaaaaaaaaaaaaaaaaaaaaaaaaaaaaaaaaaaaaaaaaaaaaaaaaaaaaaaaaaaaaaaaaaaaaaaaaaaaaaaaaaaaaaaaaaaaaaaaaaaaaaaaaaaaaaaaaaaaaaaaaaaaaaaaaaaaaaaaaaaaaaaaaaaaaaaaaaaaaaaaaaaaaaaaaaaaaaaaaaaaaaaaaaaaaaaaaaaaaaaaaaaaaaaaaaaaaaaaaaaaaaaaaaaaaaaaaaaaaaaaaaaaaaaaaaaaaaaaaaaaaaaaaaaaaaaaaaaaaaaaaaaaaaaaaaaaaaaaaaaaaaaaaaaaaaaaaaaaaaaaaaaaaaaaaaaaaaaaaaaaaaaaaaaaaaaaaaaaaaaaaaaaaaaaaaaaaaaaaaaaaaaaaaaaaaaaaaaaaaaaaaaaaaaaaaaaaaaaaaaaaaaaaaaaaaaaaaaaaaaaaaaaaaaaaaaaaaaaaaaaaaaaaaaaaaaaaaaaaaaaaaaaaaaaaaaaaaaaaaaaaaaaaaaaaaaaaaaaaaaaaaaaaaaaaaaaaaaaaaaaaaaaaaaaaaaaaaaaaaaaaaaaaaaaaaaaaaaaaaaaaaaaaaaaaaaaaaaaaaaaaaaaaaaaaaaaaaaaaaaaaaaaaaaaaaaaaaaaaaaaaaaaaaaaaaaaaaaaaaaaaaaaaaaaaaaaaaaaaaaaaaaaaaaaaaaaaaaaaaaaaaaaaaaaaaaaaaaaaaaaaaaaaaaaaaaaaaaaaaaaaaaaaaaaaaaaaaaaaaaaaaaaaaaaaaaaaaaaaaaaaaaaaaaaaaaaaaaaaaaaaaaaaaaaaaaaaaaaaaaaaaaaaaaaaaaaaaaaaaaaaaaaaaaaaaaaaaaaaaaaaaaaaaaaaaaaaaaaaaaaaaaaaaaaaaaaaaaaaaaaaaaaaaaaaaaaaaaaaaaaaaaaaaaaaaaaaaaaaaaaaaaaaaaaaaaaaaaaaaaaaaaaaaaaaaaaaaaaaaaaaaaaaaaaaaaaaaaaaaaaaaaaaaaaaaaaaaaaaaaaaaaaaaaaaaaaaaaaaaaaaaaaaaaaaaaaaaaaaaaaaaaaaaaaaaaaaaaaaaaaaaaaaaaaaaaaaaaaaaaaaaaaaaaaaaaaaaaaaaaaaaaaaaaaaaaaaaaaaaaaaaaaaaaaaaaaaaaaaaaaaaaaaaaaaaaaaaaaaaaaaaaaaaaaaaaaaaaaaaaaaaaaaaaaaaaaaaaaaaaaaaaaaaaaaaaaaaaaaaaaaaaaaaaaaaaaaaaaaaaaaaaaaaaaaaaaaaaaaaaaaaaaaaaaaaaaaaaaaaaaaaaaaaaaaaaaaaaaaaaaaaaaaaaaaaaaaaaaaaaaaaaaaaaaaaaaaaaaaaaaaaaaaaaaaaaaaaaaaaaaaaaaaaaaaaaaaaaaaaaaaaaaaaaaaaaaaaaaaaaaaaaaaaaaaaaaaaaaaaaaaaaaaaaaaaaaaaaaaaaaaaaaaaaaaaaaaaaaaaaaaaaaaaaaaaaaaaaaaaaaaaaaaaaaaaaaaaaaaaaaaaaaaaaaaaaaaaaaaaaaaaaaaaaaaaaaaaaaaaaaaaaaaaaaaaaaaaaaaaaaaaaaaaaaaaaaaaaaaaaaaaaaaaaaaaaaaaaaaaaaaaaaaaaaaaaaaaaaaaaaaaaaaaaaaaaaaaaaaaaaaaaaaaaaaaaaaaaaaaaaaaaaaaaaaaaaaaaaaaaaaaaaaaaaaaaaaaaaaaaaaaaaaaaaaaaaaaaaaaaaaaaaaaaaaaaaaaaaaaaaaaaaaaaaaaaaaaaaaaaaaaaaaaaaaaaaaaaaaaaaaaaaaaaaaaaaaaaaaaaaaaaaaaaaaaaaaaaaaaaaaaaaaaaaaaaaaaaaaaaaaaaaaaaaaaaaaaaaaaaaaaaaaaaaaaaaaaaaaaaaaaaaaaaaaaaaaaaaaaaaaaaaaaaaaaaaaaaaaaaaaaaaaaaaaaaaaaaaaaaaaaaaaaaaaaaaaaaaaaaaaaaaaaaaaaaaaaaaaaaaaaaaaaaaaaaaaaaaaaaaaaaaaaaaaaaaaaaaaaaaaaaaaaaaaaaaaaaaaaaaaaaaaaaaaaaaaaaaaaaaaaaaaaaaaaaaaaaaaaaaaaaaaaaaaaaaaaaaaaaaaaaaaaaaaaaaaaaaaaaaaaaaaaaaaaaaaaaaaaaaaaaaaaaaaaaaaaaaaaaaaaaaaaaaaaaaaaaaaaaaaaaaaaaaaaaaaaaaaaaaaaaaaaaaaaaaaaaaaaaaaaaaaaaaaaaaaaaaaaaaaaaaaaaaaaaaaaaaaaaaaaaaaaaaaaaaaaaaaaaaaaaaaaaaaaaaaaaaaaaaaaaaaaaaaaaaaaaaaaaaaaaaaaaaaaaaaaaaaaaaaaaaaaaaaaaaaaaaaaaaaaaaaaaaaaaaaaaaaaaaaaaaaaaaaaaaaaaaaaaaaaaaaaaaaaaaaaaaaaaaaaaaaaaaaaaaaaaaaaaaaaaaaaaaaaaaaaaaaaaaaaaaaaaaaaaaaaaaaaaaaaaaaaaaaaaaaaaaaaaaaaaaaaaaaaaaaaaaaaaaaaaaaaaaaaaaaaaaaaaaaaaaaaaaaaaaaaaaaaaaaaaaaaaaaaaaaaaaaaaaaaaaaaaaaaaaaaaaaaaaaaaaaaaaaaaaaaaaaaaaaaaaaaaaaaaaaaaaaaaaaaaaaaaaaaaaaaaaaaaaaaaaaaaaaaaaaaaaaaaaaaaaaaaaaaaaaaaaaaaaaaaaaaaaaaaaaaaaaaaaaaaaaaaaaaaaaaaaaaaaaaaaaaaaaaaaaaaaaaaaaaaaaaaaaaaaaaaaaaaaaaaaaaaaaaaaaaaaaaaaaaaaaaaaaaaaaaaaaaaaaaaaaaaaaaaaaaaaaaaaaaaaaaaaaaaaaaaaaaaaaaaaaaaaaaaaaaaaaaaaaaaaaaaaaaaaaaaaaaaaaaaaaaaaaaaaaaaaaaaaaaaaaaaaaaaaaaaaaaaaaaaaaaaaaaaaaaaaaaaaaaaaaaaaaaaaaaaaaaaaaaaaaaaaaaaaaaaaaaaaaaaaaaaaaaaaaaaaaaaaaaaaaaaaaaaaaaaaaaaaaaaaaaaaaaaaaaaaaaaaaaaaaaaaaaaaaaaaaaaaaaaaaaaaaaaaaaaaaaaaaaaaaaaaaaaaaaaaaaaaaaaaaaaaaaaaaaaaaaaaaaaaaaaaaaaaaaaaaaaaaaaaaaaaaaaaaaaaaaaaaaaaaaaaaaaaaaaaaaaaaaaaaaaaaaaaaaaaaaaaaaaaaaaaaaaaaaaaaaaaaaaaaaaaaaaaaaaaaaaaaaaaaaaaaaaaaaaaaaaaaaaaaaaaaaaaaaaaaaaaaaaaaaaaaaaaaaaaaaaaaaaaaaaaaaaaaaaaaaaaaaaaaaaaaaaaaaaaaaaaaaaaaaaaaaaaaaaaaaaaaaaaaaaaaaaaaaaaaaaaaaaaaaaaaaaaaaaaaaaaaaaaaaaaaaaaaaaaaaaaaaaaaaaaaaaaaaaaaaaaaaaaaaaaaaaaaaaaaaaaaaaaaaaaaaaaaaaaaaaaaaaaaaaaaaaaaaaaaaaaaaaaaaaaaaaaaaaaaaaaaaaaaaaaaaaaaaaaaaaaaaaaaaaaaaaaaaaaaaaaaaaaaaaaaaaaaaaaaaaaaaaaaaaaaaaaaaaaaaaaaaaaaaaaaaaaaaaaaaaaaaaaaaaaaaaaaaaaaaaaaaaaaaaaaaaaaaaaaaaaaaaaaaaaaaaaaaaaaaaaaaaaaaaaaaaaaaaaaaaaaaaaaaaaaaaaaaaaaaaaaaaaaaaaaaaaaaaaaaaaaaaaaaaaaaaaaaaaaaaaaaaaaaaaaaaaaaaaaaaaaaaaaaaaaaaaaaaaaaaaaaaaaaaaaaaaaaaaaaaaaaaaaaaaaaaaaaaaaaaaaaaaaaaaaaaaaaaaaaaaaaaaaaaaaaaaaaaaaaaaaaaaaaaaaaaaaaaaaaaaaaaaaaaaaaaaaaaaaaaaaaaaaaaaaaaaaaaaaaaaaaaaaaaaaaaaaaaaaaaaaaaaaaaaaaaaaaaaaaaaaaaaaaaaaaaaaaaaaaaaaaaaaaaaaaaaaaaaaaaaaaaaaaaaaaaaaaaaaaaaaaaaaaaaaaaaaaaaaaaaaaaaaaaaaaaaaaaaaaaaaaaaaaaaaaaaaaaaaaaaaaaaaaaaaaaaaaaaaaaaaaaaaaaaaaaaaaaaaaaaaaaaaaaaaaaaaaaaaaaaaaaaaaaaaaaaaaaaaaaaaaaaaaaaaaaaaaaaaaaaaaaaaaaaaaaaaaaaaaaaaaaaaaaaaaaaaaaaaaaaaaaaaaaaaaaaaaaaaaaaaaaaaaaaaaaaaaaaaaaaaaaaaaaaaaaaaaaaaaaaaaaaaaaaaaaaaaaaaaaaaaaaaaaaaaaaaaaaaaaaaaaaaaaaaaaaaaaaaaaaaaaaaaaaaaaaaaaaaaaaaaaaaaaaaaaaaaaaaaaaaaaaaaaaaaaaaaaaaaaaaaaaaaaaaaaaaaaaaaaaaaaaaaaaaaaaaaaaaaaaaaaaaaaaaaaaaaaaaaaaaaaaaaaaaaaaaaaaaaaaaaaaaaaaaaaaaaaaaaaaaaaaaaaaaaaaaaaaaaaaaaaaaaaaaaaaaaaaaaaaaaaaaaaaaaaaaaaaaaaaaaaaaaaaaaaaaaaaaaaaaaaaaaaaaaaaaaaaaaaaaaaaaaaaaaaaaaaaaaaaaaaaaaaaaaaaaaaaaaaaaaaaaaaaaaaaaaaaaaaaaaaaaaaaaaaaaaaaaaaaaaaaaaaaaaaaaaaaaaaaaaaaaaaaaaaaaaaaaaaaaaaaaaaaaaaaaaaaaaaaaaaaaaaaaaaaaaaaaaaaaaaaaaaaaaaaaaaaaaaaaaaaaaaaaaaaaaaaaaaaaaaaaaaaaaaaaaaaaaaaaaaaaaaaaaaaaaaaaaaaaaaaaaaaaaaaaaaaaaaaaaaaaaaaaaaaaaaaaaaaaaaaaaaaaaaaaaaaaaaaaaaaaaaaaaaaaaaaaaaaaaaaaaaaaaaaaaaaaaaaaaaaaaaaaaaaaaaaaaaaaaaaaaaaaaaaaaaaaaaaaaaaaaaaaaaaaaaaaaaaaaaaaaaaaaaaaaaaaaaaaaaaaaaaaaaaaaaaaaaaaaaaaaaaaaaaaaaaaaaaaaaaaaaaaaaaaaaaaaaaaaaaaaaaaaaaaaaaaaaaaaaaaaaaaaaaaaaaaaaaaaaaaaaaaaaaaaaaaaaaaaaaaaaaaaaaaaaaaaaaaaaaaaaaaaaaaaaaaaaaaaaaaaaaaaaaaaaaaaaaaaaaaaaaaaaaaaaaaaaaaaaaaaaaaaaaaaaaaaaaaaaaaaaaaaaaaaaaaaaaaaaaaaaaaaaaaaaaaaaaaaaaaaaaaaaaaaaaaaaaaaaaaaaaaaaaaaaaaaaaaaaaaaaaaaaaaaaaaaaaaaaaaaaaaaaaaaaaaaaaaaaaaaaaaaaaaaaaaaaaaaaaaaaaaaaaaaaaaaaaaaaaaaaaaaaaaaaaaaaaaaaaaaaaaaaaaaaaaaaaaaaaaaaaaaaaaaaaaaaaaaaaaaaaaaaaaaaaaaaaaaaaaaaaaaaaaaaaaaaaaaaaaaaaaaaaaaaaaaaaaaaaaaaaaaaaaaaaaaaaaaaaaaaaaaaaaaaaaaaaaaaaaaaaaaaaaaaaaaaaaaaaaaaaaaaaaaaaaaaaaaaaaaaaaaaaaaaaaaaaaaaaaaaaaaaaaaaaaaaaaaaaaaaaaaaaaaaaaaaaaaaaaaaaaaaaaaaaaaaaaaaaaaaaaaaaaaaaaaaaaaaaaaaaaaaaaaaaaaaaaaaaaaaaaaaaaaaaaaaaaaaaaaaaaaaaaaaaaaaaaaaaaaaaaaaaaaaaaaaaaaaaaaaaaaaaaaaaaaaaaaaaaaaaaaaaaaaaaaaaaaaaaaaaaaaaaaaaaaaaaaaaaaaaaaaaaaaaaaaaaaaaaaaaaaaaaaaaaaaaaaaaaaaaaaaaaaaaaaaaaaaaaaaaaaaaaaaaaaaaaaaaaaaaaaaaaaaaaaaaaaaaaaaaaaaaaaaaaaaaaaaaaaaaaaaaaaaaaaaaaaaaaaaaaaaaaaaaaaaaaaaaaaaaaaaaaaaaaaaaaaaaaaaaaaaaaaaaaaaaaaaaaaaaaaaaaaaaaaaaaaaaaaaaaaaaaaaaaaaaaaaaaaaaaaaaaaaaaaaaaaaaaaaaaaaaaaaaaaaaaaaaaaaaaaaaaaaaaaaaaaaaaaaaaaaaaaaaaaaaaaaaaaaaaaaaaaaaaaaaaaaaaaaaaaaaaaaaaaaaaaaaaaaaaaaaaaaaaaaaaaaaaaaaaaaaaaaaaaaaaaaaaaaaaaaaaaaaaaaaaaaaaaaaaaaaaaaaaaaaaaaaaaaaaaaaaaaaaaaaaaaaaaaaaaaaaaaaaaaaaaaaaaaaaaaaaaaaaaaaaaaaaaaaaaaaaaaaaaaaaaaaaaaaaaaaaaaaaaaaaaaaaaaaaaaaaaaaaaaaaaaaaaaaaaaaaaaaaaaaaaaaaaaaaaaaaaaaaaaaaaaaaaaaaaaaaaaaaaaaaaaaaaaaaaaaaaaaaaaaaaaaaaaaaaaaaaaaaaaaaaaaaaaaaaaaaaaaaaaaaaaaaaaaaaaaaaaaaaaaaaaaaaaaaaaaaaaaaaaaaaaaaaaaaaaaaaaaaaaaaaaaaaaaaaaaaaaaaaaaaaaaaaaaaaaaaaaaaaaaaaaaaaaaaaaaaaaaaaaaaaaaaaaaaaaaaaaaaaaaaaaaaaaaaaaaaaaaaaaaaaaaaaaaaaaaaaaaaaaaaaaaaaaaaaaaaaaaaaaaaaaaaaaaaaaaaaaaaaaaaaaaaaaaaaaaaaaaaaaaaaaaaaaaaaaaaaaaaaaaaaaaaaaaaaaaaaaaaaaaaaaaaaaaaaaaaaaaaaaaaaaaaaaaaaaaaaaaaaaaaaaaaaaaaaaaaaaaaaaaaaaaaaaaaaaaaaaaaaaaaaaaaaaaaaaaaaaaaaaaaaaaaaaaaaaaaaaaaaaaaaaaaaaaaaaaaaaaaaaaaaaaaaaaaaaaaaaaaaaaaaaaaaaaaaaaaaaaaaaaaaaaaaaaaaaaaaaaaaaaaaaaaaaaaaaaaaaaaaaaaaaaaaaaaaaaaaaaaaaaaaaaaaaaaaaaaaaaaaaaaaaaaaaaaaaaaaaaaaaaaaaaaaaaaaaaaaaaaaaaaaaaaaaaaaaaaaaaaaaaaaaaaaaaaaaaaaaaaaaaaaaaaaaaaaaaaaaaaaaaaaaaaaaaaaaaaaaaaaaaaaaaaaaaaaaaaaaaaaaaaaaaaaaaaaaaaaaaaaaaaaaaaaaaaaaaaaaaaaaaaaaaaaaaaaaaaaaaaaaaaaaaaaaaaaaaaaaaaaaaaaaaaaaaaaaaaaaaaaaaaaaaaaaaaaaaaaaaaaaaaaaaaaaaaaaaaaaaaaaaaaaaaaaaaaaaaaaaaaaaaaaaaaaaaaaaaaaaaaaaaaaaaaaaaaaaaaaaaaaaaaaaaaaaaaaaaaaaaaaaaaaaaaaaaaaaaaaaaaaaaaaaaaaaaaaaaaaaaaaaaaaaaaaaaaaaaaaaaaaaaaaaaaaaaaaaaaaaaaaaaaaaaaaaaaaaaaaaaaaaaaaaaaaaaaaaaaaaaaaaaaaaaaaaaaaaaaaaaaaaaaaaaaaaaaaaaaaaaaaaaaaaaaaaaaaaaaaaaaaaaaaaaaaaaaaaaaaaaaaaaaaaaaaaaaaaaaaaaaaaaaaaaaaaaaaaaaaaaaaaaaaaaaaaaaaaaaaaaaaaaaaaaaaaaaaaaaaaaaaaaaaaaaaaaaaaaaaaaaaaaaaaaaaaaaaaaaaaaaaaaaaaaaaaaaaaaaaaaaaaaaaaaaaaaaaaaaaaaaaaaaaaaaaaaaaaaaaaaaaaaaaaaaaaaaaaaaaaaaaaaaaaaaaaaaaaaaaaaaaaaaaaaaaaaaaaaaaaaaaaaaaaaaaaaaaaaaaaaaaaaaaaaaaaaaaaaaaaaaaaaaaaaaaaaaaaaaaaaaaaaaaaaaaaaaaaaaaaaaaaaaaaaaaaaaaaaaaaaaaaaaaaaaaaaaaaaaaaaaaaaaaaaaaaaaaaaaaaaaaaaaaaaaaaaaaaaaaaaaaaaaaaaaaaaaaaaaaaaaaaaaaaaaaaaaaaaaaaaaaaaaaaaaaaaaaaaaaaaaaaaaaaaaaaaaaaaaaaaaaaaaaaaaaaaaaaaaaaaaaaaaaaaaaaaaaaaaaaaaaaaaaaaaaaaaaaaaaaaaaaaaaaaaaaaaaaaaaaaaaaaaaaaaaaaaaaaaaaaaaaaaaaaaaaaaaaaaaaaaaaaaaaaaaaaaaaaaaaaaaaaaaaaaaaaaaaaaaaaaaaaaaaaaaaaaaaaaaaaaaaaaaaaaaaaaaaaaaaaaaaaaaaaaaaaaaaaaaaaaaaaaaaaaaaaaaaaaaaaaaaaaaaaaaaaaaaaaaaaaaaaaaaaaaaaaaaaaaaaaaaaaaaaaaaaaaaaaaaaaaaaaaaaaaaaaaaaaaaaaaaaaaaaaaaaaaaaaaaaaaaaaaaaaaaaaaaaaaaaaaaaaaaaaaaaaaaaaaaaaaaaaaaaaaaaaaaaaaaaaaaaaaaaaaaaaaaaaaaaaaaaaaaaaaaaaaaaaaaaaaaaaaaaaaaaaaaaaaaaaaaaaaaaaaaaaaaaaaaaaaaaaaaaaaaaaaaaaaaaaaaaaaaaaaaaaaaaaaaaaaaaaaaaaaaaaaaaaaaaaaaaaaaaaaaaaaaaaaaaaaaaaaaaaaaaaaaaaaaaaaaaaaaaaaaaaaaaaaaaaaaaaaaaaaaaaaaaaaaaaaaaaaaaaaaaaaaaaaaaaaaaaaaaaaaaaaaaaaaaaaaaaaaaaaaaaaaaaaaaaaaaaaaaaaaaaaaaaaaaaaaaaaaaaaaaaaaaaaaaaaaaaaaaaaaaaaaaaaaaaaaaaaaaaaaaaaaaaaaaaaaaaaaaaaaaaaaaaaaaaaaaaaaaaaaaaaaaaaaaaaaaaaaaaaaaaaaaaaaaaaaaaaaaaaaaaaaaaaaaaaaaaaaaaaaaaaaaaaaaaaaaaaaaaaaaaaaaaaaaaaaaaaaaaaaaaaaaaaaaaaaaaaaaaaaaaaaaaaaaaaaaaaaaaaaaaaaaaaaaaaaaaaaaaaaaaaaaaaaaaaaaaaaaaaaaaaaaaaaaaaaaaaaaaaaaaaaaaaaaaaaaaaaaaaaaaaaaaaaaaaaaaaaaaaaaaaaaaaaaaaaaaaaaaaaaaaaaaaaaaaaaaaaaaaaaaaaaaaaaaaaaaaaaaaaaaaaaaaaaaaaaaaaaaaaaaaaaaaaaaaaaaaaaaaaaaaaaaaaaaaaaaaaaaaaaaaaaaaaaaaaaaaaaaaaaaaaaaaaaaaaaaaaaaaaaaaaaaaaaaaaaaaaaaaaaaaaaaaaaaaaaaaaaaaaaaaaaaaaaaaaaaaaaaaaaaaaaaaaaaaaaaaaaaaaaaaaaaaaaaaaaaaaaaaaaaaaaaaaaaaaaaaaaaaaaaaaaaaaaaaaaaaaaaaaaaaaaaaaaaaaaaaaaaaaaaaaaaaaaaaaaaaaaaaaaaaaaaaaaaaaaaaaaaaaaaaaaaaaaaaaaaaaaaaaaaaaaaaaaaaaaaaaaaaaaaaaaaaaaaaaaaaaaaaaaaaaaaaaaaaaaaaaaaaaaaaaaaaaaaaaaaaaaaaaaaaaaaaaaaaaaaaaaaaaaaaaaaaaaaaaaaaaaaaaaaaaaaaaaaaaaaaaaaaaaaaaaaaaaaaaaaaaaaaaaaaaaaaaaaaaaaaaaaaaaaaaaaaaaaaaaaaaaaaaaaaaaaaaaaaaaaaaaaaaaaaaaaaaaaaaaaaaaaaaaaaaaaaaaaaaaaaaaaaaaaaaaaaaaaaaaaaaaaaaaaaaaaaaaaaaaaaaaaaaaaaaaaaaaaaaaaaaaaaaaaaaaaaaaaaaaaaaaaaaaaaaaaaaaaaaaaaaaaaaaaaaaaaaaaaaaaaaaaaaaaaaaaaaaaaaaaaaaaaaaaaaaaaaaaaaaaaaaaaaaaaaaaaaaaaaaaaaaaaaaaaaaaaaaaaaaaaaaaaaaaaaaaaaaaaaaaaaaaaaaaaaaaaaaaaaaaaaaaaaaaaaaaaaaaaaaaaaaaaaaaaaaaaaaaaaaaaaaaaaaaaaaaaaaaaaaaaaaaaaaaaaaaaaaaaaaaaaaaaaaaaaaaaaaaaaaaaaaaaaaaaaaaaaaaaaaaaaaaaaaaaaaaaaaaaaaaaaaaaaaaaaaaaaaaaaaaaaaaaaaaaaaaaaaaaaaaaaaaaaaaaaaaaaaaaaaaaaaaaaaaaaaaaaaaaaaaaaaaaaaaaaaaaaaaaaaaaaaaaaaaaaaaaaaaaaaaaaaaaaaaaaaaaaaaaaaaaaaaaaaaaaaaaaaaaaaaaaaaaaaaaaaaaaaaaaaaaaaaaaaaaaaaaaaaaaaaaaaaaaaaaaaaaaaaaaaaaaaaaaaaaaaaaaaaaaaaaaaaaaaaaaaaaaaaaaaaaaaaaaaaaaaaaaaaaaaaaaaaaaaaaaaaaaaaaaaaaaaaaaaaaaaaaaaaaaaaaaaaaaaaaaaaaaaaaaaaaaaaaaaaaaaaaaaaaaaaaaaaaaaaaaaaaaaaaaaaaaaaaaaaaaaaaaaaaaaaaaaaaaaaaaaaaaaaaaaaaaaaaaaaaaaaaaaaaaaaaaaaaaaaaaaaaaaaaaaaaaaaaaaaaaaaaaaaaaaaaaaaaaaaaaaaaaaaaaaaaaaaaaaaaaaaaaaaaaaaaaaaaaaaaaaaaaaaaaaaaaaaaaaaaaaaaaaaaaaaaaaaaaaaaaaaaaaaaaaaaaaaaaaaaaaaaaaaaaaaaaaaaaaaaaaaaaaaaaaaaaaaaaaaaaaaaaaaaaaaaaaaaaaaaaaaaaaaaaaaaaaaaaaaaaaaaaaaaaaaaaaaaaaaaaaaaaaaaaaaaaaaaaaaaaaaaaaaaaaaaaaaaaaaaaaaaaaaaaaaaaaaaaaaaaaaaaaaaaaaaaaaaaaaaaaaaaaaaaaaaaaaaaaaaaaaaaaaaaaaaaaaaaaaaaaaaaaaaaaaaaaaaaaaaaaaaaaaaaaaaaaaaaaaaaaaaaaaaaaaaaaaaaaaaaaaaaaaaaaaaaaaaaaaaaaaaaaaaaaaaaaaaaaaaaaaaaaaaaaaaaaaaaaaaaaaaaaaaaaaaaaaaaaaaaaaaaaaaaaaaaaaaaaaaaaaaaaaaaaaaaaaaaaaaaaaaaaaaaaaaaaaaaaaaaaaaaaaaaaaaaaaaaaaaaaaaaaaaaaaaaaaaaaaaaaaaaaaaaaaaaaaaaaaaaaaaaaaaaaaaaaaaaaaaaaaaaaaaaaaaaaaaaaaaaaaaaaaaaaaaaaaaaaaaaaaaaaaaaaaaaaaaaaaaaaaaaaaaaaaaaaaaaaaaaaaaaaaaaaaaaaaaaaaaaaaaaaaaaaaaaaaaaaaaaaaaaaaaaaaaaaaaaaaaaaaaaaaaaaaaaaaaaaaaaaaaaaaaaaaaaaaaaaaaaaaaaaaaaaaaaaaaaaaaaaaaaaaaaaaaaaaaaaaaaaaaaaaaaaaaaaaaaaaaaaaaaaaaaaaaaaaaaaaaaaaaaaaaaaaaaaaaaaaaaaaaaaaaaaaaaaaaaaaaaaaaaaaaaaaaaaaaaaaaaaaaaaaaaaaaaaaaaaaaaaaaaaaaaaaaaaaaaaaaaaaaaaaaaaaaaaaaaaaaaaaaaaaaaaaaaaaaaaaaaaaaaaaaaaaaaaaaaaaaaaaaaaaaaaaaaaaaaaaaaaaaaaaaaaaaaaaaaaaaaaaaaaaaaaaaaaaaaaaaaaaaaaaaaaaaaaaaaaaaaaaaaaaaaaaaaaaaaaaaaaaaaaaaaaaaaaaaaaaaaaaaaaaaaaaaaaaaaaaaaaaaaaaaaaaaaaaaaaaaaaaaaaaaaaaaaaaaaaaaaaaaaaaaaaaaaaaaaaaaaaaaaaaaaaaaaaaaaaaaaaaaaaaaaaaaaaaaaaaaaaaaaaaaaaaaaaaaaaaaaaaaaaaaaaaaaaaaaaaaaaaaaaaaaaaaaaaaaaaaaaaaaaaaaaaaaaaaaaaaaaaaaaaaaaaaaaaaaaaaaaaaaaaaaaaaaaaaaaaaaaaaaaaaaaaaaaaaaaaaaaaaaaaaaaaaaaaaaaaaaaaaaaaaaaaaaaaaaaaaaaaaaaaaaaaaaaaaaaaaaaaaaaaaaaaaaaaaaaaaaaaaaaaaaaaaaaaaaaaaaaaaaaaaaaaaaaaaaaaaaaaaaaaaaaaaaaaaaaaaaaaaaaaaaaaaaaaaaaaaaaaaaaaaaaaaaaaaaaaaaaaaaaaaaaaaaaaaaaaaaaaaaaaaaaaaaaaaaaaaaaaaaaaaaaaaaaaaaaaaaaaaaaaaaaaaaaaaaaaaaaaaaaaaaaaaaaaaaaaaaaaaaaaaaaaaaaaaaaaaaaaaaaaaaaaaaaaaaaaaaaaaaaaaaaaaaaaaaaaaaaaaaaaaaaaaaaaaaaaaaaaaaaaaaaaaaaaaaaaaaaaaaaaaaaaaaaaaaaaaaaaaaaaaaaaaaaaaaaaaaaaaaaaaaaaaaaaaaaaaaaaaaaaaaaaaaaaaaaaaaaaaaaaaaaaaaaaaaaaaaaaaaaaaaaaaaaaaaaaaaaaaaaaaaaaaaaaaaaaaaaaaaaaaaaaaaaaaaaaaaaaaaaaaaaaaaaaaaaaaaaaaaaaaaaaaaaaaaaaaaaaaaaaaaaaaaaaaaaaaaaaaaaaaaaaaaaaaaaaaaaaaaaaaaaaaaaaaaaaaaaaaaaaaaaaaaaaaaaaaaaaaaaaaaaaaaaaaaaaaaaaaaaaaaaaaaaaaaaaaaaaaaaaaaaaaaaaaaaaaaaaaaaaaaaaaaaaaaaaaaaaaaaaaaaaaaaaaaaaaaaaaaaaaaaaaaaaaaaaaaaaaaaaaaaaaaaaaaaaaaaaaaaaaaaaaaaaaaaaaaaaaaaaaaaaaaaaaaaaaaaaaaaaaaaaaaaaaaaaaaaaaaaaaaaaaaaaaaaaaaaaaaaaaaaaaaaaaaaaaaaaaaaaaaaaaaaaaaaaaaaaaaaaaaaaaaaaaaaaaaaaaaaaaaaaaaaaaaaaaaaaaaaaaaaaaaaaaaaaaaaaaaaaaaaaaaaaaaaaaaaaaaaaaaaaaaaaaaaaaaaaaaaaaaaaaaaaaaaaaaaaaaaaaaaaaaaaaaaaaaaaaaaaaaaaaaaaaaaaaaaaaaaaaaaaaaaaaaaaaaaaaaaaaaaaaaaaaaaaaaaaaaaaaaaaaaaaaaaaaaaaaaaaaaaaaaaaaaaaaaaaaaaaaaaaaaaaaaaaaaaaaaaaaaaaaaaaaaaaaaaaaaaaaaaaaaaaaaaaaaaaaaaaaaaaaaaaaaaaaaaaaaaaaaaaaaaaaaaaaaaaaaaaaaaaaaaaaaaaaaaaaaaaaaaaaaaaaaaaaaaaaaaaaaaaaaaaaaaaaaaaaaaaaaaaaaaaaaaaaaaaaaaaaaaaaaaaaaaaaaaaaaaaaaaaaaaaaaaaaaaaaaaaaaaaaaaaaaaaaaaaaaaaaaaaaaaaaaaaaaaaaaaaaaaaaaaaaaaaaaaaaaaaaaaaaaaaaaaaaaaaaaaaaaaaaaaaaaaaaaaaaaaaaaaaaaaaaaaaaaaaaaaaaaaaaaaaaaaaaaaaaaaaaaaaaaaaaaaaaaaaaaaaaaaaaaaaaaaaaaaaaaaaaaaaaaaaaaaaaaaaaaaaaaaaaaaaaaaaaaaaaaaaaaaaaaaaaaaaaaaaaaaaaaaaaaaaaaaaaaaaaaaaaaaaaaaaaaaaaaaaaaaaaaaaaaaaaaaaaaaaaaaaaaaaaaaaaaaaaaaaaaaaaaaaaaaaaaaaaaaaaaaaaaaaaaaaaaaaaaaaaaaaaaaaaaaaaaaaaaaaaaaaaaaaaaaaaaaaaaaaaaaaaaaaaaaaaaaaaaaaaaaaaaaaaaaaaaaaaaaaaaaaaaaaaaaaaaaaaaaaaaaaaaaaaaaaaaaaaaaaaaaaaaaaaaaaaaaaaaaaaaaaaaaaaaaaaaaaaaaaaaaaaaaaaaaaaaaaaaaaaaaaaaaaaaaaaaaaaaaaaaaaaaaaaaaaaaaaaaaaaaaaaaaaaaaaaaaaaaaaaaaaaaaaaaaaaaaaaaaaaaaaaaaaaaaaaaaaaaaaaaaaaaaaaaaaaaaaaaaaaaaaaaaaaaaaaaaaaaaaaaaaaaaaaaaaaaaaaaaaaaaaaaaaaaaaaaaaaaaaaaaaaaaaaaaaaaaaaaaaaaaaaaaaaaaaaaaaaaaaaaaaaaaaaaaaaaaaaaaaaaaaaaaaaaaaaaaaaaaaaaaaaaaaaaaaaaaaaaaaaaaaaaaaaaaaaaaaaaaaaaaaaaaaaaaaaaaaaaaaaaaaaaaaaaaaaaaaaaaaaaaaaaaaaaaaaaaaaaaaaaaaaaaaaaaaaaaaaaaaaaaaaaaaaaaaaaaaaaaaaaaaaaaaaaaaaaaaaaaaaaaaaaaaaaaaaaaaaaaaaaaaaaaaaaaaaaaaaaaaaaaaaaaaaaaaaaaaaaaaaaaaaaaaaaaaaaaaaaaaaaaaaaaaaaaaaaaaaaaaaaaaaaaaaaaaaaaaaaaaaaaaaaaaaaaaaaaaaaaaaaaaaaaaaaaaaaaaaaaaaaaaaaaaaaaaaaaaaaaaaaaaaaaaaaaaaaaaaaaaaaaaaaaaaaaaaaaaaaaaaaaaaaaaaaaaaaaaaaaaaaaaaaaaaaaaaaaaaaaaaaaaaaaaaaaaaaaaaaaaaaaaaaaaaaaaaaaaaaaaaaaaaaaaaaaaaaaaaaaaaaaaaaaaaaaaaaaaaaaaaaaaaaaaaaaaaaaaaaaaaaaaaaaaaaaaaaaaaaaaaaaaaaaaaaaaaaaaaaaaaaaaaaaaaaaaaaaaaaaaaaaaaaaaaaaaaaaaaaaaaaaaaaaaaaaaaaaaaaaaaaaaaaaaaaaaaaaaaaaaaaaaaaaaaaaaaaaaaaaaaaaaaaaaaaaaaaaaaaaaaaaaaaaaaaaaaaaaaaaaaaaaaaaaaaaaaaaaaaaaaaaaaaaaaaaaaaaaaaaaaaaaaaaaaaaaaaaaaaaaaaaaaaaaaaaaaaaaaaaaaaaaaaaaaaaaaaaaaaaaaaaaaaaaaaaaaaaaaaaaaaaaaaaaaaaaaaaaaaaaaaaaaaaaaaaaaaaaaaaaaaaaaaaaaaaaaaaaaaaaaaaaaaaaaaaaaaaaaaaaaaaaaaaaaaaaaaaaaaaaaaaaaaaaaaaaaaaaaaaaaaaaaaaaaaaaaaaaaaaaaaaaaaaaaaaaaaaaaaaaaaaaaaaaaaaaaaaaaaaaaaaaaaaaaaaaaaaaaaaaaaaaaaaaaaaaaaaaaaaaaaaaaaaaaaaaaaaaaaaaaaaaaaaaaaaaaaaaaaaaaaaaaaaaaaaaaaaaaaaaaaaaaaaaaaaaaaaaaaaaaaaaaaaaaaaaaaaaaaaaaaaaaaaaaaaaaaaaaaaaaaaaaaaaaaaaaaaaaaaaaaaaaaaaaaaaaaaaaaaaaaaaaaaaaaaaaaaaaaaaaaaaaaaaaaaaaaaaaaaaaaaaaaaaaaaaaaaaaaaaaaaaaaaaaaaaaaaaaaaaaaaaaaaaaaaaaaaaaaaaaaaaaaaaaaaaaaaaaaaaaaaaaaaaaaaaaaaaaaaaaaaaaaaaaaaaaaaaaaaaaaaaaaaaaaaaaaaaaaaaaaaaaaaaaaaaaaaaaaaaaaaaaaaaaaaaaaaaaaaaaaaaaaaaaaaaaaaaaaaaaaaaaaaaaaaaaaaaaaaaaaaaaaaaaaaaaaaaaaaaaaaaaaaaaaaaaaaaaaaaaaaaaaaaaaaaaaaaaaaaaaaaaaaaaaaaaaaaaaaaaaaaaaaaaaaaaaaaaaaaaaaaaaaaaaaaaaaaaaaaaaaaaaaaaaaaaaaaaaaaaaaaaaaaaaaaaaaaaaaaaaaaaaaaaaaaaaaaaaaaaaaaaaaaaaaaaaaaaaaaaaaaaaaaaaaaaaaaaaaaaaaaaaaaaaaaaaaaaaaaaaaaaaaaaaaaaaaaaaaaaaaaaaaaaaaaaaaaaaaaaaaaaaaaaaaaaaaaaaaaaaaaaaaaaaaaaaaaaaaaaaaaaaaaaaaaaaaaaaaaaaaaaaaaaaaaaaaaaaaaaaaaaaaaaaaaaaaaaaaaaaaaaaaaaaaaaaaaaaaaaaaaaaaaaaaaaaaaaaaaaaaaaaaaaaaaaaaaaaaaaaaaaaaaaaaaaaaaaaaaaaaaaaaaaaaaaaaaaaaaaaaaaaaaaaaaaaaaaaaaaaaaaaaaaaaaaaaaaaaaaaaaaaaaaaaaaaaaaaaaaaaaaaaaaaaaaaaaaaaaaaaaaaaaaaaaaaaaaaaaaaaaaaaaaaaaaaaaaaaaaaaaaaaaaaaaaaaaaaaaaaaaaaaaaaaaaaaaaaaaaaaaaaaaaaaaaaaaaaaaaaaaaaaaaaaaaaaaaaaaaaaaaaaaaaaaaaaaaaaaaaaaaaaaaaaaaaaaaaaaaaaaaaaaaaaaaaaaaaaaaaaaaaaaaaaaaaaaaaaaaaaaaaaaaaaaaaaaaaaaaaaaaaaaaaaaaaaaaaaaaaaaaaaaaaaaaaaaaaaaaaaaaaaaaaaaaaaaaaaaaaaaaaaaaaaaaaaaaaaaaaaaaaaaaaaaaaaaaaaaaaaaaaaaaaaaaaaaaaaaaaaaaaaaaaaaaaaaaaaaaaaaaaaaaaaaaaaaaaaaaaaaaaaaaaaaaaaaaaaaaaaaaaaaaaaaaaaaaaaaaaaaaaaaaaaaaaaaaaaaaaaaaaaaaaaaaaaaaaaaaaaaaaaaaaaaaaaaaaaaaaaaaaaaaaaaaaaaaaaaaaaaaaaaaaaaaaaaaaaaaaaaaaaaaaaaaaaaaaaaaaaaaaaaaaaaaaaaaaaaaaaaaaaaaaaaaaaaaaaaaaaaaaaaaaaaaaaaaaaaaaaaaaaaaaaaaaaaaaaaaaaaaaaaaaaaaaaaaaaaaaaaaaaaaaaaaaaaaaaaaaaaaaaaaaaaaaaaaaaaaaaaaaaaaaaaaaaaaaaaaaaaaaaaaaaaaaaaaaaaaaaaaaaaaaaaaaaaaaaaaaaaaaaaaaaaaaaaaaaaaaaaaaaaaaaaaaaaaaaaaaaaaaaaaaaaaaaaaaaaaaaaaaaaaaaaaaaaaaaaaaaaaaaaaaaaaaaaaaaaaaaaaaaaaaaaaaaaaaaaaaaaaaaaaaaaaaaaaaaaaaaaaaaaaaaaaaaaaaaaaaaaaaaaaaaaaaaaaaaaaaaaaaaaaaaaaaaaaaaaaaaaaaaaaaaaaaaaaaaaaaaaaaaaaaaaaaaaaaaaaaaaaaaaaaaaaaaaaaaaaaaaaaaaaaaaaaaaaaaaaaaaaaaaaaaaaaaaaaaaaaaaaaaaaaaaaaaaaaaaaaaaaaaaaaaaaaaaaaaaaaaaaaaaaaaaaaaaaaaaaaaaaaaaaaaaaaaaaaaaaaaaaaaaaaaaaaaaaaaaaaaaaaaaaaaaaaaaaaaaaaaaaaaaaaaaaaaaaaaaaaaaaaaaaaaaaaaaaaaaaaaaaaaaaaaaaaaaaaaaaaaaaaaaaaaaaaaaaaaaaaaaaaaaaaaaaaaaaaaaaaaaaaaaaaaaaaaaaaaaaaaaaaaaaaaaaaaaaaaaaaaaaaaaaaaaaaaaaaaaaaaaaaaaaaaaaaaaaaaaaaaaaaaaaaaaaaaaaaaaaaaaaaaaaaaaaaaaaaaaaaaaaaaaaaaaaaaaaaaaaaaaaaaaaaaaaaaaaaaaaaaaaaaaaaaaaaaaaaaaaaaaaaaaaaaaaaaaaaaaaaaaaaaaaaaaaaaaaaaaaaaaaaaaaaaaaaaaaaaaaaaaaaaaaaaaaaaaaaaaaaaaaaaaaaaaaaaaaaaaaaaaaaaaaaaaaaaaaaaaaaaaaaaaaaaaaaaaaaaaaaaaaaaaaaaaaaaaaaaaaaaaaaaaaaaaaaaaaaaaaaaaaaaaaaaaaaaaaaaaaaaaaaaaaaaaaaaaaaaaaaaaaaaaaaaaaaaaaaaaaaaaaaaaaaaaaaaaaaaaaaaaaaaaaaaaaaaaaaaaaaaaaaaaaaaaaaaaaaaaaaaaaaaaaaaaaaaaaaaaaaaaaaaaaaaaaaaaaaaaaaaaaaaaaaaaaaaaaaaaaaaaaaaaaaaaaaaaaaaaaaaaaaaaaaaaaaaaaaaaaaaaaaaaaaaaaaaaaaaaaaaaaaaaaaaaaaaaaaaaaaaaaaaaaaaaaaaaaaaaaaaaaaaaaaaaaaaaaaaaaaaaaaaaaaaaaaaaaaaaaaaaaaaaaaaaaaaaaaaaaaaaaaaaaaaaaaaaaaaaaaaaaaaaaaaaaaaaaaaaaaaaaaaaaaaaaaaaaaaaaaaaaaaaaaaaaaaaaaaaaaaaaaaaaaaaaaaaaaaaaaaaaaaaaaaaaaaaaaaaaaaaaaaaaaaaaaaaaaaaaaaaaaaaaaaaaaaaaaaaaaaaaaaaaaaaaaaaaaaaaaaaaaaaaaaaaaaaaaaaaaaaaaaaaaaaaaaaaaaaaaaaaaaaaaaaaaaaaaaaaaaaaaaaaaaaaaaaaaaaaaaaaaaaaaaaaaaaaaaaaaaaaaaaaaaaaaaaaaaaaaaaaaaaaaaaaaaaaaaaaaaaaaaaaaaaaaaaaaaaaaaaaaaaaaaaaaaaaaaaaaaaaaaaaaaaaaaaaaaaaaaaaaaaaaaaaaaaaaaaaaaaaaaaaaaaaaaaaaaaaaaaaaaaaaaaaaaaaaaaaaaaaaaaaaaaaaaaaaaaaaaaaaaaaaaaaaaaaaaaaaaaaaaaaaaaaaaaaaaaaaaaaaaaaaaaaaaaaaaaaaaaaaaaaaaaaaaaaaaaaaaaaaaaaaaaaaaaaaaaaaaaaaaaaaaaaaaaaaaaaaaaaaaaaaaaaaaaaaaaaaaaaaaaaaaaaaaaaaaaaaaaaaaaaaaaaaaaaaaaaaaaaaaaaaaaaaaaaaaaaaaaaaaaaaaaaaaaaaaaaaaaaaaaaaaaaaaaaaaaaaaaaaaaaaaaaaaaaaaaaaaaaaaaaaaaaaaaaaaaaaaaaaaaaaaaaaaaaaaaaaaaaaaaaaaaaaaaaaaaaaaaaaaaaaaaaaaaaaaaaaaaaaaaaaaaaaaaaaaaaaaaaaaaaaaaaaaaaaaaaaaaaaaaaaaaaaaaaaaaaaaaaaaaaaaaaaaaaaaaaaaaaaaaaaaaaaaaaaaaaaaaaaaaaaaaaaaaaaaaaaaaaaaaaaaaaaaaaaaaaaaaaaaaaaaaaaaaaaaaaaaaaaaaaaaaaaaaaaaaaaaaaaaaaaaaaaaaaaaaaaaaaaaaaaaaaaaaaaaaaaaaaaaaaaaaaaaaaaaaaaaaaaaaaaaaaaaaaaaaaaaaaaaaaaaaaaaaaaaaaaaaaaaaaaaaaaaaaaaaaaaaaaaaaaaaaaaaaaaaaaaaaaaaaaaaaaaaaaaaaaaaaaaaaaaaaaaaaaaaaaaaaaaaaaaaaaaaaaaaaaaaaaaaaaaaaaaaaaaaaaaaaaaaaaaaaaaaaaaaaaaaaaaaaaaaaaaaaaaaaaaaaaaaaaaaaaaaaaaaaaaaaaaaaaaaaaaaaaaaaaaaaaaaaaaaaaaaaaaaaaaaaaaaaaaaaaaaaaaaaaaaaaaaaaaaaaaaaaaaaaaaaaaaaaaaaaaaaaaaaaaaaaaaaaaaaaaaaaaaaaaaaaaaaaaaaaaaaaaaaaaaaaaaaaaaaaaaaaaaaaaaaaaaaaaaaaaaaaaaaaaaaaaaaaaaaaaaaaaaaaaaaaaaaaaaaaaaaaaaaaaaaaaaaaaaaaaaaaaaaaaaaaaaaaaaaaaaaaaaaaaaaaaaaaaaaaaaaaaaaaaaaaaaaaaaaaaaaaaaaaaaaaaaaaaaaaaaaaaaaaaaaaaaaaaaaaaaaaaaaaaaaaaaaaaaaaaaaaaaaaaaaaaaaaaaaaaaaaaaaaaaaaaaaaaaaaaaaaaaaaaaaaaaaaaaaaaaaaaaaaaaaaaaaaaaaaaaaaaaaaaaaaaaaaaaaaaaaaaaaaaaaaaaaaaaaaaaaaaaaaaaaaaaaaaaaaaaaaaaaaaaaaaaaaaaaaaaaaaaaaaaaaaaaaaaaaaaaaaaaaaaaaaaaaaaaaaaaaaaaaaaaaaaaaaaaaaaaaaaaaaaaaaaaaaaaaaaaaaaaaaaaaaaaaaaaaaaaaaaaaaaaaaaaaaaaaaaaaaaaaaaaaaaaaaaaaaaaaaaaaaaaaaaaaaaaaaaaaaaaaaaaaaaaaaaaaaaaaaaaaaaaaaaaaaaaaaaaaaaaaaaaaaaaaaaaaaaaaaaaaaaaaaaaaaaaaaaaaaaaaaaaaaaaaaaaaaaaaaaaaaaaaaaaaaaaaaaaaaaaaaaaaaaaaaaaaaaaaaaaaaaaaaaaaaaaaaaaaaaaaaaaaaaaaaaaaaaaaaaaaaaaaaaaaaaaaaaaaaaaaaaaaaaaaaaaaaaaaaaaaaaaaaaaaaaaaaaaaaaaaaaaaaaaaaaaaaaaaaaaaaaaaaaaaaaaaaaaaaaaaaaaaaaaaaaaaaaaaaaaaaaaaaaaaaaaaaaaaaaaaaaaaaaaaaaaaaaaaaaaaaaaaaaaaaaaaaaaaaaaaaaaaaaaaaaaaaaaaaaaaaaaaaaaaaaaaaaaaaaaaaaaaaaaaaaaaaaaaaaaaaaaaaaaaaaaaaaaaaaaaaaaaaaaaaaaaaaaaaaaaaaaaaaaaaaaaaaaaaaaaaaaaaaaaaaaaaaaaaaaaaaaaaaaaaaaaaaaaaaaaaaaaaaaaaaaaaaaaaaaaaaaaaaaaaaaaaaaaaaaaaaaaaaaaaaaaaaaaaaaaaaaaaaaaaaaaaaaaaaaaaaaaaaaaaaaaaaaaaaaaaaaaaaaaaaaaaaaaaaaaaaaaaaaaaaaaaaaaaaaaaaaaaaaaaaaaaaaaaaaaaaaaaaaaaaaaaaaaaaaaaaaaaaaaaaaaaaaaaaaaaaaaaaaaaaaaaaaaaaaaaaaaaaaaaaaaaaaaaaaaaaaaaaaaaaaaaaaaaaaaaaaaaaaaaaaaaaaaaaaaaaaaaaaaaaaaaaaaaaaaaaaaaaaaaaaaaaaaaaaaaaaaaaaaaaaaaaaaaaaaaaaaaaaaaaaaaaaaaaaaaaaaaaaaaaaaaaaaaaaaaaaaaaaaaaaaaaaaaaaaaaaaaaaaaaaaaaaaaaaaaaaaaaaaaaaaaaaaaaaaaaaaaaaaaaaaaaaaaaaaaaaaaaaaaaaaaaaaaaaaaaaaaaaaaaaaaaaaaaaaaaaaaaaaaaaaaaaaaaaaaaaaaaaaaaaaaaaaaaaaaaaaaaaaaaaaaaaaaaaaaaaaaaaaaaaaaaaaaaaaaaaaaaaaaaaaaaaaaaaaaaaaaaaaaaaaaaaaaaaaaaaaaaaaaaaaaaaaaaaaaaaaaaaaaaaaaaaaaaaaaaaaaaaaaaaaaaaaaaaaaaaaaaaaaaaaaaaaaaaaaaaaaaaaaaaaaaaaaaaaaaaaaaaaaaaaaaaaaaaaaaaaaaaaaaaaaaaaaaaaaaaaaaaaaaaaaaaaaaaaaaaaaaaaaaaaaaaaaaaaaaaaaaaaaaaaaaaaaaaaaaaaaaaaaaaaaaaaaaaaaaaaaaaaaaaaaaaaaaaaaaaaaaaaaaaaaaaaaaaaaaaaaaaaaaaaaaaaaaaaaaaaaaaaaaaaaaaaaaaaaaaaaaaaaaaaaaaaaaaaaaaaaaaaaaaaaaaaaaaaaaaaaaaaaaaaaaaaaaaaaaaaaaaaaaaaaaaaaaaaaaaaaaaaaaaaaaaaaaaaaaaaaaaaaaaaaaaaaaaaaaaaaaaaaaaaaaaaaaaaaaaaaaaaaaaaaaaaaaaaaaaaaaaaaaaaaaaaaaaaaaaaaaaaaaaaaaaaaaaaaaaaaaaaaaaaaaaaaaaaaaaaaaaaaaaaaaaaaaaaaaaaaaaaaaaaaaaaaaaaaaaaaaaaaaaaaaaaaaaaaaaaaaaaaaaaaaaaaaaaaaaaaaaaaaaaaaaaaaaaaaaaaaaaaaaaaaaaaaaaaaaaaaaaaaaaaaaaaaaaaaaaaaaaaaaaaaaaaaaaaaaaaaaaaaaaaaaaaaaaaaaaaaaaaaaaaaaaaaaaaaaaaaaaaaaaaaaaaaaaaaaaaaaaaaaaaaaaaaaaaaaaaaaaaaaaaaaaaaaaaaaaaaaaaaaaaaaaaaaaaaaaaaaaaaaaaaaaaaaaaaaaaaaaaaaaaaaaaaaaaaaaaaaaaaaaaaaaaaaaaaaaaaaaaaaaaaaaaaaaaaaaaaaaaaaaaaaaaaaaaaaaaaaaaaaaaaaaaaaaaaaaaaaaaaaaaaaaaaaaaaaaaaaaaaaaaaaaaaaaaaaaaaaaaaaaaaaaaaaaaaaaaaaaaaaaaaaaaaaaaaaaaaaaaaaaaaaaaaaaaaaaaaaaaaaaaaaaaaaaaaaaaaaaaaaaaaaaaaaaaaaaaaaaaaaaaaaaaaaaaaaaaaaaaaaaaaaaaaaaaaaaaaaaaaaaaaaaaaaaaaaaaaaaaaaaaaaaaaaaaaaaaaaaaaaaaaaaaaaaaaaaaaaaaaaaaaaaaaaaaaaaaaaaaaaaaaaaaaaaaaaaaaaaaaaaaaaaaaaaaaaaaaaaaaaaaaaaaaaaaaaaaaaaaaaaaaaaaaaaaaaaaaaaaaaaaaaaaaaaaaaaaaaaaaaaaaaaaaaaaaaaaaaaaaaaaaaaaaaaaaaaaaaaaaaaaaaaaaaaaaaaaaaaaaaaaaaaaaaaaaaaaaaaaaaaaaaaaaaaaaaaaaaaaaaaaaaaaaaaaaaaaaaaaaaaaaaaaaaaaaaaaaaaaaaaaaaaaaaaaaaaaaaaaaaaaaaaaaaaaaaaaaaaaaaaaaaaaaaaaaaaaaaaaaaaaaaaaaaaaaaaaaaaaaaaaaaaaaaaaaaaaaaaaaaaaaaaaaaaaaaaaaaaaaaaaaaaaaaaaaaaaaaaaaaaaaaaaaaaaaaaaaaaaaaaaaaaaaaaaaaaaaaaaaaaaaaaaaaaaaaaaaaaaaaaaaaaaaaaaaaaaaaaaaaaaaaaaaaaaaaaaaaaaaaaaaaaaaaaaaaaaaaaaaaaaaaaaaaaaaaaaaaaaaaaaaaaaaaaaaaaaaaaaaaaaaaaaaaaaaaaaaaaaaaaaaaaaaaaaaaaaaaaaaaaaaaaaaaaaaaaaaaaaaaaaaaaaaaaaaaaaaaaaaaaaaaaaaaaaaaaaaaaaaaaaaaaaaaaaaaaaaaaaaaaaaaaaaaaaaaaaaaaaaaaaaaaaaaaaaaaaaaaaaaaaaaaaaaaaaaaaaaaaaaaaaaaaaaaaaaaaaaaaaaaaaaaaaaaaaaaaaaaaaaaaaaaaaaaaaaaaaaaaaaaaaaaaaaaaaaaaaaaaaaaaaaaaaaaaaaaaaaaaaaaaaaaaaaaaaaaaaaaaaaaaaaaaaaaaaaaaaaaaaaaaaaaaaaaaaaaaaaaaaaaaaaaaaaaaaaaaaaaaaaaaaaaaaaaaaaaaaaaaaaaaaaaaaaaaaaaaaaaaaaaaaaaaaaaaaaaaaaaaaaaaaaaaaaaaaaaaaaaaaaaaaaaaaaaaaaaaaaaaaaaaaaaaaaaaaaaaaaaaaaaaaaaaaaaaaaaaaaaaaaaaaaaaaaaaaaaaaaaaaaaaaaaaaaaaaaaaaaaaaaaaaaaaaaaaaaaaaaaaaaaaaaaaaaaaaaaaaaaaaaaaaaaaaaaaaaaaaaaaaaaaaaaaaaaaaaaaaaaaaaaaaaaaaaaaaaaaaaaaaaaaaaaaaaaaaaaaaaaaaaaaaaaaaaaaaaaaaaaaaaaaaaaaaaaaaaaaaaaaaaaaaaaaaaaaaaaaaaaaaaaaaaaaaaaaaaaaaaaaaaaaaaaaaaaaaaaaaaaaaaaaaaaaaaaaaaaaaaaaaaaaaaaaaaaaaaaaaaaaaaaaaaaaaaaaaaaaaaaaaaaaaaaaaaaaaaaaaaaaaaaaaaaaaaaaaaaaaaaaaaaaaaaaaaaaaaaaaaaaaaaaaaaaaaaaaaaaaaaaaaaaaaaaaaaaaaaaaaaaaaaaaaaaaaaaaaaaaaaaaaaaaaaaaaaaaaaaaaaaaaaaaaaaaaaaaaaaaaaaaaaaaaaaaaaaaaaaaaaaaaaaaaaaaaaaaaaaaaaaaaaaaaaaaaaaaaaaaaaaaaaaaaaaaaaaaaaaaaaaaaaaaaaaaaaaaaaaaaaaaaaaaaaaaaaaaaaaaaaaaaaaaaaaaaaaaaaaaaaaaaaaaaaaaaaaaaaaaaaaaaaaaaaaaaaaaaaaaaaaaaaaaaaaaaaaaaaaaaaaaaaaaaaaaaaaaaaaaaaaaaaaaaaaaaaaaaaaaaaaaaaaaaaaaaaaaaaaaaaaaaaaaaaaaaaaaaaaaaaaaaaaaaaaaaaaaaaaaaaaaaaaaaaaaaaaaaaaaaaaaaaaaaaaaaaaaaaaaaaaaaaaaaaaaaaaaaaaaaaaaaaaaaaaaaaaaaaaaaaaaaaaaaaaaaaaaaaaaaaaaaaaaaaaaaaaaaaaaaaaaaaaaaaaaaaaaaaaaaaaaaaaaaaaaaaaaaaaaaaaaaaaaaaaaaaaaaaaaaaaaaaaaaaaaaaaaaaaaaaaaaaaaaaaaaaaaaaaaaaaaaaaaaaaaaaaaaaaaaaaaaaaaaaaaaaaaaaaaaaaaaaaaaaaaaaaaaaaaaaaaaaaaaaaaaaaaaaaaaaaaaaaaaaaaaaaaaaaaaaaaaaaaaaaaaaaaaaaaaaaaaaaaaaaaaaaaaaaaaaaaaaaaaaaaaaaaaaaaaaaaaaaaaaaaaaaaaaaaaaaaaaaaaaaaaaaaaaaaaaaaaaaaaaaaaaaaaaaaaaaaaaaaaaaaaaaaaaaaaaaaaaaaaaaaaaaaaaaaaaaaaaaaaaaaaaaaaaaaaaaaaaaaaaaaaaaaaaaaaaaaaaaaaaaaaaaaaaaaaaaaaaaaaaaaaaaaaaaaaaaaaaaaaaaaaaaaaaaaaaaaaaaaaaaaaaaaaaaaaaaaaaaaaaaaaaaaaaaaaaaaaaaaaaaaaaaaaaaaaaaaaaaaaaaaaaaaaaaaaaaaaaaaaaaaaaaaaaaaaaaaaaaaaaaaaaaaaaaaaaaaaaaaaaaaaaaaaaaaaaaaaaaaaaaaaaaaaaaaaaaaaaaaaaaaaaaaaaaaaaaaaaaaaaaaaaaaaaaaaaaaaaaaaaaaaaaaaaaaaaaaaaaaaaaaaaaaaaaaaaaaaaaaaaaaaaaaaaaaaaaaaaaaaaaaaaaaaaaaaaaaaaaaaaaaaaaaaaaaaaaaaaaaaaaaaaaaaaaaaaaaaaaaaaaaaaaaaaaaaaaaaaaaaaaaaaaaaaaaaaaaaaaaaaaaaaaaaaaaaaaaaaaaaaaaaaaaaaaaaaaaaaaaaaaaaaaaaaaaaaaaaaaaaaaaaaaaaaaaaaaaaaaaaaaaaaaaaaaaaaaaaaaaaaaaaaaaaaaaaaaaaaaaaaaaaaaaaaaaaaaaaaaaaaaaaaaaaaaaaaaaaaaaaaaaaaaaaaaaaaaaaaaaaaaaaaaaaaaaaaaaaaaaaaaaaaaaaaaaaaaaaaaaaaaaaaaaaaaaaaaaaaaaaaaaaaaaaaaaaaaaaaaaaaaaaaaaaaaaaaaaaaaaaaaaaaaaaaaaaaaaaaaaaaaaaaaaaaaaaaaaaaaaaaaaaaaaaaaaaaaaaaaaaaaaaaaaaaaaaaaaaaaaaaaaaaaaaaaaaaaaaaaaaaaaaaaaaaaaaaaaaaaaaaaaaaaaaaaaaaaaaaaaaaaaaaaaaaaaaaaaaaaaaaaaaaaaaaaaaaaaaaaaaaaaaaaaaaaaaaaaaaaaaaaaaaaaaaaaaaaaaaaaaaaaaaaaaaaaaaaaaaaaaaaaaaaaaaaaaaaaaaaaaaaaaaaaaaaaaaaaaaaaaaaaaaaaaaaaaaaaaaaaaaaaaaaaaaaaaaaaaaaaaaaaaaaaaaaaaaaaaaaaaaaaaaaaaaaaaaaaaaaaaaaaaaaaaaaaaaaaaaaaaaaaaaaaaaaaaaaaaaaaaaaaaaaaaaaaaaaaaaaaaaaaaaaaaaaaaaaaaaaaaaaaaaaaaaaaaaaaaaaaaaaaaaaaaaaaaaaaaaaaaaaaaaaaaaaaaaaaaaaaaaaaaaaaaaaaaaaaaaaaaaaaaaaaaaaaaaaaaaaaaaaaaaaaaaaaaaaaaaaaaaaaaaaaaaaaaaaaaaaaaaaaaaaaaaaaaaaaaaaaaaaaaaaaaaaaaaaaaaaaaaaaaaaaaaaaaaaaaaaaaaaaaaaaaaaaaaaaaaaaaaaaaaaaaaaaaaaaaaaaaaaaaaaaaaaaaaaaaaaaaaaaaaaaaaaaaaaaaaaaaaaaaaaaaaaaaaaaaaaaaaaaaaaaaaaaaaaaaaaaaaaaaaaaaaaaaaaaaaaaaaaaaaaaaaaaaaaaaaaaaaaaaaaaaaaaaaaaaaaaaaaaaaaaaaaaaaaaaaaaaaaaaaaaaaaaaaaaaaaaaaaaaaaaaaaaaaaaaaaaaaaaaaaaaaaaaaaaaaaaaaaaaaaaaaaaaaaaaaaaaaaaaaaaaaaaaaaaaaaaaaaaaaaaaaaaaaaaaaaaaaaaaaaaaaaaaaaaaaaaaaaaaaaaaaaaaaaaaaaaaaaaaaaaaaaaaaaaaaaaaaaaaaaaaaaaaaaaaaaaaaaaaaaaaaaaaaaaaaaaaaaaaaaaaaaaaaaaaaaaaaaaaaaaaaaaaaaaaaaaaaaaaaaaaaaaaaaaaaaaaaaaaaaaaaaaaaaaaaaaaaaaaaaaaaaaaaaaaaaaaaaaaaaaaaaaaaaaaaaaaaaaaaaaaaaaaaaaaaaaaaaaaaaaaaaaaaaaaaaaaaaaaaaaaaaaaaaaaaaaaaaaaaaaaaaaaaaaaaaaaaaaaaaaaaaaaaaaaaaaaaaaaaaaaaaaaaaaaaaaaaaaaaaaaaaaaaaaaaaaaaaaaaaaaaaaaaaaaaaaaaaaaaaaaaaaaaaaaaaaaaaaaaaaaaaaaaaaaaaaaaaaaaaaaaaaaaaaaaaaaaaaaaaaaaaaaaaaaaaaaaaaaaaaaaaaaaaaaaaaaaaaaaaaaaaaaaaaaaaaaaaaaaaaaaaaaaaaaaaaaaaaaaaaaaaaaaaaaaaaaaaaaaaaaaaaaaaaaaaaaaaaaaaaaaaaaaaaaaaaaaaaaaaaaaaaaaaaaaaaaaaaaaaaaaaaaaaaaaaaaaaaaaaaaaaaaaaaaaaaaaaaaaaaaaaaaaaaaaaaaaaaaaaaaaaaaaaaaaaaaaaaaaaaaaaaaaaaaaaaaaaaaaaaaaaaaaaaaaaaaaaaaaaaaaaaaaaaaaaaaaaaaaaaaaaaaaaaaaaaaaaaaaaaaaaaaaaaaaaaaaaaaaaaaaaaaaaaaaaaaaaaaaaaaaaaaaaaaaaaaaaaaaaaaaaaaaaaaaaaaaaaaaaaaaaaaaaaaaaaaaaaaaaaaaaaaaaaaaaaaaaaaaaaaaaaaaaaaaaaaaaaaaaaaaaaaaaaaaaaaaaaaaaaaaaaaaaaaaaaaaaaaaaaaaaaaaaaaaaaaaaaaaaaaaaaaaaaaaaaaaaaaaaaaaaaaaaaaaaaaaaaaaaaaaaaaaaaaaaaaaaaaaaaaaaaaaaaaaaaaaaaaaaaaaaaaaaaaaaaaaaaaaaaaaaaaaaaaaaaaaaaaaaaaaaaaaaaaaaaaaaaaaaaaaaaaaaaaaaaaaaaaaaaaaaaaaaaaaaaaaaaaaaaaaaaaaaaaaaaaaaaaaaaaaaaaaaaaaaaaaaaaaaaaaaaaaaaaaaaaaaaaaaaaaaaaaaaaaaaaaaaaaaaaaaaaaaaaaaaaaaaaaaaaaaaaaaaaaaaaaaaaaaaaaaaaaaaaaaaaaaaaaaaaaaaaaaaaaaaaaaaaaaaaaaaaaaaaaaaaaaaaaaaaaaaaaaaaaaaaaaaaaaaaaaaaaaaaaaaaaaaaaaaaaaaaaaaaaaaaaaaaaaaaaaaaaaaaaaaaaaaaaaaaaaaaaaaaaaaaaaaaaaaaaaaaaaaaaaaaaaaaaaaaaaaaaaaaaaaaaaaaaaaaaaaaaaaaaaaaaaaaaaaaaaaaaaaaaaaaaaaaaaaaaaaaaaaaaaaaaaaaaaaaaaaaaaaaaaaaaaaaaaaaaaaaaaaaaaaaaaaaaaaaaaaaaaaaaaaaaaaaaaaaaaaaaaaaaaaaaaaaaaaaaaaaaaaaaaaaaaaaaaaaaaaaaaaaaaaaaaaaaaaaaaaaaaaaaaaaaaaaaaaaaaaaaaaaaaaaaaaaaaaaaaaaaaaaaaaaaaaaaaaaaaaaaaaaaaaaaaaaaaaaaaaaaaaaaaaaaaaaaaaaaaaaaaaaaaaaaaaaaaaaaaaaaaaaaaaaaaaaaaaaaaaaaaaaaaaaaaaaaaaaaaaaaaaaaaaaaaaaaaaaaaaaaaaaaaaaaaaaaaaaaaaaaaaaaaaaaaaaaaaaaaaaaaaaaaaaaaaaaaaaaaaaaaaaaaaaaaaaaaaaaaaaaaaaaaaaaaaaaaaaaaaaaaaaaaaaaaaaaaaaaaaaaaaaaaaaaaaaaaaaaaaaaaaaaaaaaaaaaaaaaaaaaaaaaaaaaaaaaaaaaaaaaaaaaaaaaaaaaaaaaaaaaaaaaaaaaaaaaaaaaaaaaaaaaaaaaaaaaaaaaaaaaaaaaaaaaaaaaaaaaaaaaaaaaaaaaaaaaaaaaaaaaaaaaaaaaaaaaaaaaaaaaaaaaaaaaaaaaaaaaaaaaaaaaaaaaaaaaaaaaaaaaaaaaaaaaaaaaaaaaaaaaaaaaaaaaaaaaaaaaaaaaaaaaaaaaaaaaaaaaaaaaaaaaaaaaaaaaaaaaaaaaaaaaaaaaaaaaaaaaaaaaaaaaaaaaaaaaaaaaaaaaaaaaaaaaaaaaaaaaaaaaaaaaaaaaaaaaaaaaaaaaaaaaaaaaaaaaaaaaaaaaaaaaaaaaaaaaaaaaaaaaaaaaaaaaaaaaaaaaaaaaaaaaaaaaaaaaaaaaaaaaaaaaaaaaaaaaaaaaaaaaaaaaaaaaaaaaaaaaaaaaaaaaaaaaaaaaaaaaaaaaaaaaaaaaaaaaaaaaaaaaaaaaaaaaaaaaaaaaaaaaaaaaaaaaaaaaaaaaaaaaaaaaaaaaaaaaaaaaaaaaaaaaaaaaaaaaaaaaaaaaaaaaaaaaaaaaaaaaaaaaaaaaaaaaaaaaaaaaaaaaaaaaaaaaaaaaaaaaaaaaaaaaaaaaaaaaaaaaaaaaaaaaaaaaaaaaaaaaaaaaaaaaaaaaaaaaaaaaaaaaaaaaaaaaaaaaaaaaaaaaaaaaaaaaaaaaaaaaaaaaaaaaaaaaaaaaaaaaaaaaaaaaaaaaaaaaaaaaaaaaaaaaaaaaaaaaaaaaaaaaaaaaaaaaaaaaaaaaaaaaaaaaaaaaaaaaaaaaaaaaaaaaaaaaaaaaaaaaaaaaaaaaaaaaaaaaaaaaaaaaaaaaaaaaaaaaaaaaaaaaaaaaaaaaaaaaaaaaaaaaaaaaaaaaaaaaaaaaaaaaaaaaaaaaaaaaaaaaaaaaaaaaaaaaaaaaaaaaaaaaaaaaaaaaaaaaaaaaaaaaaaaaaaaaaaaaaaaaaaaaaaaaaaaaaaaaaaaaaaaaaaaaaaaaaaaaaaaaaaaaaaaaaaaaaaaaaaaaaaaaaaaaaaaaaaaaaaaaaaaaaaaaaaaaaaaaaaaaaaaaaaaaaaaaaaaaaaaaaaaaaaaaaaaaaaaaaaaaaaaaaaaaaaaaaaaaaaaaaaaaaaaaaaaaaaaaaaaaaaaaaaaaaaaaaaaaaaaaaaaaaaaaaaaaaaaaaaaaaaaaaaaaaaaaaaaaaaaaaaaaaaaaaaaaaaaaaaaaaaaaaaaaaaaaaaaaaaaaaaaaaaaaaaaaaaaaaaaaaaaaaaaaaaaaaaaaaaaaaaaaaaaaaaaaaaaaaaaaaaaaaaaaaaaaaaaaaaaaaaaaaaaaaaaaaaaaaaaaaaaaaaaaaaaaaaaaaaaaaaaaaaaaaaaaaaaaaaaaaaaaaaaaaaaaaaaaaaaaaaaaaaaaaaaaaaaaaaaaaaaaaaaaaaaaaaaaaaaaaaaaaaaaaaaaaaaaaaaaaaaaaaaaaaaaaaaaaaaaaaaaaaaaaaaaaaaaaaaaaaaaaaaaaaaaaaaaaaaaaaaaaaaaaaaaaaaaaaaaaaaaaaaaaaaaaaaaaaaaaaaaaaaaaaaaaaaaaaaaaaaaaaaaaaaaaaaaaaaaaaaaaaaaaaaaaaaaaaaaaaaaaaaaaaaaaaaaaaaaaaaaaaaaaaaaaaaaaaaaaaaaaaaaaaaaaaaaaaaaaaaaaaaaaaaaaaaaaaaaaaaaaaaaaaaaaaaaaaaaaaaaaaaaaaaaaaaaaaaaaaaaaaaaaaaaaaaaaaaaaaaaaaaaaaaaaaaaaaaaaaaaaaaaaaaaaaaaaaaaaaaaaaaaaaaaaaaaaaaaaaaaaaaaaaaaaaaaaaaaaaaaaaaaaaaaaaaaaaaaaaaaaaaaaaaaaaaaaaaaaaaaaaaaaaaaaaaaaaaaaaaaaaaaaaaaaaaaaaaaaaaaaaaaaaaaaaaaaaaaaaaaaaaaaaaaaaaaaaaaaaaaaaaaaaaaaaaaaaaaaaaaaaaaaaaaaaaaaaaaaaaaaaaaaaaaaaaaaaaaaaaaaaaaaaaaaaaaaaaaaaaaaaaaaaaaaaaaaaaaaaaaaaaaaaaaaaaaaaaaaaaaaaaaaaaaaaaaaaaaaaaaaaaaaaaaaaaaaaaaaaaaaaaaaaaaaaaaaaaaaaaaaaaaaaaaaaaaaaaaaaaaaaaaaaaaaaaaaaaaaaaaaaaaaaaaaaaaaaaaaaaaaaaaaaaaaaaaaaaaaaaaaaaaaaaaaaaaaaaaaaaaaaaaaaaaaaaaaaaaaaaaaaaaaaaaaaaaaaaaaaaaaaaaaaaaaaaaaaaaaaaaaaaaaaaaaaaaaaaaaaaaaaaaaaaaaaaaaaaaaaaaaaaaaaaaaaaaaaaaaaaaaaaaaaaaaaaaaaaaaaaaaaaaaaaaaaaaaaaaaaaaaaaaaaaaaaaaaaaaaaaaaaaaaaaaaaaaaaaaaaaaaaaaaaaaaaaaaaaaaaaaaaaaaaaaaaaaaaaaaaaaaaaaaaaaaaaaaaaaaaaaaaaaaaaaaaaaaaaaaaaaaaaaaaaaaaaaaaaaaaaaaaaaaaaaaaaaaaaaaaaaaaaaaaaaaaaaaaaaaaaaaaaaaaaaaaaaaaaaaaaaaaaaaaaaaaaaaaaaaaaaaaaaaaaaaaaaaaaaaaaaaaaaaaaaaaaaaaaaaaaaaaaaaaaaaaaaaaaaaaaaaaaaaaaaaaaaaaaaaaaaaaaaaaaaaaaaaaaaaaaaaaaaaaaaaaaaaaaaaaaaaaaaaaaaaaaaaaaaaaaaaaaaaaaaaaaaaaaaaaaaaaaaaaaaaaaaaaaaaaaaaaaaaaaaaaaaaaaaaaaaaaaaaaaaaaaaaaaaaaaaaaaaaaaaaaaaaaaaaaaaaaaaaaaaaaaaaaaaaaaaaaaaaaaaaaaaaaaaaaaaaaaaaaaaaaaaaaaaaaaaaaaaaaaaaaaaaaaaaaaaaaaaaaaaaaaaaaaaaaaaaaaaaaaaaaaaaaaaaaaaaaaaaaaaaaaaaaaaaaaaaaaaaaaaaaaaaaaaaaaaaaaaaaaaaaaaaaaaaaaaaaaaaaaaaaaaaaaaaaaaaaaaaaaaaaaaaaaaaaaaaaaaaaaaaaaaaaaaaaaaaaaaaaaaaaaaaaaaaaaaaaaaaaaaaaaaaaaaaaaaaaaaaaaaaaaaaaaaaaaaaaaaaaaaaaaaaaaaaaaaaaaaaaaaaaaaaaaaaaaaaaaaaaaaaaaaaaaaaaaaaaaaaaaaaaaaaaaaaaaaaaaaaaaaaaaaaaaaaaaaaaaaaaaaaaaaaaaaaaaaaaaaaaaaaaaaaaaaaaaaaaaaaaaaaaaaaaaaaaaaaaaaaaaaaaaaaaaaaaaaaaaaaaaaaaaaaaaaaaaaaaaaaaaaaaaaaaaaaaaaaaaaaaaaaaaaaaaaaaaaaaaaaaaaaaaaaaaaaaaaaaaaaaaaaaaaaaaaaaaaaaaaaaaaaaaaaaaaaaaaaaaaaaaaaaaaaaaaaaaaaaaaaaaaaaaaaaaaaaaaaaaaaaaaaaaaaaaaaaaaaaaaaaaaaaaaaaaaaaaaaaaaaaaaaaaaaaaaaaaaaaaaaaaaaaaaaaaaaaaaaaaaaaaaaaaaaaaaaaaaaaaaaaaaaaaaaaaaaaaaaaaaaaaaaaaaaaaaaaaaaaaaaaaaaaaaaaaaaaaaaaaaaaaaaaaaaaaaaaaaaaaaaaaaaaaaaaaaaaaaaaaaaaaaaaaaaaaaaaaaaaaaaaaaaaaaaaaaaaaaaaaaaaaaaaaaaaaaaaaaaaaaaaaaaaaaaaaaaaaaaaaaaaaaaaaaaaaaaaaaaaaaaaaaaaaaaaaaaaaaaaaaaaaaaaaaaaaaaaaaaaaaaaaaaaaaaaaaaaaaaaaaaaaaaaaaaaaaaaaaaaaaaaaaaaaaaaaaaaaaaaaaaaaaaaaaaaaaaaaaaaaaaaaaaaaaaaaaaaaaaaaaaaaaaaaaaaaaaaaaaaaaaaaaaaaaaaaaaaaaaaaaaaaaaaaaaaaaaaaaaaaaaaaaaaaaaaaaaaaaaaaaaaaaaaaaaaaaaaaaaaaaaaaaaaaaaaaaaaaaaaaaaaaaaaaaaaaaaaaaaaaaaaaaaaaaaaaaaaaaaaaaaaaaaaaaaaaaaaaaaaaaaaaaaaaaaaaaaaaaaaaaaaaaaaaaaaaaaaaaaaaaaaaaaaaaaaaaaaaaaaaaaaaaaaaaaaaaaaaaaaaaaaaaaaaaaaaaaaaaaaaaaaaaaaaaaaaaaaaaaaaaaaaaaaaaaaaaaaaaaaaaaaaaaaaaaaaaaaaaaaaaaaaaaaaaaaaaaaaaaaaaaaaaaaaaaaaaaaaaaaaaaaaaaaaaaaaaaaaaaaaaaaaaaaaaaaaaaaaaaaaaaaaaaaaaaaaaaaaaaaaaaaaaaaaaaaaaaaaaaaaaaaaaaaaaaaaaaaaaaaaaaaaaaaaaaaaaaaaaaaaaaaaaaaaaaaaaaaaaaaaaaaaaaaaaaaaaaaaaaaaaaaaaaaaaaaaaaaaaaaaaaaaaaaaaaaaaaaaaaaaaaaaaaaaaaaaaaaaaaaaaaaaaaaaaaaaaaaaaaaaaaaaaaaaaaaaaaaaaaaaaaaaaaaaaaaaaaaaaaaaaaaaaaaaaaaaaaaaaaaaaaaaaaaaaaaaaaaaaaaaaaaaaaaaaaaaaaaaaaaaaaaaaaaaaaaaaaaaaaaaaaaaaaaaaaaaaaaaaaaaaaaaaaaaaaaaaaaaaaaaaaaaaaaaaaaaaaaaaaaaaaaaaaaaaaaaaaaaaaaaaaaaaaaaaaaaaaaaaaaaaaaaaaaaaaaaaaaaaaaaaaaaaaaaaaaaaaaaaaaaaaaaaaaaaaaaaaaaaaaaaaaaaaaaaaaaaaaaaaaaaaaaaaaaaaaaaaaaaaaaaaaaaaaaaaaaaaaaaaaaaaaaaaaaaaaaaaaaaaaaaaaaaaaaaaaaaaaaaaaaaaaaaaaaaaaaaaaaaaaaaaaaaaaaaaaaaaaaaaaaaaaaaaaaaaaaaaaaaaaaaaaaaaaaaaaaaaaaaaaaaaaaaaaaaaaaaaaaaaaaaaaaaaaaaaaaaaaaaaaaaaaaaaaaaaaaaaaaaaaaaaaaaaaaaaaaaaaaaaaaaaaaaaaaaaaaaaaaaaaaaaaaaaaaaaaaaaaaaaaaaaaaaaaaaaaaaaaaaaaaaaaaaaaaaaaaaaaaaaaaaaaaaaaaaaaaaaaaaaaaaaaaaaaaaaaaaaaaaaaaaaaaaaaaaaaaaaaaaaaaaaaaaaaaaaaaaaaaaaaaaaaaaaaaaaaaaaaaaaaaaaaaaaaaaaaaaaaaaaaaaaaaaaaaaaaaaaaaaaaaaaaaaaaaaaaaaaaaaaaaaaaaaaaaaaaaaaaaaaaaaaaaaaaaaaaaaaaaaaaaaaaaaaaaaaaaaaaaaaaaaaaaaaaaaaaaaaaaaaaaaaaaaaaaaaaaaaaaaaaaaaaaaaaaaaaaaaaaaaaaaaaaaaaaaaaaaaaaaaaaaaaaaaaaaaaaaaaaaaaaaaaaaaaaaaaaaaaaaaaaaaaaaaaaaaaaaaaaaaaaaaaaaaaaaaaaaaaaaaaaaaaaaaaaaaaaaaaaaaaaaaaaaaaaaaaaaaaaaaaaaaaaaaaaaaaaaaaaaaaaaaaaaaaaaaaaaaaaaaaaaaaaaaaaaaaaaaaaaaaaaaaaaaaaaaaaaaaaaaaaaaaaaaaaaaaaaaaaaaaaaaaaaaaaaaaaaaaaaaaaaaaaaaaaaaaaaaaaaaaaaaaaaaaaaaaaaaaaaaaaaaaaaaaaaaaaaaaaaaaaaaaaaaaaaaaaaaaaaaaaaaaaaaaaaaaaaaaaaaaaaaaaaaaaaaaaaaaaaaaaaaaaaaaaaaaaaaaaaaaaaaaaaaaaaaaaaaaaaaaaaaaaaaaaaaaaaaaaaaaaaaaaaaaaaaaaaaaaaaaaaaaaaaaaaaaaaaaaaaaaaaaaaaaaaaaaaaaaaaaaaaaaaaaaaaaaaaaaaaaaaaaaaaaaaaaaaaaaaaaaaaaaaaaaaaaaaaaaaaaaaaaaaaaaaaaaaaaaaaaaaaaaaaaaaaaaaaaaaaaaaaaaaaaaaaaaaaaaaaaaaaaaaaaaaaaaaaaaaaaaaaaaaaaaaaaaaaaaaaaaaaaaaaaaaaaaaaaaaaaaaaaaaaaaaaaaaaaaaaaaaaaaaaaaaaaaaaaaaaaaaaaaaaaaaaaaaaaaaaaaaaaaaaaaaaaaaaaaaaaaaaaaaaaaaaaaaaaaaaaaaaaaaaaaaaaaaaaaaaaaaaaaaaaaaaaaaaaaaaaaaaaaaaaaaaaaaaaaaaaaaaaaaaaaaaaaaaaaaaaaaaaaaaaaaaaaaaaaaaaaaaaaaaaaaaaaaaaaaaaaaaaaaaaaaaaaaaaaaaaaaaaaaaaaaaaaaaaaaaaaaaaaaaaaaaaaaaaaaaaaaaaaaaaaaaaaaaaaaaaaaaaaaaaaaaaaaaaaaaaaaaaaaaaaaaaaaaaaaaaaaaaaaaaaaaaaaaaaaaaaaaaaaaaaaaaaaaaaaaaaaaaaaaaaaaaaaaaaaaaaaaaaaaaaaaaaaaaaaaaaaaaaaaaaaaaaaaaaaaaaaaaaaaaaaaaaaaaaaaaaaaaaaaaaaaaaaaaaaaaaaaaaaaaaaaaaaaaaaaaaaaaaaaaaaaaaaaaaaaaaaaaaaaaaaaaaaaaaaaaaaaaaaaaaaaaaaaaaaaaaaaaaaaaaaaaaaaaaaaaaaaaaaaaaaaaaaaaaaaaaaaaaaaaaaaaaaaaaaaaaaaaaaaaaaaaaaaaaaaaaaaaaaaaaaaaaaaaaaaaaaaaaaaaaaaaaaaaaaaaaaaaaaaaaaaaaaaaaaaaaaaaaaaaaaaaaaaaaaaaaaaaaaaaaaaaaaaaaaaaaaaaaaaaaaaaaaaaaaaaaaaaaaaaaaaaaaaaaaaaaaaaaaaaaaaaaaaaaaaaaaaaaaaaaaaaaaaaaaaaaaaaaaaaaaaaaaaaaaaaaaaaaaaaaaaaaaaaaaaaaaaaaaaaaaaaaaaaaaaaaaaaaaaaaaaaaaaaaaaaaaaaaaaaaaaaaaaaaaaaaaaaaaaaaaaaaaaaaaaaaaaaaaaaaaaaaaaaaaaaaaaaaaaaaaaaaaaaaaaaaaaaaaaaaaaaaaaaaaaaaaaaaaaaaaaaaaaaaaaaaaaaaaaaaaaaaaaaaaaaaaaaaaaaaaaaaaaaaaaaaaaaaaaaaaaaaaaaaaaaaaaaaaaaaaaaaaaaaaaaaaaaaaaaaaaaaaaaaaa"]
select jsn_keys(NULL);
jsn_keys(NULL)
NULL
select jsn_keys(NULL, '$.b');
jsn_keys(NULL, '$.b')
NULL
select jsn_keys(NULL, NULL);
jsn_keys(NULL, NULL)
NULL
select jsn_keys('{"a": 1, "b": {"e": "foo", "b": 3}}', '$.a');
jsn_keys('{"a": 1, "b": {"e": "foo", "b": 3}}', '$.a')
NULL
select jsn_keys('{"a": 1, "b": {"e": "foo", "b": 3}}', NULL);
jsn_keys('{"a": 1, "b": {"e": "foo", "b": 3}}', NULL)
NULL
select jsn_keys('{"a": 1, "b": {"e": "foo", "b": 3}}');
jsn_keys('{"a": 1, "b": {"e": "foo", "b": 3}}')
["a", "b"]
select jsn_keys('{"a": 1, "b": {"e": "foo", "b": 3}}', '$.b');
jsn_keys('{"a": 1, "b": {"e": "foo", "b": 3}}', '$.b')
["b", "e"]
select jsn_keys('{"a": 1, "b": {"e": "foo", "b": 3}}', '$.*.b');
ERROR 42000: In this situation, path expressions may not contain the * and ** tokens.
delete from keys1;
insert into keys1 values (0, NULL),
(1, '{"a": 1, "b": {"e": "foo", "b": 3}}');
select i, jsn_keys(j), jsn_keys(j, '$.b') from keys1;
i	jsn_keys(j)	jsn_keys(j, '$.b')
0	NULL	NULL
1	["a", "b"]	["b", "e"]
# returns [ "a", "b" ]
SELECT JSN_KEYS('{ "a" : "foo", "b" : [ true, { "c" : "123" } ] }');
JSN_KEYS('{ "a" : "foo", "b" : [ true, { "c" : "123" } ] }')
["a", "b"]
# returns []
SELECT JSN_KEYS('{ "a" : "foo", "b" : [ true, { "c" : {} } ] }',
'$.b[1].c');
JSN_KEYS('{ "a" : "foo", "b" : [ true, { "c" : {} } ] }',
'$.b[1].c')
[]
# returns NULL
SELECT JSN_KEYS('{ "a" : "foo", "b" : [ true, { "c" : {} } ] }',
'$.a.b[2]');
JSN_KEYS('{ "a" : "foo", "b" : [ true, { "c" : {} } ] }',
'$.a.b[2]')
NULL
SELECT JSN_KEYS('{"a":1}', '1010');
ERROR 42000: Invalid JSON path expression. The error is around character position 1 in '1010'.
SELECT JSN_KEYS('{"a":1}', '1010') IS NULL;
ERROR 42000: Invalid JSON path expression. The error is around character position 1 in '1010'.
SELECT JSN_KEYS
(
'{ "a" : "foo", "b" : [ true, { "c" : "123" } ] }'
);
JSN_KEYS
(
'{ "a" : "foo", "b" : [ true, { "c" : "123" } ] }'
)
["a", "b"]
SELECT JSN_KEYS
(
'{ "a" : "foo", "b" : [ true, { "c" : {} } ] }',
'$.b[1].c'
);
JSN_KEYS
(
'{ "a" : "foo", "b" : [ true, { "c" : {} } ] }',
'$.b[1].c'
)
[]
SELECT JSN_KEYS
(
'{ "a" : "foo", "b" : [ true, { "c" : {} } ] }',
'$.a.b[2]'
);
JSN_KEYS
(
'{ "a" : "foo", "b" : [ true, { "c" : {} } ] }',
'$.a.b[2]'
)
NULL
# ----------------------------------------------------------------------
# CAST(<json> AS CHAR). See also 'json_conversions.test' for other
# conversion tests.
# ----------------------------------------------------------------------
select cast(jsn_keys('{"a": 1}') as char);
cast(jsn_keys('{"a": 1}') as char)
["a"]
select cast(cast(1 as json) as char);
cast(cast(1 as json) as char)
1
select cast(jsn_keys(NULL) as char);
cast(jsn_keys(NULL) as char)
NULL
select cast(j as char) from keys1;
cast(j as char)
NULL
{"a": 1, "b": {"b": 3, "e": "foo"}}
create table t(i int);
select cast(jsn_extract(j, '$.b.b') as char) from keys1;
cast(jsn_extract(j, '$.b.b') as char)
NULL
3
insert into t select cast(jsn_extract(j, '$.b.b') as char) from keys1;
select * from t;
i
NULL
3
drop table t;
drop table keys1;
# ----------------------------------------------------------------------
# Path matching with double-quotes
# ----------------------------------------------------------------------
select jsn_extract( '{ "one potato" : 1 }', '$."one potato"' );
jsn_extract( '{ "one potato" : 1 }', '$."one potato"' )
1
select jsn_extract( '{ "a.b" : 1 }', '$."a.b"' );
jsn_extract( '{ "a.b" : 1 }', '$."a.b"' )
1
select jsn_extract( '{ "\\"a\\"": 1}', '$."a"' );
jsn_extract( '{ "\\"a\\"": 1}', '$."a"' )
NULL
select jsn_extract( '{ "\\"a\\"": 1}', '$."\\"a\\""' );
jsn_extract( '{ "\\"a\\"": 1}', '$."\\"a\\""' )
1
select jsn_extract( '{ "a": 1}', '$."a"' );
jsn_extract( '{ "a": 1}', '$."a"' )
1
select jsn_extract( '{ "a": 1}', '$.a' );
jsn_extract( '{ "a": 1}', '$.a' )
1
select jsn_extract( '{ "a": [ [ 3, 2 ], [ { "c" : "d" }, 1 ] ], "b": { "c" : 6 }, "one potato": 7, "b.c" : 8 }', '$.a[0]' );
jsn_extract( '{ "a": [ [ 3, 2 ], [ { "c" : "d" }, 1 ] ], "b": { "c" : 6 }, "one potato": 7, "b.c" : 8 }', '$.a[0]' )
[3, 2]
select jsn_extract( '{ "a": [ [ 3, 2 ], [ { "c" : "d" }, 1 ] ], "b": { "c" : 6 }, "one potato": 7, "b.c" : 8 }', '$.a[0][1]' );
jsn_extract( '{ "a": [ [ 3, 2 ], [ { "c" : "d" }, 1 ] ], "b": { "c" : 6 }, "one potato": 7, "b.c" : 8 }', '$.a[0][1]' )
2
select jsn_extract( '{ "a": [ [ 3, 2 ], [ { "c" : "d" }, 1 ] ], "b": { "c" : 6 }, "one potato": 7, "b.c" : 8 }', '$.a[1]' );
jsn_extract( '{ "a": [ [ 3, 2 ], [ { "c" : "d" }, 1 ] ], "b": { "c" : 6 }, "one potato": 7, "b.c" : 8 }', '$.a[1]' )
[{"c": "d"}, 1]
select jsn_extract( '{ "a": [ [ 3, 2 ], [ { "c" : "d" }, 1 ] ], "b": { "c" : 6 }, "one potato": 7, "b.c" : 8 }', '$.a[1][0]' );
jsn_extract( '{ "a": [ [ 3, 2 ], [ { "c" : "d" }, 1 ] ], "b": { "c" : 6 }, "one potato": 7, "b.c" : 8 }', '$.a[1][0]' )
{"c": "d"}
select jsn_extract( '{ "a": [ [ 3, 2 ], [ { "c" : "d" }, 1 ] ], "b": { "c" : 6 }, "one potato": 7, "b.c" : 8 }', '$.a[1][0].c' );
jsn_extract( '{ "a": [ [ 3, 2 ], [ { "c" : "d" }, 1 ] ], "b": { "c" : 6 }, "one potato": 7, "b.c" : 8 }', '$.a[1][0].c' )
"d"
select jsn_extract( '{ "a": [ [ 3, 2 ], [ { "c" : "d" }, 1 ] ], "b": { "c" : 6 }, "one potato": 7, "b.c" : 8 }', '$."one potato"' );
jsn_extract( '{ "a": [ [ 3, 2 ], [ { "c" : "d" }, 1 ] ], "b": { "c" : 6 }, "one potato": 7, "b.c" : 8 }', '$."one potato"' )
7
select jsn_extract( '{ "a": [ [ 3, 2 ], [ { "c" : "d" }, 1 ] ], "b": { "c" : 6 }, "one potato": 7, "b.c" : 8 }', '$.b.c' );
jsn_extract( '{ "a": [ [ 3, 2 ], [ { "c" : "d" }, 1 ] ], "b": { "c" : 6 }, "one potato": 7, "b.c" : 8 }', '$.b.c' )
6
select jsn_extract( '{ "a": [ [ 3, 2 ], [ { "c" : "d" }, 1 ] ], "b": { "c" : 6 }, "one potato": 7, "b.c" : 8 }', '$."b.c"' );
jsn_extract( '{ "a": [ [ 3, 2 ], [ { "c" : "d" }, 1 ] ], "b": { "c" : 6 }, "one potato": 7, "b.c" : 8 }', '$."b.c"' )
8
# ----------------------------------------------------------------------
# Test of JSN_EXTRACT function.
# ----------------------------------------------------------------------
select jsn_extract(NULL);
ERROR 42000: Incorrect parameter count in the call to native function 'jsn_extract'
select jsn_extract('$.b');
ERROR 42000: Incorrect parameter count in the call to native function 'jsn_extract'
select jsn_extract('{"a": 1, "b": {"e": "foo", "b": 3}}');
ERROR 42000: Incorrect parameter count in the call to native function 'jsn_extract'
select jsn_extract('$.a', '{"a": 1, "b": {"e": "foo", "b": 3}}');
ERROR 22032: Invalid JSON text in argument 1 to function jsn_extract: "Expect a value here." at position 0 in '$.a'.
select jsn_extract(NULL, '$.b');
jsn_extract(NULL, '$.b')
NULL
select jsn_extract(NULL, NULL);
jsn_extract(NULL, NULL)
NULL
select jsn_extract('{"a": 1, "b": {"e": "foo", "b": 3}}', '$.a');
jsn_extract('{"a": 1, "b": {"e": "foo", "b": 3}}', '$.a')
1
select jsn_extract('{"a": 1, "b": {"e": "foo", "b": 3}}', '$.*');
jsn_extract('{"a": 1, "b": {"e": "foo", "b": 3}}', '$.*')
[1, {"b": 3, "e": "foo"}]
select jsn_extract('{"a": 1, "b": {"e": "foo", "b": 3}}', '$.a', '$.b.e');
jsn_extract('{"a": 1, "b": {"e": "foo", "b": 3}}', '$.a', '$.b.e')
[1, "foo"]
select jsn_extract('{"a": 1, "b": [1,2,3]}', '$.b[2]');
jsn_extract('{"a": 1, "b": [1,2,3]}', '$.b[2]')
3
select jsn_extract('{"a": 1, "b": {"e": "foo", "b": 3}}', '$.a', NULL);
jsn_extract('{"a": 1, "b": {"e": "foo", "b": 3}}', '$.a', NULL)
NULL
# returns a JSON value containing just the string "123"
SELECT JSN_EXTRACT('{ "a" : "foo", "b" : [ true, { "c" : "123" } ] }',
'$.b[ 1 ].c');
JSN_EXTRACT('{ "a" : "foo", "b" : [ true, { "c" : "123" } ] }',
'$.b[ 1 ].c')
"123"
# returns a JSON value containing just the number 123
SELECT JSN_EXTRACT('{ "a" : "foo", "b" : [ true, { "c" : 123 } ] }',
'$.b[ 1 ].c');
JSN_EXTRACT('{ "a" : "foo", "b" : [ true, { "c" : 123 } ] }',
'$.b[ 1 ].c')
123
# raises an error because the document is not valid
SELECT JSN_EXTRACT('{ "a" : [ }',
'$.b[ 1 ].c');
ERROR 22032: Invalid JSON text in argument 1 to function jsn_extract: "Expect a value here." at position 10 in '{ "a" : [ }'.
# raises an error because the path is invalid
SELECT JSN_EXTRACT('{ "a" : "foo", "b" : [ true, { "c" : 123 } ] }',
'$.b[ 1 ].');
ERROR 42000: Invalid JSON path expression. The error is around character position 9 in '$.b[ 1 ].'.
# returns a JSON value containing the number 123 (because of 
# auto-wrapping the scalar)
SELECT JSN_EXTRACT('{ "a" : "foo", "b" : [ true, { "c" : 123 } ] }',
'$.b[ 1 ].c[ 0 ]');
JSN_EXTRACT('{ "a" : "foo", "b" : [ true, { "c" : 123 } ] }',
'$.b[ 1 ].c[ 0 ]')
123
# returns a JSON value containing the object because of auto-wrapping
SELECT JSN_EXTRACT('{ "a" : "foo", "b" : [ true, { "c" : {"not array": 4} } ] }',
'$.b[ 1 ].c[ 0 ]');
JSN_EXTRACT('{ "a" : "foo", "b" : [ true, { "c" : {"not array": 4} } ] }',
'$.b[ 1 ].c[ 0 ]')
{"not array": 4}
# returns null because the path, although valid, does not identify a value
SELECT JSN_EXTRACT('{ "a" : "foo", "b" : [ true, { "c" : 123 } ] }',
'$.b[ 1 ].c[ 1 ]');
JSN_EXTRACT('{ "a" : "foo", "b" : [ true, { "c" : 123 } ] }',
'$.b[ 1 ].c[ 1 ]')
NULL
# returns a JSON value containing the number 123 (due to normalization)
SELECT JSN_EXTRACT('{ "a" : "foo", "b" : [ true, { "c" : 123, "c" : 456 } ] }',
'$.b[ 1 ].c');
JSN_EXTRACT('{ "a" : "foo", "b" : [ true, { "c" : 123, "c" : 456 } ] }',
'$.b[ 1 ].c')
123
# returns a JSON array [ "foo", true ]
SELECT JSN_EXTRACT('{ "a" : "foo", "b" : [ true, { "c" : 123, "c" : 456 } ] }',
'$.a', '$.b[0]');
JSN_EXTRACT('{ "a" : "foo", "b" : [ true, { "c" : 123, "c" : 456 } ] }',
'$.a', '$.b[0]')
["foo", true]
# returns a JSON array [ true ]
SELECT JSN_EXTRACT('{ "a" : "foo", "b" : [ true, { "c" : 123, "c" : 456 } ] }',
'$.d', '$.b[0]');
JSN_EXTRACT('{ "a" : "foo", "b" : [ true, { "c" : 123, "c" : 456 } ] }',
'$.d', '$.b[0]')
true
select jsn_extract( '[1]', '$[0][0]' );
jsn_extract( '[1]', '$[0][0]' )
1
select jsn_extract( '[1]', '$**[0]' );
jsn_extract( '[1]', '$**[0]' )
1
select jsn_extract( '{ "a": 1 }', '$.a[0]' );
jsn_extract( '{ "a": 1 }', '$.a[0]' )
1
select jsn_extract( '{ "a": 1 }', '$**[0]' );
jsn_extract( '{ "a": 1 }', '$**[0]' )
[{"a": 1}, 1]
select jsn_extract( '{ "a": 1 }', '$[0].a' );
jsn_extract( '{ "a": 1 }', '$[0].a' )
1
select jsn_extract( '{ "a": 1 }', '$**.a' );
jsn_extract( '{ "a": 1 }', '$**.a' )
1
select jsn_extract( '{ "a": 1 }', '$[0].a[0]' );
jsn_extract( '{ "a": 1 }', '$[0].a[0]' )
1
select jsn_extract( '{ "a": 1 }', '$**[0]' );
jsn_extract( '{ "a": 1 }', '$**[0]' )
[{"a": 1}, 1]
select jsn_extract( '{ "a": 1 }', '$[0].a' );
jsn_extract( '{ "a": 1 }', '$[0].a' )
1
select jsn_extract( '{ "a": 1 }', '$**.a' );
jsn_extract( '{ "a": 1 }', '$**.a' )
1
select jsn_extract( '{ "a": 1 }', '$[0][0].a' );
jsn_extract( '{ "a": 1 }', '$[0][0].a' )
1
select jsn_extract( '{ "a": 1 }', '$[0][0][0].a' );
jsn_extract( '{ "a": 1 }', '$[0][0][0].a' )
1
SELECT JSN_EXTRACT
(
'{ "a" : "foo", "b" : [ true, { "c" : "123" } ] }',
'$.b[ 1 ].c'
);
JSN_EXTRACT
(
'{ "a" : "foo", "b" : [ true, { "c" : "123" } ] }',
'$.b[ 1 ].c'
)
"123"
SELECT JSN_EXTRACT
(
'{ "a" : "foo", "b" : [ true, { "c" : 123 } ] }',
'$.b[ 1 ].c'
);
JSN_EXTRACT
(
'{ "a" : "foo", "b" : [ true, { "c" : 123 } ] }',
'$.b[ 1 ].c'
)
123
SELECT JSN_EXTRACT
(
'{ "a" : [ }',
'$.b[ 1 ].c'
);
ERROR 22032: Invalid JSON text in argument 1 to function jsn_extract: "Expect a value here." at position 10 in '{ "a" : [ }'.
SELECT JSN_EXTRACT
(
'{ "a" : "foo", "b" : [ true, { "c" : 123 } ] }',
'$.b[ 1 ].'
);
ERROR 42000: Invalid JSON path expression. The error is around character position 9 in '$.b[ 1 ].'.
SELECT JSN_EXTRACT
(
'{ "a" : "foo", "b" : [ true, { "c" : 123 } ] }',
'$.b[ 1 ].c[ 0 ]'
);
JSN_EXTRACT
(
'{ "a" : "foo", "b" : [ true, { "c" : 123 } ] }',
'$.b[ 1 ].c[ 0 ]'
)
123
SELECT JSN_EXTRACT
(
'{ "a" : "foo", "b" : [ true, { "c" : 123 } ] }',
'$.b[ 1 ].c[ 1 ]'
);
JSN_EXTRACT
(
'{ "a" : "foo", "b" : [ true, { "c" : 123 } ] }',
'$.b[ 1 ].c[ 1 ]'
)
NULL
SELECT JSN_EXTRACT
(
'{ "a" : "foo", "b" : [ true, { "c" : 123, "c" : 456 } ] }',
'$.b[ 1 ].c'
);
JSN_EXTRACT
(
'{ "a" : "foo", "b" : [ true, { "c" : 123, "c" : 456 } ] }',
'$.b[ 1 ].c'
)
123
SELECT JSN_EXTRACT
(
'{ "a" : "foo", "b" : [ true, { "c" : 123, "c" : 456 } ] }',
'$.a', '$.b[0]'
);
JSN_EXTRACT
(
'{ "a" : "foo", "b" : [ true, { "c" : 123, "c" : 456 } ] }',
'$.a', '$.b[0]'
)
["foo", true]
SELECT JSN_EXTRACT
(
'{ "a" : "foo", "b" : [ true, { "c" : 123, "c" : 456 } ] }',
'$.d', '$.b[0]'
);
JSN_EXTRACT
(
'{ "a" : "foo", "b" : [ true, { "c" : 123, "c" : 456 } ] }',
'$.d', '$.b[0]'
)
true
# ----------------------------------------------------------------------
# Test of JSN_APPEND function.
# ----------------------------------------------------------------------
select jsn_append(NULL, '$.b', cast(1 as json));
jsn_append(NULL, '$.b', cast(1 as json))
NULL
select jsn_append('[1,2,3]', NULL, cast(1 as json));
jsn_append('[1,2,3]', NULL, cast(1 as json))
NULL
select jsn_append('[1,2,3]', '$', NULL);
jsn_append('[1,2,3]', '$', NULL)
NULL
select jsn_append(NULL);
ERROR 42000: Incorrect parameter count in the call to native function 'jsn_append'
select jsn_append(NULL, NULL);
ERROR 42000: Incorrect parameter count in the call to native function 'jsn_append'
select jsn_append(NULL, NULL, NULL, NULL);
ERROR 42000: Incorrect parameter count in the call to native function 'jsn_append'
create table t(j json);
insert into t values ('[ 1, 2, 3, {"a": [4,5,6]}]');
select jsn_append(j, '$[3].a', cast(7 as json)) from t;
jsn_append(j, '$[3].a', cast(7 as json))
[1, 2, 3, {"a": [4, 5, 6, 7]}]
select jsn_append(j, '$', 7) from t;
jsn_append(j, '$', 7)
[1, 2, 3, {"a": [4, 5, 6]}, 7]
select jsn_append(j, '$', cast(7 as json), '$[3].a', 3.14) from t;
jsn_append(j, '$', cast(7 as json), '$[3].a', 3.14)
[1, 2, 3, {"a": [4, 5, 6, 3.14]}, 7]
# second path's append ignored since it doesn't specify an array
# nor is it an existing scalar,  so no auto-wrapping either
select jsn_append(j, '$', 7, '$[3].b', cast(8 as json)) from t;
jsn_append(j, '$', 7, '$[3].b', cast(8 as json))
[1, 2, 3, {"a": [4, 5, 6]}, 7]
drop table t;
SELECT JSN_APPEND(cast('1' as json), '$', 3);
JSN_APPEND(cast('1' as json), '$', 3)
[1, 3]
SELECT JSN_APPEND(cast('{"a": 3}' as json), '$', 3);
JSN_APPEND(cast('{"a": 3}' as json), '$', 3)
[{"a": 3}, 3]
select jsn_append(cast('{"a": {"b": [3]}}' as json), '$**[0]', 6);
ERROR 42000: In this situation, path expressions may not contain the * and ** tokens.
# Auto-wrapping, since because the paths identify scalars.
# should return {"a": "foo", "b": ["bar", 4], "c": ["wibble", "grape"]}
SELECT JSN_APPEND('{"a": "foo", "b": "bar", "c": "wibble"}',
'$.b', cast(4 as json),
'$.c', cast('"grape"' as json));
JSN_APPEND('{"a": "foo", "b": "bar", "c": "wibble"}',
'$.b', cast(4 as json),
'$.c', cast('"grape"' as json))
{"a": "foo", "b": ["bar", 4], "c": ["wibble", "grape"]}
# should return {"a": "foo", "b": [1, 2, 3, 4],
#                "c": ["apple", "pear", "grape"]}
SELECT JSN_APPEND('{"a" : "foo","b": [1, 2, 3], "c": ["apple", "pear"]}',
'$.b', cast(4 as json),
'$.c', cast('"grape"' as json));
JSN_APPEND('{"a" : "foo","b": [1, 2, 3], "c": ["apple", "pear"]}',
'$.b', cast(4 as json),
'$.c', cast('"grape"' as json))
{"a": "foo", "b": [1, 2, 3, 4], "c": ["apple", "pear", "grape"]}
SELECT JSN_APPEND('{"a" : "foo","b": [1, 2, 3], "c": ["apple", "pear"]}',
'$.b', 4,
'$.c', 'grape');
JSN_APPEND('{"a" : "foo","b": [1, 2, 3], "c": ["apple", "pear"]}',
'$.b', 4,
'$.c', 'grape')
{"a": "foo", "b": [1, 2, 3, 4], "c": ["apple", "pear", "grape"]}
select jsn_append( '[[], [], []]', '$[*]', 3, '$[*]', 4);
ERROR 42000: In this situation, path expressions may not contain the * and ** tokens.
select jsn_append( '[[], "not array", []]', '$[*]', 3, '$[*]', 4);
ERROR 42000: In this situation, path expressions may not contain the * and ** tokens.
SELECT JSN_APPEND
(
'{ "a" : "foo", "b" : "bar", "c" : "wibble" }',
'$.b', 4,
'$.c', "grape"
);
JSN_APPEND
(
'{ "a" : "foo", "b" : "bar", "c" : "wibble" }',
'$.b', 4,
'$.c', "grape"
)
{"a": "foo", "b": ["bar", 4], "c": ["wibble", "grape"]}
SELECT JSN_APPEND
(
'{ "a" : "foo", "b" : [ 1, 2, 3 ], "c" : [ "apple", "pear" ] }',
'$.b', 4,
'$.c', "grape"
);
JSN_APPEND
(
'{ "a" : "foo", "b" : [ 1, 2, 3 ], "c" : [ "apple", "pear" ] }',
'$.b', 4,
'$.c', "grape"
)
{"a": "foo", "b": [1, 2, 3, 4], "c": ["apple", "pear", "grape"]}
# ----------------------------------------------------------------------
# Test of JSN_INSERT function.
# ----------------------------------------------------------------------
select jsn_insert(NULL, '$.b', cast(1 as json));
jsn_insert(NULL, '$.b', cast(1 as json))
NULL
select jsn_insert('[1,2,3]', NULL, cast(1 as json));
jsn_insert('[1,2,3]', NULL, cast(1 as json))
NULL
select jsn_insert('[1,2,3]', '$[3]', NULL);
jsn_insert('[1,2,3]', '$[3]', NULL)
NULL
select jsn_insert(NULL);
ERROR 42000: Incorrect parameter count in the call to native function 'jsn_insert'
select jsn_insert(NULL, NULL);
ERROR 42000: Incorrect parameter count in the call to native function 'jsn_insert'
select jsn_insert(NULL, NULL, NULL, NULL);
ERROR 42000: Incorrect parameter count in the call to native function 'jsn_insert'
select jsn_insert('[1,2,3]', '$[2]', 4);
jsn_insert('[1,2,3]', '$[2]', 4)
[1, 2, 3]
select jsn_insert('[1,2,3]', '$[3]', 4);
jsn_insert('[1,2,3]', '$[3]', 4)
[1, 2, 3, 4]
select jsn_insert('[1,2,3]', '$[10]', 4);
jsn_insert('[1,2,3]', '$[10]', 4)
[1, 2, 3, 4]
select jsn_insert('{"c":4}', '$.c', 4);
jsn_insert('{"c":4}', '$.c', 4)
{"c": 4}
select jsn_insert('{"c":4}', '$.a', 4);
jsn_insert('{"c":4}', '$.a', 4)
{"a": 4, "c": 4}
select jsn_insert('1', '$', 4);
jsn_insert('1', '$', 4)
1
select jsn_insert('1', '$[0]', 4);
jsn_insert('1', '$[0]', 4)
1
select jsn_insert('1', '$[1]', 4);
jsn_insert('1', '$[1]', 4)
[1, 4]
select jsn_insert('1', '$[10]', '4', '$[11]', 5);
jsn_insert('1', '$[10]', '4', '$[11]', 5)
[1, "4", 5]
select jsn_insert('[1,2,3]', '$[2][0]', 4);
jsn_insert('[1,2,3]', '$[2][0]', 4)
[1, 2, 3]
select jsn_insert('[1,2,3]', '$[2][2]', 4);
jsn_insert('[1,2,3]', '$[2][2]', 4)
[1, 2, [3, 4]]
select jsn_insert('{"a": 3}', '$.a[0]', 4);
jsn_insert('{"a": 3}', '$.a[0]', 4)
{"a": 3}
select jsn_insert('{"a": 3}', '$.a[1]', 4, '$.a[2]', '5');
jsn_insert('{"a": 3}', '$.a[1]', 4, '$.a[2]', '5')
{"a": [3, 4, "5"]}
select jsn_insert(cast('{"a": [1], "b": 2}' as json), '$.*[1]', 6);
ERROR 42000: In this situation, path expressions may not contain the * and ** tokens.
select jsn_insert(cast('{"a": 1, "b": 2}' as json), '$.*[1]', 6);
ERROR 42000: In this situation, path expressions may not contain the * and ** tokens.
select jsn_insert(cast('{"a": {"b": 3}}' as json),   '$.a.*[1]', 6);
ERROR 42000: In this situation, path expressions may not contain the * and ** tokens.
select jsn_insert(cast('{"a": {"b": [3]}}' as json), '$.a.*[1]', 6);
ERROR 42000: In this situation, path expressions may not contain the * and ** tokens.
select jsn_insert(cast('{"a": {"b": 3}}' as json),   '$**[1]', 6);
ERROR 42000: In this situation, path expressions may not contain the * and ** tokens.
select jsn_insert(cast('{"a": {"b": [3]}}' as json), '$**[1]', 6);
ERROR 42000: In this situation, path expressions may not contain the * and ** tokens.
select jsn_insert(cast('[1]' as json), '$[*][1]', 6);
ERROR 42000: In this situation, path expressions may not contain the * and ** tokens.
select jsn_insert(cast('[1]' as json), '$**[1]', 6);
ERROR 42000: In this situation, path expressions may not contain the * and ** tokens.
select jsn_insert(cast('[1, [2], 3]' as json), '$[*][1]', 6);
ERROR 42000: In this situation, path expressions may not contain the * and ** tokens.
select jsn_insert(cast('[1, [2], 3]' as json), '$**[1]', 6);
ERROR 42000: In this situation, path expressions may not contain the * and ** tokens.
select jsn_insert(cast('[[1]]' as json), '$[*][1]', 6);
ERROR 42000: In this situation, path expressions may not contain the * and ** tokens.
select jsn_insert(cast('[[1]]' as json), '$**[1]', 6);
ERROR 42000: In this situation, path expressions may not contain the * and ** tokens.
select jsn_insert(cast('{"a": 3}' as json), '$[1]', 6);
jsn_insert(cast('{"a": 3}' as json), '$[1]', 6)
[{"a": 3}, 6]
SELECT JSN_INSERT('{ "a" : "foo", "b" : [ 1, 2, 3 ] }', '$.a', true);
JSN_INSERT('{ "a" : "foo", "b" : [ 1, 2, 3 ] }', '$.a', true)
{"a": "foo", "b": [1, 2, 3]}
SELECT JSN_INSERT('{ "a" : "foo", "b" : [ 1, 2, 3 ] }', '$.c', 123);
JSN_INSERT('{ "a" : "foo", "b" : [ 1, 2, 3 ] }', '$.c', 123)
{"a": "foo", "b": [1, 2, 3], "c": 123}
SELECT JSN_INSERT('{ "a" : "foo", "b" : [ 1, 2, 3 ] }', '$.c', '123');
JSN_INSERT('{ "a" : "foo", "b" : [ 1, 2, 3 ] }', '$.c', '123')
{"a": "foo", "b": [1, 2, 3], "c": "123"}
SELECT JSN_INSERT('{ "a" : "foo", "b" : [ 1, 2, 3 ] }', '$.a[1]', true);
JSN_INSERT('{ "a" : "foo", "b" : [ 1, 2, 3 ] }', '$.a[1]', true)
{"a": ["foo", true], "b": [1, 2, 3]}
SELECT JSN_INSERT('{ "a" : "foo"}', '$.b', true, '$.b', false);
JSN_INSERT('{ "a" : "foo"}', '$.b', true, '$.b', false)
{"a": "foo", "b": true}
SELECT JSN_INSERT
(
'{ "a" : "foo", "b" : [ 1, 2, 3 ] }',
'$.a',
true
);
JSN_INSERT
(
'{ "a" : "foo", "b" : [ 1, 2, 3 ] }',
'$.a',
true
)
{"a": "foo", "b": [1, 2, 3]}
SELECT JSN_INSERT
(
'{ "a" : "foo", "b" : [ 1, 2, 3 ] }',
'$.c',
123
);
JSN_INSERT
(
'{ "a" : "foo", "b" : [ 1, 2, 3 ] }',
'$.c',
123
)
{"a": "foo", "b": [1, 2, 3], "c": 123}
SELECT JSN_INSERT
(
'{ "a" : "foo", "b" : [ 1, 2, 3 ] }',
'$.c',
'123'
);
JSN_INSERT
(
'{ "a" : "foo", "b" : [ 1, 2, 3 ] }',
'$.c',
'123'
)
{"a": "foo", "b": [1, 2, 3], "c": "123"}
SELECT JSN_INSERT
(
'{ "a" : "foo", "b" : [ 1, 2, 3 ] }',
'$.a[1]',
true
);
JSN_INSERT
(
'{ "a" : "foo", "b" : [ 1, 2, 3 ] }',
'$.a[1]',
true
)
{"a": ["foo", true], "b": [1, 2, 3]}
SELECT JSN_INSERT
(
'{ "a" : "foo"}',
'$.b', true,
'$.b', false
);
JSN_INSERT
(
'{ "a" : "foo"}',
'$.b', true,
'$.b', false
)
{"a": "foo", "b": true}
# ----------------------------------------------------------------------
# Test of JSN_SET function.
# ----------------------------------------------------------------------
select jsn_set(NULL, '$.b', cast(1 as json));
jsn_set(NULL, '$.b', cast(1 as json))
NULL
select jsn_set('[1,2,3]', NULL, cast(1 as json));
jsn_set('[1,2,3]', NULL, cast(1 as json))
NULL
select jsn_set('[1,2,3]', '$[3]', NULL);
jsn_set('[1,2,3]', '$[3]', NULL)
NULL
select jsn_set(NULL);
ERROR 42000: Incorrect parameter count in the call to native function 'jsn_set'
select jsn_set(NULL, NULL);
ERROR 42000: Incorrect parameter count in the call to native function 'jsn_set'
select jsn_set(NULL, NULL, NULL, NULL);
ERROR 42000: Incorrect parameter count in the call to native function 'jsn_set'
select jsn_set('[1,2,3]', '$[2]', 4);
jsn_set('[1,2,3]', '$[2]', 4)
[1, 2, 4]
select jsn_set('[1,2,3]', '$[3]', 4);
jsn_set('[1,2,3]', '$[3]', 4)
[1, 2, 3, 4]
select jsn_set('[1,2,3]', '$[10]', 4);
jsn_set('[1,2,3]', '$[10]', 4)
[1, 2, 3, 4]
select jsn_set('{"c":4}', '$.c', 5);
jsn_set('{"c":4}', '$.c', 5)
{"c": 5}
select jsn_set('{"c":4}', '$.a', 5);
jsn_set('{"c":4}', '$.a', 5)
{"a": 5, "c": 4}
select jsn_set('1', '$', 4);
jsn_set('1', '$', 4)
4
select jsn_set('1', '$[0]', 4);
jsn_set('1', '$[0]', 4)
4
select jsn_set('1', '$[1]', 4);
jsn_set('1', '$[1]', 4)
[1, 4]
select jsn_set('1', '$[10]', '4', '$[11]', 5);
jsn_set('1', '$[10]', '4', '$[11]', 5)
[1, "4", 5]
select jsn_set('[1,2,3]', '$[2][0]', 4);
jsn_set('[1,2,3]', '$[2][0]', 4)
[1, 2, 4]
select jsn_set('[1,2,3]', '$[2][2]', 4);
jsn_set('[1,2,3]', '$[2][2]', 4)
[1, 2, [3, 4]]
select jsn_set('{"a": 3}', '$.a[0]', 4);
jsn_set('{"a": 3}', '$.a[0]', 4)
{"a": 4}
select jsn_set('{"a": 3}', '$.a[1]', 4, '$.a[2]', '5');
jsn_set('{"a": 3}', '$.a[1]', 4, '$.a[2]', '5')
{"a": [3, 4, "5"]}
select jsn_set(cast('{"a": {"b": [3]}}' as json), '$**[1]', 6);
ERROR 42000: In this situation, path expressions may not contain the * and ** tokens.
SELECT JSN_SET('{ "a" : "foo", "b" : [ 1, 2, 3 ] }',
'$.a',
JSN_OBJECT());
JSN_SET('{ "a" : "foo", "b" : [ 1, 2, 3 ] }',
'$.a',
JSN_OBJECT())
{"a": {}, "b": [1, 2, 3]}
SELECT JSN_SET('{ "a" : "foo"}', '$.a',
JSN_OBJECT( 'b', false ), '$.a.c', true);
JSN_SET('{ "a" : "foo"}', '$.a',
JSN_OBJECT( 'b', false ), '$.a.c', true)
{"a": {"b": false, "c": true}}
select jsn_set('{ "a" : "foo", "b" : [ 1, 2, 3 ] }',
'$.a',
cast('{}' as json));
jsn_set('{ "a" : "foo", "b" : [ 1, 2, 3 ] }',
'$.a',
cast('{}' as json))
{"a": {}, "b": [1, 2, 3]}
select jsn_set('{ "a" : "foo", "b" : [ 1, 2, 3 ] }',
'$.c',
cast('[true, false]' as json));
jsn_set('{ "a" : "foo", "b" : [ 1, 2, 3 ] }',
'$.c',
cast('[true, false]' as json))
{"a": "foo", "b": [1, 2, 3], "c": [true, false]}
select jsn_set('1', '$[3]', 2);
jsn_set('1', '$[3]', 2)
[1, 2]
select jsn_set('{ "a" : "foo"}', '$.a',
cast('{"b": false}' as json), '$.a.c', true);
jsn_set('{ "a" : "foo"}', '$.a',
cast('{"b": false}' as json), '$.a.c', true)
{"a": {"b": false, "c": true}}
SELECT JSN_SET
(
'{ "a" : "foo", "b" : [ 1, 2, 3 ] }',
'$.a',
JSN_OBJECT()
);
JSN_SET
(
'{ "a" : "foo", "b" : [ 1, 2, 3 ] }',
'$.a',
JSN_OBJECT()
)
{"a": {}, "b": [1, 2, 3]}
SELECT JSN_SET
(
'{ "a" : "foo", "b" : [ 1, 2, 3 ] }',
'$.c',
JSN_ARRAY( true, false )
);
JSN_SET
(
'{ "a" : "foo", "b" : [ 1, 2, 3 ] }',
'$.c',
JSN_ARRAY( true, false )
)
{"a": "foo", "b": [1, 2, 3], "c": [true, false]}
SELECT JSN_SET
(
'{ "a" : "foo", "b" : [ 1, 2, 3 ] }',
'$.c',
JSN_ARRAY( CAST( 'true' AS JSON ), CAST( 'false' AS JSON ) )
);
JSN_SET
(
'{ "a" : "foo", "b" : [ 1, 2, 3 ] }',
'$.c',
JSN_ARRAY( CAST( 'true' AS JSON ), CAST( 'false' AS JSON ) )
)
{"a": "foo", "b": [1, 2, 3], "c": [true, false]}
SELECT JSN_SET
(
'1',
'$[3]',
2
);
JSN_SET
(
'1',
'$[3]',
2
)
[1, 2]
SELECT JSN_SET
(
'{ "a" : "foo"}',
'$.a', JSN_OBJECT( 'b', false ),
'$.a.c', true
);
JSN_SET
(
'{ "a" : "foo"}',
'$.a', JSN_OBJECT( 'b', false ),
'$.a.c', true
)
{"a": {"b": false, "c": true}}
# ----------------------------------------------------------------------
# Test of JSN_REPLACE function.
# ----------------------------------------------------------------------
select jsn_replace(NULL, '$.b', cast(1 as json));
jsn_replace(NULL, '$.b', cast(1 as json))
NULL
select jsn_replace('[1,2,3]', NULL, cast(1 as json));
jsn_replace('[1,2,3]', NULL, cast(1 as json))
NULL
select jsn_replace('[1,2,3]', '$[3]', NULL);
jsn_replace('[1,2,3]', '$[3]', NULL)
NULL
select jsn_replace(NULL);
ERROR 42000: Incorrect parameter count in the call to native function 'jsn_replace'
select jsn_replace(NULL, NULL);
ERROR 42000: Incorrect parameter count in the call to native function 'jsn_replace'
select jsn_replace(NULL, NULL, NULL, NULL);
ERROR 42000: Incorrect parameter count in the call to native function 'jsn_replace'
select jsn_replace('[1,2,3]', '$[2]', 4);
jsn_replace('[1,2,3]', '$[2]', 4)
[1, 2, 4]
select jsn_replace('[1,2,3]', '$[3]', 4);
jsn_replace('[1,2,3]', '$[3]', 4)
[1, 2, 3]
select jsn_replace('[1,2,3]', '$[10]', 4);
jsn_replace('[1,2,3]', '$[10]', 4)
[1, 2, 3]
select jsn_replace('{"c":4}', '$.c', 5);
jsn_replace('{"c":4}', '$.c', 5)
{"c": 5}
select jsn_replace('{"c":4}', '$.a', 5);
jsn_replace('{"c":4}', '$.a', 5)
{"c": 4}
select jsn_replace('1', '$', 4);
jsn_replace('1', '$', 4)
4
select jsn_replace('1', '$[0]', 4);
jsn_replace('1', '$[0]', 4)
4
select jsn_replace('1', '$[1]', 4);
jsn_replace('1', '$[1]', 4)
1
select jsn_replace('1', '$[10]', '4', '$[11]', 5);
jsn_replace('1', '$[10]', '4', '$[11]', 5)
1
select jsn_replace('[1,2,3]', '$[2][0]', 4);
jsn_replace('[1,2,3]', '$[2][0]', 4)
[1, 2, 4]
select jsn_replace('[1,2,3]', '$[2][2]', 4);
jsn_replace('[1,2,3]', '$[2][2]', 4)
[1, 2, 3]
select jsn_replace('{"a": 3}', '$.a[0]', 4);
jsn_replace('{"a": 3}', '$.a[0]', 4)
{"a": 4}
select jsn_replace('{"a": 3}', '$.a[1]', 4, '$.a[2]', '5');
jsn_replace('{"a": 3}', '$.a[1]', 4, '$.a[2]', '5')
{"a": 3}
SELECT JSN_REPLACE('{ "a" : "foo", "b" : [ 1, 2, 3 ] }',
'$.c',
true);
JSN_REPLACE('{ "a" : "foo", "b" : [ 1, 2, 3 ] }',
'$.c',
true)
{"a": "foo", "b": [1, 2, 3]}
SELECT JSN_REPLACE('{ "a" : "foo", "b" : [ 1, 2, 3 ] }',
'$.a[0]',
true);
JSN_REPLACE('{ "a" : "foo", "b" : [ 1, 2, 3 ] }',
'$.a[0]',
true)
{"a": true, "b": [1, 2, 3]}
SELECT JSN_REPLACE('{ "a" : "foo", "b" : [ 1, 2, 3 ] }',
'$.b[5]',
true);
JSN_REPLACE('{ "a" : "foo", "b" : [ 1, 2, 3 ] }',
'$.b[5]',
true)
{"a": "foo", "b": [1, 2, 3]}
# ----------------------------------------------------------------------
# Test of JSN_ARRAY function.
# ----------------------------------------------------------------------
select jsn_array(NULL, '$.b', cast(1 as json));
jsn_array(NULL, '$.b', cast(1 as json))
NULL
select jsn_array('[1,2,3]', NULL, cast(1 as json));
jsn_array('[1,2,3]', NULL, cast(1 as json))
NULL
select jsn_array('[1,2,3]', '$[3]', NULL);
jsn_array('[1,2,3]', '$[3]', NULL)
NULL
select jsn_array();
jsn_array()
[]
select jsn_array(3.14);
jsn_array(3.14)
[3.14]
select jsn_array('[1,2,3]');
jsn_array('[1,2,3]')
["[1,2,3]"]
select jsn_array(cast('[1,2,3]' as json));
jsn_array(cast('[1,2,3]' as json))
[[1, 2, 3]]
select jsn_array(1,2,3);
jsn_array(1,2,3)
[1, 2, 3]
select jsn_array(b'0', b'1', b'10');
jsn_array(b'0', b'1', b'10')
["base64:type16:AA==", "base64:type16:AQ==", "base64:type16:Ag=="]
create table t (i int, j json, d double);
insert into t values (3, '["a", "b"]', 3.14);
select jsn_array(i, j, d) from t;
jsn_array(i, j, d)
[3, ["a", "b"], 3.14]
drop table t;
create table department( id int, deptName varchar(50), isExempt boolean, blobColumn blob );
insert into department values ( 405, 'Accounting', true, '<a><b>ccc</b><d></d></a>' );
SELECT JSN_ARRAY();
JSN_ARRAY()
[]
SELECT JSN_ARRAY( d.deptName, CAST( '{ "processed" : true }' AS JSON ) )
FROM department d
WHERE id = 405;
JSN_ARRAY( d.deptName, CAST( '{ "processed" : true }' AS JSON ) )
["Accounting", {"processed": true}]
create table json_table( json_column json );
INSERT INTO json_table( json_column )
SELECT JSN_ARRAY( d.deptName, d.id, d.blobColumn )
FROM department d
WHERE id = 405;
drop table json_table;
drop table department;
# ----------------------------------------------------------------------
# Test of JSN_OBJECT function.
# ----------------------------------------------------------------------
select jsn_object( 'a' );
ERROR 42000: Incorrect parameter count in the call to native function 'jsn_object'
select jsn_object( 'a', 1, 'b' );
ERROR 42000: Incorrect parameter count in the call to native function 'jsn_object'
select jsn_object();
jsn_object()
{}
select jsn_object( null, 1 );
jsn_object( null, 1 )
NULL
select jsn_object( 'a', null );
jsn_object( 'a', null )
NULL
select jsn_object( 'a', 1 );
jsn_object( 'a', 1 )
{"a": 1}
select jsn_object( 'a', 1, 'b', 'foo' );
jsn_object( 'a', 1, 'b', 'foo' )
{"a": 1, "b": "foo"}
select jsn_object( 'a', 1, 'b', 'foo', 'c', cast( '{ "d": "wibble" }' as json ) );
jsn_object( 'a', 1, 'b', 'foo', 'c', cast( '{ "d": "wibble" }' as json ) )
{"a": 1, "b": "foo", "c": {"d": "wibble"}}
select jsn_object( 'a', true, 'b', false, 'c', cast( 'null' as json) );
jsn_object( 'a', true, 'b', false, 'c', cast( 'null' as json) )
{"a": true, "b": false, "c": null}
select jsn_valid( jsn_object( '"a"', 1 ) );
jsn_valid( jsn_object( '"a"', 1 ) )
1
select jsn_object( REPEAT('a', 64 * 1024), 1 );
jsn_object( REPEAT('a', 64 * 1024), 1 )
{"aaaaaaaaaaaaaaaaaaaaaaaaaaaaaaaaaaaaaaaaaaaaaaaaaaaaaaaaaaaaaaaaaaaaaaaaaaaaaaaaaaaaaaaaaaaaaaaaaaaaaaaaaaaaaaaaaaaaaaaaaaaaaaaaaaaaaaaaaaaaaaaaaaaaaaaaaaaaaaaaaaaaaaaaaaaaaaaaaaaaaaaaaaaaaaaaaaaaaaaaaaaaaaaaaaaaaaaaaaaaaaaaaaaaaaaaaaaaaaaaaaaaaaaaaaaaaaaaaaaaaaaaaaaaaaaaaaaaaaaaaaaaaaaaaaaaaaaaaaaaaaaaaaaaaaaaaaaaaaaaaaaaaaaaaaaaaaaaaaaaaaaaaaaaaaaaaaaaaaaaaaaaaaaaaaaaaaaaaaaaaaaaaaaaaaaaaaaaaaaaaaaaaaaaaaaaaaaaaaaaaaaaaaaaaaaaaaaaaaaaaaaaaaaaaaaaaaaaaaaaaaaaaaaaaaaaaaaaaaaaaaaaaaaaaaaaaaaaaaaaaaaaaaaaaaaaaaaaaaaaaaaaaaaaaaaaaaaaaaaaaaaaaaaaaaaaaaaaaaaaaaaaaaaaaaaaaaaaaaaaaaaaaaaaaaaaaaaaaaaaaaaaaaaaaaaaaaaaaaaaaaaaaaaaaaaaaaaaaaaaaaaaaaaaaaaaaaaaaaaaaaaaaaaaaaaaaaaaaaaaaaaaaaaaaaaaaaaaaaaaaaaaaaaaaaaaaaaaaaaaaaaaaaaaaaaaaaaaaaaaaaaaaaaaaaaaaaaaaaaaaaaaaaaaaaaaaaaaaaaaaaaaaaaaaaaaaaaaaaaaaaaaaaaaaaaaaaaaaaaaaaaaaaaaaaaaaaaaaaaaaaaaaaaaaaaaaaaaaaaaaaaaaaaaaaaaaaaaaaaaaaaaaaaaaaaaaaaaaaaaaaaaaaaaaaaaaaaaaaaaaaaaaaaaaaaaaaaaaaaaaaaaaaaaaaaaaaaaaaaaaaaaaaaaaaaaaaaaaaaaaaaaaaaaaaaaaaaaaaaaaaaaaaaaaaaaaaaaaaaaaaaaaaaaaaaaaaaaaaaaaaaaaaaaaaaaaaaaaaaaaaaaaaaaaaaaaaaaaaaaaaaaaaaaaaaaaaaaaaaaaaaaaaaaaaaaaaaaaaaaaaaaaaaaaaaaaaaaaaaaaaaaaaaaaaaaaaaaaaaaaaaaaaaaaaaaaaaaaaaaaaaaaaaaaaaaaaaaaaaaaaaaaaaaaaaaaaaaaaaaaaaaaaaaaaaaaaaaaaaaaaaaaaaaaaaaaaaaaaaaaaaaaaaaaaaaaaaaaaaaaaaaaaaaaaaaaaaaaaaaaaaaaaaaaaaaaaaaaaaaaaaaaaaaaaaaaaaaaaaaaaaaaaaaaaaaaaaaaaaaaaaaaaaaaaaaaaaaaaaaaaaaaaaaaaaaaaaaaaaaaaaaaaaaaaaaaaaaaaaaaaaaaaaaaaaaaaaaaaaaaaaaaaaaaaaaaaaaaaaaaaaaaaaaaaaaaaaaaaaaaaaaaaaaaaaaaaaaaaaaaaaaaaaaaaaaaaaaaaaaaaaaaaaaaaaaaaaaaaaaaaaaaaaaaaaaaaaaaaaaaaaaaaaaaaaaaaaaaaaaaaaaaaaaaaaaaaaaaaaaaaaaaaaaaaaaaaaaaaaaaaaaaaaaaaaaaaaaaaaaaaaaaaaaaaaaaaaaaaaaaaaaaaaaaaaaaaaaaaaaaaaaaaaaaaaaaaaaaaaaaaaaaaaaaaaaaaaaaaaaaaaaaaaaaaaaaaaaaaaaaaaaaaaaaaaaaaaaaaaaaaaaaaaaaaaaaaaaaaaaaaaaaaaaaaaaaaaaaaaaaaaaaaaaaaaaaaaaaaaaaaaaaaaaaaaaaaaaaaaaaaaaaaaaaaaaaaaaaaaaaaaaaaaaaaaaaaaaaaaaaaaaaaaaaaaaaaaaaaaaaaaaaaaaaaaaaaaaaaaaaaaaaaaaaaaaaaaaaaaaaaaaaaaaaaaaaaaaaaaaaaaaaaaaaaaaaaaaaaaaaaaaaaaaaaaaaaaaaaaaaaaaaaaaaaaaaaaaaaaaaaaaaaaaaaaaaaaaaaaaaaaaaaaaaaaaaaaaaaaaaaaaaaaaaaaaaaaaaaaaaaaaaaaaaaaaaaaaaaaaaaaaaaaaaaaaaaaaaaaaaaaaaaaaaaaaaaaaaaaaaaaaaaaaaaaaaaaaaaaaaaaaaaaaaaaaaaaaaaaaaaaaaaaaaaaaaaaaaaaaaaaaaaaaaaaaaaaaaaaaaaaaaaaaaaaaaaaaaaaaaaaaaaaaaaaaaaaaaaaaaaaaaaaaaaaaaaaaaaaaaaaaaaaaaaaaaaaaaaaaaaaaaaaaaaaaaaaaaaaaaaaaaaaaaaaaaaaaaaaaaaaaaaaaaaaaaaaaaaaaaaaaaaaaaaaaaaaaaaaaaaaaaaaaaaaaaaaaaaaaaaaaaaaaaaaaaaaaaaaaaaaaaaaaaaaaaaaaaaaaaaaaaaaaaaaaaaaaaaaaaaaaaaaaaaaaaaaaaaaaaaaaaaaaaaaaaaaaaaaaaaaaaaaaaaaaaaaaaaaaaaaaaaaaaaaaaaaaaaaaaaaaaaaaaaaaaaaaaaaaaaaaaaaaaaaaaaaaaaaaaaaaaaaaaaaaaaaaaaaaaaaaaaaaaaaaaaaaaaaaaaaaaaaaaaaaaaaaaaaaaaaaaaaaaaaaaaaaaaaaaaaaaaaaaaaaaaaaaaaaaaaaaaaaaaaaaaaaaaaaaaaaaaaaaaaaaaaaaaaaaaaaaaaaaaaaaaaaaaaaaaaaaaaaaaaaaaaaaaaaaaaaaaaaaaaaaaaaaaaaaaaaaaaaaaaaaaaaaaaaaaaaaaaaaaaaaaaaaaaaaaaaaaaaaaaaaaaaaaaaaaaaaaaaaaaaaaaaaaaaaaaaaaaaaaaaaaaaaaaaaaaaaaaaaaaaaaaaaaaaaaaaaaaaaaaaaaaaaaaaaaaaaaaaaaaaaaaaaaaaaaaaaaaaaaaaaaaaaaaaaaaaaaaaaaaaaaaaaaaaaaaaaaaaaaaaaaaaaaaaaaaaaaaaaaaaaaaaaaaaaaaaaaaaaaaaaaaaaaaaaaaaaaaaaaaaaaaaaaaaaaaaaaaaaaaaaaaaaaaaaaaaaaaaaaaaaaaaaaaaaaaaaaaaaaaaaaaaaaaaaaaaaaaaaaaaaaaaaaaaaaaaaaaaaaaaaaaaaaaaaaaaaaaaaaaaaaaaaaaaaaaaaaaaaaaaaaaaaaaaaaaaaaaaaaaaaaaaaaaaaaaaaaaaaaaaaaaaaaaaaaaaaaaaaaaaaaaaaaaaaaaaaaaaaaaaaaaaaaaaaaaaaaaaaaaaaaaaaaaaaaaaaaaaaaaaaaaaaaaaaaaaaaaaaaaaaaaaaaaaaaaaaaaaaaaaaaaaaaaaaaaaaaaaaaaaaaaaaaaaaaaaaaaaaaaaaaaaaaaaaaaaaaaaaaaaaaaaaaaaaaaaaaaaaaaaaaaaaaaaaaaaaaaaaaaaaaaaaaaaaaaaaaaaaaaaaaaaaaaaaaaaaaaaaaaaaaaaaaaaaaaaaaaaaaaaaaaaaaaaaaaaaaaaaaaaaaaaaaaaaaaaaaaaaaaaaaaaaaaaaaaaaaaaaaaaaaaaaaaaaaaaaaaaaaaaaaaaaaaaaaaaaaaaaaaaaaaaaaaaaaaaaaaaaaaaaaaaaaaaaaaaaaaaaaaaaaaaaaaaaaaaaaaaaaaaaaaaaaaaaaaaaaaaaaaaaaaaaaaaaaaaaaaaaaaaaaaaaaaaaaaaaaaaaaaaaaaaaaaaaaaaaaaaaaaaaaaaaaaaaaaaaaaaaaaaaaaaaaaaaaaaaaaaaaaaaaaaaaaaaaaaaaaaaaaaaaaaaaaaaaaaaaaaaaaaaaaaaaaaaaaaaaaaaaaaaaaaaaaaaaaaaaaaaaaaaaaaaaaaaaaaaaaaaaaaaaaaaaaaaaaaaaaaaaaaaaaaaaaaaaaaaaaaaaaaaaaaaaaaaaaaaaaaaaaaaaaaaaaaaaaaaaaaaaaaaaaaaaaaaaaaaaaaaaaaaaaaaaaaaaaaaaaaaaaaaaaaaaaaaaaaaaaaaaaaaaaaaaaaaaaaaaaaaaaaaaaaaaaaaaaaaaaaaaaaaaaaaaaaaaaaaaaaaaaaaaaaaaaaaaaaaaaaaaaaaaaaaaaaaaaaaaaaaaaaaaaaaaaaaaaaaaaaaaaaaaaaaaaaaaaaaaaaaaaaaaaaaaaaaaaaaaaaaaaaaaaaaaaaaaaaaaaaaaaaaaaaaaaaaaaaaaaaaaaaaaaaaaaaaaaaaaaaaaaaaaaaaaaaaaaaaaaaaaaaaaaaaaaaaaaaaaaaaaaaaaaaaaaaaaaaaaaaaaaaaaaaaaaaaaaaaaaaaaaaaaaaaaaaaaaaaaaaaaaaaaaaaaaaaaaaaaaaaaaaaaaaaaaaaaaaaaaaaaaaaaaaaaaaaaaaaaaaaaaaaaaaaaaaaaaaaaaaaaaaaaaaaaaaaaaaaaaaaaaaaaaaaaaaaaaaaaaaaaaaaaaaaaaaaaaaaaaaaaaaaaaaaaaaaaaaaaaaaaaaaaaaaaaaaaaaaaaaaaaaaaaaaaaaaaaaaaaaaaaaaaaaaaaaaaaaaaaaaaaaaaaaaaaaaaaaaaaaaaaaaaaaaaaaaaaaaaaaaaaaaaaaaaaaaaaaaaaaaaaaaaaaaaaaaaaaaaaaaaaaaaaaaaaaaaaaaaaaaaaaaaaaaaaaaaaaaaaaaaaaaaaaaaaaaaaaaaaaaaaaaaaaaaaaaaaaaaaaaaaaaaaaaaaaaaaaaaaaaaaaaaaaaaaaaaaaaaaaaaaaaaaaaaaaaaaaaaaaaaaaaaaaaaaaaaaaaaaaaaaaaaaaaaaaaaaaaaaaaaaaaaaaaaaaaaaaaaaaaaaaaaaaaaaaaaaaaaaaaaaaaaaaaaaaaaaaaaaaaaaaaaaaaaaaaaaaaaaaaaaaaaaaaaaaaaaaaaaaaaaaaaaaaaaaaaaaaaaaaaaaaaaaaaaaaaaaaaaaaaaaaaaaaaaaaaaaaaaaaaaaaaaaaaaaaaaaaaaaaaaaaaaaaaaaaaaaaaaaaaaaaaaaaaaaaaaaaaaaaaaaaaaaaaaaaaaaaaaaaaaaaaaaaaaaaaaaaaaaaaaaaaaaaaaaaaaaaaaaaaaaaaaaaaaaaaaaaaaaaaaaaaaaaaaaaaaaaaaaaaaaaaaaaaaaaaaaaaaaaaaaaaaaaaaaaaaaaaaaaaaaaaaaaaaaaaaaaaaaaaaaaaaaaaaaaaaaaaaaaaaaaaaaaaaaaaaaaaaaaaaaaaaaaaaaaaaaaaaaaaaaaaaaaaaaaaaaaaaaaaaaaaaaaaaaaaaaaaaaaaaaaaaaaaaaaaaaaaaaaaaaaaaaaaaaaaaaaaaaaaaaaaaaaaaaaaaaaaaaaaaaaaaaaaaaaaaaaaaaaaaaaaaaaaaaaaaaaaaaaaaaaaaaaaaaaaaaaaaaaaaaaaaaaaaaaaaaaaaaaaaaaaaaaaaaaaaaaaaaaaaaaaaaaaaaaaaaaaaaaaaaaaaaaaaaaaaaaaaaaaaaaaaaaaaaaaaaaaaaaaaaaaaaaaaaaaaaaaaaaaaaaaaaaaaaaaaaaaaaaaaaaaaaaaaaaaaaaaaaaaaaaaaaaaaaaaaaaaaaaaaaaaaaaaaaaaaaaaaaaaaaaaaaaaaaaaaaaaaaaaaaaaaaaaaaaaaaaaaaaaaaaaaaaaaaaaaaaaaaaaaaaaaaaaaaaaaaaaaaaaaaaaaaaaaaaaaaaaaaaaaaaaaaaaaaaaaaaaaaaaaaaaaaaaaaaaaaaaaaaaaaaaaaaaaaaaaaaaaaaaaaaaaaaaaaaaaaaaaaaaaaaaaaaaaaaaaaaaaaaaaaaaaaaaaaaaaaaaaaaaaaaaaaaaaaaaaaaaaaaaaaaaaaaaaaaaaaaaaaaaaaaaaaaaaaaaaaaaaaaaaaaaaaaaaaaaaaaaaaaaaaaaaaaaaaaaaaaaaaaaaaaaaaaaaaaaaaaaaaaaaaaaaaaaaaaaaaaaaaaaaaaaaaaaaaaaaaaaaaaaaaaaaaaaaaaaaaaaaaaaaaaaaaaaaaaaaaaaaaaaaaaaaaaaaaaaaaaaaaaaaaaaaaaaaaaaaaaaaaaaaaaaaaaaaaaaaaaaaaaaaaaaaaaaaaaaaaaaaaaaaaaaaaaaaaaaaaaaaaaaaaaaaaaaaaaaaaaaaaaaaaaaaaaaaaaaaaaaaaaaaaaaaaaaaaaaaaaaaaaaaaaaaaaaaaaaaaaaaaaaaaaaaaaaaaaaaaaaaaaaaaaaaaaaaaaaaaaaaaaaaaaaaaaaaaaaaaaaaaaaaaaaaaaaaaaaaaaaaaaaaaaaaaaaaaaaaaaaaaaaaaaaaaaaaaaaaaaaaaaaaaaaaaaaaaaaaaaaaaaaaaaaaaaaaaaaaaaaaaaaaaaaaaaaaaaaaaaaaaaaaaaaaaaaaaaaaaaaaaaaaaaaaaaaaaaaaaaaaaaaaaaaaaaaaaaaaaaaaaaaaaaaaaaaaaaaaaaaaaaaaaaaaaaaaaaaaaaaaaaaaaaaaaaaaaaaaaaaaaaaaaaaaaaaaaaaaaaaaaaaaaaaaaaaaaaaaaaaaaaaaaaaaaaaaaaaaaaaaaaaaaaaaaaaaaaaaaaaaaaaaaaaaaaaaaaaaaaaaaaaaaaaaaaaaaaaaaaaaaaaaaaaaaaaaaaaaaaaaaaaaaaaaaaaaaaaaaaaaaaaaaaaaaaaaaaaaaaaaaaaaaaaaaaaaaaaaaaaaaaaaaaaaaaaaaaaaaaaaaaaaaaaaaaaaaaaaaaaaaaaaaaaaaaaaaaaaaaaaaaaaaaaaaaaaaaaaaaaaaaaaaaaaaaaaaaaaaaaaaaaaaaaaaaaaaaaaaaaaaaaaaaaaaaaaaaaaaaaaaaaaaaaaaaaaaaaaaaaaaaaaaaaaaaaaaaaaaaaaaaaaaaaaaaaaaaaaaaaaaaaaaaaaaaaaaaaaaaaaaaaaaaaaaaaaaaaaaaaaaaaaaaaaaaaaaaaaaaaaaaaaaaaaaaaaaaaaaaaaaaaaaaaaaaaaaaaaaaaaaaaaaaaaaaaaaaaaaaaaaaaaaaaaaaaaaaaaaaaaaaaaaaaaaaaaaaaaaaaaaaaaaaaaaaaaaaaaaaaaaaaaaaaaaaaaaaaaaaaaaaaaaaaaaaaaaaaaaaaaaaaaaaaaaaaaaaaaaaaaaaaaaaaaaaaaaaaaaaaaaaaaaaaaaaaaaaaaaaaaaaaaaaaaaaaaaaaaaaaaaaaaaaaaaaaaaaaaaaaaaaaaaaaaaaaaaaaaaaaaaaaaaaaaaaaaaaaaaaaaaaaaaaaaaaaaaaaaaaaaaaaaaaaaaaaaaaaaaaaaaaaaaaaaaaaaaaaaaaaaaaaaaaaaaaaaaaaaaaaaaaaaaaaaaaaaaaaaaaaaaaaaaaaaaaaaaaaaaaaaaaaaaaaaaaaaaaaaaaaaaaaaaaaaaaaaaaaaaaaaaaaaaaaaaaaaaaaaaaaaaaaaaaaaaaaaaaaaaaaaaaaaaaaaaaaaaaaaaaaaaaaaaaaaaaaaaaaaaaaaaaaaaaaaaaaaaaaaaaaaaaaaaaaaaaaaaaaaaaaaaaaaaaaaaaaaaaaaaaaaaaaaaaaaaaaaaaaaaaaaaaaaaaaaaaaaaaaaaaaaaaaaaaaaaaaaaaaaaaaaaaaaaaaaaaaaaaaaaaaaaaaaaaaaaaaaaaaaaaaaaaaaaaaaaaaaaaaaaaaaaaaaaaaaaaaaaaaaaaaaaaaaaaaaaaaaaaaaaaaaaaaaaaaaaaaaaaaaaaaaaaaaaaaaaaaaaaaaaaaaaaaaaaaaaaaaaaaaaaaaaaaaaaaaaaaaaaaaaaaaaaaaaaaaaaaaaaaaaaaaaaaaaaaaaaaaaaaaaaaaaaaaaaaaaaaaaaaaaaaaaaaaaaaaaaaaaaaaaaaaaaaaaaaaaaaaaaaaaaaaaaaaaaaaaaaaaaaaaaaaaaaaaaaaaaaaaaaaaaaaaaaaaaaaaaaaaaaaaaaaaaaaaaaaaaaaaaaaaaaaaaaaaaaaaaaaaaaaaaaaaaaaaaaaaaaaaaaaaaaaaaaaaaaaaaaaaaaaaaaaaaaaaaaaaaaaaaaaaaaaaaaaaaaaaaaaaaaaaaaaaaaaaaaaaaaaaaaaaaaaaaaaaaaaaaaaaaaaaaaaaaaaaaaaaaaaaaaaaaaaaaaaaaaaaaaaaaaaaaaaaaaaaaaaaaaaaaaaaaaaaaaaaaaaaaaaaaaaaaaaaaaaaaaaaaaaaaaaaaaaaaaaaaaaaaaaaaaaaaaaaaaaaaaaaaaaaaaaaaaaaaaaaaaaaaaaaaaaaaaaaaaaaaaaaaaaaaaaaaaaaaaaaaaaaaaaaaaaaaaaaaaaaaaaaaaaaaaaaaaaaaaaaaaaaaaaaaaaaaaaaaaaaaaaaaaaaaaaaaaaaaaaaaaaaaaaaaaaaaaaaaaaaaaaaaaaaaaaaaaaaaaaaaaaaaaaaaaaaaaaaaaaaaaaaaaaaaaaaaaaaaaaaaaaaaaaaaaaaaaaaaaaaaaaaaaaaaaaaaaaaaaaaaaaaaaaaaaaaaaaaaaaaaaaaaaaaaaaaaaaaaaaaaaaaaaaaaaaaaaaaaaaaaaaaaaaaaaaaaaaaaaaaaaaaaaaaaaaaaaaaaaaaaaaaaaaaaaaaaaaaaaaaaaaaaaaaaaaaaaaaaaaaaaaaaaaaaaaaaaaaaaaaaaaaaaaaaaaaaaaaaaaaaaaaaaaaaaaaaaaaaaaaaaaaaaaaaaaaaaaaaaaaaaaaaaaaaaaaaaaaaaaaaaaaaaaaaaaaaaaaaaaaaaaaaaaaaaaaaaaaaaaaaaaaaaaaaaaaaaaaaaaaaaaaaaaaaaaaaaaaaaaaaaaaaaaaaaaaaaaaaaaaaaaaaaaaaaaaaaaaaaaaaaaaaaaaaaaaaaaaaaaaaaaaaaaaaaaaaaaaaaaaaaaaaaaaaaaaaaaaaaaaaaaaaaaaaaaaaaaaaaaaaaaaaaaaaaaaaaaaaaaaaaaaaaaaaaaaaaaaaaaaaaaaaaaaaaaaaaaaaaaaaaaaaaaaaaaaaaaaaaaaaaaaaaaaaaaaaaaaaaaaaaaaaaaaaaaaaaaaaaaaaaaaaaaaaaaaaaaaaaaaaaaaaaaaaaaaaaaaaaaaaaaaaaaaaaaaaaaaaaaaaaaaaaaaaaaaaaaaaaaaaaaaaaaaaaaaaaaaaaaaaaaaaaaaaaaaaaaaaaaaaaaaaaaaaaaaaaaaaaaaaaaaaaaaaaaaaaaaaaaaaaaaaaaaaaaaaaaaaaaaaaaaaaaaaaaaaaaaaaaaaaaaaaaaaaaaaaaaaaaaaaaaaaaaaaaaaaaaaaaaaaaaaaaaaaaaaaaaaaaaaaaaaaaaaaaaaaaaaaaaaaaaaaaaaaaaaaaaaaaaaaaaaaaaaaaaaaaaaaaaaaaaaaaaaaaaaaaaaaaaaaaaaaaaaaaaaaaaaaaaaaaaaaaaaaaaaaaaaaaaaaaaaaaaaaaaaaaaaaaaaaaaaaaaaaaaaaaaaaaaaaaaaaaaaaaaaaaaaaaaaaaaaaaaaaaaaaaaaaaaaaaaaaaaaaaaaaaaaaaaaaaaaaaaaaaaaaaaaaaaaaaaaaaaaaaaaaaaaaaaaaaaaaaaaaaaaaaaaaaaaaaaaaaaaaaaaaaaaaaaaaaaaaaaaaaaaaaaaaaaaaaaaaaaaaaaaaaaaaaaaaaaaaaaaaaaaaaaaaaaaaaaaaaaaaaaaaaaaaaaaaaaaaaaaaaaaaaaaaaaaaaaaaaaaaaaaaaaaaaaaaaaaaaaaaaaaaaaaaaaaaaaaaaaaaaaaaaaaaaaaaaaaaaaaaaaaaaaaaaaaaaaaaaaaaaaaaaaaaaaaaaaaaaaaaaaaaaaaaaaaaaaaaaaaaaaaaaaaaaaaaaaaaaaaaaaaaaaaaaaaaaaaaaaaaaaaaaaaaaaaaaaaaaaaaaaaaaaaaaaaaaaaaaaaaaaaaaaaaaaaaaaaaaaaaaaaaaaaaaaaaaaaaaaaaaaaaaaaaaaaaaaaaaaaaaaaaaaaaaaaaaaaaaaaaaaaaaaaaaaaaaaaaaaaaaaaaaaaaaaaaaaaaaaaaaaaaaaaaaaaaaaaaaaaaaaaaaaaaaaaaaaaaaaaaaaaaaaaaaaaaaaaaaaaaaaaaaaaaaaaaaaaaaaaaaaaaaaaaaaaaaaaaaaaaaaaaaaaaaaaaaaaaaaaaaaaaaaaaaaaaaaaaaaaaaaaaaaaaaaaaaaaaaaaaaaaaaaaaaaaaaaaaaaaaaaaaaaaaaaaaaaaaaaaaaaaaaaaaaaaaaaaaaaaaaaaaaaaaaaaaaaaaaaaaaaaaaaaaaaaaaaaaaaaaaaaaaaaaaaaaaaaaaaaaaaaaaaaaaaaaaaaaaaaaaaaaaaaaaaaaaaaaaaaaaaaaaaaaaaaaaaaaaaaaaaaaaaaaaaaaaaaaaaaaaaaaaaaaaaaaaaaaaaaaaaaaaaaaaaaaaaaaaaaaaaaaaaaaaaaaaaaaaaaaaaaaaaaaaaaaaaaaaaaaaaaaaaaaaaaaaaaaaaaaaaaaaaaaaaaaaaaaaaaaaaaaaaaaaaaaaaaaaaaaaaaaaaaaaaaaaaaaaaaaaaaaaaaaaaaaaaaaaaaaaaaaaaaaaaaaaaaaaaaaaaaaaaaaaaaaaaaaaaaaaaaaaaaaaaaaaaaaaaaaaaaaaaaaaaaaaaaaaaaaaaaaaaaaaaaaaaaaaaaaaaaaaaaaaaaaaaaaaaaaaaaaaaaaaaaaaaaaaaaaaaaaaaaaaaaaaaaaaaaaaaaaaaaaaaaaaaaaaaaaaaaaaaaaaaaaaaaaaaaaaaaaaaaaaaaaaaaaaaaaaaaaaaaaaaaaaaaaaaaaaaaaaaaaaaaaaaaaaaaaaaaaaaaaaaaaaaaaaaaaaaaaaaaaaaaaaaaaaaaaaaaaaaaaaaaaaaaaaaaaaaaaaaaaaaaaaaaaaaaaaaaaaaaaaaaaaaaaaaaaaaaaaaaaaaaaaaaaaaaaaaaaaaaaaaaaaaaaaaaaaaaaaaaaaaaaaaaaaaaaaaaaaaaaaaaaaaaaaaaaaaaaaaaaaaaaaaaaaaaaaaaaaaaaaaaaaaaaaaaaaaaaaaaaaaaaaaaaaaaaaaaaaaaaaaaaaaaaaaaaaaaaaaaaaaaaaaaaaaaaaaaaaaaaaaaaaaaaaaaaaaaaaaaaaaaaaaaaaaaaaaaaaaaaaaaaaaaaaaaaaaaaaaaaaaaaaaaaaaaaaaaaaaaaaaaaaaaaaaaaaaaaaaaaaaaaaaaaaaaaaaaaaaaaaaaaaaaaaaaaaaaaaaaaaaaaaaaaaaaaaaaaaaaaaaaaaaaaaaaaaaaaaaaaaaaaaaaaaaaaaaaaaaaaaaaaaaaaaaaaaaaaaaaaaaaaaaaaaaaaaaaaaaaaaaaaaaaaaaaaaaaaaaaaaaaaaaaaaaaaaaaaaaaaaaaaaaaaaaaaaaaaaaaaaaaaaaaaaaaaaaaaaaaaaaaaaaaaaaaaaaaaaaaaaaaaaaaaaaaaaaaaaaaaaaaaaaaaaaaaaaaaaaaaaaaaaaaaaaaaaaaaaaaaaaaaaaaaaaaaaaaaaaaaaaaaaaaaaaaaaaaaaaaaaaaaaaaaaaaaaaaaaaaaaaaaaaaaaaaaaaaaaaaaaaaaaaaaaaaaaaaaaaaaaaaaaaaaaaaaaaaaaaaaaaaaaaaaaaaaaaaaaaaaaaaaaaaaaaaaaaaaaaaaaaaaaaaaaaaaaaaaaaaaaaaaaaaaaaaaaaaaaaaaaaaaaaaaaaaaaaaaaaaaaaaaaaaaaaaaaaaaaaaaaaaaaaaaaaaaaaaaaaaaaaaaaaaaaaaaaaaaaaaaaaaaaaaaaaaaaaaaaaaaaaaaaaaaaaaaaaaaaaaaaaaaaaaaaaaaaaaaaaaaaaaaaaaaaaaaaaaaaaaaaaaaaaaaaaaaaaaaaaaaaaaaaaaaaaaaaaaaaaaaaaaaaaaaaaaaaaaaaaaaaaaaaaaaaaaaaaaaaaaaaaaaaaaaaaaaaaaaaaaaaaaaaaaaaaaaaaaaaaaaaaaaaaaaaaaaaaaaaaaaaaaaaaaaaaaaaaaaaaaaaaaaaaaaaaaaaaaaaaaaaaaaaaaaaaaaaaaaaaaaaaaaaaaaaaaaaaaaaaaaaaaaaaaaaaaaaaaaaaaaaaaaaaaaaaaaaaaaaaaaaaaaaaaaaaaaaaaaaaaaaaaaaaaaaaaaaaaaaaaaaaaaaaaaaaaaaaaaaaaaaaaaaaaaaaaaaaaaaaaaaaaaaaaaaaaaaaaaaaaaaaaaaaaaaaaaaaaaaaaaaaaaaaaaaaaaaaaaaaaaaaaaaaaaaaaaaaaaaaaaaaaaaaaaaaaaaaaaaaaaaaaaaaaaaaaaaaaaaaaaaaaaaaaaaaaaaaaaaaaaaaaaaaaaaaaaaaaaaaaaaaaaaaaaaaaaaaaaaaaaaaaaaaaaaaaaaaaaaaaaaaaaaaaaaaaaaaaaaaaaaaaaaaaaaaaaaaaaaaaaaaaaaaaaaaaaaaaaaaaaaaaaaaaaaaaaaaaaaaaaaaaaaaaaaaaaaaaaaaaaaaaaaaaaaaaaaaaaaaaaaaaaaaaaaaaaaaaaaaaaaaaaaaaaaaaaaaaaaaaaaaaaaaaaaaaaaaaaaaaaaaaaaaaaaaaaaaaaaaaaaaaaaaaaaaaaaaaaaaaaaaaaaaaaaaaaaaaaaaaaaaaaaaaaaaaaaaaaaaaaaaaaaaaaaaaaaaaaaaaaaaaaaaaaaaaaaaaaaaaaaaaaaaaaaaaaaaaaaaaaaaaaaaaaaaaaaaaaaaaaaaaaaaaaaaaaaaaaaaaaaaaaaaaaaaaaaaaaaaaaaaaaaaaaaaaaaaaaaaaaaaaaaaaaaaaaaaaaaaaaaaaaaaaaaaaaaaaaaaaaaaaaaaaaaaaaaaaaaaaaaaaaaaaaaaaaaaaaaaaaaaaaaaaaaaaaaaaaaaaaaaaaaaaaaaaaaaaaaaaaaaaaaaaaaaaaaaaaaaaaaaaaaaaaaaaaaaaaaaaaaaaaaaaaaaaaaaaaaaaaaaaaaaaaaaaaaaaaaaaaaaaaaaaaaaaaaaaaaaaaaaaaaaaaaaaaaaaaaaaaaaaaaaaaaaaaaaaaaaaaaaaaaaaaaaaaaaaaaaaaaaaaaaaaaaaaaaaaaaaaaaaaaaaaaaaaaaaaaaaaaaaaaaaaaaaaaaaaaaaaaaaaaaaaaaaaaaaaaaaaaaaaaaaaaaaaaaaaaaaaaaaaaaaaaaaaaaaaaaaaaaaaaaaaaaaaaaaaaaaaaaaaaaaaaaaaaaaaaaaaaaaaaaaaaaaaaaaaaaaaaaaaaaaaaaaaaaaaaaaaaaaaaaaaaaaaaaaaaaaaaaaaaaaaaaaaaaaaaaaaaaaaaaaaaaaaaaaaaaaaaaaaaaaaaaaaaaaaaaaaaaaaaaaaaaaaaaaaaaaaaaaaaaaaaaaaaaaaaaaaaaaaaaaaaaaaaaaaaaaaaaaaaaaaaaaaaaaaaaaaaaaaaaaaaaaaaaaaaaaaaaaaaaaaaaaaaaaaaaaaaaaaaaaaaaaaaaaaaaaaaaaaaaaaaaaaaaaaaaaaaaaaaaaaaaaaaaaaaaaaaaaaaaaaaaaaaaaaaaaaaaaaaaaaaaaaaaaaaaaaaaaaaaaaaaaaaaaaaaaaaaaaaaaaaaaaaaaaaaaaaaaaaaaaaaaaaaaaaaaaaaaaaaaaaaaaaaaaaaaaaaaaaaaaaaaaaaaaaaaaaaaaaaaaaaaaaaaaaaaaaaaaaaaaaaaaaaaaaaaaaaaaaaaaaaaaaaaaaaaaaaaaaaaaaaaaaaaaaaaaaaaaaaaaaaaaaaaaaaaaaaaaaaaaaaaaaaaaaaaaaaaaaaaaaaaaaaaaaaaaaaaaaaaaaaaaaaaaaaaaaaaaaaaaaaaaaaaaaaaaaaaaaaaaaaaaaaaaaaaaaaaaaaaaaaaaaaaaaaaaaaaaaaaaaaaaaaaaaaaaaaaaaaaaaaaaaaaaaaaaaaaaaaaaaaaaaaaaaaaaaaaaaaaaaaaaaaaaaaaaaaaaaaaaaaaaaaaaaaaaaaaaaaaaaaaaaaaaaaaaaaaaaaaaaaaaaaaaaaaaaaaaaaaaaaaaaaaaaaaaaaaaaaaaaaaaaaaaaaaaaaaaaaaaaaaaaaaaaaaaaaaaaaaaaaaaaaaaaaaaaaaaaaaaaaaaaaaaaaaaaaaaaaaaaaaaaaaaaaaaaaaaaaaaaaaaaaaaaaaaaaaaaaaaaaaaaaaaaaaaaaaaaaaaaaaaaaaaaaaaaaaaaaaaaaaaaaaaaaaaaaaaaaaaaaaaaaaaaaaaaaaaaaaaaaaaaaaaaaaaaaaaaaaaaaaaaaaaaaaaaaaaaaaaaaaaaaaaaaaaaaaaaaaaaaaaaaaaaaaaaaaaaaaaaaaaaaaaaaaaaaaaaaaaaaaaaaaaaaaaaaaaaaaaaaaaaaaaaaaaaaaaaaaaaaaaaaaaaaaaaaaaaaaaaaaaaaaaaaaaaaaaaaaaaaaaaaaaaaaaaaaaaaaaaaaaaaaaaaaaaaaaaaaaaaaaaaaaaaaaaaaaaaaaaaaaaaaaaaaaaaaaaaaaaaaaaaaaaaaaaaaaaaaaaaaaaaaaaaaaaaaaaaaaaaaaaaaaaaaaaaaaaaaaaaaaaaaaaaaaaaaaaaaaaaaaaaaaaaaaaaaaaaaaaaaaaaaaaaaaaaaaaaaaaaaaaaaaaaaaaaaaaaaaaaaaaaaaaaaaaaaaaaaaaaaaaaaaaaaaaaaaaaaaaaaaaaaaaaaaaaaaaaaaaaaaaaaaaaaaaaaaaaaaaaaaaaaaaaaaaaaaaaaaaaaaaaaaaaaaaaaaaaaaaaaaaaaaaaaaaaaaaaaaaaaaaaaaaaaaaaaaaaaaaaaaaaaaaaaaaaaaaaaaaaaaaaaaaaaaaaaaaaaaaaaaaaaaaaaaaaaaaaaaaaaaaaaaaaaaaaaaaaaaaaaaaaaaaaaaaaaaaaaaaaaaaaaaaaaaaaaaaaaaaaaaaaaaaaaaaaaaaaaaaaaaaaaaaaaaaaaaaaaaaaaaaaaaaaaaaaaaaaaaaaaaaaaaaaaaaaaaaaaaaaaaaaaaaaaaaaaaaaaaaaaaaaaaaaaaaaaaaaaaaaaaaaaaaaaaaaaaaaaaaaaaaaaaaaaaaaaaaaaaaaaaaaaaaaaaaaaaaaaaaaaaaaaaaaaaaaaaaaaaaaaaaaaaaaaaaaaaaaaaaaaaaaaaaaaaaaaaaaaaaaaaaaaaaaaaaaaaaaaaaaaaaaaaaaaaaaaaaaaaaaaaaaaaaaaaaaaaaaaaaaaaaaaaaaaaaaaaaaaaaaaaaaaaaaaaaaaaaaaaaaaaaaaaaaaaaaaaaaaaaaaaaaaaaaaaaaaaaaaaaaaaaaaaaaaaaaaaaaaaaaaaaaaaaaaaaaaaaaaaaaaaaaaaaaaaaaaaaaaaaaaaaaaaaaaaaaaaaaaaaaaaaaaaaaaaaaaaaaaaaaaaaaaaaaaaaaaaaaaaaaaaaaaaaaaaaaaaaaaaaaaaaaaaaaaaaaaaaaaaaaaaaaaaaaaaaaaaaaaaaaaaaaaaaaaaaaaaaaaaaaaaaaaaaaaaaaaaaaaaaaaaaaaaaaaaaaaaaaaaaaaaaaaaaaaaaaaaaaaaaaaaaaaaaaaaaaaaaaaaaaaaaaaaaaaaaaaaaaaaaaaaaaaaaaaaaaaaaaaaaaaaaaaaaaaaaaaaaaaaaaaaaaaaaaaaaaaaaaaaaaaaaaaaaaaaaaaaaaaaaaaaaaaaaaaaaaaaaaaaaaaaaaaaaaaaaaaaaaaaaaaaaaaaaaaaaaaaaaaaaaaaaaaaaaaaaaaaaaaaaaaaaaaaaaaaaaaaaaaaaaaaaaaaaaaaaaaaaaaaaaaaaaaaaaaaaaaaaaaaaaaaaaaaaaaaaaaaaaaaaaaaaaaaaaaaaaaaaaaaaaaaaaaaaaaaaaaaaaaaaaaaaaaaaaaaaaaaaaaaaaaaaaaaaaaaaaaaaaaaaaaaaaaaaaaaaaaaaaaaaaaaaaaaaaaaaaaaaaaaaaaaaaaaaaaaaaaaaaaaaaaaaaaaaaaaaaaaaaaaaaaaaaaaaaaaaaaaaaaaaaaaaaaaaaaaaaaaaaaaaaaaaaaaaaaaaaaaaaaaaaaaaaaaaaaaaaaaaaaaaaaaaaaaaaaaaaaaaaaaaaaaaaaaaaaaaaaaaaaaaaaaaaaaaaaaaaaaaaaaaaaaaaaaaaaaaaaaaaaaaaaaaaaaaaaaaaaaaaaaaaaaaaaaaaaaaaaaaaaaaaaaaaaaaaaaaaaaaaaaaaaaaaaaaaaaaaaaaaaaaaaaaaaaaaaaaaaaaaaaaaaaaaaaaaaaaaaaaaaaaaaaaaaaaaaaaaaaaaaaaaaaaaaaaaaaaaaaaaaaaaaaaaaaaaaaaaaaaaaaaaaaaaaaaaaaaaaaaaaaaaaaaaaaaaaaaaaaaaaaaaaaaaaaaaaaaaaaaaaaaaaaaaaaaaaaaaaaaaaaaaaaaaaaaaaaaaaaaaaaaaaaaaaaaaaaaaaaaaaaaaaaaaaaaaaaaaaaaaaaaaaaaaaaaaaaaaaaaaaaaaaaaaaaaaaaaaaaaaaaaaaaaaaaaaaaaaaaaaaaaaaaaaaaaaaaaaaaaaaaaaaaaaaaaaaaaaaaaaaaaaaaaaaaaaaaaaaaaaaaaaaaaaaaaaaaaaaaaaaaaaaaaaaaaaaaaaaaaaaaaaaaaaaaaaaaaaaaaaaaaaaaaaaaaaaaaaaaaaaaaaaaaaaaaaaaaaaaaaaaaaaaaaaaaaaaaaaaaaaaaaaaaaaaaaaaaaaaaaaaaaaaaaaaaaaaaaaaaaaaaaaaaaaaaaaaaaaaaaaaaaaaaaaaaaaaaaaaaaaaaaaaaaaaaaaaaaaaaaaaaaaaaaaaaaaaaaaaaaaaaaaaaaaaaaaaaaaaaaaaaaaaaaaaaaaaaaaaaaaaaaaaaaaaaaaaaaaaaaaaaaaaaaaaaaaaaaaaaaaaaaaaaaaaaaaaaaaaaaaaaaaaaaaaaaaaaaaaaaaaaaaaaaaaaaaaaaaaaaaaaaaaaaaaaaaaaaaaaaaaaaaaaaaaaaaaaaaaaaaaaaaaaaaaaaaaaaaaaaaaaaaaaaaaaaaaaaaaaaaaaaaaaaaaaaaaaaaaaaaaaaaaaaaaaaaaaaaaaaaaaaaaaaaaaaaaaaaaaaaaaaaaaaaaaaaaaaaaaaaaaaaaaaaaaaaaaaaaaaaaaaaaaaaaaaaaaaaaaaaaaaaaaaaaaaaaaaaaaaaaaaaaaaaaaaaaaaaaaaaaaaaaaaaaaaaaaaaaaaaaaaaaaaaaaaaaaaaaaaaaaaaaaaaaaaaaaaaaaaaaaaaaaaaaaaaaaaaaaaaaaaaaaaaaaaaaaaaaaaaaaaaaaaaaaaaaaaaaaaaaaaaaaaaaaaaaaaaaaaaaaaaaaaaaaaaaaaaaaaaaaaaaaaaaaaaaaaaaaaaaaaaaaaaaaaaaaaaaaaaaaaaaaaaaaaaaaaaaaaaaaaaaaaaaaaaaaaaaaaaaaaaaaaaaaaaaaaaaaaaaaaaaaaaaaaaaaaaaaaaaaaaaaaaaaaaaaaaaaaaaaaaaaaaaaaaaaaaaaaaaaaaaaaaaaaaaaaaaaaaaaaaaaaaaaaaaaaaaaaaaaaaaaaaaaaaaaaaaaaaaaaaaaaaaaaaaaaaaaaaaaaaaaaaaaaaaaaaaaaaaaaaaaaaaaaaaaaaaaaaaaaaaaaaaaaaaaaaaaaaaaaaaaaaaaaaaaaaaaaaaaaaaaaaaaaaaaaaaaaaaaaaaaaaaaaaaaaaaaaaaaaaaaaaaaaaaaaaaaaaaaaaaaaaaaaaaaaaaaaaaaaaaaaaaaaaaaaaaaaaaaaaaaaaaaaaaaaaaaaaaaaaaaaaaaaaaaaaaaaaaaaaaaaaaaaaaaaaaaaaaaaaaaaaaaaaaaaaaaaaaaaaaaaaaaaaaaaaaaaaaaaaaaaaaaaaaaaaaaaaaaaaaaaaaaaaaaaaaaaaaaaaaaaaaaaaaaaaaaaaaaaaaaaaaaaaaaaaaaaaaaaaaaaaaaaaaaaaaaaaaaaaaaaaaaaaaaaaaaaaaaaaaaaaaaaaaaaaaaaaaaaaaaaaaaaaaaaaaaaaaaaaaaaaaaaaaaaaaaaaaaaaaaaaaaaaaaaaaaaaaaaaaaaaaaaaaaaaaaaaaaaaaaaaaaaaaaaaaaaaaaaaaaaaaaaaaaaaaaaaaaaaaaaaaaaaaaaaaaaaaaaaaaaaaaaaaaaaaaaaaaaaaaaaaaaaaaaaaaaaaaaaaaaaaaaaaaaaaaaaaaaaaaaaaaaaaaaaaaaaaaaaaaaaaaaaaaaaaaaaaaaaaaaaaaaaaaaaaaaaaaaaaaaaaaaaaaaaaaaaaaaaaaaaaaaaaaaaaaaaaaaaaaaaaaaaaaaaaaaaaaaaaaaaaaaaaaaaaaaaaaaaaaaaaaaaaaaaaaaaaaaaaaaaaaaaaaaaaaaaaaaaaaaaaaaaaaaaaaaaaaaaaaaaaaaaaaaaaaaaaaaaaaaaaaaaaaaaaaaaaaaaaaaaaaaaaaaaaaaaaaaaaaaaaaaaaaaaaaaaaaaaaaaaaaaaaaaaaaaaaaaaaaaaaaaaaaaaaaaaaaaaaaaaaaaaaaaaaaaaaaaaaaaaaaaaaaaaaaaaaaaaaaaaaaaaaaaaaaaaaaaaaaaaaaaaaaaaaaaaaaaaaaaaaaaaaaaaaaaaaaaaaaaaaaaaaaaaaaaaaaaaaaaaaaaaaaaaaaaaaaaaaaaaaaaaaaaaaaaaaaaaaaaaaaaaaaaaaaaaaaaaaaaaaaaaaaaaaaaaaaaaaaaaaaaaaaaaaaaaaaaaaaaaaaaaaaaaaaaaaaaaaaaaaaaaaaaaaaaaaaaaaaaaaaaaaaaaaaaaaaaaaaaaaaaaaaaaaaaaaaaaaaaaaaaaaaaaaaaaaaaaaaaaaaaaaaaaaaaaaaaaaaaaaaaaaaaaaaaaaaaaaaaaaaaaaaaaaaaaaaaaaaaaaaaaaaaaaaaaaaaaaaaaaaaaaaaaaaaaaaaaaaaaaaaaaaaaaaaaaaaaaaaaaaaaaaaaaaaaaaaaaaaaaaaaaaaaaaaaaaaaaaaaaaaaaaaaaaaaaaaaaaaaaaaaaaaaaaaaaaaaaaaaaaaaaaaaaaaaaaaaaaaaaaaaaaaaaaaaaaaaaaaaaaaaaaaaaaaaaaaaaaaaaaaaaaaaaaaaaaaaaaaaaaaaaaaaaaaaaaaaaaaaaaaaaaaaaaaaaaaaaaaaaaaaaaaaaaaaaaaaaaaaaaaaaaaaaaaaaaaaaaaaaaaaaaaaaaaaaaaaaaaaaaaaaaaaaaaaaaaaaaaaaaaaaaaaaaaaaaaaaaaaaaaaaaaaaaaaaaaaaaaaaaaaaaaaaaaaaaaaaaaaaaaaaaaaaaaaaaaaaaaaaaaaaaaaaaaaaaaaaaaaaaaaaaaaaaaaaaaaaaaaaaaaaaaaaaaaaaaaaaaaaaaaaaaaaaaaaaaaaaaaaaaaaaaaaaaaaaaaaaaaaaaaaaaaaaaaaaaaaaaaaaaaaaaaaaaaaaaaaaaaaaaaaaaaaaaaaaaaaaaaaaaaaaaaaaaaaaaaaaaaaaaaaaaaaaaaaaaaaaaaaaaaaaaaaaaaaaaaaaaaaaaaaaaaaaaaaaaaaaaaaaaaaaaaaaaaaaaaaaaaaaaaaaaaaaaaaaaaaaaaaaaaaaaaaaaaaaaaaaaaaaaaaaaaaaaaaaaaaaaaaaaaaaaaaaaaaaaaaaaaaaaaaaaaaaaaaaaaaaaaaaaaaaaaaaaaaaaaaaaaaaaaaaaaaaaaaaaaaaaaaaaaaaaaaaaaaaaaaaaaaaaaaaaaaaaaaaaaaaaaaaaaaaaaaaaaaaaaaaaaaaaaaaaaaaaaaaaaaaaaaaaaaaaaaaaaaaaaaaaaaaaaaaaaaaaaaaaaaaaaaaaaaaaaaaaaaaaaaaaaaaaaaaaaaaaaaaaaaaaaaaaaaaaaaaaaaaaaaaaaaaaaaaaaaaaaaaaaaaaaaaaaaaaaaaaaaaaaaaaaaaaaaaaaaaaaaaaaaaaaaaaaaaaaaaaaaaaaaaaaaaaaaaaaaaaaaaaaaaaaaaaaaaaaaaaaaaaaaaaaaaaaaaaaaaaaaaaaaaaaaaaaaaaaaaaaaaaaaaaaaaaaaaaaaaaaaaaaaaaaaaaaaaaaaaaaaaaaaaaaaaaaaaaaaaaaaaaaaaaaaaaaaaaaaaaaaaaaaaaaaaaaaaaaaaaaaaaaaaaaaaaaaaaaaaaaaaaaaaaaaaaaaaaaaaaaaaaaaaaaaaaaaaaaaaaaaaaaaaaaaaaaaaaaaaaaaaaaaaaaaaaaaaaaaaaaaaaaaaaaaaaaaaaaaaaaaaaaaaaaaaaaaaaaaaaaaaaaaaaaaaaaaaaaaaaaaaaaaaaaaaaaaaaaaaaaaaaaaaaaaaaaaaaaaaaaaaaaaaaaaaaaaaaaaaaaaaaaaaaaaaaaaaaaaaaaaaaaaaaaaaaaaaaaaaaaaaaaaaaaaaaaaaaaaaaaaaaaaaaaaaaaaaaaaaaaaaaaaaaaaaaaaaaaaaaaaaaaaaaaaaaaaaaaaaaaaaaaaaaaaaaaaaaaaaaaaaaaaaaaaaaaaaaaaaaaaaaaaaaaaaaaaaaaaaaaaaaaaaaaaaaaaaaaaaaaaaaaaaaaaaaaaaaaaaaaaaaaaaaaaaaaaaaaaaaaaaaaaaaaaaaaaaaaaaaaaaaaaaaaaaaaaaaaaaaaaaaaaaaaaaaaaaaaaaaaaaaaaaaaaaaaaaaaaaaaaaaaaaaaaaaaaaaaaaaaaaaaaaaaaaaaaaaaaaaaaaaaaaaaaaaaaaaaaaaaaaaaaaaaaaaaaaaaaaaaaaaaaaaaaaaaaaaaaaaaaaaaaaaaaaaaaaaaaaaaaaaaaaaaaaaaaaaaaaaaaaaaaaaaaaaaaaaaaaaaaaaaaaaaaaaaaaaaaaaaaaaaaaaaaaaaaaaaaaaaaaaaaaaaaaaaaaaaaaaaaaaaaaaaaaaaaaaaaaaaaaaaaaaaaaaaaaaaaaaaaaaaaaaaaaaaaaaaaaaaaaaaaaaaaaaaaaaaaaaaaaaaaaaaaaaaaaaaaaaaaaaaaaaaaaaaaaaaaaaaaaaaaaaaaaaaaaaaaaaaaaaaaaaaaaaaaaaaaaaaaaaaaaaaaaaaaaaaaaaaaaaaaaaaaaaaaaaaaaaaaaaaaaaaaaaaaaaaaaaaaaaaaaaaaaaaaaaaaaaaaaaaaaaaaaaaaaaaaaaaaaaaaaaaaaaaaaaaaaaaaaaaaaaaaaaaaaaaaaaaaaaaaaaaaaaaaaaaaaaaaaaaaaaaaaaaaaaaaaaaaaaaaaaaaaaaaaaaaaaaaaaaaaaaaaaaaaaaaaaaaaaaaaaaaaaaaaaaaaaaaaaaaaaaaaaaaaaaaaaaaaaaaaaaaaaaaaaaaaaaaaaaaaaaaaaaaaaaaaaaaaaaaaaaaaaaaaaaaaaaaaaaaaaaaaaaaaaaaaaaaaaaaaaaaaaaaaaaaaaaaaaaaaaaaaaaaaaaaaaaaaaaaaaaaaaaaaaaaaaaaaaaaaaaaaaaaaaaaaaaaaaaaaaaaaaaaaaaaaaaaaaaaaaaaaaaaaaaaaaaaaaaaaaaaaaaaaaaaaaaaaaaaaaaaaaaaaaaaaaaaaaaaaaaaaaaaaaaaaaaaaaaaaaaaaaaaaaaaaaaaaaaaaaaaaaaaaaaaaaaaaaaaaaaaaaaaaaaaaaaaaaaaaaaaaaaaaaaaaaaaaaaaaaaaaaaaaaaaaaaaaaaaaaaaaaaaaaaaaaaaaaaaaaaaaaaaaaaaaaaaaaaaaaaaaaaaaaaaaaaaaaaaaaaaaaaaaaaaaaaaaaaaaaaaaaaaaaaaaaaaaaaaaaaaaaaaaaaaaaaaaaaaaaaaaaaaaaaaaaaaaaaaaaaaaaaaaaaaaaaaaaaaaaaaaaaaaaaaaaaaaaaaaaaaaaaaaaaaaaaaaaaaaaaaaaaaaaaaaaaaaaaaaaaaaaaaaaaaaaaaaaaaaaaaaaaaaaaaaaaaaaaaaaaaaaaaaaaaaaaaaaaaaaaaaaaaaaaaaaaaaaaaaaaaaaaaaaaaaaaaaaaaaaaaaaaaaaaaaaaaaaaaaaaaaaaaaaaaaaaaaaaaaaaaaaaaaaaaaaaaaaaaaaaaaaaaaaaaaaaaaaaaaaaaaaaaaaaaaaaaaaaaaaaaaaaaaaaaaaaaaaaaaaaaaaaaaaaaaaaaaaaaaaaaaaaaaaaaaaaaaaaaaaaaaaaaaaaaaaaaaaaaaaaaaaaaaaaaaaaaaaaaaaaaaaaaaaaaaaaaaaaaaaaaaaaaaaaaaaaaaaaaaaaaaaaaaaaaaaaaaaaaaaaaaaaaaaaaaaaaaaaaaaaaaaaaaaaaaaaaaaaaaaaaaaaaaaaaaaaaaaaaaaaaaaaaaaaaaaaaaaaaaaaaaaaaaaaaaaaaaaaaaaaaaaaaaaaaaaaaaaaaaaaaaaaaaaaaaaaaaaaaaaaaaaaaaaaaaaaaaaaaaaaaaaaaaaaaaaaaaaaaaaaaaaaaaaaaaaaaaaaaaaaaaaaaaaaaaaaaaaaaaaaaaaaaaaaaaaaaaaaaaaaaaaaaaaaaaaaaaaaaaaaaaaaaaaaaaaaaaaaaaaaaaaaaaaaaaaaaaaaaaaaaaaaaaaaaaaaaaaaaaaaaaaaaaaaaaaaaaaaaaaaaaaaaaaaaaaaaaaaaaaaaaaaaaaaaaaaaaaaaaaaaaaaaaaaaaaaaaaaaaaaaaaaaaaaaaaaaaaaaaaaaaaaaaaaaaaaaaaaaaaaaaaaaaaaaaaaaaaaaaaaaaaaaaaaaaaaaaaaaaaaaaaaaaaaaaaaaaaaaaaaaaaaaaaaaaaaaaaaaaaaaaaaaaaaaaaaaaaaaaaaaaaaaaaaaaaaaaaaaaaaaaaaaaaaaaaaaaaaaaaaaaaaaaaaaaaaaaaaaaaaaaaaaaaaaaaaaaaaaaaaaaaaaaaaaaaaaaaaaaaaaaaaaaaaaaaaaaaaaaaaaaaaaaaaaaaaaaaaaaaaaaaaaaaaaaaaaaaaaaaaaaaaaaaaaaaaaaaaaaaaaaaaaaaaaaaaaaaaaaaaaaaaaaaaaaaaaaaaaaaaaaaaaaaaaaaaaaaaaaaaaaaaaaaaaaaaaaaaaaaaaaaaaaaaaaaaaaaaaaaaaaaaaaaaaaaaaaaaaaaaaaaaaaaaaaaaaaaaaaaaaaaaaaaaaaaaaaaaaaaaaaaaaaaaaaaaaaaaaaaaaaaaaaaaaaaaaaaaaaaaaaaaaaaaaaaaaaaaaaaaaaaaaaaaaaaaaaaaaaaaaaaaaaaaaaaaaaaaaaaaaaaaaaaaaaaaaaaaaaaaaaaaaaaaaaaaaaaaaaaaaaaaaaaaaaaaaaaaaaaaaaaaaaaaaaaaaaaaaaaaaaaaaaaaaaaaaaaaaaaaaaaaaaaaaaaaaaaaaaaaaaaaaaaaaaaaaaaaaaaaaaaaaaaaaaaaaaaaaaaaaaaaaaaaaaaaaaaaaaaaaaaaaaaaaaaaaaaaaaaaaaaaaaaaaaaaaaaaaaaaaaaaaaaaaaaaaaaaaaaaaaaaaaaaaaaaaaaaaaaaaaaaaaaaaaaaaaaaaaaaaaaaaaaaaaaaaaaaaaaaaaaaaaaaaaaaaaaaaaaaaaaaaaaaaaaaaaaaaaaaaaaaaaaaaaaaaaaaaaaaaaaaaaaaaaaaaaaaaaaaaaaaaaaaaaaaaaaaaaaaaaaaaaaaaaaaaaaaaaaaaaaaaaaaaaaaaaaaaaaaaaaaaaaaaaaaaaaaaaaaaaaaaaaaaaaaaaaaaaaaaaaaaaaaaaaaaaaaaaaaaaaaaaaaaaaaaaaaaaaaaaaaaaaaaaaaaaaaaaaaaaaaaaaaaaaaaaaaaaaaaaaaaaaaaaaaaaaaaaaaaaaaaaaaaaaaaaaaaaaaaaaaaaaaaaaaaaaaaaaaaaaaaaaaaaaaaaaaaaaaaaaaaaaaaaaaaaaaaaaaaaaaaaaaaaaaaaaaaaaaaaaaaaaaaaaaaaaaaaaaaaaaaaaaaaaaaaaaaaaaaaaaaaaaaaaaaaaaaaaaaaaaaaaaaaaaaaaaaaaaaaaaaaaaaaaaaaaaaaaaaaaaaaaaaaaaaaaaaaaaaaaaaaaaaaaaaaaaaaaaaaaaaaaaaaaaaaaaaaaaaaaaaaaaaaaaaaaaaaaaaaaaaaaaaaaaaaaaaaaaaaaaaaaaaaaaaaaaaaaaaaaaaaaaaaaaaaaaaaaaaaaaaaaaaaaaaaaaaaaaaaaaaaaaaaaaaaaaaaaaaaaaaaaaaaaaaaaaaaaaaaaaaaaaaaaaaaaaaaaaaaaaaaaaaaaaaaaaaaaaaaaaaaaaaaaaaaaaaaaaaaaaaaaaaaaaaaaaaaaaaaaaaaaaaaaaaaaaaaaaaaaaaaaaaaaaaaaaaaaaaaaaaaaaaaaaaaaaaaaaaaaaaaaaaaaaaaaaaaaaaaaaaaaaaaaaaaaaaaaaaaaaaaaaaaaaaaaaaaaaaaaaaaaaaaaaaaaaaaaaaaaaaaaaaaaaaaaaaaaaaaaaaaaaaaaaaaaaaaaaaaaaaaaaaaaaaaaaaaaaaaaaaaaaaaaaaaaaaaaaaaaaaaaaaaaaaaaaaaaaaaaaaaaaaaaaaaaaaaaaaaaaaaaaaaaaaaaaaaaaaaaaaaaaaaaaaaaaaaaaaaaaaaaaaaaaaaaaaaaaaaaaaaaaaaaaaaaaaaaaaaaaaaaaaaaaaaaaaaaaaaaaaaaaaaaaaaaaaaaaaaaaaaaaaaaaaaaaaaaaaaaaaaaaaaaaaaaaaaaaaaaaaaaaaaaaaaaaaaaaaaaaaaaaaaaaaaaaaaaaaaaaaaaaaaaaaaaaaaaaaaaaaaaaaaaaaaaaaaaaaaaaaaaaaaaaaaaaaaaaaaaaaaaaaaaaaaaaaaaaaaaaaaaaaaaaaaaaaaaaaaaaaaaaaaaaaaaaaaaaaaaaaaaaaaaaaaaaaaaaaaaaaaaaaaaaaaaaaaaaaaaaaaaaaaaaaaaaaaaaaaaaaaaaaaaaaaaaaaaaaaaaaaaaaaaaaaaaaaaaaaaaaaaaaaaaaaaaaaaaaaaaaaaaaaaaaaaaaaaaaaaaaaaaaaaaaaaaaaaaaaaaaaaaaaaaaaaaaaaaaaaaaaaaaaaaaaaaaaaaaaaaaaaaaaaaaaaaaaaaaaaaaaaaaaaaaaaaaaaaaaaaaaaaaaaaaaaaaaaaaaaaaaaaaaaaaaaaaaaaaaaaaaaaaaaaaaaaaaaaaaaaaaaaaaaaaaaaaaaaaaaaaaaaaaaaaaaaaaaaaaaaaaaaaaaaaaaaaaaaaaaaaaaaaaaaaaaaaaaaaaaaaaaaaaaaaaaaaaaaaaaaaaaaaaaaaaaaaaaaaaaaaaaaaaaaaaaaaaaaaaaaaaaaaaaaaaaaaaaaaaaaaaaaaaaaaaaaaaaaaaaaaaaaaaaaaaaaaaaaaaaaaaaaaaaaaaaaaaaaaaaaaaaaaaaaaaaaaaaaaaaaaaaaaaaaaaaaaaaaaaaaaaaaaaaaaaaaaaaaaaaaaaaaaaaaaaaaaaaaaaaaaaaaaaaaaaaaaaaaaaaaaaaaaaaaaaaaaaaaaaaaaaaaaaaaaaaaaaaaaaaaaaaaaaaaaaaaaaaaaaaaaaaaaaaaaaaaaaaaaaaaaaaaaaaaaaaaaaaaaaaaaaaaaaaaaaaaaaaaaaaaaaaaaaaaaaaaaaaaaaaaaaaaaaaaaaaaaaaaaaaaaaaaaaaaaaaaaaaaaaaaaaaaaaaaaaaaaaaaaaaaaaaaaaaaaaaaaaaaaaaaaaaaaaaaaaaaaaaaaaaaaaaaaaaaaaaaaaaaaaaaaaaaaaaaaaaaaaaaaaaaaaaaaaaaaaaaaaaaaaaaaaaaaaaaaaaaaaaaaaaaaaaaaaaaaaaaaaaaaaaaaaaaaaaaaaaaaaaaaaaaaaaaaaaaaaaaaaaaaaaaaaaaaaaaaaaaaaaaaaaaaaaaaaaaaaaaaaaaaaaaaaaaaaaaaaaaaaaaaaaaaaaaaaaaaaaaaaaaaaaaaaaaaaaaaaaaaaaaaaaaaaaaaaaaaaaaaaaaaaaaaaaaaaaaaaaaaaaaaaaaaaaaaaaaaaaaaaaaaaaaaaaaaaaaaaaaaaaaaaaaaaaaaaaaaaaaaaaaaaaaaaaaaaaaaaaaaaaaaaaaaaaaaaaaaaaaaaaaaaaaaaaaaaaaaaaaaaaaaaaaaaaaaaaaaaaaaaaaaaaaaaaaaaaaaaaaaaaaaaaaaaaaaaaaaaaaaaaaaaaaaaaaaaaaaaaaaaaaaaaaaaaaaaaaaaaaaaaaaaaaaaaaaaaaaaaaaaaaaaaaaaaaaaaaaaaaaaaaaaaaaaaaaaaaaaaaaaaaaaaaaaaaaaaaaaaaaaaaaaaaaaaaaaaaaaaaaaaaaaaaaaaaaaaaaaaaaaaaaaaaaaaaaaaaaaaaaaaaaaaaaaaaaaaaaaaaaaaaaaaaaaaaaaaaaaaaaaaaaaaaaaaaaaaaaaaaaaaaaaaaaaaaaaaaaaaaaaaaaaaaaaaaaaaaaaaaaaaaaaaaaaaaaaaaaaaaaaaaaaaaaaaaaaaaaaaaaaaaaaaaaaaaaaaaaaaaaaaaaaaaaaaaaaaaaaaaaaaaaaaaaaaaaaaaaaaaaaaaaaaaaaaaaaaaaaaaaaaaaaaaaaaaaaaaaaaaaaaaaaaaaaaaaaaaaaaaaaaaaaaaaaaaaaaaaaaaaaaaaaaaaaaaaaaaaaaaaaaaaaaaaaaaaaaaaaaaaaaaaaaaaaaaaaaaaaaaaaaaaaaaaaaaaaaaaaaaaaaaaaaaaaaaaaaaaaaaaaaaaaaaaaaaaaaaaaaaaaaaaaaaaaaaaaaaaaaaaaaaaaaaaaaaaaaaaaaaaaaaaaaaaaaaaaaaaaaaaaaaaaaaaaaaaaaaaaaaaaaaaaaaaaaaaaaaaaaaaaaaaaaaaaaaaaaaaaaaaaaaaaaaaaaaaaaaaaaaaaaaaaaaaaaaaaaaaaaaaaaaaaaaaaaaaaaaaaaaaaaaaaaaaaaaaaaaaaaaaaaaaaaaaaaaaaaaaaaaaaaaaaaaaaaaaaaaaaaaaaaaaaaaaaaaaaaaaaaaaaaaaaaaaaaaaaaaaaaaaaaaaaaaaaaaaaaaaaaaaaaaaaaaaaaaaaaaaaaaaaaaaaaaaaaaaaaaaaaaaaaaaaaaaaaaaaaaaaaaaaaaaaaaaaaaaaaaaaaaaaaaaaaaaaaaaaaaaaaaaaaaaaaaaaaaaaaaaaaaaaaaaaaaaaaaaaaaaaaaaaaaaaaaaaaaaaaaaaaaaaaaaaaaaaaaaaaaaaaaaaaaaaaaaaaaaaaaaaaaaaaaaaaaaaaaaaaaaaaaaaaaaaaaaaaaaaaaaaaaaaaaaaaaaaaaaaaaaaaaaaaaaaaaaaaaaaaaaaaaaaaaaaaaaaaaaaaaaaaaaaaaaaaaaaaaaaaaaaaaaaaaaaaaaaaaaaaaaaaaaaaaaaaaaaaaaaaaaaaaaaaaaaaaaaaaaaaaaaaaaaaaaaaaaaaaaaaaaaaaaaaaaaaaaaaaaaaaaaaaaaaaaaaaaaaaaaaaaaaaaaaaaaaaaaaaaaaaaaaaaaaaaaaaaaaaaaaaaaaaaaaaaaaaaaaaaaaaaaaaaaaaaaaaaaaaaaaaaaaaaaaaaaaaaaaaaaaaaaaaaaaaaaaaaaaaaaaaaaaaaaaaaaaaaaaaaaaaaaaaaaaaaaaaaaaaaaaaaaaaaaaaaaaaaaaaaaaaaaaaaaaaaaaaaaaaaaaaaaaaaaaaaaaaaaaaaaaaaaaaaaaaaaaaaaaaaaaaaaaaaaaaaaaaaaaaaaaaaaaaaaaaaaaaaaaaaaaaaaaaaaaaaaaaaaaaaaaaaaaaaaaaaaaaaaaaaaaaaaaaaaaaaaaaaaaaaaaaaaaaaaaaaaaaaaaaaaaaaaaaaaaaaaaaaaaaaaaaaaaaaaaaaaaaaaaaaaaaaaaaaaaaaaaaaaaaaaaaaaaaaaaaaaaaaaaaaaaaaaaaaaaaaaaaaaaaaaaaaaaaaaaaaaaaaaaaaaaaaaaaaaaaaaaaaaaaaaaaaaaaaaaaaaaaaaaaaaaaaaaaaaaaaaaaaaaaaaaaaaaaaaaaaaaaaaaaaaaaaaaaaaaaaaaaaaaaaaaaaaaaaaaaaaaaaaaaaaaaaaaaaaaaaaaaaaaaaaaaaaaaaaaaaaaaaaaaaaaaaaaaaaaaaaaaaaaaaaaaaaaaaaaaaaaaaaaaaaaaaaaaaaaaaaaaaaaaaaaaaaaaaaaaaaaaaaaaaaaaaaaaaaaaaaaaaaaaaaaaaaaaaaaaaaaaaaaaaaaaaaaaaaaaaaaaaaaaaaaaaaaaaaaaaaaaaaaaaaaaaaaaaaaaaaaaaaaaaaaaaaaaaaaaaaaaaaaaaaaaaaaaaaaaaaaaaaaaaaaaaaaaaaaaaaaaaaaaaaaaaaaaaaaaaaaaaaaaaaaaaaaaaaaaaaaaaaaaaaaaaaaaaaaaaaaaaaaaaaaaaaaaaaaaaaaaaaaaaaaaaaaaaaaaaaaaaaaaaaaaaaaaaaaaaaaaaaaaaaaaaaaaaaaaaaaaaaaaaaaaaaaaaaaaaaaaaaaaaaaaaaaaaaaaaaaaaaaaaaaaaaaaaaaaaaaaaaaaaaaaaaaaaaaaaaaaaaaaaaaaaaaaaaaaaaaaaaaaaaaaaaaaaaaaaaaaaaaaaaaaaaaaaaaaaaaaaaaaaaaaaaaaaaaaaaaaaaaaaaaaaaaaaaaaaaaaaaaaaaaaaaaaaaaaaaaaaaaaaaaaaaaaaaaaaaaaaaaaaaaaaaaaaaaaaaaaaaaaaaaaaaaaaaaaaaaaaaaaaaaaaaaaaaaaaaaaaaaaaaaaaaaaaaaaaaaaaaaaaaaaaaaaaaaaaaaaaaaaaaaaaaaaaaaaaaaaaaaaaaaaaaaaaaaaaaaaaaaaaaaaaaaaaaaaaaaaaaaaaaaaaaaaaaaaaaaaaaaaaaaaaaaaaaaaaaaaaaaaaaaaaaaaaaaaaaaaaaaaaaaaaaaaaaaaaaaaaaaaaaaaaaaaaaaaaaaaaaaaaaaaaaaaaaaaaaaaaaaaaaaaaaaaaaaaaaaaaaaaaaaaaaaaaaaaaaaaaaaaaaaaaaaaaaaaaaaaaaaaaaaaaaaaaaaaaaaaaaaaaaaaaaaaaaaaaaaaaaaaaaaaaaaaaaaaaaaaaaaaaaaaaaaaaaaaaaaaaaaaaaaaaaaaaaaaaaaaaaaaaaaaaaaaaaaaaaaaaaaaaaaaaaaaaaaaaaaaaaaaaaaaaaaaaaaaaaaaaaaaaaaaaaaaaaaaaaaaaaaaaaaaaaaaaaaaaaaaaaaaaaaaaaaaaaaaaaaaaaaaaaaaaaaaaaaaaaaaaaaaaaaaaaaaaaaaaaaaaaaaaaaaaaaaaaaaaaaaaaaaaaaaaaaaaaaaaaaaaaaaaaaaaaaaaaaaaaaaaaaaaaaaaaaaaaaaaaaaaaaaaaaaaaaaaaaaaaaaaaaaaaaaaaaaaaaaaaaaaaaaaaaaaaaaaaaaaaaaaaaaaaaaaaaaaaaaaaaaaaaaaaaaaaaaaaaaaaaaaaaaaaaaaaaaaaaaaaaaaaaaaaaaaaaaaaaaaaaaaaaaaaaaaaaaaaaaaaaaaaaaaaaaaaaaaaaaaaaaaaaaaaaaaaaaaaaaaaaaaaaaaaaaaaaaaaaaaaaaaaaaaaaaaaaaaaaaaaaaaaaaaaaaaaaaaaaaaaaaaaaaaaaaaaaaaaaaaaaaaaaaaaaaaaaaaaaaaaaaaaaaaaaaaaaaaaaaaaaaaaaaaaaaaaaaaaaaaaaaaaaaaaaaaaaaaaaaaaaaaaaaaaaaaaaaaaaaaaaaaaaaaaaaaaaaaaaaaaaaaaaaaaaaaaaaaaaaaaaaaaaaaaaaaaaaaaaaaaaaaaaaaaaaaaaaaaaaaaaaaaaaaaaaaaaaaaaaaaaaaaaaaaaaaaaaaaaaaaaaaaaaaaaaaaaaaaaaaaaaaaaaaaaaaaaaaaaaaaaaaaaaaaaaaaaaaaaaaaaaaaaaaaaaaaaaaaaaaaaaaaaaaaaaaaaaaaaaaaaaaaaaaaaaaaaaaaaaaaaaaaaaaaaaaaaaaaaaaaaaaaaaaaaaaaaaaaaaaaaaaaaaaaaaaaaaaaaaaaaaaaaaaaaaaaaaaaaaaaaaaaaaaaaaaaaaaaaaaaaaaaaaaaaaaaaaaaaaaaaaaaaaaaaaaaaaaaaaaaaaaaaaaaaaaaaaaaaaaaaaaaaaaaaaaaaaaaaaaaaaaaaaaaaaaaaaaaaaaaaaaaaaaaaaaaaaaaaaaaaaaaaaaaaaaaaaaaaaaaaaaaaaaaaaaaaaaaaaaaaaaaaaaaaaaaaaaaaaaaaaaaaaaaaaaaaaaaaaaaaaaaaaaaaaaaaaaaaaaaaaaaaaaaaaaaaaaaaaaaaaaaaaaaaaaaaaaaaaaaaaaaaaaaaaaaaaaaaaaaaaaaaaaaaaaaaaaaaaaaaaaaaaaaaaaaaaaaaaaaaaaaaaaaaaaaaaaaaaaaaaaaaaaaaaaaaaaaaaaaaaaaaaaaaaaaaaaaaaaaaaaaaaaaaaaaaaaaaaaaaaaaaaaaaaaaaaaaaaaaaaaaaaaaaaaaaaaaaaaaaaaaaaaaaaaaaaaaaaaaaaaaaaaaaaaaaaaaaaaaaaaaaaaaaaaaaaaaaaaaaaaaaaaaaaaaaaaaaaaaaaaaaaaaaaaaaaaaaaaaaaaaaaaaaaaaaaaaaaaaaaaaaaaaaaaaaaaaaaaaaaaaaaaaaaaaaaaaaaaaaaaaaaaaaaaaaaaaaaaaaaaaaaaaaaaaaaaaaaaaaaaaaaaaaaaaaaaaaaaaaaaaaaaaaaaaaaaaaaaaaaaaaaaaaaaaaaaaaaaaaaaaaaaaaaaaaaaaaaaaaaaaaaaaaaaaaaaaaaaaaaaaaaaaaaaaaaaaaaaaaaaaaaaaaaaaaaaaaaaaaaaaaaaaaaaaaaaaaaaaaaaaaaaaaaaaaaaaaaaaaaaaaaaaaaaaaaaaaaaaaaaaaaaaaaaaaaaaaaaaaaaaaaaaaaaaaaaaaaaaaaaaaaaaaaaaaaaaaaaaaaaaaaaaaaaaaaaaaaaaaaaaaaaaaaaaaaaaaaaaaaaaaaaaaaaaaaaaaaaaaaaaaaaaaaaaaaaaaaaaaaaaaaaaaaaaaaaaaaaaaaaaaaaaaaaaaaaaaaaaaaaaaaaaaaaaaaaaaaaaaaaaaaaaaaaaaaaaaaaaaaaaaaaaaaaaaaaaaaaaaaaaaaaaaaaaaaaaaaaaaaaaaaaaaaaaaaaaaaaaaaaaaaaaaaaaaaaaaaaaaaaaaaaaaaaaaaaaaaaaaaaaaaaaaaaaaaaaaaaaaaaaaaaaaaaaaaaaaaaaaaaaaaaaaaaaaaaaaaaaaaaaaaaaaaaaaaaaaaaaaaaaaaaaaaaaaaaaaaaaaaaaaaaaaaaaaaaaaaaaaaaaaaaaaaaaaaaaaaaaaaaaaaaaaaaaaaaaaaaaaaaaaaaaaaaaaaaaaaaaaaaaaaaaaaaaaaaaaaaaaaaaaaaaaaaaaaaaaaaaaaaaaaaaaaaaaaaaaaaaaaaaaaaaaaaaaaaaaaaaaaaaaaaaaaaaaaaaaaaaaaaaaaaaaaaaaaaaaaaaaaaaaaaaaaaaaaaaaaaaaaaaaaaaaaaaaaaaaaaaaaaaaaaaaaaaaaaaaaaaaaaaaaaaaaaaaaaaaaaaaaaaaaaaaaaaaaaaaaaaaaaaaaaaaaaaaaaaaaaaaaaaaaaaaaaaaaaaaaaaaaaaaaaaaaaaaaaaaaaaaaaaaaaaaaaaaaaaaaaaaaaaaaaaaaaaaaaaaaaaaaaaaaaaaaaaaaaaaaaaaaaaaaaaaaaaaaaaaaaaaaaaaaaaaaaaaaaaaaaaaaaaaaaaaaaaaaaaaaaaaaaaaaaaaaaaaaaaaaaaaaaaaaaaaaaaaaaaaaaaaaaaaaaaaaaaaaaaaaaaaaaaaaaaaaaaaaaaaaaaaaaaaaaaaaaaaaaaaaaaaaaaaaaaaaaaaaaaaaaaaaaaaaaaaaaaaaaaaaaaaaaaaaaaaaaaaaaaaaaaaaaaaaaaaaaaaaaaaaaaaaaaaaaaaaaaaaaaaaaaaaaaaaaaaaaaaaaaaaaaaaaaaaaaaaaaaaaaaaaaaaaaaaaaaaaaaaaaaaaaaaaaaaaaaaaaaaaaaaaaaaaaaaaaaaaaaaaaaaaaaaaaaaaaaaaaaaaaaaaaaaaaaaaaaaaaaaaaaaaaaaaaaaaaaaaaaaaaaaaaaaaaaaaaaaaaaaaaaaaaaaaaaaaaaaaaaaaaaaaaaaaaaaaaaaaaaaaaaaaaaaaaaaaaaaaaaaaaaaaaaaaaaaaaaaaaaaaaaaaaaaaaaaaaaaaaaaaaaaaaaaaaaaaaaaaaaaaaaaaaaaaaaaaaaaaaaaaaaaaaaaaaaaaaaaaaaaaaaaaaaaaaaaaaaaaaaaaaaaaaaaaaaaaaaaaaaaaaaaaaaaaaaaaaaaaaaaaaaaaaaaaaaaaaaaaaaaaaaaaaaaaaaaaaaaaaaaaaaaaaaaaaaaaaaaaaaaaaaaaaaaaaaaaaaaaaaaaaaaaaaaaaaaaaaaaaaaaaaaaaaaaaaaaaaaaaaaaaaaaaaaaaaaaaaaaaaaaaaaaaaaaaaaaaaaaaaaaaaaaaaaaaaaaaaaaaaaaaaaaaaaaaaaaaaaaaaaaaaaaaaaaaaaaaaaaaaaaaaaaaaaaaaaaaaaaaaaaaaaaaaaaaaaaaaaaaaaaaaaaaaaaaaaaaaaaaaaaaaaaaaaaaaaaaaaaaaaaaaaaaaaaaaaaaaaaaaaaaaaaaaaaaaaaaaaaaaaaaaaaaaaaaaaaaaaaaaaaaaaaaaaaaaaaaaaaaaaaaaaaaaaaaaaaaaaaaaaaaaaaaaaaaaaaaaaaaaaaaaaaaaaaaaaaaaaaaaaaaaaaaaaaaaaaaaaaaaaaaaaaaaaaaaaaaaaaaaaaaaaaaaaaaaaaaaaaaaaaaaaaaaaaaaaaaaaaaaaaaaaaaaaaaaaaaaaaaaaaaaaaaaaaaaaaaaaaaaaaaaaaaaaaaaaaaaaaaaaaaaaaaaaaaaaaaaaaaaaaaaaaaaaaaaaaaaaaaaaaaaaaaaaaaaaaaaaaaaaaaaaaaaaaaaaaaaaaaaaaaaaaaaaaaaaaaaaaaaaaaaaaaaaaaaaaaaaaaaaaaaaaaaaaaaaaaaaaaaaaaaaaaaaaaaaaaaaaaaaaaaaaaaaaaaaaaaaaaaaaaaaaaaaaaaaaaaaaaaaaaaaaaaaaaaaaaaaaaaaaaaaaaaaaaaaaaaaaaaaaaaaaaaaaaaaaaaaaaaaaaaaaaaaaaaaaaaaaaaaaaaaaaaaaaaaaaaaaaaaaaaaaaaaaaaaaaaaaaaaaaaaaaaaaaaaaaaaaaaaaaaaaaaaaaaaaaaaaaaaaaaaaaaaaaaaaaaaaaaaaaaaaaaaaaaaaaaaaaaaaaaaaaaaaaaaaaaaaaaaaaaaaaaaaaaaaaaaaaaaaaaaaaaaaaaaaaaaaaaaaaaaaaaaaaaaaaaaaaaaaaaaaaaaaaaaaaaaaaaaaaaaaaaaaaaaaaaaaaaaaaaaaaaaaaaaaaaaaaaaaaaaaaaaaaaaaaaaaaaaaaaaaaaaaaaaaaaaaaaaaaaaaaaaaaaaaaaaaaaaaaaaaaaaaaaaaaaaaaaaaaaaaaaaaaaaaaaaaaaaaaaaaaaaaaaaaaaaaaaaaaaaaaaaaaaaaaaaaaaaaaaaaaaaaaaaaaaaaaaaaaaaaaaaaaaaaaaaaaaaaaaaaaaaaaaaaaaaaaaaaaaaaaaaaaaaaaaaaaaaaaaaaaaaaaaaaaaaaaaaaaaaaaaaaaaaaaaaaaaaaaaaaaaaaaaaaaaaaaaaaaaaaaaaaaaaaaaaaaaaaaaaaaaaaaaaaaaaaaaaaaaaaaaaaaaaaaaaaaaaaaaaaaaaaaaaaaaaaaaaaaaaaaaaaaaaaaaaaaaaaaaaaaaaaaaaaaaaaaaaaaaaaaaaaaaaaaaaaaaaaaaaaaaaaaaaaaaaaaaaaaaaaaaaaaaaaaaaaaaaaaaaaaaaaaaaaaaaaaaaaaaaaaaaaaaaaaaaaaaaaaaaaaaaaaaaaaaaaaaaaaaaaaaaaaaaaaaaaaaaaaaaaaaaaaaaaaaaaaaaaaaaaaaaaaaaaaaaaaaaaaaaaaaaaaaaaaaaaaaaaaaaaaaaaaaaaaaaaaaaaaaaaaaaaaaaaaaaaaaaaaaaaaaaaaaaaaaaaaaaaaaaaaaaaaaaaaaaaaaaaaaaaaaaaaaaaaaaaaaaaaaaaaaaaaaaaaaaaaaaaaaaaaaaaaaaaaaaaaaaaaaaaaaaaaaaaaaaaaaaaaaaaaaaaaaaaaaaaaaaaaaaaaaaaaaaaaaaaaaaaaaaaaaaaaaaaaaaaaaaaaaaaaaaaaaaaaaaaaaaaaaaaaaaaaaaaaaaaaaaaaaaaaaaaaaaaaaaaaaaaaaaaaaaaaaaaaaaaaaaaaaaaaaaaaaaaaaaaaaaaaaaaaaaaaaaaaaaaaaaaaaaaaaaaaaaaaaaaaaaaaaaaaaaaaaaaaaaaaaaaaaaaaaaaaaaaaaaaaaaaaaaaaaaaaaaaaaaaaaaaaaaaaaaaaaaaaaaaaaaaaaaaaaaaaaaaaaaaaaaaaaaaaaaaaaaaaaaaaaaaaaaaaaaaaaaaaaaaaaaaaaaaaaaaaaaaaaaaaaaaaaaaaaaaaaaaaaaaaaaaaaaaaaaaaaaaaaaaaaaaaaaaaaaaaaaaaaaaaaaaaaaaaaaaaaaaaaaaaaaaaaaaaaaaaaaaaaaaaaaaaaaaaaaaaaaaaaaaaaaaaaaaaaaaaaaaaaaaaaaaaaaaaaaaaaaaaaaaaaaaaaaaaaaaaaaaaaaaaaaaaaaaaaaaaaaaaaaaaaaaaaaaaaaaaaaaaaaaaaaaaaaaaaaaaaaaaaaaaaaaaaaaaaaaaaaaaaaaaaaaaaaaaaaaaaaaaaaaaaaaaaaaaaaaaaaaaaaaaaaaaaaaaaaaaaaaaaaaaaaaaaaaaaaaaaaaaaaaaaaaaaaaaaaaaaaaaaaaaaaaaaaaaaaaaaaaaaaaaaaaaaaaaaaaaaaaaaaaaaaaaaaaaaaaaaaaaaaaaaaaaaaaaaaaaaaaaaaaaaaaaaaaaaaaaaaaaaaaaaaaaaaaaaaaaaaaaaaaaaaaaaaaaaaaaaaaaaaaaaaaaaaaaaaaaaaaaaaaaaaaaaaaaaaaaaaaaaaaaaaaaaaaaaaaaaaaaaaaaaaaaaaaaaaaaaaaaaaaaaaaaaaaaaaaaaaaaaaaaaaaaaaaaaaaaaaaaaaaaaaaaaaaaaaaaaaaaaaaaaaaaaaaaaaaaaaaaaaaaaaaaaaaaaaaaaaaaaaaaaaaaaaaaaaaaaaaaaaaaaaaaaaaaaaaaaaaaaaaaaaaaaaaaaaaaaaaaaaaaaaaaaaaaaaaaaaaaaaaaaaaaaaaaaaaaaaaaaaaaaaaaaaaaaaaaaaaaaaaaaaaaaaaaaaaaaaaaaaaaaaaaaaaaaaaaaaaaaaaaaaaaaaaaaaaaaaaaaaaaaaaaaaaaaaaaaaaaaaaaaaaaaaaaaaaaaaaaaaaaaaaaaaaaaaaaaaaaaaaaaaaaaaaaaaaaaaaaaaaaaaaaaaaaaaaaaaaaaaaaaaaaaaaaaaaaaaaaaaaaaaaaaaaaaaaaaaaaaaaaaaaaaaaaaaaaaaaaaaaaaaaaaaaaaaaaaaaaaaaaaaaaaaaaaaaaaaaaaaaaaaaaaaaaaaaaaaaaaaaaaaaaaaaaaaaaaaaaaaaaaaaaaaaaaaaaaaaaaaaaaaaaaaaaaaaaaaaaaaaaaaaaaaaaaaaaaaaaaaaaaaaaaaaaaaaaaaaaaaaaaaaaaaaaaaaaaaaaaaaaaaaaaaaaaaaaaaaaaaaaaaaaaaaaaaaaaaaaaaaaaaaaaaaaaaaaaaaaaaaaaaaaaaaaaaaaaaaaaaaaaaaaaaaaaaaaaaaaaaaaaaaaaaaaaaaaaaaaaaaaaaaaaaaaaaaaaaaaaaaaaaaaaaaaaaaaaaaaaaaaaaaaaaaaaaaaaaaaaaaaaaaaaaaaaaaaaaaaaaaaaaaaaaaaaaaaaaaaaaaaaaaaaaaaaaaaaaaaaaaaaaaaaaaaaaaaaaaaaaaaaaaaaaaaaaaaaaaaaaaaaaaaaaaaaaaaaaaaaaaaaaaaaaaaaaaaaaaaaaaaaaaaaaaaaaaaaaaaaaaaaaaaaaaaaaaaaaaaaaaaaaaaaaaaaaaaaaaaaaaaaaaaaaaaaaaaaaaaaaaaaaaaaaaaaaaaaaaaaaaaaaaaaaaaaaaaaaaaaaaaaaaaaaaaaaaaaaaaaaaaaaaaaaaaaaaaaaaaaaaaaaaaaaaaaaaaaaaaaaaaaaaaaaaaaaaaaaaaaaaaaaaaaaaaaaaaaaaaaaaaaaaaaaaaaaaaaaaaaaaaaaaaaaaaaaaaaaaaaaaaaaaaaaaaaaaaaaaaaaaaaaaaaaaaaaaaaaaaaaaaaaaaaaaaaaaaaaaaaaaaaaaaaaaaaaaaaaaaaaaaaaaaaaaaaaaaaaaaaaaaaaaaaaaaaaaaaaaaaaaaaaaaaaaaaaaaaaaaaaaaaaaaaaaaaaaaaaaaaaaaaaaaaaaaaaaaaaaaaaaaaaaaaaaaaaaaaaaaaaaaaaaaaaaaaaaaaaaaaaaaaaaaaaaaaaaaaaaaaaaaaaaaaaaaaaaaaaaaaaaaaaaaaaaaaaaaaaaaaaaaaaaaaaaaaaaaaaaaaaaaaaaaaaaaaaaaaaaaaaaaaaaaaaaaaaaaaaaaaaaaaaaaaaaaaaaaaaaaaaaaaaaaaaaaaaaaaaaaaaaaaaaaaaaaaaaaaaaaaaaaaaaaaaaaaaaaaaaaaaaaaaaaaaaaaaaaaaaaaaaaaaaaaaaaaaaaaaaaaaaaaaaaaaaaaaaaaaaaaaaaaaaaaaaaaaaaaaaaaaaaaaaaaaaaaaaaaaaaaaaaaaaaaaaaaaaaaaaaaaaaaaaaaaaaaaaaaaaaaaaaaaaaaaaaaaaaaaaaaaaaaaaaaaaaaaaaaaaaaaaaaaaaaaaaaaaaaaaaaaaaaaaaaaaaaaaaaaaaaaaaaaaaaaaaaaaaaaaaaaaaaaaaaaaaaaaaaaaaaaaaaaaaaaaaaaaaaaaaaaaaaaaaaaaaaaaaaaaaaaaaaaaaaaaaaaaaaaaaaaaaaaaaaaaaaaaaaaaaaaaaaaaaaaaaaaaaaaaaaaaaaaaaaaaaaaaaaaaaaaaaaaaaaaaaaaaaaaaaaaaaaaaaaaaaaaaaaaaaaaaaaaaaaaaaaaaaaaaaaaaaaaaaaaaaaaaaaaaaaaaaaaaaaaaaaaaaaaaaaaaaaaaaaaaaaaaaaaaaaaaaaaaaaaaaaaaaaaaaaaaaaaaaaaaaaaaaaaaaaaaaaaaaaaaaaaaaaaaaaaaaaaaaaaaaaaaaaaaaaaaaaaaaaaaaaaaaaaaaaaaaaaaaaaaaaaaaaaaaaaaaaaaaaaaaaaaaaaaaaaaaaaaaaaaaaaaaaaaaaaaaaaaaaaaaaaaaaaaaaaaaaaaaaaaaaaaaaaaaaaaaaaaaaaaaaaaaaaaaaaaaaaaaaaaaaaaaaaaaaaaaaaaaaaaaaaaaaaaaaaaaaaaaaaaaaaaaaaaaaaaaaaaaaaaaaaaaaaaaaaaaaaaaaaaaaaaaaaaaaaaaaaaaaaaaaaaaaaaaaaaaaaaaaaaaaaaaaaaaaaaaaaaaaaaaaaaaaaaaaaaaaaaaaaaaaaaaaaaaaaaaaaaaaaaaaaaaaaaaaaaaaaaaaaaaaaaaaaaaaaaaaaaaaaaaaaaaaaaaaaaaaaaaaaaaaaaaaaaaaaaaaaaaaaaaaaaaaaaaaaaaaaaaaaaaaaaaaaaaaaaaaaaaaaaaaaaaaaaaaaaaaaaaaaaaaaaaaaaaaaaaaaaaaaaaaaaaaaaaaaaaaaaaaaaaaaaaaaaaaaaaaaaaaaaaaaaaaaaaaaaaaaaaaaaaaaaaaaaaaaaaaaaaaaaaaaaaaaaaaaaaaaaaaaaaaaaaaaaaaaaaaaaaaaaaaaaaaaaaaaaaaaaaaaaaaaaaaaaaaaaaaaaaaaaaaaaaaaaaaaaaaaaaaaaaaaaaaaaaaaaaaaaaaaaaaaaaaaaaaaaaaaaaaaaaaaaaaaaaaaaaaaaaaaaaaaaaaaaaaaaaaaaaaaaaaaaaaaaaaaaaaaaaaaaaaaaaaaaaaaaaaaaaaaaaaaaaaaaaaaaaaaaaaaaaaaaaaaaaaaaaaaaaaaaaaaaaaaaaaaaaaaaaaaaaaaaaaaaaaaaaaaaaaaaaaaaaaaaaaaaaaaaaaaaaaaaaaaaaaaaaaaaaaaaaaaaaaaaaaaaaaaaaaaaaaaaaaaaaaaaaaaaaaaaaaaaaaaaaaaaaaaaaaaaaaaaaaaaaaaaaaaaaaaaaaaaaaaaaaaaaaaaaaaaaaaaaaaaaaaaaaaaaaaaaaaaaaaaaaaaaaaaaaaaaaaaaaaaaaaaaaaaaaaaaaaaaaaaaaaaaaaaaaaaaaaaaaaaaaaaaaaaaaaaaaaaaaaaaaaaaaaaaaaaaaaaaaaaaaaaaaaaaaaaaaaaaaaaaaaaaaaaaaaaaaaaaaaaaaaaaaaaaaaaaaaaaaaaaaaaaaaaaaaaaaaaaaaaaaaaaaaaaaaaaaaaaaaaaaaaaaaaaaaaaaaaaaaaaaaaaaaaaaaaaaaaaaaaaaaaaaaaaaaaaaaaaaaaaaaaaaaaaaaaaaaaaaaaaaaaaaaaaaaaaaaaaaaaaaaaaaaaaaaaaaaaaaaaaaaaaaaaaaaaaaaaaaaaaaaaaaaaaaaaaaaaaaaaaaaaaaaaaaaaaaaaaaaaaaaaaaaaaaaaaaaaaaaaaaaaaaaaaaaaaaaaaaaaaaaaaaaaaaaaaaaaaaaaaaaaaaaaaaaaaaaaaaaaaaaaaaaaaaaaaaaaaaaaaaaaaaaaaaaaaaaaaaaaaaaaaaaaaaaaaaaaaaaaaaaaaaaaaaaaaaaaaaaaaaaaaaaaaaaaaaaaaaaaaaaaaaaaaaaaaaaaaaaaaaaaaaaaaaaaaaaaaaaaaaaaaaaaaaaaaaaaaaaaaaaaaaaaaaaaaaaaaaaaaaaaaaaaaaaaaaaaaaaaaaaaaaaaaaaaaaaaaaaaaaaaaaaaaaaaaaaaaaaaaaaaaaaaaaaaaaaaaaaaaaaaaaaaaaaaaaaaaaaaaaaaaaaaaaaaaaaaaaaaaaaaaaaaaaaaaaaaaaaaaaaaaaaaaaaaaaaaaaaaaaaaaaaaaaaaaaaaaaaaaaaaaaaaaaaaaaaaaaaaaaaaaaaaaaaaaaaaaaaaaaaaaaaaaaaaaaaaaaaaaaaaaaaaaaaaaaaaaaaaaaaaaaaaaaaaaaaaaaaaaaaaaaaaaaaaaaaaaaaaaaaaaaaaaaaaaaaaaaaaaaaaaaaaaaaaaaaaaaaaaaaaaaaaaaaaaaaaaaaaaaaaaaaaaaaaaaaaaaaaaaaaaaaaaaaaaaaaaaaaaaaaaaaaaaaaaaaaaaaaaaaaaaaaaaaaaaaaaaaaaaaaaaaaaaaaaaaaaaaaaaaaaaaaaaaaaaaaaaaaaaaaaaaaaaaaaaaaaaaaaaaaaaaaaaaaaaaaaaaaaaaaaaaaaaaaaaaaaaaaaaaaaaaaaaaaaaaaaaaaaaaaaaaaaaaaaaaaaaaaaaaaaaaaaaaaaaaaaaaaaaaaaaaaaaaaaaaaaaaaaaaaaaaaaaaaaaaaaaaaaaaaaaaaaaaaaaaaaaaaaaaaaaaaaaaaaaaaaaaaaaaaaaaaaaaaaaaaaaaaaaaaaaaaaaaaaaaaaaaaaaaaaaaaaaaaaaaaaaaaaaaaaaaaaaaaaaaaaaaaaaaaaaaaaaaaaaaaaaaaaaaaaaaaaaaaaaaaaaaaaaaaaaaaaaaaaaaaaaaaaaaaaaaaaaaaaaaaaaaaaaaaaaaaaaaaaaaaaaaaaaaaaaaaaaaaaaaaaaaaaaaaaaaaaaaaaaaaaaaaaaaaaaaaaaaaaaaaaaaaaaaaaaaaaaaaaaaaaaaaaaaaaaaaaaaaaaaaaaaaaaaaaaaaaaaaaaaaaaaaaaaaaaaaaaaaaaaaaaaaaaaaaaaaaaaaaaaaaaaaaaaaaaaaaaaaaaaaaaaaaaaaaaaaaaaaaaaaaaaaaaaaaaaaaaaaaaaaaaaaaaaaaaaaaaaaaaaaaaaaaaaaaaaaaaaaaaaaaaaaaaaaaaaaaaaaaaaaaaaaaaaaaaaaaaaaaaaaaaaaaaaaaaaaaaaaaaaaaaaaaaaaaaaaaaaaaaaaaaaaaaaaaaaaaaaaaaaaaaaaaaaaaaaaaaaaaaaaaaaaaaaaaaaaaaaaaaaaaaaaaaaaaaaaaaaaaaaaaaaaaaaaaaaaaaaaaaaaaaaaaaaaaaaaaaaaaaaaaaaaaaaaaaaaaaaaaaaaaaaaaaaaaaaaaaaaaaaaaaaaaaaaaaaaaaaaaaaaaaaaaaaaaaaaaaaaaaaaaaaaaaaaaaaaaaaaaaaaaaaaaaaaaaaaaaaaaaaaaaaaaaaaaaaaaaaaaaaaaaaaaaaaaaaaaaaaaaaaaaaaaaaaaaaaaaaaaaaaaaaaaaaaaaaaaaaaaaaaaaaaaaaaaaaaaaaaaaaaaaaaaaaaaaaaaaaaaaaaaaaaaaaaaaaaaaaaaaaaaaaaaaaaaaaaaaaaaaaaaaaaaaaaaaaaaaaaaaaaaaaaaaaaaaaaaaaaaaaaaaaaaaaaaaaaaaaaaaaaaaaaaaaaaaaaaaaaaaaaaaaaaaaaaaaaaaaaaaaaaaaaaaaaaaaaaaaaaaaaaaaaaaaaaaaaaaaaaaaaaaaaaaaaaaaaaaaaaaaaaaaaaaaaaaaaaaaaaaaaaaaaaaaaaaaaaaaaaaaaaaaaaaaaaaaaaaaaaaaaaaaaaaaaaaaaaaaaaaaaaaaaaaaaaaaaaaaaaaaaaaaaaaaaaaaaaaaaaaaaaaaaaaaaaaaaaaaaaaaaaaaaaaaaaaaaaaaaaaaaaaaaaaaaaaaaaaaaaaaaaaaaaaaaaaaaaaaaaaaaaaaaaaaaaaaaaaaaaaaaaaaaaaaaaaaaaaaaaaaaaaaaaaaaaaaaaaaaaaaaaaaaaaaaaaaaaaaaaaaaaaaaaaaaaaaaaaaaaaaaaaaaaaaaaaaaaaaaaaaaaaaaaaaaaaaaaaaaaaaaaaaaaaaaaaaaaaaaaaaaaaaaaaaaaaaaaaaaaaaaaaaaaaaaaaaaaaaaaaaaaaaaaaaaaaaaaaaaaaaaaaaaaaaaaaaaaaaaaaaaaaaaaaaaaaaaaaaaaaaaaaaaaaaaaaaaaaaaaaaaaaaaaaaaaaaaaaaaaaaaaaaaaaaaaaaaaaaaaaaaaaaaaaaaaaaaaaaaaaaaaaaaaaaaaaaaaaaaaaaaaaaaaaaaaaaaaaaaaaaaaaaaaaaaaaaaaaaaaaaaaaaaaaaaaaaaaaaaaaaaaaaaaaaaaaaaaaaaaaaaaaaaaaaaaaaaaaaaaaaaaaaaaaaaaaaaaaaaaaaaaaaaaaaaaaaaaaaaaaaaaaaaaaaaaaaaaaaaaaaaaaaaaaaaaaaaaaaaaaaaaaaaaaaaaaaaaaaaaaaaaaaaaaaaaaaaaaaaaaaaaaaaaaaaaaaaaaaaaaaaaaaaaaaaaaaaaaaaaaaaaaaaaaaaaaaaaaaaaaaaaaaaaaaaaaaaaaaaaaaaaaaaaaaaaaaaaaaaaaaaaaaaaaaaaaaaaaaaaaaaaaaaaaaaaaaaaaaaaaaaaaaaaaaaaaaaaaaaaaaaaaaaaaaaaaaaaaaaaaaaaaaaaaaaaaaaaaaaaaaaaaaaaaaaaaaaaaaaaaaaaaaaaaaaaaaaaaaaaaaaaaaaaaaaaaaaaaaaaaaaaaaaaaaaaaaaaaaaaaaaaaaaaaaaaaaaaaaaaaaaaaaaaaaaaaaaaaaaaaaaaaaaaaaaaaaaaaaaaaaaaaaaaaaaaaaaaaaaaaaaaaaaaaaaaaaaaaaaaaaaaaaaaaaaaaaaaaaaaaaaaaaaaaaaaaaaaaaaaaaaaaaaaaaaaaaaaaaaaaaaaaaaaaaaaaaaaaaaaaaaaaaaaaaaaaaaaaaaaaaaaaaaaaaaaaaaaaaaaaaaaaaaaaaaaaaaaaaaaaaaaaaaaaaaaaaaaaaaaaaaaaaaaaaaaaaaaaaaaaaaaaaaaaaaaaaaaaaaaaaaaaaaaaaaaaaaaaaaaaaaaaaaaaaaaaaaaaaaaaaaaaaaaaaaaaaaaaaaaaaaaaaaaaaaaaaaaaaaaaaaaaaaaaaaaaaaaaaaaaaaaaaaaaaaaaaaaaaaaaaaaaaaaaaaaaaaaaaaaaaaaaaaaaaaaaaaaaaaaaaaaaaaaaaaaaaaaaaaaaaaaaaaaaaaaaaaaaaaaaaaaaaaaaaaaaaaaaaaaaaaaaaaaaaaaaaaaaaaaaaaaaaaaaaaaaaaaaaaaaaaaaaaaaaaaaaaaaaaaaaaaaaaaaaaaaaaaaaaaaaaaaaaaaaaaaaaaaaaaaaaaaaaaaaaaaaaaaaaaaaaaaaaaaaaaaaaaaaaaaaaaaaaaaaaaaaaaaaaaaaaaaaaaaaaaaaaaaaaaaaaaaaaaaaaaaaaaaaaaaaaaaaaaaaaaaaaaaaaaaaaaaaaaaaaaaaaaaaaaaaaaaaaaaaaaaaaaaaaaaaaaaaaaaaaaaaaaaaaaaaaaaaaaaaaaaaaaaaaaaaaaaaaaaaaaaaaaaaaaaaaaaaaaaaaaaaaaaaaaaaaaaaaaaaaaaaaaaaaaaaaaaaaaaaaaaaaaaaaaaaaaaaaaaaaaaaaaaaaaaaaaaaaaaaaaaaaaaaaaaaaaaaaaaaaaaaaaaaaaaaaaaaaaaaaaaaaaaaaaaaaaaaaaaaaaaaaaaaaaaaaaaaaaaaaaaaaaaaaaaaaaaaaaaaaaaaaaaaaaaaaaaaaaaaaaaaaaaaaaaaaaaaaaaaaaaaaaaaaaaaaaaaaaaaaaaaaaaaaaaaaaaaaaaaaaaaaaaaaaaaaaaaaaaaaaaaaaaaaaaaaaaaaaaaaaaaaaaaaaaaaaaaaaaaaaaaaaaaaaaaaaaaaaaaaaaaaaaaaaaaaaaaaaaaaaaaaaaaaaaaaaaaaaaaaaaaaaaaaaaaaaaaaaaaaaaaaaaaaaaaaaaaaaaaaaaaaaaaaaaaaaaaaaaaaaaaaaaaaaaaaaaaaaaaaaaaaaaaaaaaaaaaaaaaaaaaaaaaaaaaaaaaaaaaaaaaaaaaaaaaaaaaaaaaaaaaaaaaaaaaaaaaaaaaaaaaaaaaaaaaaaaaaaaaaaaaaaaaaaaaaaaaaaaaaaaaaaaaaaaaaaaaaaaaaaaaaaaaaaaaaaaaaaaaaaaaaaaaaaaaaaaaaaaaaaaaaaaaaaaaaaaaaaaaaaaaaaaaaaaaaaaaaaaaaaaaaaaaaaaaaaaaaaaaaaaaaaaaaaaaaaaaaaaaaaaaaaaaaaaaaaaaaaaaaaaaaaaaaaaaaaaaaaaaaaaaaaaaaaaaaaaaaaaaaaaaaaaaaaaaaaaaaaaaaaaaaaaaaaaaaaaaaaaaaaaaaaaaaaaaaaaaaaaaaaaaaaaaaaaaaaaaaaaaaaaaaaaaaaaaaaaaaaaaaaaaaaaaaaaaaaaaaaaaaaaaaaaaaaaaaaaaaaaaaaaaaaaaaaaaaaaaaaaaaaaaaaaaaaaaaaaaaaaaaaaaaaaaaaaaaaaaaaaaaaaaaaaaaaaaaaaaaaaaaaaaaaaaaaaaaaaaaaaaaaaaaaaaaaaaaaaaaaaaaaaaaaaaaaaaaaaaaaaaaaaaaaaaaaaaaaaaaaaaaaaaaaaaaaaaaaaaaaaaaaaaaaaaaaaaaaaaaaaaaaaaaaaaaaaaaaaaaaaaaaaaaaaaaaaaaaaaaaaaaaaaaaaaaaaaaaaaaaaaaaaaaaaaaaaaaaaaaaaaaaaaaaaaaaaaaaaaaaaaaaaaaaaaaaaaaaaaaaaaaaaaaaaaaaaaaaaaaaaaaaaaaaaaaaaaaaaaaaaaaaaaaaaaaaaaaaaaaaaaaaaaaaaaaaaaaaaaaaaaaaaaaaaaaaaaaaaaaaaaaaaaaaaaaaaaaaaaaaaaaaaaaaaaaaaaaaaaaaaaaaaaaaaaaaaaaaaaaaaaaaaaaaaaaaaaaaaaaaaaaaaaaaaaaaaaaaaaaaaaaaaaaaaaaaaaaaaaaaaaaaaaaaaaaaaaaaaaaaaaaaaaaaaaaaaaaaaaaaaaaaaaaaaaaaaaaaaaaaaaaaaaaaaaaaaaaaaaaaaaaaaaaaaaaaaaaaaaaaaaaaaaaaaaaaaaaaaaaaaaaaaaaaaaaaaaaaaaaaaaaaaaaaaaaaaaaaaaaaaaaaaaaaaaaaaaaaaaaaaaaaaaaaaaaaaaaaaaaaaaaaaaaaaaaaaaaaaaaaaaaaaaaaaaaaaaaaaaaaaaaaaaaaaaaaaaaaaaaaaaaaaaaaaaaaaaaaaaaaaaaaaaaaaaaaaaaaaaaaaaaaaaaaaaaaaaaaaaaaaaaaaaaaaaaaaaaaaaaaaaaaaaaaaaaaaaaaaaaaaaaaaaaaaaaaaaaaaaaaaaaaaaaaaaaaaaaaaaaaaaaaaaaaaaaaaaaaaaaaaaaaaaaaaaaaaaaaaaaaaaaaaaaaaaaaaaaaaaaaaaaaaaaaaaaaaaaaaaaaaaaaaaaaaaaaaaaaaaaaaaaaaaaaaaaaaaaaaaaaaaaaaaaaaaaaaaaaaaaaaaaaaaaaaaaaaaaaaaaaaaaaaaaaaaaaaaaaaaaaaaaaaaaaaaaaaaaaaaaaaaaaaaaaaaaaaaaaaaaaaaaaaaaaaaaaaaaaaaaaaaaaaaaaaaaaaaaaaaaaaaaaaaaaaaaaaaaaaaaaaaaaaaaaaaaaaaaaaaaaaaaaaaaaaaaaaaaaaaaaaaaaaaaaaaaaaaaaaaaaaaaaaaaaaaaaaaaaaaaaaaaaaaaaaaaaaaaaaaaaaaaaaaaaaaaaaaaaaaaaaaaaaaaaaaaaaaaaaaaaaaaaaaaaaaaaaaaaaaaaaaaaaaaaaaaaaaaaaaaaaaaaaaaaaaaaaaaaaaaaaaaaaaaaaaaaaaaaaaaaaaaaaaaaaaaaaaaaaaaaaaaaaaaaaaaaaaaaaaaaaaaaaaaaaaaaaaaaaaaaaaaaaaaaaaaaaaaaaaaaaaaaaaaaaaaaaaaaaaaaaaaaaaaaaaaaaaaaaaaaaaaaaaaaaaaaaaaaaaaaaaaaaaaaaaaaaaaaaaaaaaaaaaaaaaaaaaaaaaaaaaaaaaaaaaaaaaaaaaaaaaaaaaaaaaaaaaaaaaaaaaaaaaaaaaaaaaaaaaaaaaaaaaaaaaaaaaaaaaaaaaaaaaaaaaaaaaaaaaaaaaaaaaaaaaaaaaaaaaaaaaaaaaaaaaaaaaaaaaaaaaaaaaaaaaaaaaaaaaaaaaaaaaaaaaaaaaaaaaaaaaaaaaaaaaaaaaaaaaaaaaaaaaaaaaaaaaaaaaaaaaaaaaaaaaaaaaaaaaaaaaaaaaaaaaaaaaaaaaaaaaaaaaaaaaaaaaaaaaaaaaaaaaaaaaaaaaaaaaaaaaaaaaaaaaaaaaaaaaaaaaaaaaaaaaaaaaaaaaaaaaaaaaaaaaaaaaaaaaaaaaaaaaaaaaaaaaaaaaaaaaaaaaaaaaaaaaaaaaaaaaaaaaaaaaaaaaaaaaaaaaaaaaaaaaaaaaaaaaaaaaaaaaaaaaaaaaaaaaaaaaaaaaaaaaaaaaaaaaaaaaaaaaaaaaaaaaaaaaaaaaaaaaaaaaaaaaaaaaaaaaaaaaaaaaaaaaaaaaaaaaaaaaaaaaaaaaaaaaaaaaaaaaaaaaaaaaaaaaaaaaaaaaaaaaaaaaaaaaaaaaaaaaaaaaaaaaaaaaaaaaaaaaaaaaaaaaaaaaaaaaaaaaaaaaaaaaaaaaaaaaaaaaaaaaaaaaaaaaaaaaaaaaaaaaaaaaaaaaaaaaaaaaaaaaaaaaaaaaaaaaaaaaaaaaaaaaaaaaaaaaaaaaaaaaaaaaaaaaaaaaaaaaaaaaaaaaaaaaaaaaaaaaaaaaaaaaaaaaaaaaaaaaaaaaaaaaaaaaaaaaaaaaaaaaaaaaaaaaaaaaaaaaaaaaaaaaaaaaaaaaaaaaaaaaaaaaaaaaaaaaaaaaaaaaaaaaaaaaaaaaaaaaaaaaaaaaaaaaaaaaaaaaaaaaaaaaaaaaaaaaaaaaaaaaaaaaaaaaaaaaaaaaaaaaaaaaaaaaaaaaaaaaaaaaaaaaaaaaaaaaaaaaaaaaaaaaaaaaaaaaaaaaaaaaaaaaaaaaaaaaaaaaaaaaaaaaaaaaaaaaaaaaaaaaaaaaaaaaaaaaaaaaaaaaaaaaaaaaaaaaaaaaaaaaaaaaaaaaaaaaaaaaaaaaaaaaaaaaaaaaaaaaaaaaaaaaaaaaaaaaaaaaaaaaaaaaaaaaaaaaaaaaaaaaaaaaaaaaaaaaaaaaaaaaaaaaaaaaaaaaaaaaaaaaaaaaaaaaaaaaaaaaaaaaaaaaaaaaaaaaaaaaaaaaaaaaaaaaaaaaaaaaaaaaaaaaaaaaaaaaaaaaaaaaaaaaaaaaaaaaaaaaaaaaaaaaaaaaaaaaaaaaaaaaaaaaaaaaaaaaaaaaaaaaaaaaaaaaaaaaaaaaaaaaaaaaaaaaaaaaaaaaaaaaaaaaaaaaaaaaaaaaaaaaaaaaaaaaaaaaaaaaaaaaaaaaaaaaaaaaaaaaaaaaaaaaaaaaaaaaaaaaaaaaaaaaaaaaaaaaaaaaaaaaaaaaaaaaaaaaaaaaaaaaaaaaaaaaaaaaaaaaaaaaaaaaaaaaaaaaaaaaaaaaaaaaaaaaaaaaaaaaaaaaaaaaaaaaaaaaaaaaaaaaaaaaaaaaaaaaaaaaaaaaaaaaaaaaaaaaaaaaaaaaaaaaaaaaaaaaaaaaaaaaaaaaaaaaaaaaaaaaaaaaaaaaaaaaaaaaaaaaaaaaaaaaaaaaaaaaaaaaaaaaaaaaaaaaaaaaaaaaaaaaaaaaaaaaaaaaaaaaaaaaaaaaaaaaaaaaaaaaaaaaaaaaaaaaaaaaaaaaaaaaaaaaaaaaaaaaaaaaaaaaaaaaaaaaaaaaaaaaaaaaaaaaaaaaaaaaaaaaaaaaaaaaaaaaaaaaaaaaaaaaaaaaaaaaaaaaaaaaaaaaaaaaaaaaaaaaaaaaaaaaaaaaaaaaaaaaaaaaaaaaaaaaaaaaaaaaaaaaaaaaaaaaaaaaaaaaaaaaaaaaaaaaaaaaaaaaaaaaaaaaaaaaaaaaaaaaaaaaaaaaaaaaaaaaaaaaaaaaaaaaaaaaaaaaaaaaaaaaaaaaaaaaaaaaaaaaaaaaaaaaaaaaaaaaaaaaaaaaaaaaaaaaaaaaaaaaaaaaaaaaaaaaaaaaaaaaaaaaaaaaaaaaaaaaaaaaaaaaaaaaaaaaaaaaaaaaaaaaaaaaaaaaaaaaaaaaaaaaaaaaaaaaaaaaaaaaaaaaaaaaaaaaaaaaaaaaaaaaaaaaaaaaaaaaaaaaaaaaaaaaaaaaaaaaaaaaaaaaaaaaaaaaaaaaaaaaaaaaaaaaaaaaaaaaaaaaaaaaaaaaaaaaaaaaaaaaaaaaaaaaaaaaaaaaaaaaaaaaaaaaaaaaaaaaaaaaaaaaaaaaaaaaaaaaaaaaaaaaaaaaaaaaaaaaaaaaaaaaaaaaaaaaaaaaaaaaaaaaaaaaaaaaaaaaaaaaaaaaaaaaaaaaaaaaaaaaaaaaaaaaaaaaaaaaaaaaaaaaaaaaaaaaaaaaaaaaaaaaaaaaaaaaaaaaaaaaaaaaaaaaaaaaaaaaaaaaaaaaaaaaaaaaaaaaaaaaaaaaaaaaaaaaaaaaaaaaaaaaaaaaaaaaaaaaaaaaaaaaaaaaaaaaaaaaaaaaaaaaaaaaaaaaaaaaaaaaaaaaaaaaaaaaaaaaaaaaaaaaaaaaaaaaaaaaaaaaaaaaaaaaaaaaaaaaaaaaaaaaaaaaaaaaaaaaaaaaaaaaaaaaaaaaaaaaaaaaaaaaaaaaaaaaaaaaaaaaaaaaaaaaaaaaaaaaaaaaaaaaaaaaaaaaaaaaaaaaaaaaaaaaaaaaaaaaaaaaaaaaaaaaaaaaaaaaaaaaaaaaaaaaaaaaaaaaaaaaaaaaaaaaaaaaaaaaaaaaaaaaaaaaaaaaaaaaaaaaaaaaaaaaaaaaaaaaaaaaaaaaaaaaaaaaaaaaaaaaaaaaaaaaaaaaaaaaaaaaaaaaaaaaaaaaaaaaaaaaaaaaaaaaaaaaaaaaaaaaaaaaaaaaaaaaaaaaaaaaaaaaaaaaaaaaaaaaaaaaaaaaaaaaaaaaaaaaaaaaaaaaaaaaaaaaaaaaaaaaaaaaaaaaaaaaaaaaaaaaaaaaaaaaaaaaaaaaaaaaaaaaaaaaaaaaaaaaaaaaaaaaaaaaaaaaaaaaaaaaaaaaaaaaaaaaaaaaaaaaaaaaaaaaaaaaaaaaaaaaaaaaaaaaaaaaaaaaaaaaaaaaaaaaaaaaaaaaaaaaaaaaaaaaaaaaaaaaaaaaaaaaaaaaaaaaaaaaaaaaaaaaaaaaaaaaaaaaaaaaaaaaaaaaaaaaaaaaaaaaaaaaaaaaaaaaaaaaaaaaaaaaaaaaaaaaaaaaaaaaaaaaaaaaaaaaaaaaaaaaaaaaaaaaaaaaaaaaaaaaaaaaaaaaaaaaaaaaaaaaaaaaaaaaaaaaaaaaaaaaaaaaaaaaaaaaaaaaaaaaaaaaaaaaaaaaaaaaaaaaaaaaaaaaaaaaaaaaaaaaaaaaaaaaaaaaaaaaaaaaaaaaaaaaaaaaaaaaaaaaaaaaaaaaaaaaaaaaaaaaaaaaaaaaaaaaaaaaaaaaaaaaaaaaaaaaaaaaaaaaaaaaaaaaaaaaaaaaaaaaaaaaaaaaaaaaaaaaaaaaaaaaaaaaaaaaaaaaaaaaaaaaaaaaaaaaaaaaaaaaaaaaaaaaaaaaaaaaaaaaaaaaaaaaaaaaaaaaaaaaaaaaaaaaaaaaaaaaaaaaaaaaaaaaaaaaaaaaaaaaaaaaaaaaaaaaaaaaaaaaaaaaaaaaaaaaaaaaaaaaaaaaaaaaaaaaaaaaaaaaaaaaaaaaaaaaaaaaaaaaaaaaaaaaaaaaaaaaaaaaaaaaaaaaaaaaaaaaaaaaaaaaaaaaaaaaaaaaaaaaaaaaaaaaaaaaaaaaaaaaaaaaaaaaaaaaaaaaaaaaaaaaaaaaaaaaaaaaaaaaaaaaaaaaaaaaaaaaaaaaaaaaaaaaaaaaaaaaaaaaaaaaaaaaaaaaaaaaaaaaaaaaaaaaaaaaaaaaaaaaaaaaaaaaaaaaaaaaaaaaaaaaaaaaaaaaaaaaaaaaaaaaaaaaaaaaaaaaaaaaaaaaaaaaaaaaaaaaaaaaaaaaaaaaaaaaaaaaaaaaaaaaaaaaaaaaaaaaaaaaaaaaaaaaaaaaaaaaaaaaaaaaaaaaaaaaaaaaaaaaaaaaaaaaaaaaaaaaaaaaaaaaaaaaaaaaaaaaaaaaaaaaaaaaaaaaaaaaaaaaaaaaaaaaaaaaaaaaaaaaaaaaaaaaaaaaaaaaaaaaaaaaaaaaaaaaaaaaaaaaaaaaaaaaaaaaaaaaaaaaaaaaaaaaaaaaaaaaaaaaaaaaaaaaaaaaaaaaaaaaaaaaaaaaaaaaaaaaaaaaaaaaaaaaaaaaaaaaaaaaaaaaaaaaaaaaaaaaaaaaaaaaaaaaaaaaaaaaaaaaaaaaaaaaaaaaaaaaaaaaaaaaaaaaaaaaaaaaaaaaaaaaaaaaaaaaaaaaaaaaaaaaaaaaaaaaaaaaaaaaaaaaaaaaaaaaaaaaaaaaaaaaaaaaaaaaaaaaaaaaaaaaaaaaaaaaaaaaaaaaaaaaaaaaaaaaaaaaaaaaaaaaaaaaaaaaaaaaaaaaaaaaaaaaaaaaaaaaaaaaaaaaaaaaaaaaaaaaaaaaaaaaaaaaaaaaaaaaaaaaaaaaaaaaaaaaaaaaaaaaaaaaaaaaaaaaaaaaaaaaaaaaaaaaaaaaaaaaaaaaaaaaaaaaaaaaaaaaaaaaaaaaaaaaaaaaaaaaaaaaaaaaaaaaaaaaaaaaaaaaaaaaaaaaaaaaaaaaaaaaaaaaaaaaaaaaaaaaaaaaaaaaaaaaaaaaaaaaaaaaaaaaaaaaaaaaaaaaaaaaaaaaaaaaaaaaaaaaaaaaaaaaaaaaaaaaaaaaaaaaaaaaaaaaaaaaaaaaaaaaaaaaaaaaaaaaaaaaaaaaaaaaaaaaaaaaaaaaaaaaaaaaaaaaaaaaaaaaaaaaaaaaaaaaaaaaaaaaaaaaaaaaaaaaaaaaaaaaaaaaaaaaaaaaaaaaaaaaaaaaaaaaaaaaaaaaaaaaaaaaaaaaaaaaaaaaaaaaaaaaaaaaaaaaaaaaaaaaaaaaaaaaaaaaaaaaaaaaaaaaaaaaaaaaaaaaaaaaaaaaaaaaaaaaaaaaaaaaaaaaaaaaaaaaaaaaaaaaaaaaaaaaaaaaaaaaaaaaaaaaaaaaaaaaaaaaaaaaaaaaaaaaaaaaaaaaaaaaaaaaaaaaaaaaaaaaaaaaaaaaaaaaaaaaaaaaaaaaaaaaaaaaaaaaaaaaaaaaaaaaaaaaaaaaaaaaaaaaaaaaaaaaaaaaaaaaaaaaaaaaaaaaaaaaaaaaaaaaaaaaaaaaaaaaaaaaaaaaaaaaaaaaaaaaaaaaaaaaaaaaaaaaaaaaaaaaaaaaaaaaaaaaaaaaaaaaaaaaaaaaaaaaaaaaaaaaaaaaaaaaaaaaaaaaaaaaaaaaaaaaaaaaaaaaaaaaaaaaaaaaaaaaaaaaaaaaaaaaaaaaaaaaaaaaaaaaaaaaaaaaaaaaaaaaaaaaaaaaaaaaaaaaaaaaaaaaaaaaaaaaaaaaaaaaaaaaaaaaaaaaaaaaaaaaaaaaaaaaaaaaaaaaaaaaaaaaaaaaaaaaaaaaaaaaaaaaaaaaaaaaaaaaaaaaaaaaaaaaaaaaaaaaaaaaaaaaaaaaaaaaaaaaaaaaaaaaaaaaaaaaaaaaaaaaaaaaaaaaaaaaaaaaaaaaaaaaaaaaaaaaaaaaaaaaaaaaaaaaaaaaaaaaaaaaaaaaaaaaaaaaaaaaaaaaaaaaaaaaaaaaaaaaaaaaaaaaaaaaaaaaaaaaaaaaaaaaaaaaaaaaaaaaaaaaaaaaaaaaaaaaaaaaaaaaaaaaaaaaaaaaaaaaaaaaaaaaaaaaaaaaaaaaaaaaaaaaaaaaaaaaaaaaaaaaaaaaaaaaaaaaaaaaaaaaaaaaaaaaaaaaaaaaaaaaaaaaaaaaaaaaaaaaaaaaaaaaaaaaaaaaaaaaaaaaaaaaaaaaaaaaaaaaaaaaaaaaaaaaaaaaaaaaaaaaaaaaaaaaaaaaaaaaaaaaaaaaaaaaaaaaaaaaaaaaaaaaaaaaaaaaaaaaaaaaaaaaaaaaaaaaaaaaaaaaaaaaaaaaaaaaaaaaaaaaaaaaaaaaaaaaaaaaaaaaaaaaaaaaaaaaaaaaaaaaaaaaaaaaaaaaaaaaaaaaaaaaaaaaaaaaaaaaaaaaaaaaaaaaaaaaaaaaaaaaaaaaaaaaaaaaaaaaaaaaaaaaaaaaaaaaaaaaaaaaaaaaaaaaaaaaaaaaaaaaaaaaaaaaaaaaaaaaaaaaaaaaaaaaaaaaaaaaaaaaaaaaaaaaaaaaaaaaaaaaaaaaaaaaaaaaaaaaaaaaaaaaaaaaaaaaaaaaaaaaaaaaaaaaaaaaaaaaaaaaaaaaaaaaaaaaaaaaaaaaaaaaaaaaaaaaaaaaaaaaaaaaaaaaaaaaaaaaaaaaaaaaaaaaaaaaaaaaaaaaaaaaaaaaaaaaaaaaaaaaaaaaaaaaaaaaaaaaaaaaaaaaaaaaaaaaaaaaaaaaaaaaaaaaaaaaaaaaaaaaaaaaaaaaaaaaaaaaaaaaaaaaaaaaaaaaaaaaaaaaaaaaaaaaaaaaaaaaaaaaaaaaaaaaaaaaaaaaaaaaaaaaaaaaaaaaaaaaaaaaaaaaaaaaaaaaaaaaaaaaaaaaaaaaaaaaaaaaaaaaaaaaaaaaaaaaaaaaaaaaaaaaaaaaaaaaaaaaaaaaaaaaaaaaaaaaaaaaaaaaaaaaaaaaaaaaaaaaaaaaaaaaaaaaaaaaaaaaaaaaaaaaaaaaaaaaaaaaaaaaaaaaaaaaaaaaaaaaaaaaaaaaaaaaaaaaaaaaaaaaaaaaaaaaaaaaaaaaaaaaaaaaaaaaaaaaaaaaaaaaaaaaaaaaaaaaaaaaaaaaaaaaaaaaaaaaaaaaaaaaaaaaaaaaaaaaaaaaaaaaaaaaaaaaaaaaaaaaaaaaaaaaaaaaaaaaaaaaaaaaaaaaaaaaaaaaaaaaaaaaaaaaaaaaaaaaaaaaaaaaaaaaaaaaaaaaaaaaaaaaaaaaaaaaaaaaaaaaaaaaaaaaaaaaaaaaaaaaaaaaaaaaaaaaaaaaaaaaaaaaaaaaaaaaaaaaaaaaaaaaaaaaaaaaaaaaaaaaaaaaaaaaaaaaaaaaaaaaaaaaaaaaaaaaaaaaaaaaaaaaaaaaaaaaaaaaaaaaaaaaaaaaaaaaaaaaaaaaaaaaaaaaaaaaaaaaaaaaaaaaaaaaaaaaaaaaaaaaaaaaaaaaaaaaaaaaaaaaaaaaaaaaaaaaaaaaaaaaaaaaaaaaaaaaaaaaaaaaaaaaaaaaaaaaaaaaaaaaaaaaaaaaaaaaaaaaaaaaaaaaaaaaaaaaaaaaaaaaaaaaaaaaaaaaaaaaaaaaaaaaaaaaaaaaaaaaaaaaaaaaaaaaaaaaaaaaaaaaaaaaaaaaaaaaaaaaaaaaaaaaaaaaaaaaaaaaaaaaaaaaaaaaaaaaaaaaaaaaaaaaaaaaaaaaaaaaaaaaaaaaaaaaaaaaaaaaaaaaaaaaaaaaaaaaaaaaaaaaaaaaaaaaaaaaaaaaaaaaaaaaaaaaaaaaaaaaaaaaaaaaaaaaaaaaaaaaaaaaaaaaaaaaaaaaaaaaaaaaaaaaaaaaaaaaaaaaaaaaaaaaaaaaaaaaaaaaaaaaaaaaaaaaaaaaaaaaaaaaaaaaaaaaaaaaaaaaaaaaaaaaaaaaaaaaaaaaaaaaaaaaaaaaaaaaaaaaaaaaaaaaaaaaaaaaaaaaaaaaaaaaaaaaaaaaaaaaaaaaaaaaaaaaaaaaaaaaaaaaaaaaaaaaaaaaaaaaaaaaaaaaaaaaaaaaaaaaaaaaaaaaaaaaaaaaaaaaaaaaaaaaaaaaaaaaaaaaaaaaaaaaaaaaaaaaaaaaaaaaaaaaaaaaaaaaaaaaaaaaaaaaaaaaaaaaaaaaaaaaaaaaaaaaaaaaaaaaaaaaaaaaaaaaaaaaaaaaaaaaaaaaaaaaaaaaaaaaaaaaaaaaaaaaaaaaaaaaaaaaaaaaaaaaaaaaaaaaaaaaaaaaaaaaaaaaaaaaaaaaaaaaaaaaaaaaaaaaaaaaaaaaaaaaaaaaaaaaaaaaaaaaaaaaaaaaaaaaaaaaaaaaaaaaaaaaaaaaaaaaaaaaaaaaaaaaaaaaaaaaaaaaaaaaaaaaaaaaaaaaaaaaaaaaaaaaaaaaaaaaaaaaaaaaaaaaaaaaaaaaaaaaaaaaaaaaaaaaaaaaaaaaaaaaaaaaaaaaaaaaaaaaaaaaaaaaaaaaaaaaaaaaaaaaaaaaaaaaaaaaaaaaaaaaaaaaaaaaaaaaaaaaaaaaaaaaaaaaaaaaaaaaaaaaaaaaaaaaaaaaaaaaaaaaaaaaaaaaaaaaaaaaaaaaaaaaaaaaaaaaaaaaaaaaaaaaaaaaaaaaaaaaaaaaaaaaaaaaaaaaaaaaaaaaaaaaaaaaaaaaaaaaaaaaaaaaaaaaaaaaaaaaaaaaaaaaaaaaaaaaaaaaaaaaaaaaaaaaaaaaaaaaaaaaaaaaaaaaaaaaaaaaaaaaaaaaaaaaaaaaaaaaaaaaaaaaaaaaaaaaaaaaaaaaaaaaaaaaaaaaaaaaaaaaaaaaaaaaaaaaaaaaaaaaaaaaaaaaaaaaaaaaaaaaaaaaaaaaaaaaaaaaaaaaaaaaaaaaaaaaaaaaaaaaaaaaaaaaaaaaaaaaaaaaaaaaaaaaaaaaaaaaaaaaaaaaaaaaaaaaaaaaaaaaaaaaaaaaaaaaaaaaaaaaaaaaaaaaaaaaaaaaaaaaaaaaaaaaaaaaaaaaaaaaaaaaaaaaaaaaaaaaaaaaaaaaaaaaaaaaaaaaaaaaaaaaaaaaaaaaaaaaaaaaaaaaaaaaaaaaaaaaaaaaaaaaaaaaaaaaaaaaaaaaaaaaaaaaaaaaaaaaaaaaaaaaaaaaaaaaaaaaaaaaaaaaaaaaaaaaaaaaaaaaaaaaaaaaaaaaaaaaaaaaaaaaaaaaaaaaaaaaaaaaaaaaaaaaaaaaaaaaaaaaaaaaaaaaaaaaaaaaaaaaaaaaaaaaaaaaaaaaaaaaaaaaaaaaaaaaaaaaaaaaaaaaaaaaaaaaaaaaaaaaaaaaaaaaaaaaaaaaaaaaaaaaaaaaaaaaaaaaaaaaaaaaaaaaaaaaaaaaaaaaaaaaaaaaaaaaaaaaaaaaaaaaaaaaaaaaaaaaaaaaaaaaaaaaaaaaaaaaaaaaaaaaaaaaaaaaaaaaaaaaaaaaaaaaaaaaaaaaaaaaaaaaaaaaaaaaaaaaaaaaaaaaaaaaaaaaaaaaaaaaaaaaaaaaaaaaaaaaaaaaaaaaaaaaaaaaaaaaaaaaaaaaaaaaaaaaaaaaaaaaaaaaaaaaaaaaaaaaaaaaaaaaaaaaaaaaaaaaaaaaaaaaaaaaaaaaaaaaaaaaaaaaaaaaaaaaaaaaaaaaaaaaaaaaaaaaaaaaaaaaaaaaaaaaaaaaaaaaaaaaaaaaaaaaaaaaaaaaaaaaaaaaaaaaaaaaaaaaaaaaaaaaaaaaaaaaaaaaaaaaaaaaaaaaaaaaaaaaaaaaaaaaaaaaaaaaaaaaaaaaaaaaaaaaaaaaaaaaaaaaaaaaaaaaaaaaaaaaaaaaaaaaaaaaaaaaaaaaaaaaaaaaaaaaaaaaaaaaaaaaaaaaaaaaaaaaaaaaaaaaaaaaaaaaaaaaaaaaaaaaaaaaaaaaaaaaaaaaaaaaaaaaaaaaaaaaaaaaaaaaaaaaaaaaaaaaaaaaaaaaaaaaaaaaaaaaaaaaaaaaaaaaaaaaaaaaaaaaaaaaaaaaaaaaaaaaaaaaaaaaaaaaaaaaaaaaaaaaaaaaaaaaaaaaaaaaaaaaaaaaaaaaaaaaaaaaaaaaaaaaaaaaaaaaaaaaaaaaaaaaaaaaaaaaaaaaaaaaaaaaaaaaaaaaaaaaaaaaaaaaaaaaaaaaaaaaaaaaaaaaaaaaaaaaaaaaaaaaaaaaaaaaaaaaaaaaaaaaaaaaaaaaaaaaaaaaaaaaaaaaaaaaaaaaaaaaaaaaaaaaaaaaaaaaaaaaaaaaaaaaaaaaaaaaaaaaaaaaaaaaaaaaaaaaaaaaaaaaaaaaaaaaaaaaaaaaaaaaaaaaaaaaaaaaaaaaaaaaaaaaaaaaaaaaaaaaaaaaaaaaaaaaaaaaaaaaaaaaaaaaaaaaaaaaaaaaaaaaaaaaaaaaaaaaaaaaaaaaaaaaaaaaaaaaaaaaaaaaaaaaaaaaaaaaaaaaaaaaaaaaaaaaaaaaaaaaaaaaaaaaaaaaaaaaaaaaaaaaaaaaaaaaaaaaaaaaaaaaaaaaaaaaaaaaaaaaaaaaaaaaaaaaaaaaaaaaaaaaaaaaaaaaaaaaaaaaaaaaaaaaaaaaaaaaaaaaaaaaaaaaaaaaaaaaaaaaaaaaaaaaaaaaaaaaaaaaaaaaaaaaaaaaaaaaaaaaaaaaaaaaaaaaaaaaaaaaaaaaaaaaaaaaaaaaaaaaaaaaaaaaaaaaaaaaaaaaaaaaaaaaaaaaaaaaaaaaaaaaaaaaaaaaaaaaaaaaaaaaaaaaaaaaaaaaaaaaaaaaaaaaaaaaaaaaaaaaaaaaaaaaaaaaaaaaaaaaaaaaaaaaaaaaaaaaaaaaaaaaaaaaaaaaaaaaaaaaaaaaaaaaaaaaaaaaaaaaaaaaaaaaaaaaaaaaaaaaaaaaaaaaaaaaaaaaaaaaaaaaaaaaaaaaaaaaaaaaaaaaaaaaaaaaaaaaaaaaaaaaaaaaaaaaaaaaaaaaaaaaaaaaaaaaaaaaaaaaaaaaaaaaaaaaaaaaaaaaaaaaaaaaaaaaaaaaaaaaaaaaaaaaaaaaaaaaaaaaaaaaaaaaaaaaaaaaaaaaaaaaaaaaaaaaaaaaaaaaaaaaaaaaaaaaaaaaaaaaaaaaaaaaaaaaaaaaaaaaaaaaaaaaaaaaaaaaaaaaaaaaaaaaaaaaaaaaaaaaaaaaaaaaaaaaaaaaaaaaaaaaaaaaaaaaaaaaaaaaaaaaaaaaaaaaaaaaaaaaaaaaaaaaaaaaaaaaaaaaaaaaaaaaaaaaaaaaaaaaaaaaaaaaaaaaaaaaaaaaaaaaaaaaaaaaaaaaaaaaaaaaaaaaaaaaaaaaaaaaaaaaaaaaaaaaaaaaaaaaaaaaaaaaaaaaaaaaaaaaaaaaaaaaaaaaaaaaaaaaaaaaaaaaaaaaaaaaaaaaaaaaaaaaaaaaaaaaaaaaaaaaaaaaaaaaaaaaaaaaaaaaaaaaaaaaaaaaaaaaaaaaaaaaaaaaaaaaaaaaaaaaaaaaaaaaaaaaaaaaaaaaaaaaaaaaaaaaaaaaaaaaaaaaaaaaaaaaaaaaaaaaaaaaaaaaaaaaaaaaaaaaaaaaaaaaaaaaaaaaaaaaaaaaaaaaaaaaaaaaaaaaaaaaaaaaaaaaaaaaaaaaaaaaaaaaaaaaaaaaaaaaaaaaaaaaaaaaaaaaaaaaaaaaaaaaaaaaaaaaaaaaaaaaaaaaaaaaaaaaaaaaaaaaaaaaaaaaaaaaaaaaaaaaaaaaaaaaaaaaaaaaaaaaaaaaaaaaaaaaaaaaaaaaaaaaaaaaaaaaaaaaaaaaaaaaaaaaaaaaaaaaaaaaaaaaaaaaaaaaaaaaaaaaaaaaaaaaaaaaaaaaaaaaaaaaaaaaaaaaaaaaaaaaaaaaaaaaaaaaaaaaaaaaaaaaaaaaaaaaaaaaaaaaaaaaaaaaaaaaaaaaaaaaaaaaaaaaaaaaaaaaaaaaaaaaaaaaaaaaaaaaaaaaaaaaaaaaaaaaaaaaaaaaaaaaaaaaaaaaaaaaaaaaaaaaaaaaaaaaaaaaaaaaaaaaaaaaaaaaaaaaaaaaaaaaaaaaaaaaaaaaaaaaaaaaaaaaaaaaaaaaaaaaaaaaaaaaaaaaaaaaaaaaaaaaaaaaaaaaaaaaaaaaaaaaaaaaaaaaaaaaaaaaaaaaaaaaaaaaaaaaaaaaaaaaaaaaaaaaaaaaaaaaaaaaaaaaaaaaaaaaaaaaaaaaaaaaaaaaaaaaaaaaaaaaaaaaaaaaaaaaaaaaaaaaaaaaaaaaaaaaaaaaaaaaaaaaaaaaaaaaaaaaaaaaaaaaaaaaaaaaaaaaaaaaaaaaaaaaaaaaaaaaaaaaaaaaaaaaaaaaaaaaaaaaaaaaaaaaaaaaaaaaaaaaaaaaaaaaaaaaaaaaaaaaaaaaaaaaaaaaaaaaaaaaaaaaaaaaaaaaaaaaaaaaaaaaaaaaaaaaaaaaaaaaaaaaaaaaaaaaaaaaaaaaaaaaaaaaaaaaaaaaaaaaaaaaaaaaaaaaaaaaaaaaaaaaaaaaaaaaaaaaaaaaaaaaaaaaaaaaaaaaaaaaaaaaaaaaaaaaaaaaaaaaaaaaaaaaaaaaaaaaaaaaaaaaaaaaaaaaaaaaaaaaaaaaaaaaaaaaaaaaaaaaaaaaaaaaaaaaaaaaaaaaaaaaaaaaaaaaaaaaaaaaaaaaaaaaaaaaaaaaaaaaaaaaaaaaaaaaaaaaaaaaaaaaaaaaaaaaaaaaaaaaaaaaaaaaaaaaaaaaaaaaaaaaaaaaaaaaaaaaaaaaaaaaaaaaaaaaaaaaaaaaaaaaaaaaaaaaaaaaaaaaaaaaaaaaaaaaaaaaaaaaaaaaaaaaaaaaaaaaaaaaaaaaaaaaaaaaaaaaaaaaaaaaaaaaaaaaaaaaaaaaaaaaaaaaaaaaaaaaaaaaaaaaaaaaaaaaaaaaaaaaaaaaaaaaaaaaaaaaaaaaaaaaaaaaaaaaaaaaaaaaaaaaaaaaaaaaaaaaaaaaaaaaaaaaaaaaaaaaaaaaaaaaaaaaaaaaaaaaaaaaaaaaaaaaaaaaaaaaaaaaaaaaaaaaaaaaaaaaaaaaaaaaaaaaaaaaaaaaaaaaaaaaaaaaaaaaaaaaaaaaaaaaaaaaaaaaaaaaaaaaaaaaaaaaaaaaaaaaaaaaaaaaaaaaaaaaaaaaaaaaaaaaaaaaaaaaaaaaaaaaaaaaaaaaaaaaaaaaaaaaaaaaaaaaaaaaaaaaaaaaaaaaaaaaaaaaaaaaaaaaaaaaaaaaaaaaaaaaaaaaaaaaaaaaaaaaaaaaaaaaaaaaaaaaaaaaaaaaaaaaaaaaaaaaaaaaaaaaaaaaaaaaaaaaaaaaaaaaaaaaaaaaaaaaaaaaaaaaaaaaaaaaaaaaaaaaaaaaaaaaaaaaaaaaaaaaaaaaaaaaaaaaaaaaaaaaaaaaaaaaaaaaaaaaaaaaaaaaaaaaaaaaaaaaaaaaaaaaaaaaaaaaaaaaaaaaaaaaaaaaaaaaaaaaaaaaaaaaaaaaaaaaaaaaaaaaaaaaaaaaaaaaaaaaaaaaaaaaaaaaaaaaaaaaaaaaaaaaaaaaaaaaaaaaaaaaaaaaaaaaaaaaaaaaaaaaaaaaaaaaaaaaaaaaaaaaaaaaaaaaaaaaaaaaaaaaaaaaaaaaaaaaaaaaaaaaaaaaaaaaaaaaaaaaaaaaaaaaaaaaaaaaaaaaaaaaaaaaaaaaaaaaaaaaaaaaaaaaaaaaaaaaaaaaaaaaaaaaaaaaaaaaaaaaaaaaaaaaaaaaaaaaaaaaaaaaaaaaaaaaaaaaaaaaaaaaaaaaaaaaaaaaaaaaaaaaaaaaaaaaaaaaaaaaaaaaaaaaaaaaaaaaaaaaaaaaaaaaaaaaaaaaaaaaaaaaaaaaaaaaaaaaaaaaaaaaaaaaaaaaaaaaaaaaaaaaaaaaaaaaaaaaaaaaaaaaaaaaaaaaaaaaaaaaaaaaaaaaaaaaaaaaaaaaaaaaaaaaaaaaaaaaaaaaaaaaaaaaaaaaaaaaaaaaaaaaaaaaaaaaaaaaaaaaaaaaaaaaaaaaaaaaaaaaaaaaaaaaaaaaaaaaaaaaaaaaaaaaaaaaaaaaaaaaaaaaaaaaaaaaaaaaaaaaaaaaaaaaaaaaaaaaaaaaaaaaaaaaaaaaaaaaaaaaaaaaaaaaaaaaaaaaaaaaaaaaaaaaaaaaaaaaaaaaaaaaaaaaaaaaaaaaaaaaaaaaaaaaaaaaaaaaaaaaaaaaaaaaaaaaaaaaaaaaaaaaaaaaaaaaaaaaaaaaaaaaaaaaaaaaaaaaaaaaaaaaaaaaaaaaaaaaaaaaaaaaaaaaaaaaaaaaaaaaaaaaaaaaaaaaaaaaaaaaaaaaaaaaaaaaaaaaaaaaaaaaaaaaaaaaaaaaaaaaaaaaaaaaaaaaaaaaaaaaaaaaaaaaaaaaaaaaaaaaaaaaaaaaaaaaaaaaaaaaaaaaaaaaaaaaaaaaaaaaaaaaaaaaaaaaaaaaaaaaaaaaaaaaaaaaaaaaaaaaaaaaaaaaaaaaaaaaaaaaaaaaaaaaaaaaaaaaaaaaaaaaaaaaaaaaaaaaaaaaaaaaaaaaaaaaaaaaaaaaaaaaaaaaaaaaaaaaaaaaaaaaaaaaaaaaaaaaaaaaaaaaaaaaaaaaaaaaaaaaaaaaaaaaaaaaaaaaaaaaaaaaaaaaaaaaaaaaaaaaaaaaaaaaaaaaaaaaaaaaaaaaaaaaaaaaaaaaaaaaaaaaaaaaaaaaaaaaaaaaaaaaaaaaaaaaaaaaaaaaaaaaaaaaaaaaaaaaaaaaaaaaaaaaaaaaaaaaaaaaaaaaaaaaaaaaaaaaaaaaaaaaaaaaaaaaaaaaaaaaaaaaaaaaaaaaaaaaaaaaaaaaaaaaaaaaaaaaaaaaaaaaaaaaaaaaaaaaaaaaaaaaaaaaaaaaaaaaaaaaaaaaaaaaaaaaaaaaaaaaaaaaaaaaaaaaaaaaaaaaaaaaaaaaaaaaaaaaaaaaaaaaaaaaaaaaaaaaaaaaaaaaaaaaaaaaaaaaaaaaaaaaaaaaaaaaaaaaaaaaaaaaaaaaaaaaaaaaaaaaaaaaaaaaaaaaaaaaaaaaaaaaaaaaaaaaaaaaaaaaaaaaaaaaaaaaaaaaaaaaaaaaaaaaaaaaaaaaaaaaaaaaaaaaaaaaaaaaaaaaaaaaaaaaaaaaaaaaaaaaaaaaaaaaaaaaaaaaaaaaaaaaaaaaaaaaaaaaaaaaaaaaaaaaaaaaaaaaaaaaaaaaaaaaaaaaaaaaaaaaaaaaaaaaaaaaaaaaaaaaaaaaaaaaaaaaaaaaaaaaaaaaaaaaaaaaaaaaaaaaaaaaaaaaaaaaaaaaaaaaaaaaaaaaaaaaaaaaaaaaaaaaaaaaaaaaaaaaaaaaaaaaaaaaaaaaaaaaaaaaaaaaaaaaaaaaaaaaaaaaaaaaaaaaaaaaaaaaaaaaaaaaaaaaaaaaaaaaaaaaaaaaaaaaaaaaaaaaaaaaaaaaaaaaaaaaaaaaaaaaaaaaaaaaaaaaaaaaaaaaaaaaaaaaaaaaaaaaaaaaaaaaaaaaaaaaaaaaaaaaaaaaaaaaaaaaaaaaaaaaaaaaaaaaaaaaaaaaaaaaaaaaaaaaaaaaaaaaaaaaaaaaaaaaaaaaaaaaaaaaaaaaaaaaaaaaaaaaaaaaaaaaaaaaaaaaaaaaaaaaaaaaaaaaaaaaaaaaaaaaaaaaaaaaaaaaaaaaaaaaaaaaaaaaaaaaaaaaaaaaaaaaaaaaaaaaaaaaaaaaaaaaaaaaaaaaaaaaaaaaaaaaaaaaaaaaaaaaaaaaaaaaaaaaaaaaaaaaaaaaaaaaaaaaaaaaaaaaaaaaaaaaaaaaaaaaaaaaaaaaaaaaaaaaaaaaaaaaaaaaaaaaaaaaaaaaaaaaaaaaaaaaaaaaaaaaaaaaaaaaaaaaaaaaaaaaaaaaaaaaaaaaaaaaaaaaaaaaaaaaaaaaaaaaaaaaaaaaaaaaaaaaaaaaaaaaaaaaaaaaaaaaaaaaaaaaaaaaaaaaaaaaaaaaaaaaaaaaaaaaaaaaaaaaaaaaaaaaaaaaaaaaaaaaaaaaaaaaaaaaaaaaaaaaaaaaaaaaaaaaaaaaaaaaaaaaaaaaaaaaaaaaaaaaaaaaaaaaaaaaaaaaaaaaaaaaaaaaaaaaaaaaaaaaaaaaaaaaaaaaaaaaaaaaaaaaaaaaaaaaaaaaaaaaaaaaaaaaaaaaaaaaaaaaaaaaaaaaaaaaaaaaaaaaaaaaaaaaaaaaaaaaaaaaaaaaaaaaaaaaaaaaaaaaaaaaaaaaaaaaaaaaaaaaaaaaaaaaaaaaaaaaaaaaaaaaaaaaaaaaaaaaaaaaaaaaaaaaaaaaaaaaaaaaaaaaaaaaaaaaaaaaaaaaaaaaaaaaaaaaaaaaaaaaaaaaaaaaaaaaaaaaaaaaaaaaaaaaaaaaaaaaaaaaaaaaaaaaaaaaaaaaaaaaaaaaaaaaaaaaaaaaaaaaaaaaaaaaaaaaaaaaaaaaaaaaaaaaaaaaaaaaaaaaaaaaaaaaaaaaaaaaaaaaaaaaaaaaaaaaaaaaaaaaaaaaaaaaaaaaaaaaaaaaaaaaaaaaaaaaaaaaaaaaaaaaaaaaaaaaaaaaaaaaaaaaaaaaaaaaaaaaaaaaaaaaaaaaaaaaaaaaaaaaaaaaaaaaaaaaaaaaaaaaaaaaaaaaaaaaaaaaaaaaaaaaaaaaaaaaaaaaaaaaaaaaaaaaaaaaaaaaaaaaaaaaaaaaaaaaaaaaaaaaaaaaaaaaaaaaaaaaaaaaaaaaaaaaaaaaaaaaaaaaaaaaaaaaaaaaaaaaaaaaaaaaaaaaaaaaaaaaaaaaaaaaaaaaaaaaaaaaaaaaaaaaaaaaaaaaaaaaaaaaaaaaaaaaaaaaaaaaaaaaaaaaaaaaaaaaaaaaaaaaaaaaaaaaaaaaaaaaaaaaaaaaaaaaaaaaaaaaaaaaaaaaaaaaaaaaaaaaaaaaaaaaaaaaaaaaaaaaaaaaaaaaaaaaaaaaaaaaaaaaaaaaaaaaaaaaaaaaaaaaaaaaaaaaaaaaaaaaaaaaaaaaaaaaaaaaaaaaaaaaaaaaaaaaaaaaaaaaaaaaaaaaaaaaaaaaaaaaaaaaaaaaaaaaaaaaaaaaaaaaaaaaaaaaaaaaaaaaaaaaaaaaaaaaaaaaaaaaaaaaaaaaaaaaaaaaaaaaaaaaaaaaaaaaaaaaaaaaaaaaaaaaaaaaaaaaaaaaaaaaaaaaaaaaaaaaaaaaaaaaaaaaaaaaaaaaaaaaaaaaaaaaaaaaaaaaaaaaaaaaaaaaaaaaaaaaaaaaaaaaaaaaaaaaaaaaaaaaaaaaaaaaaaaaaaaaaaaaaaaaaaaaaaaaaaaaaaaaaaaaaaaaaaaaaaaaaaaaaaaaaaaaaaaaaaaaaaaaaaaaaaaaaaaaaaaaaaaaaaaaaaaaaaaaaaaaaaaaaaaaaaaaaaaaaaaaaaaaaaaaaaaaaaaaaaaaaaaaaaaaaaaaaaaaaaaaaaaaaaaaaaaaaaaaaaaaaaaaaaaaaaaaaaaaaaaaaaaaaaaaaaaaaaaaaaaaaaaaaaaaaaaaaaaaaaaaaaaaaaaaaaaaaaaaaaaaaaaaaaaaaaaaaaaaaaaaaaaaaaaaaaaaaaaaaaaaaaaaaaaaaaaaaaaaaaaaaaaaaaaaaaaaaaaaaaaaaaaaaaaaaaaaaaaaaaaaaaaaaaaaaaaaaaaaaaaaaaaaaaaaaaaaaaaaaaaaaaaaaaaaaaaaaaaaaaaaaaaaaaaaaaaaaaaaaaaaaaaaaaaaaaaaaaaaaaaaaaaaaaaaaaaaaaaaaaaaaaaaaaaaaaaaaaaaaaaaaaaaaaaaaaaaaaaaaaaaaaaaaaaaaaaaaaaaaaaaaaaaaaaaaaaaaaaaaaaaaaaaaaaaaaaaaaaaaaaaaaaaaaaaaaaaaaaaaaaaaaaaaaaaaaaaaaaaaaaaaaaaaaaaaaaaaaaaaaaaaaaaaaaaaaaaaaaaaaaaaaaaaaaaaaaaaaaaaaaaaaaaaaaaaaaaaaaaaaaaaaaaaaaaaaaaaaaaaaaaaaaaaaaaaaaaaaaaaaaaaaaaaaaaaaaaaaaaaaaaaaaaaaaaaaaaaaaaaaaaaaaaaaaaaaaaaaaaaaaaaaaaaaaaaaaaaaaaaaaaaaaaaaaaaaaaaaaaaaaaaaaaaaaaaaaaaaaaaaaaaaaaaaaaaaaaaaaaaaaaaaaaaaaaaaaaaaaaaaaaaaaaaaaaaaaaaaaaaaaaaaaaaaaaaaaaaaaaaaaaaaaaaaaaaaaaaaaaaaaaaaaaaaaaaaaaaaaaaaaaaaaaaaaaaaaaaaaaaaaaaaaaaaaaaaaaaaaaaaaaaaaaaaaaaaaaaaaaaaaaaaaaaaaaaaaaaaaaaaaaaaaaaaaaaaaaaaaaaaaaaaaaaaaaaaaaaaaaaaaaaaaaaaaaaaaaaaaaaaaaaaaaaaaaaaaaaaaaaaaaaaaaaaaaaaaaaaaaaaaaaaaaaaaaaaaaaaaaaaaaaaaaaaaaaaaaaaaaaaaaaaaaaaaaaaaaaaaaaaaaaaaaaaaaaaaaaaaaaaaaaaaaaaaaaaaaaaaaaaaaaaaaaaaaaaaaaaaaaaaaaaaaaaaaaaaaaaaaaaaaaaaaaaaaaaaaaaaaaaaaaaaaaaaaaaaaaaaaaaaaaaaaaaaaaaaaaaaaaaaaaaaaaaaaaaaaaaaaaaaaaaaaaaaaaaaaaaaaaaaaaaaaaaaaaaaaaaaaaaaaaaaaaaaaaaaaaaaaaaaaaaaaaaaaaaaaaaaaaaaaaaaaaaaaaaaaaaaaaaaaaaaaaaaaaaaaaaaaaaaaaaaaaaaaaaaaaaaaaaaaaaaaaaaaaaaaaaaaaaaaaaaaaaaaaaaaaaaaaaaaaaaaaaaaaaaaaaaaaaaaaaaaaaaaaaaaaaaaaaaaaaaaaaaaaaaaaaaaaaaaaaaaaaaaaaaaaaaaaaaaaaaaaaaaaaaaaaaaaaaaaaaaaaaaaaaaaaaaaaaaaaaaaaaaaaaaaaaaaaaaaaaaaaaaaaaaaaaaaaaaaaaaaaaaaaaaaaaaaaaaaaaaaaaaaaaaaaaaaaaaaaaaaaaaaaaaaaaaaaaaaaaaaaaaaaaaaaaaaaaaaaaaaaaaaaaaaaaaaaaaaaaaaaaaaaaaaaaaaaaaaaaaaaaaaaaaaaaaaaaaaaaaaaaaaaaaaaaaaaaaaaaaaaaaaaaaaaaaaaaaaaaaaaaaaaaaaaaaaaaaaaaaaaaaaaaaaaaaaaaaaaaaaaaaaaaaaaaaaaaaaaaaaaaaaaaaaaaaaaaaaaaaaaaaaaaaaaaaaaaaaaaaaaaaaaaaaaaaaaaaaaaaaaaaaaaaaaaaaaaaaaaaaaaaaaaaaaaaaaaaaaaaaaaaaaaaaaaaaaaaaaaaaaaaaaaaaaaaaaaaaaaaaaaaaaaaaaaaaaaaaaaaaaaaaaaaaaaaaaaaaaaaaaaaaaaaaaaaaaaaaaaaaaaaaaaaaaaaaaaaaaaaaaaaaaaaaaaaaaaaaaaaaaaaaaaaaaaaaaaaaaaaaaaaaaaaaaaaaaaaaaaaaaaaaaaaaaaaaaaaaaaaaaaaaaaaaaaaaaaaaaaaaaaaaaaaaaaaaaaaaaaaaaaaaaaaaaaaaaaaaaaaaaaaaaaaaaaaaaaaaaaaaaaaaaaaaaaaaaaaaaaaaaaaaaaaaaaaaaaaaaaaaaaaaaaaaaaaaaaaaaaaaaaaaaaaaaaaaaaaaaaaaaaaaaaaaaaaaaaaaaaaaaaaaaaaaaaaaaaaaaaaaaaaaaaaaaaaaaaaaaaaaaaaaaaaaaaaaaaaaaaaaaaaaaaaaaaaaaaaaaaaaaaaaaaaaaaaaaaaaaaaaaaaaaaaaaaaaaaaaaaaaaaaaaaaaaaaaaaaaaaaaaaaaaaaaaaaaaaaaaaaaaaaaaaaaaaaaaaaaaaaaaaaaaaaaaaaaaaaaaaaaaaaaaaaaaa": 1}
create table jro
(
a int,
b varchar( 10 ),
c boolean
);
insert into jro( a, b, c ) values
( 0, 'zero', false ),
( 1, 'one', true ),
( null, null, null );
select a, jsn_object( 'a', a, 'b', b, 'c', c )
from jro
order by a;
a	jsn_object( 'a', a, 'b', b, 'c', c )
NULL	NULL
0	{"a": 0, "b": "zero", "c": 0}
1	{"a": 1, "b": "one", "c": 1}
drop table jro;
create table jro2( a int, b varchar( 10 ), c json );
insert into jro2 ( a, b, c ) values
( 1, 'array', '[ 1, 2, 3 ]' ), ( 2, 'object', '{ "d": "foo", "e": true }' );
select a, jsn_object( 'type', b, 'value', c )
from jro2 order by a;
a	jsn_object( 'type', b, 'value', c )
1	{"type": "array", "value": [1, 2, 3]}
2	{"type": "object", "value": {"d": "foo", "e": true}}
drop table jro2;
select jsn_object(jsn_array(), jsn_array());
jsn_object(jsn_array(), jsn_array())
{"[]": []}
select jsn_object( cast(jsn_array() as char), jsn_array());
jsn_object( cast(jsn_array() as char), jsn_array())
{"[]": []}
select jsn_object( 1, jsn_array());
jsn_object( 1, jsn_array())
{"1": []}
select jsn_object( cast(1 as char), jsn_array());
jsn_object( cast(1 as char), jsn_array())
{"1": []}
create table department( id int, deptName varchar(50), isExempt boolean, blobColumn blob );
insert into department values ( 405, 'Accounting', true, '<a><b>ccc</b><d></d></a>' );
SELECT JSN_OBJECT();
JSN_OBJECT()
{}
SELECT JSN_OBJECT
(
'deptName', d.deptName,
'id', d.id,
'isExempt', d.isExempt and true
)
FROM department d
WHERE id = 405;
JSN_OBJECT
(
'deptName', d.deptName,
'id', d.id,
'isExempt', d.isExempt and true
)
{"id": 405, "deptName": "Accounting", "isExempt": true}
drop table department;
# ----------------------------------------------------------------------
# Test of JSN_SEARCH function.
# ----------------------------------------------------------------------
select jsn_search();
ERROR 42000: Incorrect parameter count in the call to native function 'jsn_search'
select jsn_search( '{ "a": true }' );
ERROR 42000: Incorrect parameter count in the call to native function 'jsn_search'
select jsn_search( '{ "a": true }', 'one' );
ERROR 42000: Incorrect parameter count in the call to native function 'jsn_search'
select jsn_search( null, 'one', 'foo' );
jsn_search( null, 'one', 'foo' )
NULL
select jsn_search( '{ "a": "foo" }', null, 'foo' );
jsn_search( '{ "a": "foo" }', null, 'foo' )
NULL
select jsn_search( '{ "a": "foo" }', 'one', 'foo', null, null );
jsn_search( '{ "a": "foo" }', 'one', 'foo', null, null )
NULL
select jsn_search( '{ "a": "foo" }', 'one', 'foo', null, '$.a', null );
jsn_search( '{ "a": "foo" }', 'one', 'foo', null, '$.a', null )
NULL
select jsn_search( '{ "a": "foo" }', 'twof', 'foo' );
ERROR 42000: The oneOrAll argument to JSN_SEARCH may take these values: 'one' or 'all'.
select jsn_search( '{ "a": "foo" }', 'two', 'foo' );
ERROR 42000: The oneOrAll argument to JSN_SEARCH may take these values: 'one' or 'all'.
select jsn_search( '{ "a": "foo" }', 'one', 'foo', 'ab' );
ERROR HY000: Incorrect arguments to ESCAPE
select jsn_search( '{ "a": "foo" }', 'one', 'foo', null, '$a' );
ERROR 42000: Invalid JSON path expression. The error is around character position 1 in '$a'.
select jsn_search( '{ "a": "foo" }', 'all', 'foo', null, '$.a', '$b' );
ERROR 42000: Invalid JSON path expression. The error is around character position 1 in '$b'.
select jsn_search( '{ "a": "foobar" }', 'one', 'foo%' );
jsn_search( '{ "a": "foobar" }', 'one', 'foo%' )
"$.a"
select jsn_search( '{ "a": "foobar", "b": "focus", "c": [ "arm", "foot", "shoulder" ] }', 'one', 'foo%' );
jsn_search( '{ "a": "foobar", "b": "focus", "c": [ "arm", "foot", "shoulder" ] }', 'one', 'foo%' )
"$.a"
select jsn_search( '{ "a": "foobar", "b": "focus", "c": [ "arm", "foot", "shoulder" ] }', 'all', 'foo%' );
jsn_search( '{ "a": "foobar", "b": "focus", "c": [ "arm", "foot", "shoulder" ] }', 'all', 'foo%' )
["$.a", "$.c[1]"]
select jsn_search( '{ "a": "foobar", "b": "focus", "c": [ "arm", "foot", "shoulder" ] }', 'all', 'f__us' );
jsn_search( '{ "a": "foobar", "b": "focus", "c": [ "arm", "foot", "shoulder" ] }', 'all', 'f__us' )
"$.b"
create table jsn_search_table( id_col int, json_col json );
insert into jsn_search_table values
( 1, '{ "a": "foobar" }' ),
( 2, '{ "a": "foobar", "b": "focus", "c": [ "arm", "foot", "shoulder" ] }' );
select id_col, jsn_search( json_col, 'all', 'foo%' )
from jsn_search_table
order by id_col;
id_col	jsn_search( json_col, 'all', 'foo%' )
1	"$.a"
2	["$.a", "$.c[1]"]
select id_col, jsn_search( json_col, 'all', 'foot' )
from jsn_search_table
order by id_col;
id_col	jsn_search( json_col, 'all', 'foot' )
1	NULL
2	"$.c[1]"
select id_col, jsn_search( json_col, 'all', 'f__us' )
from jsn_search_table
order by id_col;
id_col	jsn_search( json_col, 'all', 'f__us' )
1	NULL
2	"$.b"
delete from jsn_search_table;
insert into jsn_search_table values
( 1, '{ "a": "foobar" }' ),
( 2, '{ "a": [ "foolish", "folly", "foolhardy"  ], "b" : "fool" }' );
select jsn_search( '{ "a": [ "foolish", "folly", "foolhardy"  ], "b" : "fool" }', 'all', 'foo%', null, '$.a' );
jsn_search( '{ "a": [ "foolish", "folly", "foolhardy"  ], "b" : "fool" }', 'all', 'foo%', null, '$.a' )
["$.a[0]", "$.a[2]"]
select jsn_search( '{ "a": [ "foolish", "folly", "foolhardy"  ], "b" : "fool" }', 'all', 'foo%', null, '$.a', '$.b' );
jsn_search( '{ "a": [ "foolish", "folly", "foolhardy"  ], "b" : "fool" }', 'all', 'foo%', null, '$.a', '$.b' )
["$.a[0]", "$.a[2]", "$.b"]
select jsn_search( '{ "a": [ "foolish", "folly", "foolhardy"  ], "b" : "fool" }', 'one', 'foo%', null, '$.a', '$.b' );
jsn_search( '{ "a": [ "foolish", "folly", "foolhardy"  ], "b" : "fool" }', 'one', 'foo%', null, '$.a', '$.b' )
"$.a[0]"
select jsn_search( '{ "a": [ "foolish", "folly", "foolhardy"  ], "b" : "fool" }', 'ALL', 'foo%', null, '$.a' );
jsn_search( '{ "a": [ "foolish", "folly", "foolhardy"  ], "b" : "fool" }', 'ALL', 'foo%', null, '$.a' )
["$.a[0]", "$.a[2]"]
select jsn_search( '{ "a": [ "foolish", "folly", "foolhardy"  ], "b" : "fool" }', 'aLl', 'foo%', null, '$.a', '$.b' );
jsn_search( '{ "a": [ "foolish", "folly", "foolhardy"  ], "b" : "fool" }', 'aLl', 'foo%', null, '$.a', '$.b' )
["$.a[0]", "$.a[2]", "$.b"]
select jsn_search( '{ "a": [ "foolish", "folly", "foolhardy"  ], "b" : "fool" }', 'ONE', 'foo%', null, '$.a', '$.b' );
jsn_search( '{ "a": [ "foolish", "folly", "foolhardy"  ], "b" : "fool" }', 'ONE', 'foo%', null, '$.a', '$.b' )
"$.a[0]"
select id_col, jsn_search( json_col, 'all', 'foo%', null, '$.a' )
from jsn_search_table
order by id_col;
id_col	jsn_search( json_col, 'all', 'foo%', null, '$.a' )
1	"$.a"
2	["$.a[0]", "$.a[2]"]
select id_col, jsn_search( json_col, 'all', 'foo%', null, '$.a', '$.b' )
from jsn_search_table
order by id_col;
id_col	jsn_search( json_col, 'all', 'foo%', null, '$.a', '$.b' )
1	"$.a"
2	["$.a[0]", "$.a[2]", "$.b"]
select id_col, jsn_search( json_col, 'one', 'foo%', null, '$.a', '$.b' )
from jsn_search_table
order by id_col;
id_col	jsn_search( json_col, 'one', 'foo%', null, '$.a', '$.b' )
1	"$.a"
2	"$.a[0]"
select jsn_search
(
'[ { "a": { "b": { "c": "fool" } } }, { "b": { "c": "shoulder" } }, { "c": { "c": "food"} } ]',
'all',
'foo%',
null,
'$**.c'
);
jsn_search
(
'[ { "a": { "b": { "c": "fool" } } }, { "b": { "c": "shoulder" } }, { "c": { "c": "food"} } ]',
'all',
'foo%',
null,
'$**.c'
)
["$[0].a.b.c", "$[2].c.c"]
delete from jsn_search_table;
insert into jsn_search_table values
( 1, '{ "a": "foobar" }' ),
( 2, '[ { "a": { "b": { "c": "fool" } } }, { "b": { "c": "shoulder" } }, { "c": { "c": "food"} } ]' );
select id_col, jsn_search( json_col, 'all', 'foo%', null, '$.a', '$**.c' )
from jsn_search_table
order by id_col;
id_col	jsn_search( json_col, 'all', 'foo%', null, '$.a', '$**.c' )
1	"$.a"
2	["$[0].a.b.c", "$[2].c.c"]
select id_col, jsn_search( json_col, 'one', 'foo%', null, '$.a', '$**.c' )
from jsn_search_table
order by id_col;
id_col	jsn_search( json_col, 'one', 'foo%', null, '$.a', '$**.c' )
1	"$.a"
2	"$[0].a.b.c"
select jsn_search
(
'[ { "a": { "b": { "c": "showtime" } } }, { "b": { "c": "shoulder" } }, { "c": { "c": "shoe"} } ]',
'all',
'sho%',
null,
'$**.c'
);
jsn_search
(
'[ { "a": { "b": { "c": "showtime" } } }, { "b": { "c": "shoulder" } }, { "c": { "c": "shoe"} } ]',
'all',
'sho%',
null,
'$**.c'
)
["$[0].a.b.c", "$[1].b.c", "$[2].c.c"]
select jsn_search
(
'[ { "a": { "b": { "c": "showtime" } } }, { "b": { "c": "shoulder" } }, { "c": { "c": "shoe"} } ]',
'all',
'sho%e',
null,
'$**.c'
);
jsn_search
(
'[ { "a": { "b": { "c": "showtime" } } }, { "b": { "c": "shoulder" } }, { "c": { "c": "shoe"} } ]',
'all',
'sho%e',
null,
'$**.c'
)
["$[0].a.b.c", "$[2].c.c"]
select jsn_search
(
'[ { "a": { "b": { "c": "showtime" } } }, { "b": { "c": "shoulder" } }, { "c": { "c": "shoe"} } ]',
'all',
'sho%',
null,
'$[*].c'
);
jsn_search
(
'[ { "a": { "b": { "c": "showtime" } } }, { "b": { "c": "shoulder" } }, { "c": { "c": "shoe"} } ]',
'all',
'sho%',
null,
'$[*].c'
)
"$[2].c.c"
select jsn_search
(
'[ { "a": { "b": { "c": "showtime" } } }, [ { "b": { "c": "shout" } }, { "c": { "c": "shoe"} } ] ]',
'all',
'sho%',
null,
'$[1]**.c'
);
jsn_search
(
'[ { "a": { "b": { "c": "showtime" } } }, [ { "b": { "c": "shout" } }, { "c": { "c": "shoe"} } ] ]',
'all',
'sho%',
null,
'$[1]**.c'
)
["$[1][0].b.c", "$[1][1].c.c"]
select jsn_search( '[ "footbar", "foo%bar" ]', 'all', 'foo%bar' );
jsn_search( '[ "footbar", "foo%bar" ]', 'all', 'foo%bar' )
["$[0]", "$[1]"]
select jsn_search( '[ "footbar", "foo%bar" ]', 'all', 'foo\%bar' );
jsn_search( '[ "footbar", "foo%bar" ]', 'all', 'foo\%bar' )
"$[1]"
select jsn_search( '[ "footbar", "foo%bar" ]', 'all', 'foo|%bar', '|' );
jsn_search( '[ "footbar", "foo%bar" ]', 'all', 'foo|%bar', '|' )
"$[1]"
select jsn_search( '[ "footbar", "foo%bar" ]', 'all', 'foo|%bar', '|', '$[0]' );
jsn_search( '[ "footbar", "foo%bar" ]', 'all', 'foo|%bar', '|', '$[0]' )
NULL
select jsn_search( '[ "footbar", "foo%bar" ]', 'all', 'foo|%bar', '|', '$[0]', '$[1]' );
jsn_search( '[ "footbar", "foo%bar" ]', 'all', 'foo|%bar', '|', '$[0]', '$[1]' )
"$[1]"
select jsn_search( '[ "footbar", "foo%bar" ]', 'all', 'foo|%bar', '|', '$[0]', '$[1]', '$[2]' );
jsn_search( '[ "footbar", "foo%bar" ]', 'all', 'foo|%bar', '|', '$[0]', '$[1]', '$[2]' )
"$[1]"
select jsn_search( '[ "footbar", "foo%bar" ]', 'all', 'foo\%bar', null );
jsn_search( '[ "footbar", "foo%bar" ]', 'all', 'foo\%bar', null )
"$[1]"
select jsn_search( '[ "footbar", "foo%bar" ]', 'all', 'foo\%bar', null, '$[0]' );
jsn_search( '[ "footbar", "foo%bar" ]', 'all', 'foo\%bar', null, '$[0]' )
NULL
select jsn_search( '[ "footbar", "foo%bar" ]', 'all', 'foo\%bar', null, '$[1]' );
jsn_search( '[ "footbar", "foo%bar" ]', 'all', 'foo\%bar', null, '$[1]' )
"$[1]"
select jsn_search( '[ "footbar", "foo%bar" ]', 'all', 'foo|%bar', '|', '$[0]' );
jsn_search( '[ "footbar", "foo%bar" ]', 'all', 'foo|%bar', '|', '$[0]' )
NULL
select jsn_search( '[ "footbar", "foo%bar" ]', 'all', 'foo|%bar', '|', '$[1]' );
jsn_search( '[ "footbar", "foo%bar" ]', 'all', 'foo|%bar', '|', '$[1]' )
"$[1]"
select jsn_search( '[ "abc", "ABC" ]', 'all', 'aBc' );
jsn_search( '[ "abc", "ABC" ]', 'all', 'aBc' )
NULL
select jsn_search( '[ "abc", "ABC" ]', 'all', 'abc' );
jsn_search( '[ "abc", "ABC" ]', 'all', 'abc' )
"$[0]"
select jsn_search( '[ "abc", "ABC" ]', 'all', 'ABC' );
jsn_search( '[ "abc", "ABC" ]', 'all', 'ABC' )
"$[1]"
select jsn_search( '[ 10, "10", 1.0, "1.0" ]', 'all', '1%' );
jsn_search( '[ 10, "10", 1.0, "1.0" ]', 'all', '1%' )
["$[1]", "$[3]"]
drop table jsn_search_table;
create table jep( key_col int primary key, doc json, path varchar( 50 ) );
insert into jep values
( 1, '{ "onepotato": "seven"  }', '$.onepotato' ),
( 2, '{ "one potato": "seven"  }', '$."one potato"' ),
( 3, '{ "one \\"potato": "seven"  }', '$."one \\"potato"' ),
( 4, '{ "one \\npotato": "seven"  }', '$."one \\npotato"' );
select key_col,
jsn_search( doc, 'all', 'seven' ) paths,
jsn_unquote( cast( jsn_search( doc, 'all', 'seven' ) as char ) ) unquoted,
path
from jep order by key_col;
key_col	paths	unquoted	path
1	"$.onepotato"	$.onepotato	$.onepotato
2	"$.\"one potato\""	$."one potato"	$."one potato"
3	"$.\"one \\\"potato\""	$."one \"potato"	$."one \"potato"
4	"$.\"one \\npotato\""	$."one \npotato"	$."one \npotato"
drop table jep;
SELECT JSN_SEARCH
(
'{ "a" : 123, "b" : [ 123, 456 ] }',
'one',
'123'
);
JSN_SEARCH
(
'{ "a" : 123, "b" : [ 123, 456 ] }',
'one',
'123'
)
NULL
SELECT JSN_SEARCH
(
'{ "a" : "123", "b" : [ 123, "789", "123", "456", "123" ] }',
'one',
'123',
null,
'$.b'
);
JSN_SEARCH
(
'{ "a" : "123", "b" : [ 123, "789", "123", "456", "123" ] }',
'one',
'123',
null,
'$.b'
)
"$.b[2]"
SELECT JSN_SEARCH
(
'{ "a" : "123", "b" : { "key" : "123" } }',
'one',
'123'
);
JSN_SEARCH
(
'{ "a" : "123", "b" : { "key" : "123" } }',
'one',
'123'
)
"$.a"
SELECT JSN_SEARCH
(
'{ "a" : "1243", "b" : { "key" : "1234" } }',
'one',
'123%'
);
JSN_SEARCH
(
'{ "a" : "1243", "b" : { "key" : "1234" } }',
'one',
'123%'
)
"$.b.key"
SELECT JSN_SEARCH
(
'{ "a" : "1243", "b" : { "key" : "1234", "c": "directorysub%directoryabc" } }',
'one',
'dir%torysub@%dir%',
'@'
);
JSN_SEARCH
(
'{ "a" : "1243", "b" : { "key" : "1234", "c": "directorysub%directoryabc" } }',
'one',
'dir%torysub@%dir%',
'@'
)
"$.b.c"
SELECT JSN_SEARCH
(
'{ "a" : "1243", "b" : { "key" : "1234" } }',
'one',
'123%',
null,
'$.c'
);
JSN_SEARCH
(
'{ "a" : "1243", "b" : { "key" : "1234" } }',
'one',
'123%',
null,
'$.c'
)
NULL
SELECT JSN_UNQUOTE
(
JSN_SEARCH
(
'{ "onepotato": "foot", "one potato": "food" , "one \\"potato": "fool" }',
'all',
'food'
  )
);
JSN_UNQUOTE
(
JSN_SEARCH
(
'{ "onepotato": "foot", "one potato": "food" , "one \\"potato": "fool" }',
'all',
'food'
  )
)
$."one potato"
# ----------------------------------------------------------------------
# Test of CASE and IF expressions returning JSON
# ----------------------------------------------------------------------
create table t(j json);
insert into t values (null), ('[3,4,5]');
select jsn_type(case (null is null) when 1 then
cast('null' as json) else
cast('[1,2,3]' as json) end);
jsn_type(case (null is null) when 1 then
cast('null' as json) else
cast('[1,2,3]' as json) end)
NULL
select jsn_type(case (null is not null) when 1 then
cast('null' as json) else
cast('[1,2,3]' as json) end);
jsn_type(case (null is not null) when 1 then
cast('null' as json) else
cast('[1,2,3]' as json) end)
ARRAY
select jsn_type(case (j is null) when 1 then
cast('null' as json) else
cast('[1,2,3]' as json) end) from t;
jsn_type(case (j is null) when 1 then
cast('null' as json) else
cast('[1,2,3]' as json) end)
NULL
ARRAY
select jsn_type( if(null is null,
cast('null' as json),
cast('[1,2,3]' as json)) );
jsn_type( if(null is null,
cast('null' as json),
cast('[1,2,3]' as json)) )
NULL
select jsn_type( if(null is not null,
cast('null' as json),
cast('[1,2,3]' as json)));
jsn_type( if(null is not null,
cast('null' as json),
cast('[1,2,3]' as json)))
ARRAY
select jsn_type( if(j is null,
cast('{"a": 6}' as json),
cast('[1,2,3]' as json))) from t;
jsn_type( if(j is null,
cast('{"a": 6}' as json),
cast('[1,2,3]' as json)))
OBJECT
ARRAY
select jsn_type( if(j is null,
NULL,
cast('[1,2,3]' as json))    ) from t;
jsn_type( if(j is null,
NULL,
cast('[1,2,3]' as json))    )
NULL
ARRAY
# ----------------------------------------------------------------------
# Test of CASE and IF expressions with mix of JSON and other types
# Common result type is VARCHAR
# ----------------------------------------------------------------------
select jsn_type(case (j is null) when 1 then
3.14 else
cast('[1,2,3]' as json) end) from t;
jsn_type(case (j is null) when 1 then
3.14 else
cast('[1,2,3]' as json) end)
DOUBLE
ARRAY
select case (j is null) when 1 then
3.14 else
cast('[1,2,3]' as json) end from t;
case (j is null) when 1 then
3.14 else
cast('[1,2,3]' as json) end
3.14
[1, 2, 3]
select case (j is null) when 1 then
'foobar' else
cast('[1,2,3]' as json) end from t;
case (j is null) when 1 then
'foobar' else
cast('[1,2,3]' as json) end
foobar
[1, 2, 3]
select jsn_type( if(j is null,
3.14,
cast('[1,2,3]' as json))) from t;
jsn_type( if(j is null,
3.14,
cast('[1,2,3]' as json)))
DOUBLE
ARRAY
select if(j is null,
3.14,
cast('[1,2,3]' as json)) from t;
if(j is null,
3.14,
cast('[1,2,3]' as json))
3.14
[1, 2, 3]
# ----------------------------------------------------------------------
# Test of IFNULL
# ----------------------------------------------------------------------
select jsn_type(ifnull(j, cast(3 as json))) from t;
jsn_type(ifnull(j, cast(3 as json)))
INTEGER
ARRAY
select ifnull(j, cast(3 as json)) from t;
ifnull(j, cast(3 as json))
3
[3, 4, 5]
select jsn_type(ifnull(NULL, cast(3 as json)));
jsn_type(ifnull(NULL, cast(3 as json)))
INTEGER
select jsn_type(ifnull(cast(3 as json), NULL));
jsn_type(ifnull(cast(3 as json), NULL))
INTEGER
# ----------------------------------------------------------------------
# Json values used in text contexts
# ----------------------------------------------------------------------
delete from t;
insert into t values (NULL), (cast('"aBc"' as json));
select upper(j) from t;
upper(j)
NULL
"ABC"
select cast(jsn_extract(cast(concat('[', cast('["A",2]' as json), ']') as json),
'$[0][1]') as char) = 2;
cast(jsn_extract(cast(concat('[', cast('["A",2]' as json), ']') as json),
'$[0][1]') as char) = 2
1
# ----------------------------------------------------------------------
# Test of aggregate function MAX, MIN.
# ----------------------------------------------------------------------
select max(cast('[1,2,3]' as json));
max(cast('[1,2,3]' as json))
[1, 2, 3]
delete from t;
insert into t values (cast(1 as json)), (cast(10 as json)), (cast(2 as json));
select max(j) from t;
max(j)
10
select jsn_type(max(j)) from t;
jsn_type(max(j))
INTEGER
select min(j) from t;
min(j)
1
select jsn_type(max(j)) from t;
jsn_type(max(j))
INTEGER
select max(cast(j as unsigned)) from t;
max(cast(j as unsigned))
10
select jsn_type(max(cast(j as unsigned))) from t;
ERROR 22032: Invalid data type for JSON data in argument 1 to function jsn_type; a JSON string or JSON type is required.
drop table t;
# ----------------------------------------------------------------------
# Test of aggregate function SUM, AVG: in constrast to strings, we do not
# auto-convert to numeric (double) type:
# ----------------------------------------------------------------------
create table t(j json, c varchar(20));
insert into t values (cast('[1,2,3]' as json), '[a,b,c]');
insert into t values (cast(7 as json), '7'),  (cast(2 as json), '2');
select sum(j), sum(cast(j as unsigned)), sum(c) from t;
sum(j)	sum(cast(j as unsigned))	sum(c)
9	9	9
Warnings:
Warning	1292	Truncated incorrect DOUBLE value: '[1, 2, 3]'
Warning	1292	Truncated incorrect INT value: '[1, 2, 3]'
Warning	1292	Truncated incorrect DOUBLE value: '[a,b,c]'
select avg(j), avg(cast(j as unsigned)), avg(c) from t;
avg(j)	avg(cast(j as unsigned))	avg(c)
3	3.0000	3
Warnings:
Warning	1292	Truncated incorrect DOUBLE value: '[1, 2, 3]'
Warning	1292	Truncated incorrect INT value: '[1, 2, 3]'
Warning	1292	Truncated incorrect DOUBLE value: '[a,b,c]'
# ----------------------------------------------------------------------
# Test of aggregate function GROUP_CONCAT
# ----------------------------------------------------------------------
select group_concat(j), group_concat(distinct j), group_concat(c) from t;
group_concat(j)	group_concat(distinct j)	group_concat(c)
[1, 2, 3],7,2	[1, 2, 3],7,2	[a,b,c],7,2
insert into t values (NULL, NULL);
select group_concat(j), group_concat(distinct j), group_concat(c) from t;
group_concat(j)	group_concat(distinct j)	group_concat(c)
[1, 2, 3],7,2	[1, 2, 3],7,2	[a,b,c],7,2
# ----------------------------------------------------------------------
# Test of COALESCE
# ----------------------------------------------------------------------
select coalesce(cast(1 as json), cast(2 as json));
coalesce(cast(1 as json), cast(2 as json))
1
select coalesce(j, cast(3 as json)) from t;
coalesce(j, cast(3 as json))
[1, 2, 3]
7
2
3
select coalesce(j, 666) from t;
coalesce(j, 666)
[1, 2, 3]
7
2
666
select jsn_type(coalesce(j, '[1,2,3]')) from t;
jsn_type(coalesce(j, '[1,2,3]'))
ARRAY
INTEGER
INTEGER
ARRAY
select jsn_type(coalesce(j, 'abc')) from t;
ERROR 22032: Invalid JSON text in argument 1 to function jsn_type: "Expect a value here." at position 0 in 'abc'.
drop table t;
# ----------------------------------------------------------------------
# Auto-convert of non-utf8 returning system function
# ----------------------------------------------------------------------
create table t(j json, id int);
insert into t values ('{"user": "foo"}', 8), (NULL, 8);
update t set j=jsn_set(j, '$.user', current_user()) where id=8;
select j from t;
j
{"user": "root@localhost"}
NULL
update t set j=jsn_set(j, '$.user', rtrim('foo    '))  where id=8;
select j from t;
j
{"user": "foo"}
NULL
update t set j=jsn_set(j, '$.user', hex('abc'))  where id=8;
select j from t;
j
{"user": "616263"}
NULL
update t set j=jsn_set(j, '$.user', md5('bingle'))  where id=8;
select j from t;
j
{"user": "f7bffef41562255b44fe01aadecb5c8d"}
NULL
update t set j=jsn_set(j, '$.user', database())  where id=8;
select j from t;
j
{"user": "test"}
NULL
update t set j=jsn_set(j, '$.user', schema()) where id=8;
select j from t;
j
{"user": "test"}
NULL
update t set j=jsn_set(j, '$.user',
cast(UNHEX('F0A09C8E') as char character set 'utf8mb4')) where id=8;
set names 'utf8mb4';
select j from t;
j
{"user": "𠜎"}
NULL
select char_length(jsn_extract(j, '$.user')) from t;
char_length(jsn_extract(j, '$.user'))
3
NULL
drop table t;
# ----------------------------------------------------------------------
# Test of JSN_QUOTE, JSN_UNQUOTE
# ----------------------------------------------------------------------
select jsn_quote();
ERROR 42000: Incorrect parameter count in the call to native function 'jsn_quote'
select jsn_quote('abc', 'def');
ERROR 42000: Incorrect parameter count in the call to native function 'jsn_quote'
select jsn_quote(NULL, 'def');
ERROR 42000: Incorrect parameter count in the call to native function 'jsn_quote'
select jsn_quote('abc', NULL);
ERROR 42000: Incorrect parameter count in the call to native function 'jsn_quote'
select jsn_unquote();
ERROR 42000: Incorrect parameter count in the call to native function 'jsn_unquote'
select jsn_unquote('"abc"', '"def"');
ERROR 42000: Incorrect parameter count in the call to native function 'jsn_unquote'
select jsn_unquote(NULL, 'def');
ERROR 42000: Incorrect parameter count in the call to native function 'jsn_unquote'
select jsn_unquote('"abc"', NULL);
ERROR 42000: Incorrect parameter count in the call to native function 'jsn_unquote'
select jsn_quote(NULL);
jsn_quote(NULL)
NULL
select jsn_unquote(NULL);
jsn_unquote(NULL)
NULL
select jsn_quote('abc');
jsn_quote('abc')
"abc"
select jsn_quote(convert('abc' using ascii));
jsn_quote(convert('abc' using ascii))
"abc"
select jsn_quote(convert('abc' using latin1));
jsn_quote(convert('abc' using latin1))
"abc"
select jsn_quote(convert('abc' using utf8));
jsn_quote(convert('abc' using utf8))
"abc"
select jsn_quote(convert('abc' using utf8mb4));
jsn_quote(convert('abc' using utf8mb4))
"abc"
select jsn_unquote('abc');
jsn_unquote('abc')
abc
select jsn_unquote('"abc"');
jsn_unquote('"abc"')
abc
select jsn_unquote(convert('"abc"' using ascii));
jsn_unquote(convert('"abc"' using ascii))
abc
select jsn_unquote(convert('"abc"' using latin1));
jsn_unquote(convert('"abc"' using latin1))
abc
select jsn_unquote(convert('"abc"' using utf8));
jsn_unquote(convert('"abc"' using utf8))
abc
select jsn_unquote(convert('"abc"' using utf8mb4));
jsn_unquote(convert('"abc"' using utf8mb4))
abc
select jsn_quote('"');
jsn_quote('"')
"\""
select jsn_unquote('"');
jsn_unquote('"')
"
select jsn_quote(123);
ERROR HY000: Incorrect type for argument 1 in function jsn_quote.
select jsn_unquote(123);
ERROR HY000: Incorrect type for argument 1 in function jsn_unquote.
select jsn_unquote('""');
jsn_unquote('""')

select char_length(jsn_unquote('""'));
char_length(jsn_unquote('""'))
0
select jsn_unquote('"" ');
jsn_unquote('"" ')
"" 
select jsn_unquote(cast(jsn_quote('abc') as json));
jsn_unquote(cast(jsn_quote('abc') as json))
abc
select cast('{"abc": "foo"}' as json);
cast('{"abc": "foo"}' as json)
{"abc": "foo"}
select jsn_unquote(cast('{"abc": "foo"}' as json));
jsn_unquote(cast('{"abc": "foo"}' as json))
{"abc": "foo"}
select jsn_extract(cast('{"abc": "foo"}' as json), '$.abc');
jsn_extract(cast('{"abc": "foo"}' as json), '$.abc')
"foo"
select jsn_unquote(jsn_extract(cast('{"abc": "foo"}' as json), '$.abc'));
jsn_unquote(jsn_extract(cast('{"abc": "foo"}' as json), '$.abc'))
foo
create table t (c varchar(20));
insert into t values ('\\');
select char_length(c) from t;
char_length(c)
1
insert into t values (X'0C');
select sum(char_length(c)) from t;
sum(char_length(c))
2
insert into t values ('"');
select sum(char_length(c)) from t;
sum(char_length(c))
3
insert into t values ('\a');
select sum(char_length(c)) from t;
sum(char_length(c))
4
insert into t values ('\b');
select sum(char_length(c)) from t;
sum(char_length(c))
5
insert into t values ('\t');
select sum(char_length(c)) from t;
sum(char_length(c))
6
insert into t values ('\n');
select sum(char_length(c)) from t;
sum(char_length(c))
7
insert into t values ('\r');
select sum(char_length(c)) from t;
sum(char_length(c))
8
insert into t values (X'10');
select sum(char_length(c)) from t;
sum(char_length(c))
9
select group_concat(c) from t;
group_concat(c)
\,,",a,,	,
,,
select char_length(group_concat(c)) from t;
char_length(group_concat(c))
17
select jsn_quote(group_concat(c)) from t;
jsn_quote(group_concat(c))
"\\,\f,\",a,\b,\t,\n,\r,\u0010"
select char_length(jsn_quote(group_concat(c))) from t;
char_length(jsn_quote(group_concat(c)))
31
select (group_concat(c) = jsn_unquote(group_concat(c))) as should_be_equal from t;
should_be_equal
1
select jsn_quote(convert(X'e68891' using utf8));
jsn_quote(convert(X'e68891' using utf8))
"我"
select jsn_quote(convert(X'e68891' using utf8mb4));
jsn_quote(convert(X'e68891' using utf8mb4))
"我"
select cast(jsn_quote(convert(X'e68891' using utf8)) as json);
cast(jsn_quote(convert(X'e68891' using utf8)) as json)
"我"
select jsn_unquote(convert(X'e68891' using utf8));
jsn_unquote(convert(X'e68891' using utf8))
我
select  jsn_quote(jsn_quote(jsn_quote('abc')));
jsn_quote(jsn_quote(jsn_quote('abc')))
"\"\\\"abc\\\"\""
select  jsn_unquote(jsn_unquote(jsn_unquote(        # long round trip of it
jsn_quote(jsn_quote(jsn_quote('abc'))))));
jsn_unquote(jsn_unquote(jsn_unquote(        # long round trip of it
jsn_quote(jsn_quote(jsn_quote('abc'))))))
abc
select cast(cast('2015-01-15 23:24:25' as datetime) as json);
cast(cast('2015-01-15 23:24:25' as datetime) as json)
"2015-01-15 23:24:25.000000"
select jsn_unquote(cast(cast('2015-01-15 23:24:25' as datetime) as json));
jsn_unquote(cast(cast('2015-01-15 23:24:25' as datetime) as json))
2015-01-15 23:24:25.000000
select cast(st_geomfromtext('point(1 1)') as json);
cast(st_geomfromtext('point(1 1)') as json)
"base64:type255:AAAAAAEBAAAAAAAAAAAA8D8AAAAAAADwPw=="
select jsn_unquote(cast(st_geomfromtext('point(1 1)') as json));
jsn_unquote(cast(st_geomfromtext('point(1 1)') as json))
base64:type255:AAAAAAEBAAAAAAAAAAAA8D8AAAAAAADwPw==
delete from t;
alter table t add column (j json);
insert into t values (NULL, NULL);
select jsn_quote(c), jsn_quote(j) from t;
jsn_quote(c)	jsn_quote(j)
NULL	NULL
select jsn_unquote(c), jsn_unquote(j) from t;
jsn_unquote(c)	jsn_unquote(j)
NULL	NULL
drop table t;
CREATE TABLE T_WITH_NULLS(i INT, j JSON);
INSERT INTO T_WITH_NULLS VALUES
(0, NULL),
(1, '[1]'),
(2, NULL),
(3, '{"a":"b"}'),
(4, NULL),
(5, '"abc"');
SELECT
JSN_VALID(j),
JSN_TYPE(j),
JSN_KEYS(j),
JSN_EXTRACT(j, '$'),
JSN_REMOVE(j, '$.a.b.c'),
JSN_APPEND(j, '$', 2),
JSN_SET(j, '$[0]', 2),
JSN_INSERT(j, '$[0]', 2),
JSN_REPLACE(j, '$[0]', 2),
JSN_MERGE(j, j),
JSN_SEARCH(j, 'one', 'abc'),
JSN_CONTAINS_PATH(j, 'all', '$.a'),
JSN_LENGTH(j),
JSN_DEPTH(j),
JSN_ARRAY(j, j),
JSN_OBJECT('k', j),
JSN_UNQUOTE(CAST(j AS CHAR)),
JSN_QUOTE(CAST(j AS CHAR))
FROM T_WITH_NULLS
ORDER BY i;
JSN_VALID(j)	JSN_TYPE(j)	JSN_KEYS(j)	JSN_EXTRACT(j, '$')	JSN_REMOVE(j, '$.a.b.c')	JSN_APPEND(j, '$', 2)	JSN_SET(j, '$[0]', 2)	JSN_INSERT(j, '$[0]', 2)	JSN_REPLACE(j, '$[0]', 2)	JSN_MERGE(j, j)	JSN_SEARCH(j, 'one', 'abc')	JSN_CONTAINS_PATH(j, 'all', '$.a')	JSN_LENGTH(j)	JSN_DEPTH(j)	JSN_ARRAY(j, j)	JSN_OBJECT('k', j)	JSN_UNQUOTE(CAST(j AS CHAR))	JSN_QUOTE(CAST(j AS CHAR))
NULL	NULL	NULL	NULL	NULL	NULL	NULL	NULL	NULL	NULL	NULL	NULL	NULL	NULL	NULL	NULL	NULL	NULL
1	ARRAY	NULL	[1]	[1]	[1, 2]	[2]	[1]	[2]	[1, 1]	NULL	0	1	2	[[1], [1]]	{"k": [1]}	[1]	"[1]"
NULL	NULL	NULL	NULL	NULL	NULL	NULL	NULL	NULL	NULL	NULL	NULL	NULL	NULL	NULL	NULL	NULL	NULL
1	OBJECT	["a"]	{"a": "b"}	{"a": "b"}	[{"a": "b"}, 2]	2	{"a": "b"}	2	{"a": ["b", "b"]}	NULL	1	1	2	[{"a": "b"}, {"a": "b"}]	{"k": {"a": "b"}}	{"a": "b"}	"{\"a\": \"b\"}"
NULL	NULL	NULL	NULL	NULL	NULL	NULL	NULL	NULL	NULL	NULL	NULL	NULL	NULL	NULL	NULL	NULL	NULL
1	STRING	NULL	"abc"	"abc"	["abc", 2]	2	"abc"	2	["abc", "abc"]	"$"	0	1	1	["abc", "abc"]	{"k": "abc"}	abc	"\"abc\""
DROP TABLE T_WITH_NULLS;
SELECT JSN_UNQUOTE( '"abc"' );
JSN_UNQUOTE( '"abc"' )
abc
SELECT JSN_UNQUOTE( '"abc' );
JSN_UNQUOTE( '"abc' )
"abc
SELECT JSN_UNQUOTE( 123 );
ERROR HY000: Incorrect type for argument 1 in function jsn_unquote.
SELECT JSN_UNQUOTE
( CAST( CAST( '"abc"' AS JSON ) AS CHAR ) );
JSN_UNQUOTE
( CAST( CAST( '"abc"' AS JSON ) AS CHAR ) )
abc
SELECT JSN_UNQUOTE
(
CAST(
JSN_EXTRACT( '{ "userName" : "fred" }', '$.userName' )
AS CHAR
)
) = 'fred';
JSN_UNQUOTE
(
CAST(
JSN_EXTRACT( '{ "userName" : "fred" }', '$.userName' )
AS CHAR
)
) = 'fred'
1
SELECT
CAST(
JSN_EXTRACT( '{ "userName" : "fred" }', '$.userName' )
AS CHAR
) = 'fred';
CAST(
JSN_EXTRACT( '{ "userName" : "fred" }', '$.userName' )
AS CHAR
) = 'fred'
0
SELECT JSN_QUOTE( 'abc' );
JSN_QUOTE( 'abc' )
"abc"
SELECT JSN_QUOTE( 123 );
ERROR HY000: Incorrect type for argument 1 in function jsn_quote.
SELECT CAST( JSN_QUOTE( '123' ) AS JSON );
CAST( JSN_QUOTE( '123' ) AS JSON )
"123"
# ----------------------------------------------------------------------
# Test that boolean expressions are treated as boolean atom literals
# ----------------------------------------------------------------------
create table t_bool_literals( a int, b varchar(10) );
insert into t_bool_literals values ( 1, 'food' ), ( 2, 'fool' ), ( 3, 'water' );
select a, jsn_array( ((a < 3) and (a > 1)) ) from t_bool_literals order by a;
a	jsn_array( ((a < 3) and (a > 1)) )
1	[false]
2	[true]
3	[false]
select a, jsn_append( '[]', '$', ((a < 3) and (a > 1)) ) from t_bool_literals order by a;
a	jsn_append( '[]', '$', ((a < 3) and (a > 1)) )
1	[false]
2	[true]
3	[false]
select a, jsn_array( not ((a < 3) and (a > 1)) ) from t_bool_literals order by a;
a	jsn_array( not ((a < 3) and (a > 1)) )
1	[true]
2	[false]
3	[true]
select a, jsn_append( '[]', '$', not ((a < 3) and (a > 1)) ) from t_bool_literals order by a;
a	jsn_append( '[]', '$', not ((a < 3) and (a > 1)) )
1	[true]
2	[false]
3	[true]
select a, jsn_array( ((a < 3) or (a > 1)) ) from t_bool_literals order by a;
a	jsn_array( ((a < 3) or (a > 1)) )
1	[true]
2	[true]
3	[true]
select a, jsn_append( '[]', '$', ((a < 3) or (a > 1)) ) from t_bool_literals order by a;
a	jsn_append( '[]', '$', ((a < 3) or (a > 1)) )
1	[true]
2	[true]
3	[true]
select a, jsn_array( not ((a < 3) or (a > 1)) ) from t_bool_literals order by a;
a	jsn_array( not ((a < 3) or (a > 1)) )
1	[false]
2	[false]
3	[false]
select a, jsn_append( '[]', '$', not ((a < 3) or (a > 1)) ) from t_bool_literals order by a;
a	jsn_append( '[]', '$', not ((a < 3) or (a > 1)) )
1	[false]
2	[false]
3	[false]
select jsn_array( not true, not false );
jsn_array( not true, not false )
[false, true]
select jsn_append( '[]', '$', not true, '$', not false );
jsn_append( '[]', '$', not true, '$', not false )
[false, true]
select a, jsn_array( 1 and true ) from t_bool_literals order by a;
a	jsn_array( 1 and true )
1	[true]
2	[true]
3	[true]
select a, jsn_append( '[]', '$', 1 and true ) from t_bool_literals order by a;
a	jsn_append( '[]', '$', 1 and true )
1	[true]
2	[true]
3	[true]
select a, jsn_array( not 1 ) from t_bool_literals order by a;
a	jsn_array( not 1 )
1	[false]
2	[false]
3	[false]
select a, jsn_append( '[]', '$', not 1 ) from t_bool_literals order by a;
a	jsn_append( '[]', '$', not 1 )
1	[false]
2	[false]
3	[false]
select jsn_array( true, false );
jsn_array( true, false )
[true, false]
select jsn_append( '[]', '$', true, '$', false );
jsn_append( '[]', '$', true, '$', false )
[true, false]
select a, jsn_array( (a < 3) ) from t_bool_literals order by a;
a	jsn_array( (a < 3) )
1	[true]
2	[true]
3	[false]
select a, jsn_append( '[]', '$', (a < 3) ) from t_bool_literals order by a;
a	jsn_append( '[]', '$', (a < 3) )
1	[true]
2	[true]
3	[false]
select a, jsn_array( (a <= 3) ) from t_bool_literals order by a;
a	jsn_array( (a <= 3) )
1	[true]
2	[true]
3	[true]
select a, jsn_append( '[]', '$', (a <= 3) ) from t_bool_literals order by a;
a	jsn_append( '[]', '$', (a <= 3) )
1	[true]
2	[true]
3	[true]
select a, jsn_array( (a > 3) ) from t_bool_literals order by a;
a	jsn_array( (a > 3) )
1	[false]
2	[false]
3	[false]
select a, jsn_append( '[]', '$', (a > 3) ) from t_bool_literals order by a;
a	jsn_append( '[]', '$', (a > 3) )
1	[false]
2	[false]
3	[false]
select a, jsn_array( (a >= 3) ) from t_bool_literals order by a;
a	jsn_array( (a >= 3) )
1	[false]
2	[false]
3	[true]
select a, jsn_append( '[]', '$', (a >= 3) ) from t_bool_literals order by a;
a	jsn_append( '[]', '$', (a >= 3) )
1	[false]
2	[false]
3	[true]
select a, jsn_array( (a <> 3) ) from t_bool_literals order by a;
a	jsn_array( (a <> 3) )
1	[true]
2	[true]
3	[false]
select a, jsn_append( '[]', '$', (a <> 3) ) from t_bool_literals order by a;
a	jsn_append( '[]', '$', (a <> 3) )
1	[true]
2	[true]
3	[false]
select a, jsn_array( (a != 3) ) from t_bool_literals order by a;
a	jsn_array( (a != 3) )
1	[true]
2	[true]
3	[false]
select a, jsn_append( '[]', '$', (a != 3) ) from t_bool_literals order by a;
a	jsn_append( '[]', '$', (a != 3) )
1	[true]
2	[true]
3	[false]
select a, jsn_array( a is null ) from t_bool_literals order by a;
a	jsn_array( a is null )
1	[false]
2	[false]
3	[false]
select a, jsn_append( '[]', '$', a is null ) from t_bool_literals order by a;
a	jsn_append( '[]', '$', a is null )
1	[false]
2	[false]
3	[false]
select a, jsn_array( a is not null ) from t_bool_literals order by a;
a	jsn_array( a is not null )
1	[true]
2	[true]
3	[true]
select a, jsn_append( '[]', '$', a is not null ) from t_bool_literals order by a;
a	jsn_append( '[]', '$', a is not null )
1	[true]
2	[true]
3	[true]
select a, jsn_array( a is true ) from t_bool_literals order by a;
a	jsn_array( a is true )
1	[true]
2	[true]
3	[true]
select a, jsn_append( '[]', '$', a is true ) from t_bool_literals order by a;
a	jsn_append( '[]', '$', a is true )
1	[true]
2	[true]
3	[true]
select a, jsn_array( a is not true ) from t_bool_literals order by a;
a	jsn_array( a is not true )
1	[false]
2	[false]
3	[false]
select a, jsn_append( '[]', '$', a is not true ) from t_bool_literals order by a;
a	jsn_append( '[]', '$', a is not true )
1	[false]
2	[false]
3	[false]
select a, jsn_array(nullif(true, false)  ) from t_bool_literals order by a;
a	jsn_array(nullif(true, false)  )
1	[true]
2	[true]
3	[true]
select a, jsn_append
(
'[]',
'$',  nullif(true, false)
) from t_bool_literals order by a;
a	jsn_append
(
'[]',
'$',  nullif(true, false)
)
1	[true]
2	[true]
3	[true]
select a, jsn_array( (case when (a > 1) then true else false end) and true ) from t_bool_literals order by a;
a	jsn_array( (case when (a > 1) then true else false end) and true )
1	[false]
2	[true]
3	[true]
select a, jsn_append
(
'[]',
'$', (case when (a > 1) then true else false end) and true
) from t_bool_literals order by a;
a	jsn_append
(
'[]',
'$', (case when (a > 1) then true else false end) and true
)
1	[false]
2	[true]
3	[true]
select a, jsn_array( a between 2 and 4 ) from t_bool_literals order by a;
a	jsn_array( a between 2 and 4 )
1	[false]
2	[true]
3	[true]
select a, jsn_append( '[]', '$', a between 2 and 4 ) from t_bool_literals order by a;
a	jsn_append( '[]', '$', a between 2 and 4 )
1	[false]
2	[true]
3	[true]
select a, jsn_array( a in (1,3) ) from t_bool_literals order by a;
a	jsn_array( a in (1,3) )
1	[true]
2	[false]
3	[true]
select a, jsn_append( '[]', '$', a in (1,3) ) from t_bool_literals order by a;
a	jsn_append( '[]', '$', a in (1,3) )
1	[true]
2	[false]
3	[true]
select a, jsn_array( b like 'foo%' ) from t_bool_literals order by a;
a	jsn_array( b like 'foo%' )
1	[true]
2	[true]
3	[false]
select a, jsn_append( '[]', '$', b like 'foo%' ) from t_bool_literals order by a;
a	jsn_append( '[]', '$', b like 'foo%' )
1	[true]
2	[true]
3	[false]
select a, jsn_array( b REGEXP '^fo+d' ) from t_bool_literals order by a;
a	jsn_array( b REGEXP '^fo+d' )
1	[true]
2	[false]
3	[false]
select a, jsn_append( '[]', '$', b REGEXP '^fo+d' ) from t_bool_literals order by a;
a	jsn_append( '[]', '$', b REGEXP '^fo+d' )
1	[true]
2	[false]
3	[false]
select a, jsn_array( b rlike '^fo+d' ) from t_bool_literals order by a;
a	jsn_array( b rlike '^fo+d' )
1	[true]
2	[false]
3	[false]
select a, jsn_append( '[]', '$', b rlike '^fo+d' ) from t_bool_literals order by a;
a	jsn_append( '[]', '$', b rlike '^fo+d' )
1	[true]
2	[false]
3	[false]
select a, jsn_array( b not REGEXP '^fo+d' ) from t_bool_literals order by a;
a	jsn_array( b not REGEXP '^fo+d' )
1	[false]
2	[true]
3	[true]
select a, jsn_append( '[]', '$', b not REGEXP '^fo+d' ) from t_bool_literals order by a;
a	jsn_append( '[]', '$', b not REGEXP '^fo+d' )
1	[false]
2	[true]
3	[true]
select a, jsn_array( b not rlike '^fo+d' ) from t_bool_literals order by a;
a	jsn_array( b not rlike '^fo+d' )
1	[false]
2	[true]
3	[true]
select a, jsn_append( '[]', '$', b not rlike '^fo+d' ) from t_bool_literals order by a;
a	jsn_append( '[]', '$', b not rlike '^fo+d' )
1	[false]
2	[true]
3	[true]
select a, jsn_array( b = some( select b from t_bool_literals ) ) from t_bool_literals order by a;
a	jsn_array( b = some( select b from t_bool_literals ) )
1	[true]
2	[true]
3	[true]
select a, jsn_append( '[]', '$', b = some( select b from t_bool_literals ) ) from t_bool_literals order by a;
a	jsn_append( '[]', '$', b = some( select b from t_bool_literals ) )
1	[true]
2	[true]
3	[true]
select a, jsn_array( b = all( select b from t_bool_literals ) ) from t_bool_literals order by a;
a	jsn_array( b = all( select b from t_bool_literals ) )
1	[false]
2	[false]
3	[false]
select a, jsn_append( '[]', '$', b = all( select b from t_bool_literals ) ) from t_bool_literals order by a;
a	jsn_append( '[]', '$', b = all( select b from t_bool_literals ) )
1	[false]
2	[false]
3	[false]
select a, jsn_array( b = any( select b from t_bool_literals ) ) from t_bool_literals order by a;
a	jsn_array( b = any( select b from t_bool_literals ) )
1	[true]
2	[true]
3	[true]
select a, jsn_append( '[]', '$', b = any( select b from t_bool_literals ) ) from t_bool_literals order by a;
a	jsn_append( '[]', '$', b = any( select b from t_bool_literals ) )
1	[true]
2	[true]
3	[true]
select a, jsn_array( b > some( select b from t_bool_literals ) ) from t_bool_literals order by a;
a	jsn_array( b > some( select b from t_bool_literals ) )
1	[false]
2	[true]
3	[true]
select a, jsn_append( '[]', '$', b > some( select b from t_bool_literals ) ) from t_bool_literals order by a;
a	jsn_append( '[]', '$', b > some( select b from t_bool_literals ) )
1	[false]
2	[true]
3	[true]
select a, jsn_array( b > all( select b from t_bool_literals ) ) from t_bool_literals order by a;
a	jsn_array( b > all( select b from t_bool_literals ) )
1	[false]
2	[false]
3	[false]
select a, jsn_append( '[]', '$', b > all( select b from t_bool_literals ) ) from t_bool_literals order by a;
a	jsn_append( '[]', '$', b > all( select b from t_bool_literals ) )
1	[false]
2	[false]
3	[false]
select a, jsn_array( b > any( select b from t_bool_literals ) ) from t_bool_literals order by a;
a	jsn_array( b > any( select b from t_bool_literals ) )
1	[false]
2	[true]
3	[true]
select a, jsn_append( '[]', '$', b > any( select b from t_bool_literals ) ) from t_bool_literals order by a;
a	jsn_append( '[]', '$', b > any( select b from t_bool_literals ) )
1	[false]
2	[true]
3	[true]
select a, jsn_array( b < some( select b from t_bool_literals ) ) from t_bool_literals order by a;
a	jsn_array( b < some( select b from t_bool_literals ) )
1	[true]
2	[true]
3	[false]
select a, jsn_append( '[]', '$', b < some( select b from t_bool_literals ) ) from t_bool_literals order by a;
a	jsn_append( '[]', '$', b < some( select b from t_bool_literals ) )
1	[true]
2	[true]
3	[false]
select a, jsn_array( b < all( select b from t_bool_literals ) ) from t_bool_literals order by a;
a	jsn_array( b < all( select b from t_bool_literals ) )
1	[false]
2	[false]
3	[false]
select a, jsn_append( '[]', '$', b < all( select b from t_bool_literals ) ) from t_bool_literals order by a;
a	jsn_append( '[]', '$', b < all( select b from t_bool_literals ) )
1	[false]
2	[false]
3	[false]
select a, jsn_array( b < any( select b from t_bool_literals ) ) from t_bool_literals order by a;
a	jsn_array( b < any( select b from t_bool_literals ) )
1	[true]
2	[true]
3	[false]
select a, jsn_append( '[]', '$', b < any( select b from t_bool_literals ) ) from t_bool_literals order by a;
a	jsn_append( '[]', '$', b < any( select b from t_bool_literals ) )
1	[true]
2	[true]
3	[false]
select a, jsn_array( b <= some( select b from t_bool_literals ) ) from t_bool_literals order by a;
a	jsn_array( b <= some( select b from t_bool_literals ) )
1	[true]
2	[true]
3	[true]
select a, jsn_append( '[]', '$', b <= some( select b from t_bool_literals ) ) from t_bool_literals order by a;
a	jsn_append( '[]', '$', b <= some( select b from t_bool_literals ) )
1	[true]
2	[true]
3	[true]
select a, jsn_array( b <= all( select b from t_bool_literals ) ) from t_bool_literals order by a;
a	jsn_array( b <= all( select b from t_bool_literals ) )
1	[true]
2	[false]
3	[false]
select a, jsn_append( '[]', '$', b <= all( select b from t_bool_literals ) ) from t_bool_literals order by a;
a	jsn_append( '[]', '$', b <= all( select b from t_bool_literals ) )
1	[true]
2	[false]
3	[false]
select a, jsn_array( b <= any( select b from t_bool_literals ) ) from t_bool_literals order by a;
a	jsn_array( b <= any( select b from t_bool_literals ) )
1	[true]
2	[true]
3	[true]
select a, jsn_append( '[]', '$', b <= any( select b from t_bool_literals ) ) from t_bool_literals order by a;
a	jsn_append( '[]', '$', b <= any( select b from t_bool_literals ) )
1	[true]
2	[true]
3	[true]
select a, jsn_array( b >= some( select b from t_bool_literals ) ) from t_bool_literals order by a;
a	jsn_array( b >= some( select b from t_bool_literals ) )
1	[true]
2	[true]
3	[true]
select a, jsn_append( '[]', '$', b >= some( select b from t_bool_literals ) ) from t_bool_literals order by a;
a	jsn_append( '[]', '$', b >= some( select b from t_bool_literals ) )
1	[true]
2	[true]
3	[true]
select a, jsn_array( b >= all( select b from t_bool_literals ) ) from t_bool_literals order by a;
a	jsn_array( b >= all( select b from t_bool_literals ) )
1	[false]
2	[false]
3	[true]
select a, jsn_append( '[]', '$', b >= all( select b from t_bool_literals ) ) from t_bool_literals order by a;
a	jsn_append( '[]', '$', b >= all( select b from t_bool_literals ) )
1	[false]
2	[false]
3	[true]
select a, jsn_array( b >= any( select b from t_bool_literals ) ) from t_bool_literals order by a;
a	jsn_array( b >= any( select b from t_bool_literals ) )
1	[true]
2	[true]
3	[true]
select a, jsn_append( '[]', '$', b >= any( select b from t_bool_literals ) ) from t_bool_literals order by a;
a	jsn_append( '[]', '$', b >= any( select b from t_bool_literals ) )
1	[true]
2	[true]
3	[true]
select a, jsn_array( exists( select b from t_bool_literals where a = 1 ) ) from t_bool_literals order by a;
a	jsn_array( exists( select b from t_bool_literals where a = 1 ) )
1	[true]
2	[true]
3	[true]
select a, jsn_append( '[]', '$', exists( select b from t_bool_literals where a = 1 ) ) from t_bool_literals order by a;
a	jsn_append( '[]', '$', exists( select b from t_bool_literals where a = 1 ) )
1	[true]
2	[true]
3	[true]
select a, jsn_array( not exists( select b from t_bool_literals where a = 1 ) ) from t_bool_literals order by a;
a	jsn_array( not exists( select b from t_bool_literals where a = 1 ) )
1	[false]
2	[false]
3	[false]
select a, jsn_append( '[]', '$', not exists( select b from t_bool_literals where a = 1 ) ) from t_bool_literals order by a;
a	jsn_append( '[]', '$', not exists( select b from t_bool_literals where a = 1 ) )
1	[false]
2	[false]
3	[false]
select a, jsn_array( jsn_valid( b ) ) from t_bool_literals order by a;
a	jsn_array( jsn_valid( b ) )
1	[false]
2	[false]
3	[false]
select a, jsn_append( '[]', '$', jsn_valid( b ) ) from t_bool_literals order by a;
a	jsn_append( '[]', '$', jsn_valid( b ) )
1	[false]
2	[false]
3	[false]
select a, jsn_array( not jsn_valid( b ) ) from t_bool_literals order by a;
a	jsn_array( not jsn_valid( b ) )
1	[true]
2	[true]
3	[true]
select a, jsn_append( '[]', '$', not jsn_valid( b ) ) from t_bool_literals order by a;
a	jsn_append( '[]', '$', not jsn_valid( b ) )
1	[true]
2	[true]
3	[true]
select jsn_array( jsn_contains_path( '{ "a" : { "b" : 100 } }', 'all', '$.a.b' ) );
jsn_array( jsn_contains_path( '{ "a" : { "b" : 100 } }', 'all', '$.a.b' ) )
[true]
select a, jsn_array( gtid_subset('3E11FA47-71CA-11E1-9E33-C80AA9429562:23', '3E11FA47-71CA-11E1-9E33-C80AA9429562:21-57') )
from t_bool_literals order by a;
a	jsn_array( gtid_subset('3E11FA47-71CA-11E1-9E33-C80AA9429562:23', '3E11FA47-71CA-11E1-9E33-C80AA9429562:21-57') )
1	[true]
2	[true]
3	[true]
select a, jsn_append( '[]', '$', gtid_subset('3E11FA47-71CA-11E1-9E33-C80AA9429562:23', '3E11FA47-71CA-11E1-9E33-C80AA9429562:21-57') )
from t_bool_literals order by a;
a	jsn_append( '[]', '$', gtid_subset('3E11FA47-71CA-11E1-9E33-C80AA9429562:23', '3E11FA47-71CA-11E1-9E33-C80AA9429562:21-57') )
1	[true]
2	[true]
3	[true]
select a, jsn_array( not gtid_subset('3E11FA47-71CA-11E1-9E33-C80AA9429562:23', '3E11FA47-71CA-11E1-9E33-C80AA9429562:21-57') )
from t_bool_literals order by a;
a	jsn_array( not gtid_subset('3E11FA47-71CA-11E1-9E33-C80AA9429562:23', '3E11FA47-71CA-11E1-9E33-C80AA9429562:21-57') )
1	[false]
2	[false]
3	[false]
select a, jsn_append( '[]', '$', not gtid_subset('3E11FA47-71CA-11E1-9E33-C80AA9429562:23', '3E11FA47-71CA-11E1-9E33-C80AA9429562:21-57') )
from t_bool_literals order by a;
a	jsn_append( '[]', '$', not gtid_subset('3E11FA47-71CA-11E1-9E33-C80AA9429562:23', '3E11FA47-71CA-11E1-9E33-C80AA9429562:21-57') )
1	[false]
2	[false]
3	[false]
select a, jsn_array( b = ( select distinct b from t_bool_literals where a = 1 ) ) from t_bool_literals order by a;
a	jsn_array( b = ( select distinct b from t_bool_literals where a = 1 ) )
1	[true]
2	[false]
3	[false]
select a, jsn_append( '[]', '$',  b = ( select distinct b from t_bool_literals where a = 1 ) ) from t_bool_literals order by a;
a	jsn_append( '[]', '$',  b = ( select distinct b from t_bool_literals where a = 1 ) )
1	[true]
2	[false]
3	[false]
select a, jsn_array( b > ( select distinct b from t_bool_literals where a = 1 ) ) from t_bool_literals order by a;
a	jsn_array( b > ( select distinct b from t_bool_literals where a = 1 ) )
1	[false]
2	[true]
3	[true]
select a, jsn_append( '[]', '$',  b > ( select distinct b from t_bool_literals where a = 1 ) ) from t_bool_literals order by a;
a	jsn_append( '[]', '$',  b > ( select distinct b from t_bool_literals where a = 1 ) )
1	[false]
2	[true]
3	[true]
select a, jsn_array( b >= ( select distinct b from t_bool_literals where a = 1 ) ) from t_bool_literals order by a;
a	jsn_array( b >= ( select distinct b from t_bool_literals where a = 1 ) )
1	[true]
2	[true]
3	[true]
select a, jsn_append( '[]', '$',  b >= ( select distinct b from t_bool_literals where a = 1 ) ) from t_bool_literals order by a;
a	jsn_append( '[]', '$',  b >= ( select distinct b from t_bool_literals where a = 1 ) )
1	[true]
2	[true]
3	[true]
select a, jsn_array( b < ( select distinct b from t_bool_literals where a = 1 ) ) from t_bool_literals order by a;
a	jsn_array( b < ( select distinct b from t_bool_literals where a = 1 ) )
1	[false]
2	[false]
3	[false]
select a, jsn_append( '[]', '$',  b < ( select distinct b from t_bool_literals where a = 1 ) ) from t_bool_literals order by a;
a	jsn_append( '[]', '$',  b < ( select distinct b from t_bool_literals where a = 1 ) )
1	[false]
2	[false]
3	[false]
select a, jsn_array( b <= ( select distinct b from t_bool_literals where a = 1 ) ) from t_bool_literals order by a;
a	jsn_array( b <= ( select distinct b from t_bool_literals where a = 1 ) )
1	[true]
2	[false]
3	[false]
select a, jsn_append( '[]', '$',  b <= ( select distinct b from t_bool_literals where a = 1 ) ) from t_bool_literals order by a;
a	jsn_append( '[]', '$',  b <= ( select distinct b from t_bool_literals where a = 1 ) )
1	[true]
2	[false]
3	[false]
select a, jsn_array( ( select distinct a from t_bool_literals where a = 1 ) ) from t_bool_literals order by a;
a	jsn_array( ( select distinct a from t_bool_literals where a = 1 ) )
1	[1]
2	[1]
3	[1]
drop table t_bool_literals;
# ----------------------------------------------------------------------
# Test of JSN_CONTAINS
# ----------------------------------------------------------------------
# should give NULL
select jsn_contains(NULL, NULL);
jsn_contains(NULL, NULL)
NULL
select jsn_contains(cast('{"a": 1, "b": 2}' as json), NULL);
jsn_contains(cast('{"a": 1, "b": 2}' as json), NULL)
NULL
select jsn_contains(NULL, cast('null' as json));
jsn_contains(NULL, cast('null' as json))
NULL
select jsn_contains(cast('[1]' as json), cast('[1]' as json), NULL);
jsn_contains(cast('[1]' as json), cast('[1]' as json), NULL)
NULL
# should give 0:
select jsn_contains(cast(3.14 as json), cast(3 as json));
jsn_contains(cast(3.14 as json), cast(3 as json))
0
# should give 0: not at top level
select jsn_contains(cast('{"a": {"b": 7}}' as json), cast('{"b": 7}' as json));
jsn_contains(cast('{"a": {"b": 7}}' as json), cast('{"b": 7}' as json))
0
# but path argument will fix it:
select jsn_contains(cast('{"a": {"b": 7}}' as json), cast('{"b": 7}' as json), '$.a');
jsn_contains(cast('{"a": {"b": 7}}' as json), cast('{"b": 7}' as json), '$.a')
1
# but arrays "introspect"
select jsn_contains(cast('[1,[2.0, 3.0]]' as json), cast('[2.0]' as json));
jsn_contains(cast('[1,[2.0, 3.0]]' as json), cast('[2.0]' as json))
1
select jsn_contains(cast('[1, 2, [3, [4, 5]], 6, 7]' as json), cast('5' as json));
jsn_contains(cast('[1, 2, [3, [4, 5]], 6, 7]' as json), cast('5' as json))
1
# should give 0: just a key
select jsn_contains(cast('{"a": 1, "b": 2}' as json), cast('"a"' as json));
jsn_contains(cast('{"a": 1, "b": 2}' as json), cast('"a"' as json))
0
# should give 0: one candidate element doesn't match
select jsn_contains(cast('[1]' as json), cast('[1,2]' as json));
jsn_contains(cast('[1]' as json), cast('[1,2]' as json))
0
# should all give 1
select jsn_contains(cast('null' as json), cast('null' as json));
jsn_contains(cast('null' as json), cast('null' as json))
1
# simple object subset
select jsn_contains(cast('{"a": 1, "b": 2}' as json), cast( '{"a": 1}' as json));
jsn_contains(cast('{"a": 1, "b": 2}' as json), cast( '{"a": 1}' as json))
1
# simple vector subset
select jsn_contains(cast('[1, 2, 3]' as json), cast('[1, 3]' as json));
jsn_contains(cast('[1, 2, 3]' as json), cast('[1, 3]' as json))
1
# auto-wrap, should give 1
select jsn_contains(cast('[1, 2, 3]' as json), cast(3 as json));
jsn_contains(cast('[1, 2, 3]' as json), cast(3 as json))
1
# ok even with nested cast off elements
select jsn_contains(cast('{"person": {"id": 1, "country": "norway"}}' as json),
cast('{"person": {"country": "norway"}}' as json));
jsn_contains(cast('{"person": {"id": 1, "country": "norway"}}' as json),
cast('{"person": {"country": "norway"}}' as json))
1
# vector reordering and duplicates is ok
select jsn_contains(cast('[1,3,5]' as json), cast('[5,3,1,5]' as json));
jsn_contains(cast('[1,3,5]' as json), cast('[5,3,1,5]' as json))
1
# ok even with more elts in candidate than in doc
select jsn_contains(cast('[{"b": 4, "a":7}]' as json), cast('[{"a":7},{"b":4}]' as json));
jsn_contains(cast('[{"b": 4, "a":7}]' as json), cast('[{"a":7},{"b":4}]' as json))
1
select jsn_contains(cast('[{"b": 4, "a":7}, 5]' as json), cast('[5, {"a":7, "b":4}]' as json));
jsn_contains(cast('[{"b": 4, "a":7}, 5]' as json), cast('[5, {"a":7, "b":4}]' as json))
1
# ok even with mixed number types that compare equal
select jsn_contains(cast('[{"b": 4, "a":7}, 5.0]' as json), cast('[5, {"a":7.0E0, "b":4}]' as json));
jsn_contains(cast('[{"b": 4, "a":7}, 5.0]' as json), cast('[5, {"a":7.0E0, "b":4}]' as json))
1
SELECT JSN_CONTAINS
(
CAST('[1, 4, 6]' AS JSON),
CAST('[1, 6]' AS JSON)
);
JSN_CONTAINS
(
CAST('[1, 4, 6]' AS JSON),
CAST('[1, 6]' AS JSON)
)
1
SELECT JSN_CONTAINS
(
CAST('{"person": {"id": 1, "country": "norway"}}' AS JSON),
CAST('{"person": {"country": "norway"}}' AS JSON)
);
JSN_CONTAINS
(
CAST('{"person": {"id": 1, "country": "norway"}}' AS JSON),
CAST('{"person": {"country": "norway"}}' AS JSON)
)
1
SELECT JSN_CONTAINS
(
CAST('[1,3,5]' AS JSON),
CAST('[5,3,1,5]' AS JSON)
);
JSN_CONTAINS
(
CAST('[1,3,5]' AS JSON),
CAST('[5,3,1,5]' AS JSON)
)
1
SELECT JSN_CONTAINS
(
CAST('[3.14]' AS JSON),
CAST('[3]' AS JSON)
);
JSN_CONTAINS
(
CAST('[3.14]' AS JSON),
CAST('[3]' AS JSON)
)
0
SELECT JSN_CONTAINS
(
CAST('[1, 2, 3]' AS JSON),
CAST(3 AS JSON)
);
JSN_CONTAINS
(
CAST('[1, 2, 3]' AS JSON),
CAST(3 AS JSON)
)
1
# ----------------------------------------------------------------------
# Verify that all of the string types behave similarly when used as ANY_JSON_ATOMS
# ----------------------------------------------------------------------
create table t_char( a int, b char(20) );
insert into t_char values ( 1, 'foo' );
create table t_varchar( a int, b varchar(20) );
insert into t_varchar values ( 1, 'foo' );
Create table t_tinytext( a int, b tinytext );
insert into t_tinytext values ( 1, 'foo' );
create table t_text( a int, b text );
insert into t_text values ( 1, 'foo' );
create table t_mediumtext( a int, b mediumtext );
insert into t_mediumtext values ( 1, 'foo' );
create table t_longtext( a int, b longtext );
insert into t_longtext values ( 1, 'foo' );
select jsn_array( b ) from t_char;
jsn_array( b )
["foo"]
select jsn_array( b ) from t_varchar;
jsn_array( b )
["foo"]
select jsn_array( b ) from t_tinytext;
jsn_array( b )
["foo"]
select jsn_array( b ) from t_text;
jsn_array( b )
["foo"]
select jsn_array( b ) from t_mediumtext;
jsn_array( b )
["foo"]
select jsn_array( b ) from t_longtext;
jsn_array( b )
["foo"]
select jsn_array( cast( b as char ) ) from t_char;
jsn_array( cast( b as char ) )
["foo"]
select jsn_array( cast( b as char ) ) from t_varchar;
jsn_array( cast( b as char ) )
["foo"]
select jsn_array( cast( b as char ) ) from t_tinytext;
jsn_array( cast( b as char ) )
["foo"]
select jsn_array( cast( b as char ) ) from t_text;
jsn_array( cast( b as char ) )
["foo"]
select jsn_array( cast( b as char ) ) from t_mediumtext;
jsn_array( cast( b as char ) )
["foo"]
select jsn_array( cast( b as char ) ) from t_longtext;
jsn_array( cast( b as char ) )
["foo"]
select jsn_array( UpdateXML('<a><b>ccc</b><d></d></a>', '/a/d', '<e>fff</e>') );
jsn_array( UpdateXML('<a><b>ccc</b><d></d></a>', '/a/d', '<e>fff</e>') )
["<a><b>ccc</b><e>fff</e></a>"]
select jsn_array( cast( UpdateXML('<a><b>ccc</b><d></d></a>', '/a/d', '<e>fff</e>') as char ) );
jsn_array( cast( UpdateXML('<a><b>ccc</b><d></d></a>', '/a/d', '<e>fff</e>') as char ) )
["<a><b>ccc</b><e>fff</e></a>"]
select jsn_array( ExtractValue('<r><n id="1">v1</n><n id="2">v2</n></r>','//n[@id=1]' ) );
jsn_array( ExtractValue('<r><n id="1">v1</n><n id="2">v2</n></r>','//n[@id=1]' ) )
["v1"]
select jsn_array( cast( ExtractValue('<r><n id="1">v1</n><n id="2">v2</n></r>','//n[@id=1]' ) as char ) );
jsn_array( cast( ExtractValue('<r><n id="1">v1</n><n id="2">v2</n></r>','//n[@id=1]' ) as char ) )
["v1"]
drop table t_char;
drop table t_varchar;
drop table t_tinytext;
drop table t_text;
drop table t_mediumtext;
drop table t_longtext;
# ----------------------------------------------------------------------
# Check that JSON values stemming from views and derived tables work
# ----------------------------------------------------------------------
create table t(x int);
insert into t values (NULL), (4);
select jsn_array(x) from (select x from t) tt order by x;
jsn_array(x)
NULL
[4]
create view v as select * from t;
select jsn_array(x) from v order by x;
jsn_array(x)
NULL
[4]
drop view v;
drop table t;
# ----------------------------------------------------------------------
# Ignore collation.collation when handing off val_str to a JSON field -
# bug found by John E.
# ----------------------------------------------------------------------
create table t3( col_json json );
insert into t3(col_json) values ( jsn_quote( '1' ) );
select * from t3;
col_json
"1"
select jsn_type(col_json) from t3;
jsn_type(col_json)
STRING
drop table t3;
set names default;
